Grammar,Usage,JLPT Level,Reference Example,Original Example,Prefix,Chunk1,Chunk2,Chunk3,Chunk4,Suffix,Explanation
とちゅう,～とちゅう（は）,N3,①会社に来る途中、ずっとこの小説を読んでいた。,スーパーへ買い物に行く途中で雨が降ってきたから急いで帰った。,スーパーへ,買い物に,行く,途中で,雨が,降ってきたから急いで帰った。,"""買い物に"" đi với động từ di chuyển ""行く"" để chỉ mục đích. Động từ ""行く"" thể từ điển bổ nghĩa cho danh từ ""途中"" tạo thành cụm từ chỉ hành trình. Trợ từ ""で"" chỉ thời điểm một hành động khác xen vào. ""雨が"" làm chủ ngữ cho vế sau."
どちらかというと,,N3,①私はどちらかというと、人前で発言するのが苦手である。,私はどちらかというと休日は家でアニメを見るのが好きだ。,私は,どちらかというと,休日は,家で,アニメを見るのが,好きだ。,"""どちらかというと"" là trạng từ đứng đầu bổ nghĩa cho cả câu để đưa ra xu hướng lựa chọn. ""休日は"" làm chủ đề thời gian. ""家で"" chỉ nơi chốn của hành động. ""アニメを見るのが"" danh từ hóa cụm động từ để làm tân ngữ bổ nghĩa cho tính từ ""好きだ""."
とて,Nとて（も）,N1,①私とて悔しい気持ちは皆と同じである。,母親とて子供の反抗期にはどう接するべきか悩むものだ。,母親,とて,子供の,反抗期には,どう接するべきか,悩むものだ。,"""母親とて"" sử dụng ngữ pháp N1 mang nghĩa 'ngay cả người mẹ cũng...'. ""子供の"" bổ nghĩa cho danh từ ""反抗期"". ""反抗期には"" chỉ thời điểm người mẹ gặp khó khăn. ""どう接するべきか"" là cụm nghi vấn danh từ làm nội dung cho động từ ""悩むものだ""."
とて,だからとて　A／Vからとて,N1,①病気だからとて、無断で休むのはけしからん。,親しい友人だからとて親しき仲にも礼儀ありという言葉を忘れてはいけない。,親しい,友人だから,とて,親しき仲にも,礼儀ありという言葉を,忘れてはいけない。,"""友人だから"" kết hợp với ""とて"" thành cấu trúc 'cho dù là bạn thân đi nữa' (phủ định việc lấy lý do đó để hành xử sai). ""親しき仲にも礼儀ありという"" bổ nghĩa cho danh từ ""言葉"". ""言葉を"" làm tân ngữ cho vế phủ định ""忘れてはいけない""."
とて,～とて　Nだとて　V一たとて,N1,①いくら愚か者だとて、そのくらいのことはわきまえていてもよさそうなものだが。,どんなに安い物だとて無駄遣いを続ければお金はたまらない。,どんなに,安い物だ,とて,無駄遣いを,続ければ,お金はたまらない。,"""どんなに...だ"" đi với ""とて"" thể hiện ý nghĩa giả định 'dù có là đồ rẻ tiền đi chăng nữa'. ""無駄遣いを"" là tân ngữ cho động từ điều kiện ""続ければ"" (nếu cứ tiếp tục lãng phí). Vế cuối đưa ra kết quả tất yếu mang tính tiêu cực."
とでもいう,,N2,①学問の楽しみは、未知の世界を発見する喜びとでもいおうか。,彼女の手料理はまるでお店の味とでもいうような素晴らしい出来栄えだ。,彼女の手料理は,まるで,お店の味,とでもいう,ような,素晴らしい出来栄えだ。,"""まるで"" là phó từ so sánh thường đi kèm với ""ような"" ở cuối. ""お店の味"" đi với cụm ""とでもいう"" nghĩa là 'có thể nói là hương vị nhà hàng'. Cả cụm bổ nghĩa trực tiếp cho danh từ ""出来栄えだ""."
とでもいうべき,NとでもいうべきN,N2,①そこは東洋のパリとでもいうべき優雅な雰囲気のある町である。,うちの猫は家族のアイドルとでもいうべき大切な存在です。,うちの猫は,家族の,アイドル,とでもいうべき,大切な,存在です。,"""家族の"" bổ nghĩa cho danh từ ""アイドル"". ""アイドルとでもいうべき"" mang ý nghĩa 'đích xác có thể gọi là thần tượng'. Cụm này đóng vai trò định ngữ bổ nghĩa cho tính từ ""大切な"" để cùng làm rõ nghĩa cho danh từ ""存在です""."
とともに,Nとともに,N3,①仲間とともに作業に励んでいる。,日曜日は家族とともに近くの公園でピクニックを楽しんだ。,日曜日は,家族,とともに,近くの,公園で,ピクニックを楽しんだ。,"""家族とともに"" thể hiện việc cùng thực hiện hành động với người nhà. ""近くの"" bổ nghĩa cho danh từ địa điểm ""公園"". Trợ từ ""で"" chỉ nơi chốn diễn ra hành động kết thúc câu ""ピクニックを楽しんだ""."
とともに,～とともに　Nとともに　V－るとともに,N2,①テレビの普及とともに、映画は衰退した。,年をとるとともに健康に気を使うようになってきた。,年を,とると,ともに,健康に,気を使う,ようになってきた。,"""年をとる"" kết hợp với cấu trúc ""とともに"" biểu thị hai sự biến đổi diễn ra song song (càng có tuổi thì càng...). ""健康に"" đi với cụm động từ ""気を使う"" (chú ý/quan tâm). Cụm này kết hợp với ""ようになってきた"" chỉ xu hướng thay đổi thói quen."
となく,なん＋助数詞＋となく,N1,①原始林の中には、巨大な樹木が何本となく茂っている。,彼はそのお気に入りの曲を毎日何回となく繰り返し聴いている。,彼はそのお気に入りの曲を,毎日,何回,となく,繰り返し,聴いている。,"""毎日"" bổ nghĩa thời gian. ""何回となく"" là cấu trúc N1 chỉ số lượng không đếm xuể (vô số lần), bổ nghĩa cho phó từ ""繰り返し"" (lặp đi lặp lại). Cả cụm phó từ này làm rõ cách thức cho động từ chính ""聴いている""."
となく,ひるとなくよるとなく,N1,①世界の至るところで、昼となく夜となく様々な事件が発生している。,隣の部屋から昼となく夜となく赤ちゃんの泣き声が聞こえてくる。,隣の部屋から,昼となく,夜となく,赤ちゃんの,泣き声が,聞こえてくる。,"""昼となく夜となく"" là thành ngữ cố định nghĩa là 'không kể ngày đêm/lúc nào cũng'. ""赤ちゃんの"" bổ nghĩa cho danh từ ""泣き声"" (tiếng khóc). ""泣き声が"" đi với trợ từ ""が"" làm chủ ngữ cho tự động từ ""聞こえてくる""."
となったら,節や名詞を受け、「～ような場合・状況になったら」といった意味や「そのことが話題になったら」といった意味を表す。状況・議題が「そのようなことになった場合」のように、自然にそうなるといった意味が強い。「となると」「となれば」とも言う。～となったら　N／Na（だ）となったら　A／V　となったら,N2,①もし、一戸建の家を建てるとなったら、銀行から相当の借金をしなければならない。,一人暮らしを始めるとなったら家具や家電を揃える必要がある。,一人暮らしを,始める,となったら,家具や,家電を,揃える必要がある。,"""始める"" bổ nghĩa cho cấu trúc giả định ""となったら"" (nếu bước vào tình huống bắt đầu sống một mình). ""家具や"" liên kết với ""家電を"" bằng trợ từ ""や"" để làm cụm tân ngữ song hành cho động từ ""揃える"". Cụm này đi với ""必要がある""."
となったら,いざとなったら,N2,①いざとなったら私が責任をとります。,困った時はいつでも相談してね。いざとなったら私が助けてあげるから。,困った時はいつでも相談してね。,いざと,なったら,私が,助けて,あげるから。,"""いざと"" liên kết với ""なったら"" tạo thành quán ngữ cố định 'khi cần kíp/khi đến thời khắc quyết định'. ""私が"" làm chủ ngữ thực hiện hành động hành vi ""助けてあげる"", đi kèm trợ từ ""から"" để giải thích nguyên nhân làm chỗ dựa."
となったら,N（のこと）となったら,N2,①日本料理となったらここの坂前の右に出る者はいないそうだ。,彼はゲームのこととなったら寝る時間も惜しんで熱中してしまう。,彼は,ゲームの,ことと,なったら,寝る時間も,惜しんで熱中してしまう。,"Cấu trúc 「N của こととなったら」 mang nghĩa 'cứ nói đến chuyện N là...'. Danh từ 'ゲーム' kết hợp với 'のこととなったら' tạo thành vế điều kiện, chỉ ra chủ đề gây sự thay đổi. Trạng ngữ '寝る時間も' và động từ '惜しんで' bổ nghĩa cho hành động '熱中してしまう' ở vế sau."
となっては,いまとなっては,N2,①今となっては、名前も顔も思い出すことができない。,幼い頃の思い出は今となっては記憶の彼方に消えてしまった。,幼い頃の思い出は,今と,なっては,記憶の,彼方に,消えてしまった。,"""今と"" kết hợp ""なっては"" thành quán ngữ ""今となっては"" (đến giờ/bây giờ đã muộn). ""記憶の"" bổ nghĩa cho danh từ ""彼方"". Trợ từ ""に"" chỉ hướng hoặc nơi chốn mà trạng thái động từ ""消えてしまった"" hướng tới."
となっては,～となっては　N／Na（だ）となっては　A／V　となっては,N2,①子供達だけで海外へ行くとなっては、親としてはちょっと心配になる。,毎月これほど物価が上がるとなっては生活費を節約せざるを得ない。,毎月これほど,物価が上がる,となっては,生活費を,節約せざる,を得ない。,"""物価が上がる"" đi liền với cấu trúc diễn tả thực tế khách quan ""となっては"" (khi mà tình trạng... xảy ra thì kéo theo hệ quả tiêu cực). ""生活費を"" làm tân ngữ cho ""節約せざる"", kết hợp với ""を得ない"" tạo mẫu ngữ pháp 'buộc phải tiết kiệm'."
となる,となる,N3,①初めて戦後生まれの人物がアメリカの大統領となった。,来月から姉の子供がいよいよ小学生となるのでランドセルを買った。,来月から姉の子供が,いよいよ,小学生,と,なるので,ランドセルを買った。,"""いよいよ"" là phó từ nhấn mạnh sự việc mong đợi sắp sửa diễn ra. ""小学生"" kết hợp với trợ từ ""と"" và động từ ""なる"" (biến đổi thành/trở thành). Trợ từ ""ので"" chỉ nguyên nhân khách quan, dẫn đến hành động mua cặp ở vế sau."
となると,となると,N2,①A：先生はご病気で昨日入院されました。B：となると、しばらく授業は休講ということになりますね。,明日は大雨が降るらしい。となると予定していたバーベキューは中止にするしかない。,明日は大雨が降るらしい。,となると,予定していた,バーベキューは,中止にする,しかない。,"""となると"" đứng đầu câu làm liên từ nối mang nghĩa 'nếu vậy thì/trong trường hợp đó'. ""予定していた"" là định ngữ bổ nghĩa cho danh từ ""バーベキューは"". Động từ ""中止にする"" đi với ""しかない"" tạo nghĩa 'chỉ còn cách hủy bỏ'."
となると,～となると　N／Na（だ）となると　A／V　となると,N2,①医学部に進むとなると相当にお金がかかるだろう。,駅から近いアパートを借りるとなると毎月の家賃がかなり高くなる。,駅から近い,アパートを,借りる,となると,毎月の家賃が,かなり高くなる。,"""アパートを"" làm tân ngữ cho động từ ""借りる"". Cụm động từ này đi với cấu trúc giả định tình huống ""となると"" (nếu xét đến việc thuê căn hộ...). ""毎月の家賃が"" làm chủ ngữ chính cho tính từ biến đổi ở vế cuối ""かなり高くなる""."
となると,いざとなると,N2,①危険は承知の手術だが、いざとなると不安になるものだ。,好きな人に告白しようと決めていたが、いざとなると緊張して言葉が出なかった。,好きな人に告白しようと決めていたが、,いざと,なると,緊張して,言葉が,出なかった。,"""いざと"" đi với ""なると"" tạo thành quán ngữ ""いざとなると"" (đến khi thực sự hành động/khi thời khắc quyết định đến). ""緊張して"" chỉ nguyên nhân trạng thái (vì căng thẳng) dẫn đến hệ quả ""言葉が"" (lời nói) không thể ""出なかった""."
