Grammar,Usage,JLPT Level,Reference Example,Original Example,Prefix,Chunk1,Chunk2,Chunk3,Chunk4,Suffix,Explanation
また,また＜繰り返し＞,N5,①また、飛行機が落ちたらしい。,"今週、またあのカフェに行きました。","今週、","また","あの","カフェに","行きました","。","Trạng từ 「また」 (lại/một lần nữa) bổ nghĩa cho động từ 「行きました」 ở cuối câu. Từ chỉ định 「あの」 đứng trước để bổ nghĩa cho danh từ 「カフェ」. Trợ từ 「に」 chỉ điểm đến của hành động di chuyển. Thứ tự các thành phần sắp xếp theo cấu trúc tự nhiên của tiếng Nhật N5."
また,また＜付加＞,N4,①教科書は、大学生協で購入できる。また、大きな書店でも販売している。,"この店はパンが美味しく、また、値段も安いです。","この店はパンが美味しく、","また、","値段","も","安いです","。","Liên từ 「また」 được dùng ở đầu vế câu thứ hai nhằm thêm thông tin bổ sung (hơn nữa/bên cạnh đó). Danh từ 「値段」 đi kèm với trợ từ 「も」 để thể hiện tính chất bổ sung tương đồng với vế trước. Tính từ 「安いです」 kết thúc câu làm vị ngữ nêu bật đặc điểm giá cả."
また,また＜列挙＞,N3,①彼は良き父であり、また良き夫でもある。,"鈴木さんは私の親友であり、また仕事の良いライバルでもある。","鈴木さんは私の親友であり、","また","仕事の","良いライバル","でもある","。","Cấu trúc 「...であり、また...でもある」 dùng để liệt kê song song hai đặc điểm của cùng một đối tượng. 「また」 đóng vai trò liên kết ở vế sau. Cụm 「仕事の」 bổ nghĩa cho danh từ 「良いライバル」. Vĩ tố 「でもある」 kết hợp với danh từ để hoàn thiện ý nghĩa liệt kê song hành."
また,また＜選択＞,N3,①参加してもよい。また、参加しなくてもよい。,"今日中に返事をしてください。また、明日でも大丈夫です。","今日中に返事をしてください。","また、","明日","でも","大丈夫です","。","Liên từ 「また」 ở đây thể hiện sự lựa chọn thay thế (hoặc là). Danh từ thời gian 「明日」 kết hợp với trợ từ 「 Almond/đối với」 dưới dạng 「đều/dù là」 (「でも」) để đưa ra một phương án khác có thể chấp nhận. Vị ngữ 「大丈夫です」 kết thúc câu khẳng định sự ổn thỏa."
また,～もまた Nもまた Naなのもまた A／V のもまた,N2,①山でのキャンプ生活は電気もガスもないが、不便なのもまた楽しい。,"子育ては大変だが、子供の成長を見るのもまた楽しい。","子育ては大変だが、","子供の成長を","見る","のもまた","楽しい","。","Cấu trúc 「V-るのもまた」 biểu thị ý nghĩa cái việc làm hành động đó cũng lại mang tính chất gì đó. Cụm tân ngữ 「子供 của sự trưởng thành」 đứng trước động từ nguyên mẫu 「見る」. Cụm 「のもまた」 đóng vai trò danh từ hóa vế câu và thêm nét nghĩa nhấn mạnh. Tính từ 「楽しい」 làm vị ngữ kết câu."
また,～また,N2,①いったいまたどうしてそんなことを。,"こんな夜遅くに、いったいまたどこへ行くの？","こんな夜遅くに、","いったい","また","どこへ","行くの","？","Cụm từ 「いったいまた」 dùng trong câu hỏi để nhấn mạnh sự ngạc nhiên hoặc thắc mắc cực độ (rốt cuộc là lại...). Từ nghi vấn chỉ nơi chốn 「どこへ」 định hướng cho hành động di chuyển. Động từ thể thông thường kết hợp đuôi hỏi 「の」 phù hợp bối cảnh giao tiếp thường nhật với bạn bè, người thân."
また,またのN,N4,①またのお越しをお待ちしております。,"またの機会に、ぜひ一緒にご飯に行きましょう。","","またの","機会に、","ぜひ一緒に","ご飯に行きましょう","。","Cấu trúc 「またの＋N」 dùng để chỉ một N khác hoặc lần sau. Ở đây 「またの機会に」 nghĩa là vào một cơ hội khác. Trạng từ chỉ ý chí 「ぜひ」 và phó từ 「一緒に」 hỗ trợ tăng sức biểu cảm cho lời mời gọi, đứng trước hình thức rủ rê 「行こう/いきましょう」 ở cuối câu."
また,NまたN,N2,①一行は、山また山の奥地に進んで行った。,"毎日、仕事また仕事の日々で、自分の時間が全くない。","毎日、","仕事また仕事の","日々で、","自分の時間が","全くない","。","Cấu trúc 「NまたN」 diễn tả sự lặp đi lặp lại liên tục, chồng chất của sự vật (hết việc này đến việc khác). Cụm 「仕事また仕事の」 bổ nghĩa cho danh từ 「日々」, đi với trợ từ chỉ nguyên nhân 「で」. Vế sau bắt đầu bằng chủ ngữ 「自分の時間が」 và kết thúc bằng trạng thái phủ định hoàn toàn 「全くない」."
まだ,まだ～ない,N5,①A：昼ご飯は、もう食べましたか。B：いいえ、まだ食べていません。 deadly,"私はまだ朝のご飯を食べていません。","私は","まだ","朝のご飯を","食べて","いません","。","Cấu trúc 「まだ...ていません」 dùng diễn tả một hành động chưa được thực hiện tính đến hiện tại (chưa...). Phó từ 「まだ」 đứng đầu bổ nghĩa cho cụm phủ định phía sau. Tân ngữ 「朝のご飯を」 đứng trực tiếp trước động từ chính chia thể Te 「食べて」 kết hợp với trợ động từ phủ định 「いません」."
まだ,まだ＜過去からの継続＞,N5,①A：敏子は何をしているの？B：おねえちゃんは、まだ電話をしているよ。,"父はまだ自分の部屋で寝ています。","父は","まだ","自分の部屋で","寝て","います","。","Phó từ 「まだ」 kết hợp với thể tiếp diễn 「V-ている」 thể hiện một trạng thái vẫn đang tiếp diễn từ quá khứ (vẫn đang...). Cụm chỉ vị trí 「自分の部屋で」 làm trạng ngữ bổ nghĩa cho hành động ngủ. Động từ chia thể Te 「寝て」 đi liền với 「います」 để hoàn thiện cấu trúc hành động đang diễn ra."
まだ,まだ＜未果への継続＞,N4,①これから、まだもっと寒くなる。,"昼からは、まだもっと暑くなりますよ。","昼からは、","まだ","もっと","暑く","なりますよ","。","Sự kết hợp 「まだもっと」 dùng để nhấn mạnh mức độ sẽ còn tiếp diễn và tăng tiến hơn nữa trong tương lai (sẽ còn... hơn nữa). Tính từ đuôi i biến đổi sang dạng trạng từ 「暑く」 để bổ nghĩa cho động từ thay đổi trạng thái 「なります」. Đuôi câu 「よ」 dùng để nhấn mạnh thông tin truyền tải tới người nghe."
まだ,まだ～ある,N5,①開演までには、まだ時間がある。,"冷蔵庫の中に、まだ美味しいケーキがあります。","冷蔵庫の中に、","まだ","美味しい","ケーキが","あります","。","Cấu trúc 「まだ...ある」 chỉ việc một đồ vật hay số lượng vẫn còn tồn tại chưa hết (vẫn còn...). Trạng từ 「まだ」 bổ nghĩa cho động từ tồn tại 「あります」 ở cuối câu. Cụm danh từ đóng vai trò chủ ngữ 「美味しいケーキが」 đứng trước động từ để thể hiện sự hiện hữu của sự vật."
まだ,まだ＜経過＞,N4,①まだ一時間しかたっていない。,"日本に来てから、まだ三ヶ月しかたっていません。","日本に来てから、","まだ","三ヶ月","しか","たっていません","。","Mẫu câu 「まだ＋Số lượng＋しか＋Phủ định」 diễn tả ý nghĩa mới chỉ trôi qua một khoảng lượng ít ỏi, chưa đạt tới mong đợi. 「まだ」 bổ nghĩa cho tính chất ít ỏi của thời gian 「三ヶ月」. Trợ từ hạn định 「しか」 bắt buộc phải đi cùng với hình thức phủ định của động từ trôi qua thời gian 「たっていません」."
まだ,まだ＜比較＞,N3,①何日もかかって、長いレポートを書かされるよりは、一日ですむ試験の方がまだいい。,"家で一人で悩むよりは、友達に相談する方がまだいい。","家で一人で悩むよりは、","友達に","相談する","方が","まだいい","。","Cấu trúc so sánh 「AよりはBの方がまだいい」 diễn tả ý nghĩa so với A thì phương án B vẫn còn tốt hơn (dù chưa phải là tuyệt đối nhất). Cụm tân ngữ hành động 「友達に相談する」 làm rõ nội dung của phương án lựa chọn. Trợ từ so sánh hơn 「方が」 đi kèm trực tiếp phó từ so sánh mức độ 「まだいい」 để kết thúc câu."
またしても,,N2,①またしても空の事故が起こった。,"ダイエット中なのに、またしても夜遅くにラーメンを食べてしまった。","ダイエット中なのに、","またしても","夜遅くに","ラーメンを","食べてしまった","。","Phó từ 「またしても」 mang sắc thái trang trọng hoặc biểu cảm mạnh, diễn tả một việc không mong muốn lại xảy ra một lần nữa. Cụm chỉ thời gian 「夜遅くに」 và tân ngữ 「ラーメンを」 bổ nghĩa trực tiếp cho hành động mang tính tiếc nuối, lỡ làm gì đó ở cuối câu 「食べてしまった」."
または,NまたはN,N4,①黒か青 ofペンまたはえんぴつで書いてください。,"申し込みは、窓口またはインターネットで受け付けています。","申し込みは、","窓口","または","インターネットで","受け付けています","。","Liên từ 「または」 dùng để liên kết hai danh từ nhằm đưa ra sự lựa chọn một trong hai phương án (hoặc là). Danh từ phương thức đầu tiên 「窓口」 nối với danh từ thứ hai 「インターネット」. Trợ từ cách thức 「で」 đứng sau danh từ thứ hai để bổ nghĩa cho động từ hành động chính 「受け付けています」."
またもや,,N2,①またもや、彼が登場した。,"せっかくの休みなのに、またもや急に雨が降り出した。","せっかくの休みなのに、","またもや","急に","雨が","降り出した","。","Trạng từ 「またもや」 diễn tả sự lặp lại của một sự việc ngoài dự kiến mang sắc thái ngạc nhiên hoặc thất vọng (lại nữa rồi). Phó từ cách thức 「急に」 bổ nghĩa cho động từ biến đổi thời tiết 「降り出した」 (bắt đầu mưa). Danh từ chủ ngữ 「雨が」 đứng trước động từ thể hiện chủ thể của hành động tự nhiên."
まったく,まったく～ない,N4,①きのうのクラスはまったくおもしろくなかった。,"最近忙しくて、まったく部屋の掃除をしていません。","最近忙しくて、","まったく","部屋の","掃除を","していません","。","Cấu trúc phối hợp 「まったく...ない」 biểu thị ý nghĩa hoàn toàn không làm một việc gì đó. Trạng ngữ chỉ bối cảnh 「最近忙しくて」 đứng ở đầu câu. Phó từ 「まったく」 bổ nghĩa mức độ phủ định triệt để cho hành động phía sau. Cụm tân ngữ 「部屋の掃除を」 bổ nghĩa trực tiếp cho động từ chính ở hình thức phủ định hoàn thành 「していません」."
まったく,まったく,N4,①これとこれはまったく同じものです。,"彼の意見は、私の考えとまったく同じです。","彼の意見は、","私の","考えと","まったく","同じです","。","Phó từ 「まったく」 trong câu khẳng định mang ý nghĩa nhấn mạnh mức độ tuyệt đối (hoàn toàn/chính xác là). Cụm danh từ sở hữu 「私の考え」 kết hợp trợ từ so sánh 「と」 (với). 「まったく」 đứng ngay trước từ chỉ sự tương đồng 「同じです」 để nhấn mạnh tính chất giống nhau hoàn toàn 100%."
まで,NからNまで,N5,①シンポジウムは1時から3時まで第3会場で行います。,"駅から家まで歩いて10分かかります。","","駅から","家まで","歩いて","10分かかります","。","Cấu trúc chỉ phạm vi không gian từ đâu tới đâu 「N1からN2まで」. Ở đây danh từ điểm xuất phát 「駅」 đi với 「から」, danh từ điểm đích 「家」 đi với 「まで」. Động từ chia thể Te 「歩いて」 đóng vai trò trạng ngữ chỉ cách thức di chuyển, đứng trước cụm chỉ thời lượng và động từ tiêu tốn 「10分かかります」."