Grammar,Usage,JLPT Level,Reference Example,Original Example,Prefix,Chunk1,Chunk2,Chunk3,Chunk4,Suffix,Explanation
よかった,V－なければよかったのに,N3,①そんなこと言わなければよかったのに。,あの高いコートは買わなければよかったのに。,あの,高い,コートは,買わなければ,よかった,のに。,"Cụm 'あの' bổ nghĩa cho danh từ phía sau, tiếp theo là tính từ '高い' bổ nghĩa cho 'コートは' làm chủ đề câu. '買わなければ' là thể điều kiện phủ định của động từ '買う', đi liền với cụm 'よかったのに' tạo thành cấu trúc thể hiện sự hối tiếc, giá mà không làm thì tốt biết mấy."
よかろう,,N1,①のんびりしたいのなら、観光地に行くよりは温泉の方がよかろう。,自立したいのなら、一人暮らしをしてみるのもよかろう。,自立したいの,なら、,一人暮らしを,してみるのも,よか,ろう。,"Vế '自立したいのなら' đưa ra giả thuyết (nếu muốn tự lập). '一人暮らしをしてみる' (thử sống một mình) đi với danh từ hóa 'の' và trợ từ 'も' đóng vai trò cụm chủ ngữ, kết hợp với vị ngữ 'よかろう' là thể phỏng đoán trang trọng của 'よい'."
よく,よく ＜頻度＞,N5,①彼はこの店によく来る。,私はこのレストランで友達とよく昼ご飯を食べます。,私はこの,レストランで,友達と,よく,昼ご飯を,食べます。,Cụm '私はこの' đứng trước và bổ nghĩa cho danh từ địa điểm 'レストランで'. Tiếp theo là cụm '友達と' (cùng với bạn). Trạng từ tần suất 'よく' đứng ngay trước cụm danh từ tân ngữ + động từ '昼ご飯を食べます' để bổ nghĩa cho hành động ăn thường xuyên.
よく,よく ＜程度＞,N5,①最近よく眠れなくて困っている。,ご飯の前に石鹸で手をよく洗いなさい。,ご飯の,前に,石鹸で,手を,よく,洗いなさい。,"Cụm 'ご飯の前に' chỉ thời gian trước bữa ăn. '石鹸で' chỉ phương thức bằng xà phòng. '手を' là tân ngữ của hành động. Trạng từ chỉ mức độ 'よく' (kỹ, sạch) đứng trước động từ dạng mệnh lệnh '洗いなさい' để bổ nghĩa trực tiếp cho hành động rửa."
よく,よく（ぞ）＜感激＞,N2,①よくいらっしゃいました。,よくぞあんなに難しい試験に合格してくれた。,よくぞ,あんなに,難しい,試験に,合格して,くれた。,"Trạng từ biểu thị sự cảm kích 'よくぞ' đứng ở đầu câu để nhấn mạnh. 'あんなに' bổ nghĩa cho tính từ '難しい', tính từ này bổ nghĩa cho danh từ '試験に'. Cụm '試験に合格する' đi liền nhau, được chia sang dạng '～てくれた' thể hiện niềm vui, sự biết ơn của người nói đối với hành động của đối phương."
よく,よく（も）＜驚き＞,N2,①おじいさんの子供の頃なんて、よくもそんな古い写真が残っていたね。,こんなに散らかった部屋でよくも鍵を見つけられたね。,こんなに,散らかった,部屋で,よくも,鍵を,見つけられたね。,"Cụm 'こんなに散らかった' bổ nghĩa cho danh từ địa điểm '部屋で' (trong căn phòng bừa bộn thế này). Trạng từ thể hiện sự kinh ngạc 'よくも' đi liền trước cụm tân ngữ '鍵を' và động từ khả năng quá khứ '見つけられたね' để tạo thành câu thể hiện sự bất ngờ, không ngờ có thể làm được."
よく,よく（も）＜非難＞,N2,①よくもみんなの前で私に二恥をかかせてくれたな。,冷蔵庫のケーキをよくも勝手に食べてくれたな。,冷蔵庫の,ケーキを,よくも,勝手に,食べて,くれたな。,"Cụm danh từ '冷蔵庫のケーキを' đóng vai trò tân ngữ đứng đầu câu. Trạng từ mang tính chất chỉ trích, phê phán 'よくも' kết hợp với trạng từ '勝手に' (tự tiện) để bổ nghĩa cho hành động gây bực dọc '食べてくれたな' (dám ăn mất của tôi)."
よそに,Nをよそに＜無視＞,N1,①弟は親の心配をよそに毎晩遅くまで遊んでいる。,娘は親の反対をよそに高級なバッグを買ってしまった。,娘は,親の,反対を,よそに,高級なバッグを,買ってしまった。,'娘は' là chủ ngữ chính. Danh từ '親の反対' đi kèm với cấu trúc 'をよそに' tạo thành một cụm trạng ngữ mang nghĩa 'mặc kệ sự phản đối của bố mẹ'. Cụm này bổ nghĩa cho hành động phía sau bao gồm tân ngữ '高級なバッグを' và động từ kết quả đáng tiếc '買ってしまった'.
よそに,Nをよそに＜無関係＞,N1,①高速道路の渋滞をよそに、私たちはゆうゆうと新幹線で東京に向かった。,外の大雨をよそに、私たちは家でパーティーを楽しんだ。,外の,大雨を,よそに、,私たちは家で,パーティーを,楽しんだ。,"Cụm danh từ '外の大雨' kết hợp với 'をよそに' chỉ hoàn cảnh bên ngoài không liên quan hay ảnh hưởng đến hoạt động bên trong. Tiếp theo là chủ ngữ và địa điểm '私たちは家で', đi cùng cụm tân ngữ và động từ vị ngữ 'パーティーを楽しんだ' để hoàn thành câu."
よほど,話しことばで強めるときには「よっぽど」となる。よほど Aよほど,N3,①こんな大邸宅を建てるなんて、よほどの金持ちに違いない。,コンビニであんなに買うなんて、よほどお腹が空いていたのだろう。,コンビニで,あんなに,買うなんて、,よほど,お腹が,空いていたのだろう。,"Cụm 'コンビニであんなに買うなんて' đưa ra một sự kiện thực tế làm căn cứ suy đoán. Trạng từ mức độ cao 'よほど' bổ nghĩa cho cụm từ chỉ trạng thái 'お腹が空いていた' (đang đói bụng lắm), đi kèm với đuôi câu suy đoán 'のだろう'."
よほど,よほどV－よう,N2,①こんなつまらない仕事、よほど辞めようかと思った。,あのワンピースが可愛くて、よほど買おうかと思った。,あのワン,ピースが,可愛くて、,よほど,買おうかと,思った。,Chủ ngữ 'あのワンピースが' đi liền với tính từ chỉ lý do '可愛くて' (vì đáng yêu). Trạng từ 'よほど' kết hợp với động từ thể ý chí '買おう' cùng cấu trúc 'かと思った' diễn tả một hành động suýt chút nữa đã thực hiện trong quá khứ nhưng thực tế lại thôi.
よもや,よもや～ないだろう／～まい,N1,①よもや負けるまいと思われていた選手が予選落ちした。,あんなに優しい子がよもや親に嘘をつくまい。,あんなに,優しい子が,よもや,親に,嘘を,つくまい。,Cụm từ 'あんなに優しい子が' làm chủ ngữ cho câu. Trạng từ 'よもや' mang nghĩa 'không đời nào / hoàn toàn không nghĩ tới' đứng trước để bổ nghĩa bổ trợ cho cụm phủ định phỏng đoán mang tính chắc chắn ở cuối câu là '親に嘘をつくまい' (nói dối bố mẹ).
より,～より（も／は） N／V より（も／は）,N5,①今年の冬は昨年よりも寒い。,この店のミルクティーはあの店よりも甘いです。,この店の,ミルクティーは,あの店,よりも,甘い,です。,Chủ đề so sánh được đặt ở đầu câu là 'この店のミルクティーは'. Đối tượng được dùng để so sánh là 'あの店' đi kèm với trợ từ so sánh 'よりも' (hơn). Vị ngữ là tính từ đuôi i '甘い' kết hợp đuôi lịch sự 'です'.
より,～というより,N3,①彼は堅実家というよりけちだと言う方が当たっている。,二人の関係は友達というより家族のようだ。,二人の,関係は,友達という,より,家族の,ようだ。,"Cụm '二人の関係は' xác định chủ đề của câu. Danh từ thứ nhất '友達' kết hợp với cấu trúc 'というより' (hơn là nói là...) nhằm bổ nghĩa so sánh, hướng tới danh từ thứ hai mô tả chính xác bản chất hơn là '家族のようだ' (như là gia đình)."
より,V－るよりない,N2,①どうしても大学に通う気が起きないのなら、もう退学するよりないだろう。,家の鍵をなくしてしまったし、今は鍵屋を呼ぶよりない。,家の鍵を,なくしてしまったし、,今は,鍵屋を,呼ぶより,ない。,Vế '家の鍵をなくしてしまったし' chỉ nguyên nhân. Trạng từ '今は' chỉ thời gian hiện tại. Tân ngữ '鍵屋を' đi kèm động từ thể từ điển '呼ぶ' kết hợp cấu trúc 'よりない' biểu thị tình thế bắt buộc không còn lựa chọn nào khác.
より,V－るよりほか（に／は）ない,N2,①今さらあれはうそだったとも言えないし、隠しとおすよりほかにない。,冷蔵庫が空っぽだから、今夜は外食するよりほかはない。,冷蔵庫が,空っぽだから、,今夜は,外食する,よりほかは,ない。,Vế đầu '冷蔵庫が空っぽだから' bổ nghĩa chỉ nguyên nhân (vì tủ lạnh trống trơn). Trạng từ '今夜は' làm rõ thời gian. Động từ thể từ điển '外食する' đi kèm với cấu trúc 'よりほかはない' nhằm khẳng định đây là phương án duy nhất có thể thực hiện.
より,～よりほかに～ない Nよりほかに～ない V－るよりほかに～ない,N2,①その部屋は静かで、時計の音よりほかに何の物音も聞こえなかった。,この店には、このシャツよりほかにサイズが合う服はない。,この店には、,このシャツ,よりほかに,サイズが合う,服は,ない。,"Cụm 'この店には' chỉ địa điểm bối cảnh. Danh từ so sánh 'このシャツ' đi liền với cấu trúc giới hạn 'よりほかに'. Mệnh đề định ngữ 'サイズが合う' bổ nghĩa cho danh từ '服は', kết thúc bằng động từ phủ định 'ない' để tạo nghĩa loại trừ hoàn toàn tất cả các trang phục khác."
より,V－るよりしかたがない,N2,①お金がないのなら、旅行はあきらめるよりしかたがないね。,こんなに雨が降っていては、ピクニックは諦めるよりしかたがない。,こんなに,雨が降っていては、,ピクニックは,諦めるより,しかたが,ない。,Vế đầu 'こんなに雨が降っていては' đưa ra điều kiện tiêu cực cản trở. Tân ngữ 'ピクニックは' được đưa lên làm chủ đề vế sau. Động từ '諦める' đi kèm với cấu trúc 'よりしかたがない' biểu thị việc đành phải chấp nhận từ bỏ do hoàn cảnh ép buộc.
らしい,NらしいN,N3,①最近は子供らしい子供が少なくなった。,私は家族らしい家族がいる温かい家に住みたい。,私は,家族らしい,家族がいる,温かい,家に,住みたい。,"Chủ ngữ '私は' đứng đầu câu. Cụm từ '家族らしい家族' mang ý nghĩa 'một gia đình đúng nghĩa gia đình', đóng vai trò làm chủ ngữ cho mệnh đề định ngữ '～がいる'. Cả mệnh đề này kết hợp tính từ '温かい' cùng bổ nghĩa cho danh từ chỉ nơi chốn '家に', kết thúc bằng động từ nguyện vọng '住みたい'."
らしい,Nらしい,N3,①今日は春らしい天気だ。,今日の彼の服装は学生らしい爽やかな感じだ。,今日の,彼の服装は,学生らしい,爽やかな,感じ,だ。,"Cụm '今日の彼の服装は' đóng vai trò là chủ đề câu. Danh từ mang tính chất đặc trưng '学生らしい' (ra dáng học sinh) cùng với tính từ đuôi na '爽やかな' (tươi tắn) đồng thời bổ nghĩa cho danh từ chỉ phong thái '感じ', kết thúc bằng hệ từ khẳng định 'だ'."
