Grammar,Usage,Reference Example,Original Example,Prefix,Chunk1,Chunk2,Chunk3,Chunk4,Suffix,Explanation
させる,V－させてください＜許可求め＞,①申し訳ありませんが、今日は少し早く帰らせてください。,すみませんが、体調が悪いので明日の買い出しは私に行かせてください。,すみませんが、体調が悪いので明日の,買い出しは,私に,行かせて,ください,。,「明日の」 bổ nghĩa cho danh từ 「買い出しは」. Động từ thể sai khiến 「行かせて」 đi với trợ từ 「に」 để chỉ đối tượng trực tiếp thực hiện hành động (私に). Mẫu câu 「～させてください」 dùng để xin phép đối phương cho bản thân mình được làm một việc gì đó.
させる,V－させて もらう／くれる＜恩恵＞,①両親が早く亡くなったので、姉が働いて私を大学に行かせてくれた。,母は私がやりたいと言ったので、子供の頃からピアノを思い切り習わせてくれた。,母は私がやりたいと言ったので、子供の頃から,ピアノを,思い切り,習わせて,くれた,。,「ピアノを」 đóng vai trò là tân ngữ của hành động. Phó từ 「思い切り」 đứng trước để bổ nghĩa cho động từ phía sau. Động từ thể sai khiến kết hợp với dạng ban ơn 「習わせてくれた」 thể hiện lòng biết ơn khi được người khác (người mẹ) cho phép hoặc tạo điều kiện cho làm việc mình muốn.
させる,V－させられる＜使役受身＞ NがNにVさせられる,①きのうは、お母さんに3時間も勉強させられた。,週末なのに、兄に部屋の大掃除をさせられた。,週末なのに、,兄に,部屋の,大掃除を,させられた,。,「兄に」 chỉ tác nhân ép buộc trong câu sai khiến bị động. Danh từ ghép được kết hợp bằng trợ từ 「部屋の」 để bổ nghĩa cho 「大掃除」. Thể sai khiến bị động 「させられた」 đặt ở cuối câu để diễn tả tâm trạng bất mãn khi bị người khác bắt buộc làm việc mình không muốn.
さっぱり,さっぱり～ない,①あの人の話はいつもむずかしいことばがたくさんでてきてさっぱりわからない。,スマホの新しい機能の使い方がさっぱりわからない。,スマホの,新しい機能の,使い方が,さっぱり,わからない,。,"Định ngữ 「新しい機能の」 bổ nghĩa cho danh từ 「使い方」. Trợ từ 「が」 đi kèm để biểu thị đối tượng của năng lượng hành vi (không hiểu cái gì). Phó từ 「さっぱり」 mang ý nghĩa nhấn mạnh, luôn đi kèm với thể phủ định 「わからない」 ở phía sau để tạo thành nghĩa 'hoàn toàn không...'"
さっぱり,さっぱりだ,①A：どう、調子は。B：だめ。さっぱりだよ。,最近商店街の福引きに挑戦しているが、今年のくじの結果はさっぱりだ。,最近商店街の福引きに挑戦しているが、,今年の,くじの,結果は,さっぱりだ,。,"「今年の」 bổ nghĩa cho 「くじの」, và toàn bộ cụm này bổ nghĩa cho chủ ngữ 「結果は」. Tính từ đuôi na biến thể 「さっぱりだ」 đóng vai trò làm vị ngữ kết thúc câu, mang ý nghĩa tiêu cực diễn tả tình hình hoặc kết quả vô cùng tồi tệ, không có gì tiến triển."
さて,さて,①さて、そろそろいこうか。,おしゃべりはここまでにして、さて、晩ご飯の準備に取りかかろう。,おしゃべりはここまでにして、,さて、,晩ご飯の,準備に,取りかかろう,。,"Liên từ 「さて」 đứng ở đầu mệnh đề mới để chuyển đổi tâm trạng hoặc chuyển sang một chủ đề, hành động tiếp theo. 「晩ご飯の」 bổ nghĩa cho danh từ 「準備に」. Cụm từ 「準備に取りかかる」 được chia sang thể ý chí 「取りかかろう」 để tự nhủ hoặc rủ rê cùng thực hiện hành động."
さて,さてV－てみると,①漢字がおもしろそうだったので日本語を勉強することにしたのだが、さてはじめてみると、これがけっこうむずかしい。,簡単そうな料理だと思って作ってみたが、さて実際にやってみるとかなり難しかった。,簡単そうな料理だと思って作ってみたが、,さて,実際に,やってみると,かなり難しかった,。,Liên từ 「さて」 dẫn dắt vào một tình huống trải nghiệm thực tế. Phó từ 「実際に」 đứng trước để bổ nghĩa cho cấu trúc giả định tình huống thực tế 「やってみると」 (khi thử làm thì...). Vế cuối cùng 「かなり難しかった」 đưa ra kết luận hoặc nhận thức bất ngờ sau khi đã thử nghiệm.
さほど,さほどNaではない さほどA－くない さほどV－ない,①きょうはさほどさむくない。,近所にできた新しいスーパーの惣菜は、値段のわりにはさほど美味しくない。,近所にできた新しいスーパーの惣菜は、,値段の,わりには,さほど,美味しくない,。,"Cấu trúc biểu thị sự so sánh tỷ lệ nghịch 「値段のわりには」 (tuy giá thế nhưng...). Trạng từ mức độ phủ định 「さほど」 bắt buộc phải đi kèm với tính từ thể phủ định 「美味しくない」 nhằm giảm nhẹ mức độ, mang nghĩa là 'không đến mức ngon lắm'."
さも,,「かれはさもおいしそうにビールを飲みほした。」,弟は自分で作ったわけでもないのに、さも自分が作ったかのように自慢している。,,,,,,,「Phó từ 「さも」 mang nghĩa 'như thật' luôn có xu hướng đi kèm với cấu trúc so sánh giả định 「～かのように」. Chủ ngữ 「自分が」 thực hiện hành động 「作った」 trong mệnh đề phụ
さらに,さらにNa／A／V さらに＋数量詞,①一日一回では効かないので、さらに薬の量を増やした。,セールで安くなっていた服が、タイムサービスでレジにてさらに20パーセント安くなった。,セールで安くなっていた服が、タイムサービスで,レジにて,さらに,20パーセント,安くなった,。,"Cụm từ 「レジにて」 chỉ nơi chốn xảy ra hành động. Trạng từ chỉ mức độ tăng tiến 「さらに」 đứng trước số lượng từ 「20パーセント」 để nhấn mạnh tính chất tăng thêm (rẻ hơn nữa, rẻ thêm nữa) bổ nghĩa cho trạng thái biến đổi 「安くなった」."
ざるをえない,V－ざるをえない 「V－ない」の「ない」を「ざる」に変えて作る。ただし、「する」は「せざるをえない」となる。,①先生に言われたことだからやらざるをえない。,台風で電車が止まってしまったので、今日の友達との約束は苦渋の決断でキャンセルせざるを得ない。,台風で電車が止まってしまったので、今日の友達との約束は,苦渋の,決断で,キャンセルせ,ざるを得ない,。,Danh từ bổ nghĩa 「苦渋の」 đi với 「決断で」 chỉ phương thức/lý do. Động từ nhóm 3 「キャンセルする」 khi đi với mẫu câu đành phải làm gì sẽ biến đổi thành dạng 「キャンセルせ」 rồi kết hợp với đuôi 「ざるを得ない」 để biểu thị việc bản thân không muốn nhưng không còn lựa chọn nào khác.
し,～し,①あの店は安いし、うまい。,このアパートは駅からも近いし、家賃も手頃だから気に入っている。,このアパートは,駅からも,近いし、,家賃も,手頃だから,気に入っている。,"Cấu trúc liệt kê lý do song hành dùng trợ từ 「も」 ở hai vế để nhấn mạnh tính tương đồng (駅からも / 家賃も). Tính từ 「近いし」 kết thúc vế thứ nhất để nối sang lý do thứ hai mang tính quyết định 「手頃だから」, từ đó dẫn đến kết luận cuối cùng."
し,～し、それに,①今日は雨だし、それに風もつよい。,今日はスーパーの特売日だし、それにポイントも5倍つくから買い出しに行こう。,今日はスーパーの,特売日だし、,それに,ポイントも,5倍つくから,買い出しに行こう。,「特売日だし」 sử dụng đuôi 「し」 để kết thúc lý do thứ nhất. Liên từ nối 「それに」 đứng đầu mệnh đề tiếp theo để bổ sung thêm một thông tin quan trọng. Cụm 「ポイントも5倍つくから」 tạo thành vế nguyên nhân tổng hợp hoàn chỉnh hướng đến hành động ở đuôi câu.
し,Nも～し、Nも,①あの子は頭もいいし性格もいい。,うちの猫はキャットフードもよく食べるし、おやつも大好きだ。,うちの猫は,キャットフードも,よく食べるし、,おやつも,大好きだ,。,"Mẫu câu song hành liệt kê hai đặc điểm tương đồng 「N1も...し、N2も...」. Trợ từ 「も」 gắn sau tân ngữ thứ nhất, đi với phó từ và động từ liệt kê 「よく食べるし」. Vế sau tiếp tục dùng trợ từ 「も」 gắn sau danh từ thứ hai kết hợp vị ngữ tính từ 「大好きだ」."
し,～し,①もう遅いしこれで失礼します。,冷蔵庫の中身が空っぽだし、今からちょっとコンビニに行ってくるよ。,冷蔵庫の,中身が,空っぽだし、,今から,ちょっとコンビニに,行ってくるよ。,"「冷蔵庫の」 bổ nghĩa cho 「中身が」. Từ 「空っぽだし」 đóng vai trò đưa ra nguyên nhân, lý do một cách nhẹ nhàng trong văn nói hàng ngày để giải thích cho hành động di chuyển mang tính tạm thời 「今からちょっとコンビニに行ってくるよ」 ở phía sau."
し,～し、～から,①この子はまだ10歳だし、体が弱いから留学は無理だ。,外は雨が降っているし、私は風邪気味だから今日の買い物は明日にしよう。,外は,雨が降っているし、,私は,風邪気味だから,今日の買い物は,明日にしよう。,Cấu trúc kết hợp liệt kê lý do khách quan 「雨が降っているし」 và lý do chủ quan từ phía bản thân 「私は風邪気味だから」. Việc đưa hai lý do liên tiếp bằng 「し」 và 「から」 tạo căn cứ logic vững chắc cho quyết định trì hoãn hành động ở vế cuối câu.
し,Nは～し、Nは～しで,①子供は生まれるし、金はないしで大変だ。,今日はスマホは忘れるし、財布は落とすしで散々な一日だった。,今日は,スマホは忘れるし、,財布は,落とすしで,散々な,一日だった。,Mẫu câu liệt kê hàng loạt sự việc không may xảy ra đồng thời gây ra một kết quả tệ hại 「N1は...し、N2は...しで」. Cụm 「スマホは忘れるし」 song hành với 「財布は落とすしで」 đóng vai trò làm cụm nguyên nhân bổ nghĩa cho tính từ 「散々な」 để kết luận tính chất của danh từ 「一日だった」.
し,Nじゃあるまいし,①子供じゃあるまいしそんなこと一人でやりなさい。,三歳の子どもじゃあるまいし、これくらいの野菜は残さずに食べなさい。,三歳の,子どもじゃ,あるまいし、,これくらいの野菜は,残さずに,食べなさい。,「三歳の」 bổ nghĩa cho danh từ 「子ども」. Biểu thức phủ định giả định mang tính khiển trách 「子どもじゃあるまいし」 (Đâu phải là...) dùng để nhắc nhở đối phương. Vế sau danh từ chỉ số lượng mức độ 「これくらいの野菜は」 đi kèm trạng từ phủ định cách thức 「残さずに」 để bổ nghĩa cho động từ mệnh lệnh 「食べなさい」.
しいしい,,「女は遠慮しいしい部屋の片隅に座った。」,友達の家に招かれたが、最初は遠慮しいしいお菓子を一口だけ食べた。,,,,,,,「Từ nhóm Danh từ + しいしい (như 「遠慮しいしい」) cấu tạo nên một trạng từ diễn tả dáng vẻ vừa làm gì đó vừa giữ kẽ
しか,N（＋助詞）しか～ない,①朝はコーヒーしか飲まない。,給料日前なので、今の私の財布には百円玉が数枚しか残っていない。,給料日前なので、今の,私の財布には,百円玉が,数枚しか,残って,いない。,Cụm định ngữ 「今の」 bổ nghĩa cho cụm danh từ chỉ vị trí 「私の財布には」. 「百円玉が」 đóng vai trò là chủ ngữ của trạng thái. Trợ từ hạn định mang tính tiêu cực 「しか」 gắn sau lượng từ 「数枚」 và bắt buộc đi với thể phủ định kết thúc câu 「残っていない」 mang ý nghĩa 'chỉ duy nhất'.
