Grammar,Usage,JLPT Level,Reference Example,Original Example,Prefix,Chunk1,Chunk2,Chunk3,Chunk4,Suffix,Explanation
わけだ,～わけだ＜言いかえ＞,N3,①彼女の父親は私の母の弟だ。つまり彼女と私はいとこ同士なわけだ。,今日と明日は祝日だから、土日を合わせてつまり4連休になるわけだ。,今日と明日は祝日だから、土日を合わせて,つまり,4連休に,なる,わけだ,。,"Trình tự diễn đạt ý nghĩa diễn dịch/thay thế bằng cách khác: 'つまり' (tóm lại) đứng đầu vế câu kết luận, đi với cụm danh từ biểu thị kết quả '4連休に' kết hợp với động từ 'なる' (trở thành/thành) thành vế 'つまり4連休になる' (tóm lại là thành kỳ nghỉ 4 ngày liên tiếp), cuối cùng kết thúc bằng cấu trúc khẳng định một sự thật hiển nhiên hoặc đúc kết 'わけだ'."
わけだ,～わけだ＜理由＞,N3,①今年は米のできが良くなかった。冷夏だったわけだ。,部屋がずいぶん寒いと思ったら、窓が開いているわけだ。,部屋がずいぶん寒いと思ったら、,窓が,開いて,いる,わけだ,。,"Giải thích nguyên nhân của một sự việc hiện tại: '窓が' (cửa sổ) là chủ ngữ cho hành động tự động từ trạng thái '開いている' (đang mở). Việc cửa sổ đang mở giải thích cho lý do tại sao căn phòng lại lạnh, do đó cấu trúc 'わけだ' (thảo nào/hóa ra là vì) được đặt ở cuối câu sau động từ thể thông thường để hoàn thành ý nghĩa biểu thị lý do căn nguyên."
わけだ,～わけだ＜事実の主張＞,N3,①4人とも車で来るわけだから、うちの前にずらっと4台路上駐車することになるね。,今夜は家で夕食を作るわけだから、外食する必要はないね。,今夜は家で,夕食を,作る,わけだから、,外食する,必要はないね。,"Cấu trúc đưa ra một thực tế làm căn cứ cho chủ trương hoặc phán đoán: '夕食を開ける' (bữa tối) làm tân ngữ cho động từ '作る' (nấu/làm). Tiếp theo, thực tế này được nhấn mạnh bằng 'わけだから' (vì thực tế là... nên) để làm cơ sở cho vế sau. Cụm động từ '外食する' (ăn ngoài) đi liền với phần đuôi câu '必要はないね' (không cần thiết nhỉ) để tạo thành kết luận logic."
わけだ,～わけだ＜結論＞　それなら～わけだ　それじや～わけだ　じや～わけだ,N3,①A：森さんは8年もフィンランドに留学していたそうですよ。B：へえ、そうなんですか。それならフィンランド語は得意なわけですね。,A:山田さんは毎日自分で弁当を作っているそうですよ。B:へえ、それなら料理が上手なわけですね。,A:山田さんは毎日自分で弁当を作っているそうですよ。B:へえ、,それなら,料理が,上手な,わけですね,。,"Hội thoại đưa ra kết luận logic dựa trên thông tin thu nhận: Từ nối 'それなら' (nếu thế thì) đứng đầu câu của B để phản hồi lại thông tin của A. Tiếp theo là chủ ngữ/đối tượng '料理が' (món ăn/việc nấu ăn) đi kèm với tính từ đuôi na '上手な' (giỏi) để bổ nghĩa cho cấu trúc kết luận 'わけですね' (thảo nào/hợp lý nhỉ), tạo thành một suy luận hoàn toàn tự nhiên."
わけだ,わけだ＜言いかえ＞　つまり～わけだ　ようするに～わけだ,N3,①A：この間書いた小説、文学賞がもらえたよ。B：あなたもようやく実力が認められたわけね。,A:今日は作ったケーキが全部売り切れたよ。B:つまり大成功だったわけね。,A:今日は作ったケーキが全部売り切れたよ。B:,つまり,大成功,だった,わけね,。,"Diễn đạt cách nói khác hoặc tóm tắt lại bản chất của sự việc: Từ nối 'つまり' (tóm lại/nói cách khác) mở đầu để định hướng câu trả lời mang tính đúc kết. Danh từ '大成功' (đại thành công/thành công lớn) đi kèm với thể quá khứ của trợ động từ 'だった' (đã là) để xác nhận thực tế đã xảy ra. Cuối cùng, cụm này đi với 'わけね' (nghĩa là... nhỉ) để thể hiện sự thấu hiểu và đồng tình với kết quả đó dưới một cách gọi khác."
わけだ,～わけだ＜理由＞,N3,①A：川本さん、事大きいのに買いかえたらしいよ。B：へえ。子供が生まれて前のが小さくなったわけだな。A：いや、そうじゃなくて、単に新車がほしくなっただけのことらしいけど。,A:佐藤さん、新しいアパートに引っ越したらしいよ。B:へえ。前の部屋が駅から遠かったわけだな。,A:佐藤さん、新しいアパートに引っ越したらしいよ。B:へえ。,前の部屋が,駅から,遠かった,わけだな,。,Đưa ra giả định về nguyên nhân/lý do của một sự việc: Cụm chủ ngữ '前の部屋が' (phòng cũ) đi trước để chỉ đối tượng được nói đến. Tiếp theo là cụm trạng ngữ chỉ khoảng cách/nguồn gốc '駅から' (từ nhà ga) kết hợp với tính từ quá khứ '遠かった' (đã xa) tạo thành lý do '遠かった' (vì xa ga). Cấu trúc kết luận nguyên nhân 'わけだな' (thảo nào/hóa ra là vì thế) đặt ở cuối câu để hoàn thiện suy đoán của người nói.
わけだ,～わけだ＜納得＞　だから～わけだ　それで叶わけだ　なるほと～わけだ　とうりで～わけだ,N3,①A：山本さん、結婚したらしいですよ。B：ああ、そうだったんですか。それで最近いつもきげんがいいわけだな。,A:明日はスーパーの特売日らしいですよ。B:なるほど、それで今日こんなに混んでいるわけだ。,A:明日はスーパーの特売日らしいですよ。B:なるほど、,それで,今日こんなに,混んでいる,わけだ,。,"Thể hiện sự lý giải, tâm phục khẩu phục (納得) sau khi biết lý do: Từ nối 'それで' (vì thế/cho nên) đứng đầu vế để liên kết nguyên nhân vừa nghe được. Tiếp theo là cụm trạng từ chỉ thời gian và mức độ '今日こんなに' (hôm nay đông như thế này) đi với động từ trạng thái '混んでいる' (đang đông đúc). Cuối cùng, cấu trúc 'わけだ' (thảo nào) đứng cuối câu để biểu thị việc người nói đã hoàn toàn hiểu ra lý do tại sao siêu thị lại đông như vậy."
わけだ,～わけだから～はとうぜんだ,N3,①小池さんは何年もインドネシア駐在員だったわけだから、インドネシア語が話せるのは当然です。,彼はもう5年も一人暮らしをしているわけだから、料理ができるのは当然です。,彼はもう5年も,一人暮らしを,している,わけだから、,料理ができるのは,当然です。,Cấu trúc lập luận chỉ sự tất nhiên: Cụm từ '一人暮らしを' (việc sống một mình) làm tân ngữ cho động từ diễn tiến 'している' (đang làm/đang sống). Toàn bộ vế này kết hợp với 'わけだから' (bởi vì thực tế là... nên) để tạo ra căn cứ cực kỳ vững chắc. Cụm danh từ hóa '料理ができるのは' (việc có thể nấu ăn) làm chủ ngữ cho phần kết luận mang tính hiển nhiên ở đuôi câu '当然です' (là đương nhiên).
わけだ,～わけだから～てもとうぜんだ,N3,①彼女は大学を出てからもう8年も経っているわけだから、結婚していても当然だろう。,これは今すごく人気があるゲームなわけだから、売り切れていても当然だろう。,これは今すごく,人気がある,ゲームな,わけだから、,売り切れていても,当然だろう。,Lập luận chỉ một trạng thái là hiển nhiên dựa trên thực tế: Cụm tính từ/động từ '人気がある' (được yêu thích) bổ nghĩa cho danh từ 'ゲーム' (trò chơi). Vì 'ゲーム' là danh từ nên khi kết hợp với 'わけだから' phải có 'な' thành 'ゲームなわけだから' (vì thực tế là trò chơi đang hot). Vế tiếp theo sử dụng động từ ở thể 'ていても' ('売り切れていても' - dẫu có bán hết) để đi liền với kết luận '当然だろう' (cũng là điều đương nhiên thôi).
わけだ,というわけだ／ってわけだ,N3,①イギリスとは時差が8時間あるから、日本が11時ならイギリスは3時（だ）というわけだ。,16人のグループを4台の車に分けるから、1台に4人ずつ乗るというわけだ。,16人のグループを4台の車に分けるから、,1台に,4人ずつ,乗る,というわけだ,。,"Kết luận mang tính giải thích, tính toán logic từ dữ kiện trước: Cụm trạng ngữ '1台に' (trên một chiếc xe) đi với từ chỉ số lượng bổ trợ '4人ずつ' (mỗi xe 4 người). Hành động '乗る' (lên xe/ngồi xe) làm động từ chính cho vế kết luận. Cuối cùng, cấu trúc 'というわけだ' (nghĩa là/thành ra là như thế) được dùng ở cuối câu để tóm gọn kết quả một cách rõ ràng sau khi làm phép chia toán học đơn giản."
わけではない,～わけではない,N3,①このレストランはいつも客がいっぱいだが、だからといって特別においしいわけではない。,私はいま毎日自分で料理を作っているが、料理が特別に得意なわけではない。,私はいま毎日自分で料理を作っているが、,料理が,特別に,得意な,わけではない,。,Phủ định một phần hoặc phủ định một suy luận thông thường: Cụm '料理が' (việc nấu ăn) đi với trạng từ nhấn mạnh '特別に' (đặc biệt). Tính từ đuôi na '得意な' (giỏi/đắc ý) bổ nghĩa trực tiếp cho cấu trúc phủ định 'わけではない' (không có nghĩa là/không hẳn là). Thứ tự này làm rõ ý: mặc dù nấu ăn hàng ngày nhưng không hẳn là nấu ăn đặc biệt giỏi.
わけではない,というわけではない　ってわけではない,N3,①このレストランはいつも満員だが、だからといって特においしいというわけではない。,お菓子や甘いものが嫌いだというわけではないが、今はダイエット中なんです。,お菓子や甘いものが,嫌いだ,という,わけではないが、,今は,ダイエット中なんです。,Cấu trúc phủ định nhẹ nhàng hoặc giải thích một phần: Tính từ đuôi na '嫌いだ' (ghét) giữ nguyên đuôi 'だ' trước cụm liên kết 'という'. Cụm 'わけではないが、' (không hẳn là... nhưng) làm nhiệm vụ xoa dịu vế phủ định trước khi chuyển sang trạng từ thời gian '今は' (bây giờ) để kết nối vào phần đuôi câu giải thích lý do thực sự 'ダイエット中なんです' (đang trong chế độ ăn kiêng).
わけても,,N2,①この山は、わけても5月がうつくしい。,私は日本料理なら何でも好きだが、わけても寿司が一番好きだ。,私は日本料理なら何でも好きだが、,わけても,寿司が,一番,好きだ,。,Cấu trúc nhấn mạnh đối tượng nổi bật nhất trong một tập hợp: Phó từ 'わけても' (đặc biệt là/nổi bật là) luôn đứng đầu vế câu nhấn mạnh. Sau đó là danh từ trung tâm '寿司が' (món sushi) đóng vai trò chủ ngữ của cảm xúc. Tiếp theo là phó từ chỉ mức độ cao nhất '一番' (nhất) đứng trước tính từ đuôi na '好きだ' (thích) để hoàn thành cấu trúc khẳng định sở thích đặc biệt.
わけにはいかない,V－るわけに（は）いかない,N3,①ちょっと熱があるが、今日は大事な会議があるので仕事を休むわけにはいかない。,友達と何日も前から約束しているので、今さら約束をキャンセルするわけにはいかない。,友達と何日も前から約束しているので、,今さら,約束を,キャンセルする,わけにはいかない,。,"Diễn đạt ý không thể làm gì vì rào cản đạo đức, tâm lý hoặc trách nhiệm: Phó từ '今さら' (đến nông nỗi này/đến giờ này rồi) đứng trước để nhấn mạnh hoàn cảnh khó xử. Danh từ '約束を' (lời hứa) làm tân ngữ cho động từ nhóm 3 'キャンセルする' (hủy bỏ). Động từ ở thể từ điển (V-る) này kết hợp trực tiếp với cấu trúc 'わけにはいかない' (không thể) ở cuối câu để biểu thị việc bản thân không cho phép mình hủy hẹn."
わけにはいかない,V－ないわけに（は）いかない,N3,①他の人ならともかく、あの上司に飲みに誘われたら付き合わないわけにはいかない。断わると後でどんなめんどうな仕事を押しつけられるかわからないのだから。,母が私のためにわざわざ作ってくれたケーキだから、残さずきれいに食べないわけにはいかない。,母が私のためにわざわざ作ってくれたケーキだから、,残さず,きれいに,食べない,わけにはいかない,。,Cấu trúc mang ý nghĩa bắt buộc phải làm gì vì lý do tình cảm/trách nhiệm (phủ định của phủ định = khẳng định): Phó từ '残さず' (không để lại thừa) đi trước phối hợp với phó từ trạng thái 'きれいに' (sạch sẽ/gọn gàng). Cả hai bổ nghĩa cho động từ thể phủ định '食べない' (không ăn). Động từ thể ない này kết hợp với cấu trúc 'わけにはいかない' tạo thành cụm '食べないわけにはいかない' mang ý nghĩa 'không thể không ăn' hay 'buộc phải ăn hết'.
わざわざ,,N4,①山田さんはわたしの忘れ物をわざわざうちまでとどけてくれた。,遠くに住んでいる友だちが、わざわざ私の家までお土産を届けてくれた。,遠くに住んでいる友だちが、,わざわざ,私の家まで,お土産を,届けてくれた,。,Diễn tả sự biết ơn khi ai đó cất công làm gì cho mình (trình độ N4): Phó từ 'わざわざ' (cất công/gác việc khác lại để làm) đứng đầu vế để nhấn mạnh nỗ lực của đối tượng. Tiếp theo là cụm chỉ nơi chốn đích đến '私の家まで' (đến tận nhà tôi) và danh từ tân ngữ 'お土産を' (quà lưu niệm). Cuối cùng là cụm động từ thể cho nhận '届けてくれた' (đã mang đến cho) hoàn thành câu với sắc thái biết ơn sâu sắc.
わずか,,N3,①さいふの中に残っていたのはわずか200円だった。,昨日は仕事が忙しくて、わずか3時間しか寝られなかった。,昨日は仕事が忙しくて、,わずか,3時間,しか,寝られなかった,。,"Diễn tả số lượng cực kỳ ít ỏi (chỉ vỏn vẹn): Phó từ 'わずか' (vỏn vẹn/chỉ) đứng trước số từ '3時間' (3 tiếng) để nhấn mạnh tính chất ít ỏi của thời gian. Đi kèm với cấu trúc hạn định phủ định 'しか... ない' bằng cách đặt trợ từ 'しか' ngay sau danh từ chỉ số lượng, cuối cùng kết hợp với động từ thể khả năng phủ định quá khứ '寝られなかった' (đã không thể ngủ) để nhấn mạnh sự thiếu ngủ trầm trọng."
わり,わりと／わりに,N3,①わりとおいしいね。,近くの店で買ったこのパソコンは、わりと使いやすくて毎日便利だ。,近くの店で買ったこのパソコンは、,わりと,使いやすくて,毎日,便利だ,。,"Diễn tả mức độ tương đối, khá là (so với mức thông thường): Phó từ 'わりと' (khá là/tương đối) đứng trước để bổ nghĩa cho tính từ/động từ phía sau. Tiếp theo là tính từ phức hợp thể て '使いやすくて' (dễ sử dụng và...), đi liền với trạng từ chỉ tần suất '毎日' (hàng ngày) nhằm bổ trợ ý nghĩa cho tính từ kết thúc câu '便利だ' (tiện lợi), tạo nên một câu đánh giá đồ dùng hàng ngày rất tự nhiên."
わり,わりに（は）　Nのわりに　Naなわりに　A－いわりに　Vわりに,N3,①あのレストランは値段のわりにおいしい料理を出す。,私の妹はまだ小学生のわりに、料理がとても上手だ。,私の妹はまだ,小学生の,わりに、,料理が,とても上手だ,。,Diễn tả sự bất tương xứng giữa thực tế và kết quả (so với... thì trái lại): Danh từ '小学生' (học sinh tiểu học) kết hợp với trợ từ 'の' trước khi đi với cấu trúc 'わりに' (so với/tuy... nhưng) tạo thành cụm '小学生のわりに' (tuy là học sinh tiểu học nhưng...). Vế sau bắt đầu bằng đối tượng đánh giá '料理が' (việc nấu ăn) kết hợp với cụm tính từ chỉ mức độ cao 'とても上手だ' (rất giỏi) để làm nổi bật sự ngạc nhiên.
を～とする,NをNとする,N2,①その中学はその生徒を退学処分とするという決定をおこなったようだ。,私たちはこの静かな部屋を子供の勉強部屋とする計画を立てた。,私たちはこの静かな部屋を,子供の,勉強部屋と,する,計画を,立てた。,"Cấu trúc biến N1 thành N2 hoặc xem N1 là N2 (N1をN2とする): Cụm từ ở Prefix đã có '部屋を' (N1). Tiếp theo là cụm danh từ sở hữu '子供の' (của con trẻ) bổ nghĩa cho danh từ mục tiêu '勉強部屋' (phòng học), kết hợp với trợ từ 'と' thành '勉強部屋と'. Động từ 'する' (lấy làm/quy định là) đi liền sau đó để tạo thành một mệnh đề định ngữ bổ nghĩa trực tiếp cho danh từ tân ngữ '計画を' (kế hoạch), trước khi khép lại bằng động từ hành động ở phần đuôi '立てた' (đã lập)."
