Grammar,Usage,Meaning,Reference Example,Original Example,Prefix,Chunk1,Chunk2,Chunk3,Chunk4,Suffix,Explanation
ては,V－てはV、V－てはV,,①害いては消し、書いては消し、やっと手紙を書き上げた。,弟はクッキーを食べては片付け、食べては片付け、部屋が汚いままだ。,弟はクッキーを,食べては,片付け、,食べては,片付け、,部屋が汚いままだ。,"Cấu trúc 「V1-てはV2」 biểu thị hành động lặp đi lặp lại theo chu kỳ liên tục. Ở đây hành động ""ăn rồi dọn"" (食べては片付け) cứ lặp lại tuần hoàn khiến căn phòng mãi không sạch."
では1,Nでは,,①人は外見では判断できない。,このスーパーの良さは、野菜の値段だけでは判断できない。,このスーパーの良さは、,野菜の,値段,だけで,は,判断できない。,"Danh từ chỉ tiêu chí/phạm vi phán đoán kết hợp với trợ từ ""では"" để nhấn mạnh điều kiện phủ định phía sau: ""Nếu chỉ dựa trên giá rau (値段だけでは) thì không thể đánh giá được toàn bộ siêu thị""."
では2,書きことば的でやや改まった場面で使われる。くだけた話しことばでは「じゃ（あ）」が用いられる。では＜推論＞,,①A：私は1974年の卒業です。B：では、私は2年後輩になります。,A「明日は雨みたいだよ。」B「では、今週末のお花見は中止にしよう。,A「明日は雨みたいだよ。」B「,では、,今週末の,お花見は,中止に,しよう。,"Liên từ ""では"" đứng ở đầu câu của người B để đưa ra một suy luận logic hoặc hệ quả dựa trên thông tin người A vừa cung cấp (""Nếu vậy thì..."")."
では2,では＜態度表明＞,,①A：すみません。教科書を忘れてしまいました。  B：では、となりの人に見せてもらいなさい。,A「宿題の場所が分かりません。」B「では、机の上の私のノートを参考にしなさい。,A「宿題の場所が分かりません。」B「,では、,机の上の,私のノートを,参考に,しなさい。,"Từ ""では"" đóng vai trò chuyển tiếp để người nói đưa ra một chỉ thị, lời khuyên hoặc biểu thị thái độ giải quyết vấn đề dựa trên tình huống hiện tại."
では2,では＜転換＞,,①では、次の議題に入りましょう。,では、そろそろ今日の晩ご飯の準備を始めましょう。,,では、,そろそろ,今日の晩ご飯の,準備を,始めましょう。,"Liên từ ""では"" được dùng với mục đích chuyển đổi trạng thái hoặc bắt đầu một nội dung, hành động mới trong đời sống sinh hoạt gia đình (""Nào/Sau đây thì..."")."
ではあるが,ではあるが,,①この絵はきれいではあるが、感動させるものがない。,このアパートは駅から近くて便利ではあるが、家賃が高すぎる。,,,,,,,"Tính từ đuôi na ""便利"" khi đi với cấu trúc ""ではあるが"" sẽ giữ nguyên dạng bổ nghĩa kết hợp với ""ではあるが"" để diễn tả ý nghĩa nhượng bộ: ""Tuy là tiện lợi thật đấy nhưng...""."
ではあるまいか,N／Na（なの）ではあるまいか A／V のではあるまいか,,①この話は全くの作り話なのではあるまいか。,夫が急に料理を始めたのは、何か隠し事があるのではあるまいか。,夫が急に料理を始めたのは、,何か,隠し事が,あるの,ではある,まいか。,"Mẫu câu 「V-のではあるまいか」 thể hiện sự nghi vấn, suy đoán mang tính văn viết của người nói về một sự việc trong đời sống (""Chẳng phải là có điều gì giấu giếm hay sao""). Động từ ""ある"" đi kèm ""の"" để danh từ hóa."
てはいけない,V－てはいけない,,①遊んでいたらおじいさんがきて、「芝生に入ってはいけないよ。」と言った。,お母さんに内緒で、夜遅くにテレビゲームをしてはいけないよ。,お母さんに内緒で、,夜遅くに,テレビ,ゲームを,しては,いけないよ。,"Mẫu câu cấm đoán cơ bản 「V-てはいけない」. Động từ ""する"" chuyển sang thể te thành ""して"" kết hợp với ""はいけない"" để ra lệnh không được làm gì."
てはいられない,Nではいられない,,①きみは大人になりたくないと言うが、人はいつまでも子供ではいられない。,もうすぐ親になるのだから、いつまでも自由な子供ではいられない。,もうすぐ親になるのだから、,いつまでも,自由な,子供で,はいられ,ない。,"Danh từ ""子供"" kết hợp với ""ではいられない"" để chỉ một thực tế không thể duy trì mãi trạng thái hay thân phận đó nữa do hoàn cảnh thay đổi (""Không thể mãi là đứa trẻ tự do"")."
てはいられない,V－てはいられない,,①時間がないから、遅れて来る人を待ってはいられない。すぐ始めよう。,子供が泣いているから、のんびりテレビを見てはいられない。,子供が泣いているから、,のんびり,テレビを,見ては,いられ,ない。,"Cấu trúc 「V-てはいられない」 diễn tả tình huống cấp bách không cho phép người nói tiếp tục hành động thong dong đó. Động từ ""見る"" chuyển thành ""見ては"" đi với dạng khả năng phủ định ""いられない""."
てはだめだ,V－てはだめだ＜禁止＞,,①駐車場で遊んではだめだ。出て行きなさい。,お兄ちゃんの部屋のおもちゃを勝手に触ってはだめだよ。,お兄ちゃんの部屋の,おもちゃを,勝手に,触っては,だめだ,よ。,"Cách nói cấm đoán mang tính nhắc nhở, thân mật trong gia đình 「V-てはだめだ」. Động từ ""触る"" thuộc nhóm 1 biến đổi thành thể te là ""触って"" + はだめだ."
てはだめだ,ではだめだ A－くてはだめだ V－ていてはだめだ,,①写真をとるのに、こんなに暗くてはだめだ。,スープの味がこんなに薄くてはだめだから、お塩を足そう。,スープの,味が,こんなに,薄くては,だめだ,から、お塩を足そう。,"Tính từ đuôi i ""薄い"" chuyển thành dạng ""薄くて"" kết hợp với ""はだめだ"" để giả định một điều kiện/trạng thái không tốt, không đạt yêu cầu (""Nếu vị nhạt thế này thì không được"")."
てはとうか,V－てはとうか,,①A：この辺でちょっと休懲してはどうですか。B：そうですね。,疲れているなら、今日は早く寝てはどうですか。,疲れているなら、,今日は,早く,寝ては,どうです,か。,"Cấu trúc gốc là 「V-てはどうか」 dùng để đưa ra gợi ý, lời khuyên nhẹ nhàng cho đối phương (""Hay là thử làm V xem sao""). Động từ ""寝る"" sang thể te thành ""寝て"" + はどうですか."
ではない,ではない,,①これは、新しい考えではない。,これは私が買ったケーキではないから、食べないでね。,これは私が,買った,ケーキ,ではない,から、,食べないでね。,Cấu trúc phủ định định danh cơ bản 「Nではない」 để khẳng định đối tượng (bánh ngọt) không thuộc quyền sở hữu của người nói.
ではない,～ではない,,①A：すみません、日程の変更をご連終するのを忘れていました。B：忘れていましたではないよ。おかげで、予定が一日狂ってしまったんですよ。,A「ごめん、牛乳を買い忘れた。」B「買い忘れたではないよ。コーヒーが飲めないじゃない。,A「ごめん、牛乳を買い忘れた。」B「,買い,忘れた,ではない,よ。,コーヒーが飲めないじゃない。,"Mẫu câu 「V-ではないよ」 dùng để lặp lại lời của đối phương nhằm trách móc, biểu thị sự không hài lòng, không chấp nhận lời bào chữa đó (""Không phải cứ nói quên là xong đâu"")."
ではないか1,N／Na／A／V ではないか 普通体の表現に付いて、話し手の驚きの気持ちや、聞き手に認識を迫る態度を表す。名詞、ナ形容詞の辞書形の場合は「だ」を介さずに直接付くことができるが、辞書形以外の場合は「だった／ではない／ではなかった」を介して接続する。「だ」の否定疑問形が固定化した表現で、書きことば的でややかたい言い方。普通、男性が用いる。くだけた話しことばでは、男性は「じゃないか」、女性は「じゃない」「じゃないの」などの形を使う。「じゃん」は、さらにくだけた言い方で男女共用いる。丁寧体は「ではないですか／ではありませんか」。タ形にはならず、いつも辞書形で用いられる点、「だろうか」が付いたりできない点で「ではないか2」とは異なる。～ではないか＜驚き・発見＞,,①やあ、大野君ではないか。,冷蔵庫を開けたら、奥の方に大好きなプリンがあるではないか。,冷蔵庫を開けたら、,奥の方に,大好きなプリンが,ある,ではない,か。,"Mẫu câu 「Vではないか」 đặt ở cuối câu để diễn tả tâm trạng vô cùng ngạc nhiên khi phát hiện ra một sự thật ngoài dự kiến (""Ơ, hóa ra lại có bánh pudding này!"")."
ではないか1,～ではないか＜非難＞,,①A：悪いのは君のほうではないか。B：僕はそうは思いませんが。,今日、あなたが夕食を作る約束ではないか。,今日、,あなたが,夕食を,作る約束,ではない,か。,"Sử dụng dạng khẳng định của danh từ ""約束"" kết hợp trực tiếp với ""ではないか"" ở cuối câu để nhấn mạnh và trách móc đối phương vì đã không thực hiện đúng giao hẹn."
ではないか1,～ではないか＜確認＞,,①A：同級生に田中さんという女の子がいたじゃないか。B：ああ、髪が長くてやせた子ね。,去年みんなと一緒に来た海は、ここではないか。,,,,,,,"Mẫu câu kết hợp với đại từ chỉ nơi chốn ""ここ"" (Danh từ) + ではないか để khơi gợi trí nhớ và xác nhận lại thông tin chắc chắn với người nghe (""Chẳng phải chính là chỗ này sao"")."
ではないか1,V－ようではないか,,①このクラスみんなでデイベート大会に申し込もうではないか。,結婚記念日だし、今日は高級なレストランで食事をしようではないか。,結婚記念日だし、,今日は,高級なレストランで,食事を,しようではない,か。,"Động từ ""する"" chuyển sang thể ý chí (よう形) thành ""しよう"" kết hợp với ""ではないか"" để tạo thành một lời kêu gọi, đề xuất mạnh mẽ cùng thực hiện hành động nhằm tạo kỷ niệm."
ではないか2,N／Na（なの）ではないか A／V のではないか 名詞、ナ形容詞には「の」を介さずに直接付くことができるが、イ形容詞と動詞には「の」が必ず必要で「のではないか」の形で用いられる。この点で、「ではないか1」と異なる。くだけた言い方では、男性は「（ん）じゃないか」、女性は「（ん）じゃない」「んじゃないの」などを使う。丁寧形は「（の）ではないですか／（の）ではありませんか」となる。～（の）ではないか,,①あそこを歩いているのは、もしかして山下さんではないか。,ドアが閉まっているから、彼はもう出かけたのではないか。,ドアが閉まっているから、,彼は,もう,出かけたの,ではない,か。,"Động từ quá khứ ""出かけた"" phải đi qua trợ từ danh từ hóa ""の"" tạo thành cụm ""出かけたの"" rồi mới kết hợp với ""ではないか"" để đưa ra một suy luận, phán đoán có căn cứ (""Chẳng phải là anh ấy đã đi ra ngoài rồi sao"")."
