Grammar,Usage,JLPT Level,Reference Example,Original Example,Prefix,Chunk1,Chunk2,Chunk3,Chunk4,Suffix,Explanation
なら3,NがNならNもNだ,N2,①親が親なら子も子だ。,うちの兄が兄なら弟も弟で、毎日部屋を散らかしてばかりいる。,うちの,兄が兄なら,弟も,弟で、,毎日部屋を,散らかしてばかりいる。,"Cấu trúc ""NがNならNもNだ/で"" thể hiện ý nghĩa ""nếu bản thân đối tượng N đã như thế thì đối tượng liên quan cũng bấy nhiêu"" (thường mang nghĩa tiêu cực). Ở đây ""兄が兄なら"" (anh trai đã thế) kết hợp tự nhiên với ""弟も弟で"" (em trai cũng vậy) để diễn tả sự tương đồng về tính xấu, theo sau là hành động bừa bãi ""毎日部屋を散らかしてばかりいる""."
なら3,～なら（ば）　A／V　なら（ば）,N3,①今年も真夏の日照時間が短い／短かったならば米不足の問題は深刻だ。,明日天気が良いならば、家族で公園へピクニックに行きましょう。,明日,天気が,良いならば、,家族で,公園へ,ピクニックに行きましょう。,"Biểu thức điều kiện ""～ならば"" nối sau tính từ đuôi i ""良い"" để giả định tình huống ""nếu thời tiết tốt"". Theo sau theo thứ tự tự nhiên là thành phần chỉ đối tượng ""家族で"", địa điểm ""公園へ"" và kết thúc bằng hành động đề xuất ""ピクニックに行きましょう""."
なら3,だったなら　A－かったなら　V－たなら,N3,①私が全能の神様だったなら、あなたを助けてあげられるのに。,昨日暇だったなら、一緒に駅前のデパートへ買い物に行けたのに。,昨日,暇だったなら、,一緒に,駅前のデパートへ,買い物に,行けたのに。,"Mẫu câu giả định một sự việc trái với quá khứ bằng cách chia tính từ đuôi na ""暇"" thành ""暇だったなら"" (nếu hôm qua mà rảnh). Tiếp theo là phó từ ""一緒に"", trạng ngữ chỉ nơi chốn ""駅前のデパートへ"", mục đích ""買い物に"" và kết thúc bằng thể khả năng quá khứ mang tính nuối tiếc ""行けたのに""."
なら3,V－るなら＜観点＞,N2,①事情を知らない人の目から見るなら、少しおおげさな感じがするかもしれない。,ダイエットしている人の視点から見るなら、このケーキはカロリーが高すぎると思う。,,ダイエットしている人の,視点から,見るなら、,このケーキは,カロリーが高すぎると思う。,"Cấu trúc ""V-るなら"" mang ý nghĩa ""nếu nhìn từ góc độ/quan điểm của..."". Thành phần định ngữ ""ダイエットしている人の"" bổ nghĩa cho ""視点から"" (từ quan điểm), kết hợp với ""見るなら"" để đưa ra góc nhìn. Sau đó là chủ ngữ ""このケーキは"" và nhận xét khách quan ""カロリーが高すぎると思う""."
ならいい,ならいい　A／V（の）ならいい,N4,①お母さんが病気ならいいよ。早く家に帰ってあげなさい。,この本を読むのならいいよ。明日までに返してね。,,この本を,読むのなら,いいよ。,明日までに,返してね。,"Cấu trúc ""のならいい"" dùng để chấp nhận một điều kiện ""nếu là đọc cuốn sách này thì được"". Đầu tiên là tân ngữ và động từ ""この本を読む"", đi với ""のならいいよ"" để biểu thị sự chấp thuận. Tiếp theo là thời hạn ""明日までに"" và yêu cầu nhẹ nhàng ""返してね""."
ならでは,Nならでは,N2,①親友ならではの細かい心遣いが嬉しかった。,この味噌汁は、お母さんならではの優しい味がして美味しい。,この味噌汁は、,お母さん,ならではの,優しい味が,して,美味しい。,"Cấu trúc ""Nならではの"" mang ý nghĩa ""chỉ có ở N mới có"". Danh từ ""お母さん"" kết hợp với ""ならではの"" để bổ nghĩa cho cụm danh từ ""優しい味"" (hương vị dịu dàng). Cụm này đi liền với động từ chỉ cảm giác ""して"" và kết thúc bằng tính từ ""美味しい""."
ならびに,NならびにN,N1,①各国の首相ならびに外相が式典に参列した。,手続きには、マイナンバーカードならびに在留カードをご持参ください。,手続きには、,マイナンバーカード,ならびに,在留カードを,ご持参,ください。,"Cấu trúc trang trọng ""ならびに"" dùng để kết nối hai danh từ tương đương ""và/cùng với"" trong văn bản hoặc thông báo hành chính hàng ngày. Danh từ ""マイナンバーカード"" và ""在留カード"" được nối với nhau, làm tân ngữ cho cụm động từ kính ngữ ""ご持参ください""."
なり1,V－るなり,N2,①家に帰るなり自分の部屋に閉じ込もって出てこない。,弟は学校から帰るなりカバンを放り投げて遊びに行った。,弟は,学校から,帰るなり,カバンを,放り投げて,遊びに行った。,"Cấu trúc ""V-るなり"" diễn tả một hành động xảy ra ngay lập tức sau hành động trước. Động từ ""帰る"" chia thể từ điển kết hợp với ""なり"" (vừa mới về liền...). Sau đó bổ ngữ cho chuỗi hành động liên tiếp tiếp theo ""カバンを"" + ""放り投げて"" và kết thúc bằng ""遊びに行った""."
なり1,V－たなり（で）,N2,①座ったなり動こうともしない。,昨夜は仕事のスーツを着たなりベッドで横になって寝てしまった。,昨夜は,仕事のスーツを,着たなり,ベッドで,横になって,寝てしまった。,"Cấu trúc ""V-たなり"" nghĩa là giữ nguyên trạng thái sau khi thực hiện hành động. Động từ ""着る"" chia quá khứ ""着た"" đi với ""なり"" tạo thành cụm ""cứ mặc nguyên bộ vest"". Tiếp theo theo thứ tự tự nhiên là trạng ngữ nơi chốn ""ベッドで"", hành động ""横になって"" và kết quả ""寝てしまった""."
なり1,V－たなり,N2,①家を出たなり一ケ月も帰ってこなかった。,近所の友達にゲームを貸したなり、ずっと返ってこない。,近所の友達に,ゲームを,貸したなり、,ずっと,返って,こない。,"Cấu trúc ""V-たなり"" ở đây diễn tả một hành động sau khi làm xong thì trạng thái đó kéo dài liên tục mà không có sự thay đổi mong đợi (cho mượn xong biệt tăm). ""貸したなり"" đi kèm với phó từ thời gian ""ずっと"" và cụm động từ phủ định ""返ってこない""."
なり2,～なり　Nなり　V－るなり,N2,①何かお飲物なりお持ちしましょうか。,少し風邪気味なら、温かいスープなり飲んで早く寝たほうがいいよ。,少し風邪気味なら、,温かい,スープなり,飲んで,早く,寝たほうがいいよ。,"Cấu trúc ""Nなり"" dùng để đưa ra một ví dụ tiêu biểu mang tính gợi ý ""như là súp chẳng hạn"". Tính từ ""温かい"" bổ nghĩa cho ""スープなり"", theo sau là hành động liên kết ""飲んで"", phó từ ""早く"" và mẫu câu khuyên nhủ ""寝たほうがいいよ""."
なり2,V－るなりV－ないなり,N2,①行くなり行かないなりはっきり決めてほしい。,夕飯を食べるなり食べないなり、はっきり連絡してくれないと困る。,夕飯を,食べるなり,食べないなり、,はっきり,連絡してくれないと,困る。,"Cấu trúc ""V-るなりV-ないなり"" đưa ra hai lựa chọn đối lập ""dù ăn hay không ăn"". Hai hình thái của động từ kết hợp với ""なり"" đứng làm trạng ngữ cho phó từ ""はっきり"" (rõ ràng). Tiếp theo là điều kiện giả định ""連絡してくれないと"" và kết quả ""困る""."
なり2,～なり～なり　NなりNなり　V－るなりV－るなり,N2,①彼の父親なり母親なりに相談しなければならないだろう。,週末は映画を見るなり買い物をするなりして、気分転換をしよう。,週末は,映画を見るなり,買い物をするなり,して、,気分転換を,しよう。,"Cấu trúc ""V-るなりV-るなり"" đưa ra vài hành động làm ví dụ lựa chọn ""hoặc là xem phim, hoặc là mua sắm"". Hai cụm động từ kết thúc bằng ""なり"" được nối tiếp bằng trợ động từ ""して"", sau đó là tân ngữ ""気分転換を"" và thể ý chí ""しよう""."
なり2,～なりなんなり　N／V　なりなんなり,N2,①チューリップなりなんなり、少し目立つ花を買ってきて下さい。,遅れるなら、電話するなりなんなりして連絡をくれるべきだ。,遅れるなら、,電話するなり,なんなり,して,連絡を,くれるべきだ。,"Cấu trúc ""～なりなんなり"" mang nghĩa ""hoặc làm việc này hoặc làm bất cứ thứ gì khác tương tự"". Động từ ""電話するなり"" đi kèm với cụm từ ""なんなりして"" để biểu thị ""gọi điện hay làm gì đó đại loại thế"", theo sau là cụm bổ ngữ kết quả ""連絡をくれるべきだ""."
なり3,～なり　Nなり　A－いなり,N2,①私なりに努力はしてみましたが、力が及びませんでした。,この問題について、子供なりに一生懸命考えて答えを出したようだ。,この問題について、,子供,なりに,一生懸命考えて,答えを,出したようだ。,"Cấu trúc ""Nなりに"" mang ý nghĩa ""theo cách của N / phù hợp với lập trường của N"". Danh từ ""子供"" đi với ""なりに"" thể hiện ""theo cách của một đứa trẻ"". Theo sau là cụm trạng từ và động từ ""一生懸命考えて"", tân ngữ ""答えを"" và kết luận phỏng đoán ""出したようだ""."
なり3,～なり　Nなり　V－るなり,N2,①彼は妻の言うなりになっている。,うちの犬は、主人の言うなりになって静かに待つことができる。,うちの犬は、,主人の,言うなりに,なって,静かに,待つことができる。,"Cấu trúc ""言うなりに"" nghĩa là ""nghe theo/tuân theo hoàn toàn những gì ai đó nói"". Cụm danh từ sở hữu ""主人の"" đi trước cụm từ ""言うなりになって"" tạo thành nghĩa ""hoàn toàn nghe theo lời chủ nhân"", tiếp theo theo thứ tự cú pháp là phó từ ""静かに"" và cấu trúc chỉ khả năng ""待つことができる""."
なり3,～なら～なり　NならNなり　NaならNaなり　A－いならA－いなり　V－るならV－るなり,N2,①嫌なら嫌なりの理由があるはずだ。,この服は、安いなら安いなりの理由が必ずあるはずだ。,この服は、,安いなら,安いなりの,理由が,必ず,あるはずだ。,"Cấu trúc lặp lại ""A-いならA-いなり"" diễn tả ý nghĩa ""nếu ở mức độ đó thì sẽ tương ứng với mức độ đó"". Tính từ ""安い"" được lặp lại nhằm chỉ ""nếu đã rẻ thì sẽ có lý do kiểu của đồ rẻ"". Đi sau là danh từ chủ ngữ ""理由が"", phó từ khẳng định ""必ず"" và sự suy đoán chắc chắn ""あるはずだ""."
なり3,には～なり　NにはNなり　V－るにはV－るなり,N2,①若い人には若い人なりの考えがあるだろう。,都会の生活には生活なりの楽しさがたくさんある。,都会の,生活には,生活なりの,楽しさが,たくさん,ある。,"Cấu trúc ""NにはNなり"" nhấn mạnh ""đối với N thì có đặc điểm/phong cách riêng tương xứng"". Ở đây danh từ ""生活"" được lặp lại: ""生活には"" kết hợp với ""生活なりの"" để bổ nghĩa cho danh từ ""楽しさが"" (niềm vui riêng của cuộc sống), đi kèm phó từ chỉ số lượng ""たくさん"" và động từ ""ある""."
なり3,NはNなり,N2,①彼らは彼らなりにいろいろ努力しているのだから、それは認めてやってほしい。,私の部屋は狭いが、部屋は部屋なりの快適さがあって気に入っている。,私の部屋は狭いが、,部屋は,部屋なりの,快適さが,あって,気に入っている。,"Cấu trúc ""NはNなり"" mang ý nghĩa ""bản thân N có đặc điểm riêng tương xứng của N"". Danh từ ""部屋"" được lặp lại làm chủ ngữ và định ngữ ""部屋は部屋なりの"" để bổ nghĩa cho ""快適さが"" (sự thoải mái riêng của căn phòng). Sau đó dùng thể te ""あって"" nối với cụm từ biểu thị sự yêu thích ""気に入っている""."
なり3,それなり,N2,①小さな会社だがそれなりの利益は上げている。,このレストランは安いが、それなりの美味しさがあっていつも混んでいる。,このレストランは安いが、,それなりの,美味しさが,あって,いつも,混んでいる。,"Từ cụm ""それなり"" đóng vai trò bổ nghĩa cho danh từ mang ý nghĩa ""tương xứng với điều đó/ở mức độ nhất định"". Thành phần ""それなりの"" bổ nghĩa cho ""美味しさが"" (độ ngon tương xứng giá tiền), đi kèm hành động trạng thái ""あって"" và phó từ ""いつも"" dẫn đến kết quả ""混んでいる""."
