Grammar,Usage,JLPT Level,Reference Example,Original Example,Prefix,Chunk1,Chunk2,Chunk3,Chunk4,Suffix,Explanation
そうして,そうして＜列挙＞,N4,①好きな所。雑踏の中、港、遊園地、そうして、旅立つ前の空港。,本日の会議では新しい企画と予算そうして今後のスケジュールについて話し合います。,本日の会議では,新しい企画と,予算,そうして,今後のスケジュールについて,話し合います。,"Liên từ 'そうして' dùng để liệt kê thành phần cuối cùng trong chuỗi. Thứ tự tự nhiên là chủ đề câu '本日の会議では', tiếp theo là các danh từ được liệt kê '新しい企画と' và '予算', sau đó là 'そうして' bổ sung cho danh từ cuối '今後のスケジュール về...' trước động từ '話し合います。'"
そうして,そうして＜継起＞,N4,①旅行にもって行く物を全部再点検した。そうして、やっと安心した。,部下に報告書を提出させました。そうしてすぐに内容をチェックしました。,部下に報告書を提出させました。,そうして,すぐに,内容を,チェックし,ました。,"Liên từ 'そうして' biểu thị hành động xảy ra tiếp sau một hành động khác (đã nêu ở câu trước). Sau 'そうして' đứng đầu câu mới sẽ là trạng từ chỉ thời gian 'すぐに', tiếp theo là tân ngữ '内容を' và cụm động từ quá khứ 'チェックしました' (được tách ra thành 'チェックし' và 'ました')."
そうすると,そうすると＜きっかけ＞,N4,①ビルのまわりを回ってみた。そうすると、ひとつだけ電気のついている窓があった。,新しいシステムを起動しました。そうすると画面にエラーメッセージが表示されました。,新しいシステムを起動しました。,そうすると,画面に,エラーメッセージが,表示,されました。,"Liên từ 'そうすると' diễn tả một kết quả hoặc phát hiện tự nhiên ngay sau khi thực hiện hành động ở câu trước. Theo sau 'そうすると' là trạng ngữ chỉ nơi chốn '画面に', chủ ngữ 'エラーメッセージが' và động từ bị động '表示されました' (tách thành '表示' và 'されました')."
そうすると,そうすると＜帰結＞,N4,①A：ホテルを出るのが5時で、新幹線に乗るのが6時です。B：そうすると、買い物の時間がなくなりますよ。,来週の出張は金曜日までになります」「そうすると週末の会議には出席できませんね,来週の出張は金曜日までになります」「,そうすると,週末の,会議には,出席,できませんね,"Trong bối cảnh hội thoại, 'そうすると' được người B dùng ở đầu câu để đưa ra kết luận hoặc hệ quả logic từ lời nói của người A. Thứ tự tiếp theo là định ngữ '週末の' bổ nghĩa cho '会議には', và cuối cùng là cụm động từ khả năng dạng phủ định '出席できませんね'."
そうすると,,N4,①：パスポートはおととし取りました。B：そうすると、来年はまだ大丈夫ですね。,このオフィスの契約は今年で終わります」「そうすると来年は別の場所に移転しなければなりませんね,このオフィスの契約は今年で終わります」「,そうすると,来年は,別の場所に,移転しなければ,なりませんね,"'そうすると' đứng đầu câu phản hồi để dẫn dắt đến một kết luận mang tính tất yếu dựa trên thông tin trước đó. Theo sau là trạng từ thời gian '来年は', trạng ngữ chỉ nơi chốn '別の場所に' và cấu trúc bắt buộc '移転しなければなりませんね' (tách thành '移転しなければ' và 'なりませんね')."
そうだ1,だそうだ　A／V　そうだ,N4,①あの人は留学生ではなくて技術研修生だそうだ。,田中部長の話によると、来月から新しいプロジェクトが始まるそうだ。,田中部長の話によると、,来月から,新しい,プロジェクトが,始まる,そうだ。,"Cấu trúc truyền đạt thông tin nghe nhìn từ nguồn khác '～そうだ' đi với động từ thể thông thường '始まる' ở cuối câu. Cụm '田中部長の話によると' đưa ra nguồn thông tin, theo sau là trạng ngữ thời gian '来月から', chủ ngữ '新しいプロジェクトが' và động từ kết hợp với mẫu ngữ pháp."
そうだ2,～そうだ　Naそうだ　A－そうだ,N4,①その映画はおもしろそうだ。,この新しい企画書は、内容が複雑でとても大変そうだ。,この新しい企画書は、,内容が,複雑で,とても,大変,そうだ。,"Mẫu 'そうだ' biểu thị suy đoán qua vẻ bề ngoài. Với tính từ đuôi na '大変', ta bỏ 'な' rồi kết hợp trực tiếp với 'そうだ' ở cuối câu. Các thành phần trước đó gồm chủ ngữ phụ '内容が', vế chỉ nguyên nhân '複雑で' và trạng từ chỉ mức độ 'とても' để bổ nghĩa cho '大変'."
そうだ2,～そうにみえる　Naそうにみえる　A－そうにみえる,N3,①誕生パーティーで彼女はいかにもしあわせそうに見えた。,佐藤さんはプロジェクトの、締め切り前でいつもより非常に忙しそうに見える。,佐藤さんはプロジェクトの、,締め切り前で,いつもより,非常に,忙し,そうに見える。,"Cấu trúc '～そうに見える' diễn tả ngoại hình hoặc trạng thái trông có vẻ như thế nào đó. Tính từ đuôi i '忙しい' bỏ 'い' thành '忙し' kết hợp với 'そうに見える'. Phía trước là trạng ngữ chỉ bối cảnh '締め切り前で' và các trạng từ mức độ 'いつもより', '非常に'."
そうだ2,～そうにしている　Naそうにしている　A－そうにしている,N3,①彼女はいつもはずかしそうにしている。,新入社員の木村さんは、大切なプレゼンの前で不安そうにしている。,新入社員の木村さんは、,大切な,プレゼンの,前で,不安,そうにしている。,"Cấu trúc '～そうにしている' dùng để diễn tả biểu hiện, thái độ của người khác thông qua quan sát. Tính từ đuôi na '不安' bỏ 'な' thành '不安' rồi kết hợp với 'そうにしている'. Đi trước là cụm trạng ngữ chỉ thời gian/không gian '大切なプレゼンの前で'."
そうだ2,R－そうだ,N4,①星が出ているから明日は天気になりそうだ。,今月の売上は、このままだと予定の目標を達成できそうだ。,今月の売上は、,このままだと,予定の,目標を,達成でき,そうだ。,Cấu trúc 'V-stem + そうだ' biểu thị khả năng một sự việc sắp xảy ra hoặc có triển vọng đạt được dựa trên tình hình hiện tại. Động từ khả năng '達成できる' bỏ 'る' thành '達成でき' kết hợp với 'そうだ'. Cụm 'このままだと' đứng đầu để thiết lập điều kiện giả định.
そうだ2,R－そうになる,N3,①道が凍っていて、何度もころびそうになった。,昨日は仕事が忙しすぎて、クライアントとの大切な約束を忘れそうになった。,昨日は仕事が忙しすぎて、,クライアントとの,大切な,約束を,忘れ,そうになった。,Cấu trúc 'V-stem + そうになる' có nghĩa là 'suýt chút nữa thì xảy ra hành động V'. Động từ '忘れる' chuyển sang dạng liên dụng thành '忘れ' nối với 'そうになった'. Cụm danh từ đóng vai trò tân ngữ 'クライアントとの大切な約束を' phải đứng trước động từ.
そうだ2,R－そうもない　R－そうにない,N3,①この本は売れそうもない。,トラブルの対応が終わらないため、今日の定時までに自宅へ帰れそうにない。,トラブルの対応が終わらないため、,今日の,定時までに,自宅へ,帰れ,そうにない。,Cấu trúc 'V-stem + そうにない' biểu thị ý nghĩa 'gần như không có khả năng V'. Động từ khả năng '帰れる' bỏ 'る' thành '帰れ' phối hợp với 'そうにない'. Trạng ngữ chỉ thời gian '今日の定時までに' và trạng ngữ chỉ hướng '自宅へ' bổ nghĩa cho động từ.
そうだ2,R－そうだ＜生起の可能性2＞,N3,①あの様子では二人はもうじき結婚しそうだ。,何回も打ち合わせを重ねたので、A社との大型契約がようやく決まりそうだ。,何回も打ち合わせを重ねたので、,A社との,大型契約が,ようやく,決まり,そうだ。,"Cấu trúc 'V-stem + そうだ' biểu thị một sự việc sắp sửa đạt đến kết quả tốt dựa trên xu hướng thực tế. Động từ '決まる' chuyển thành '決まり' đi với 'そうだ'. Chủ ngữ 'A社との大型契約が' đi trước, kèm theo trạng từ 'ようやく' (cuối cùng thì) để bổ nghĩa cho động từ."
そうだ2,R－てしまいそうだ,N3,①おいしいから全部食べてしまいそうだ。,連日の残業で疲れているので、大事な会議の最中に居眠りをしてしまいそうだ。,連日の残業で疲れているので、,大事な,会議の,最中に,居眠りをして,しまいそうだ。,Cấu trúc 'V-て + しまいそうだ' diễn tả một hành động ngoài ý muốn hoặc không kìm chế được sắp sửa xảy ra. Động từ '居眠りをする' chia thể Te thành '居眠りをして' đi với 'しまいそうだ'. Cụm từ '大事な会議 của câu...' làm trạng ngữ chỉ thời gian.
そこで,そこで＜理由＞,N3,①今度の事件ではかなりの被害が出ています。そこで、ひとつ皆さんにご相談があるのですが。,近年、わが社の製品へのクレームが増加しています。そこで新しい業務改善計画を提案いたします。,近年、わが社の製品へのクレームが増加しています。,そこで,新しい,業務改善計画を,提案,いたします。,"Liên từ 'そこで' đứng đầu câu thứ hai nhằm đưa ra giải pháp, hành động tiếp theo dựa trên lý do hoặc hoàn cảnh thực tế đã nêu ở câu thứ nhất. Tiếp theo là tân ngữ '新しい業務改善計画を' và động từ khiêm nhường ngữ '提案いたします' (tách thành '提案' và 'いたします')."
そこで,そこで＜時点＞,N3,①A：だんだんむずかしくなってきたし、タイ語の勉強やめようかな。B：そこでやめちゃダメだよ。せっかく今までがんばってきたんだから。,新規事業の開発が難航しており諦めようかと思います」「そこで諦めてしまったら、今までの投資が無駄になります,新規事業の開発が難航しており諦めようかと思います」「,そこで,諦めて,しまったら、,今までの投資が,無駄になります,'そこで' ở đây mang tính chất đại từ chỉ thời điểm/hoàn cảnh vừa được đề cập ở câu trước ('vào lúc đó/ngay tại điểm đó'). Kết hợp với động từ chia thể điều kiện tiêu cực '諦めてしまったら' (nếu từ bỏ tại thời điểm đó) để dẫn đến hệ quả '今までの投資が無駄になります'.
そこへ,,N3,①友人のうわさ話をしていたら、そこへ当の本人が来てしまった。,会議室で重大なエラーについて話し合っていたら、そこへちょうど田中社長が入ってきました。,会議室で重大なエラーについて話し合っていたら、,そこへ,ちょうど,田中社長が,入って,きました。,"Liên từ 'そこへ' biểu thị một sự việc hoặc một người bất ngờ xuất hiện, chen ngang vào tình huống/hành động đang diễn ra ở vế trước. Trạng từ 'ちょうど' nhấn mạnh tính thời điểm, theo sau là chủ ngữ mới '田中社長が' và hành động '入ってきました' (tách thành '入って' và 'きました')."
そこへいくと,,N1,①A：うちの会社、残業が多くてね。先週はほとんど晩ご飯、家で食べていないんだ。B：そりゃ、大変だな。そこへいくと僕のとこなんか楽なほうだ。,競合のA社は製品の導入費用が非常に高いですね」「そこへいくと、我が社の新製品はコストパフォーマンスが非常に高いです,競合のA社は製品の導入費用が非常に高いですね」「,そこへいくと、,我が社の,新製品は,コストパフォーマンスが,非常に高いです,"Thành ngữ trình độ N1 'そこへいくと' dùng để đối chiếu, so sánh hai đối tượng, mang nghĩa 'nếu so với trường hợp vừa nêu thì...'. Nó đứng đầu câu vế sau, theo sau là định ngữ '我が社の', chủ ngữ '新製品は' và thành phần so sánh 'コストパフォーマンスが非常に高いです'."
そしたら,,N4,①きのう映画を見に行ったのよ。そしたらばったり高田さんに会っちゃって。,明日の午前中なら時間が取れます」「そしたら、その時間にオンライン会議を設定します,明日の午前中なら時間が取れます」「,そしたら、,その時間に,オンライン会議を,設定,します,"Liên từ 'そしたら' (văn nói của それなら/そうしたら) mang nghĩa 'nếu vậy thì', dùng để đưa ra hành động tiếp theo dựa trên thông tin đối phương cung cấp. Theo sau là trạng từ thời gian 'その時間に', tân ngữ 'オンライン会議を' và động từ '設定します'."
そして,そして＜並立＞,N5,①今回の旅行ではスペイン、イタリアそしてフランスと、おもに南ヨーロッパを中心に回った。,今回の出張では、東京、大阪、そして福岡の支店を訪問する予定です。,今回の出張では、東京、,大阪、,そして,福岡の,支店を,訪問する予定です。,"Liên từ '그리고' (ở đây là '走って' -> 'そして') dùng để nối thành phần cuối cùng trong chuỗi liệt kê song song danh từ (A, B, và C). Thứ tự tự nhiên ở trình độ N5 là liệt kê các địa danh '東京', '大阪', dùng '傷して' -> '走って' -> '그리고' -> '傷して' -> 'そして' nối danh từ cuối cùng '福岡の' bổ nghĩa cho danh từ trung tâm '支店を' trước cụm vị ngữ '訪問する予定です'."
