Grammar,Usage,JLPT Level,Reference Example,Original Example,Prefix,Chunk1,Chunk2,Chunk3,Chunk4,Suffix,Explanation
させる,V－させてください＜許可求め＞,N4,①申し訳ありませんが、今日は少し早く帰らせてください。,申し訳ありませんが、明日は会議の準備のため、少し早く出社させてください。,申し訳ありませんが、,明日は会議の,準備のため、少し,早く出社させて,ください。,,"Cụm ""明日は会議の"" (ngày mai của cuộc họp) kết hợp với ""準備のため"" (vì việc chuẩn bị) tạo thành lý do. Sau đó là phó từ ""少し"" bổ nghĩa cho ""早く"" (sớm một chút). Cuối cùng ""出社させて"" kết hợp với ""ください"" để xin phép đi làm sớm."
させる,V－させて　もらう／くれる＜恩恵＞,N4,①両親が早く亡くなったので、姉が働いて私を大学に行かせてくれた。,部長が親切にも、私に新しいプロジェクトのリーダーを担当させてくれました。,部長が親切にも、,私に新しい,プロジェクトのリーダーを,担当させて,くれました。,,"Chủ ngữ ""部長が..."" đi với đối tượng nhận hành động ""私に新しい"". Tiếp đến là tân ngữ ""プロジェクトのリーダーを"" (vị trí trưởng dự án). Động từ ""担当させて"" (cho phép đảm nhận) nối với ""くれました"" thể hiện sự biết ơn vì được cấp trên giao phó."
させる,V－させられる＜使役受身＞　NがNにVさせられる,N4,①きのうは、お母さんに3時間も勉強させられた。,昨日は課長に、遅くまで残業させられました。,昨日は,課長に、,遅くまで,残業させられ,ました。,,"Thể sử dịch bị động (bị bắt làm gì). ""課長に、"" chỉ người bắt ép, theo sau là thời gian ""遅くまで"" (đến muộn). Động từ chính chia thể 使役受身 ""残業させられ"" ghép với đuôi lịch sự ""ました。""."
さっぱり,さっぱり～ない,N3,①あの人の話はいつもむずかしいことばがたくさんでてきてさっぱりわからない。,取引先が提示した新しい契約の条件は、複雑すぎてさっぱりわからない。,取引先が提示した,新しい契約の,条件は、複雑すぎて,さっぱり,わからない。,,"Cụm danh từ ""新しい契約の"" nối với ""条件は"" tạo thành chủ ngữ (điều kiện hợp đồng mới). Lý do là ""複雑すぎて"" (quá phức tạp), dẫn đến kết quả nhấn mạnh bằng phó từ ""さっぱり"" đi kèm với phủ định ""わからない"" ở cuối câu (hoàn toàn không hiểu)."
さっぱり,さっぱりだ,N3,①A：どう、調子は。B：だめ。さっぱりだよ。,今月の新商品の売り上げはどうですか。いや、競合が多くてさっぱりですよ。,今月の新商品の売り上げはどうですか。,いや、競合が,多くて,さっぱり,ですよ。,,"Câu trả lời bắt đầu bằng ""いや、競合が"" (Không, đối thủ cạnh tranh...) làm chủ ngữ phụ, ""多くて"" (nhiều) là lý do. ""さっぱり"" đứng trước ""ですよ。"" đóng vai trò như một tính từ/danh từ mang nghĩa ""hoàn toàn không được/tệ hại"" trong bối cảnh kinh doanh."
さて,さて,N3,①さて、そろそろいこうか。,昼休憩も終わりましたし、さて、午後の会議を始めましょうか。,昼休憩も終わりましたし、,さて、,午後の,会議を,始めましょうか。,,"Sau vế mào đầu, từ nối ""さて、"" (nào, vậy thì) được dùng để chuyển ý bắt đầu công việc. Tiếp theo là tân ngữ ""午後の"" đi với ""会議を"" (cuộc họp buổi chiều) và động từ rủ rê/đề nghị ""始めましょうか。"" ở cuối câu."
さて,さてV－てみると,N2,①漢字がおもしろそうだったので日本語を勉強することにしたのだが、さてはじめてみると、これがけっこうむずかしい。,企画書では完璧な計画だと思ったが、さて実行してみると、予算不足など様々な問題が出てきた。,企画書では完璧な計画だと思ったが、,さて,実行してみると、,予算不足など様々な問題が,出てきた。,,"Cấu trúc ""さて～てみると"" diễn tả ""đến khi thử làm gì đó mới nhận ra"". Ở đây ""さて"" đi liền với ""実行してみると、"" (đến khi thử thực thi). Vế sau chỉ kết quả ngoài dự kiến: chủ ngữ ""予算不足など様々な問題が"" nối với động từ ""出てきた。""."
さほど,さほどNaではない　さほどA－くない　さほどV－ない,N2,①きょうはさほどさむくない。,今回のシステム障害による顧客への影響は、幸いにもさほど大きくないようです。,今回のシステム障害による,顧客への,影響は、幸いにも,さほど大きくない,ようです。,,"Cụm ""顧客への"" nối với ""影響は"" tạo thành chủ ngữ (ảnh hưởng đến khách hàng). Phó từ chỉ mức độ ""幸いにも"" (may mắn thay) đi kèm với ""さほど大きくない"" (không lớn đến mức đó/không nhiều). Kết thúc bằng ""ようです。"" để diễn đạt suy đoán lịch sự trong báo cáo."
さも,,N1,①かれはさもおいしそうにビールを飲みほした。,その営業マンは、さも自分が社長であるかのように、偉そうな態度でクライアントと話していた。,その営業マンは、,さも,自分が社長である,かのように、偉そうな,態度でクライアントと話していた。,,"Cấu trúc ""さも～かのように"" (cứ như thể là). ""さも"" đứng trước mệnh đề giả định ""自分が社長である"" (mình là giám đốc). Ngay sau đó là ""かのように、偉そうな"" (cứ như thể, với vẻ ngạo mạn) bổ nghĩa cho phần đuôi ""態度でクライアントと話していた。""."
さらに,さらにNa／A／V　さらに＋数量詞,N3,①一日一回では効かないので、さらに薬の量を増やした。,既存のサービスに加えて、来月からはさらに便利なオンライン決済機能を追加いたします。,既存のサービスに加えて、,来月からは,さらに,便利なオンライン決済機能を,追加いたします。,,"Sau trạng ngữ thời gian ""来月からは"", phó từ ""さらに"" (thêm nữa, hơn nữa) được dùng để nhấn mạnh mức độ của tính từ theo sau nó. Cụm ""便利なオンライン決済機能を"" (tính năng thanh toán trực tuyến tiện lợi) làm tân ngữ cho động từ khiêm nhường ""追加いたします。""."
ざるをえない,V－ざるをえない　「V－ない」の「ない」を「ざる」に変えて作る。ただし、「する」は「せざるをえない」となる。,N2,①先生に言われたことだからやらざるをえない。,深刻な不祥事が発覚したため、社長は直ちに辞任せざるをえない状況に追い込まれた。,深刻な不祥事が発覚したため、,社長は,直ちに辞任,せざるをえない,状況に追い込まれた。,,"Chủ ngữ ""社長は"" (giám đốc) bắt đầu vế chính. Động từ ""辞任する"" chuyển thành ""辞任せざるをえない"" (không thể không từ chức / buộc phải từ chức) đi sau phó từ ""直ちに"". Cụm này bổ nghĩa trực tiếp cho danh từ ""状況に"" (vào tình huống) ở phần cuối."
し,～し,N4,①あの店は安いし、うまい。,弊社の新製品はデザインも優れているし、品質も高いので、自信を持っておすすめします。,弊社の新製品は,デザインも,優れているし、,品質も高いので、,自信を持っておすすめします。,,"Liệt kê ưu điểm để thuyết phục khách hàng. ""デザインも"" (thiết kế cũng) đi kèm với động từ ""優れているし、"" (xuất sắc, và). Tiếp theo là tiêu chí thứ hai ""品質も高いので、"" (chất lượng cũng cao, nên) dẫn đến kết luận ""自信を持っておすすめします。"" ở cuối."
し,～し、それに,N4,①今日は雨だし、それに風もつよい。,今日の午後は重要な商談があるし、それに提出書類の締め切りも迫っている。,今日の午後は,重要な,商談があるし、,それに提出書類の,締め切りも迫っている。,,"Liệt kê các lý do/tình huống cùng chiều trong công việc. Tính từ ""重要な"" bổ nghĩa cho ""商談があるし、"" (có cuộc đàm phán thương mại, và). Từ nối ""それに"" (thêm vào đó) đi liền với danh từ ""提出書類の"" để bổ nghĩa cho ""締め切りも迫っている。"" ở cuối câu."
し,Nも～し、Nも,N4,①あの子は頭もいいし性格もいい。,あの新入社員はパソコンのスキルも高いし、敬語の使い方も丁寧で素晴らしい。,あの新入社員は,パソコンの,スキルも高いし、,敬語の使い方も,丁寧で素晴らしい。,,"Cấu trúc ""Nも～し、Nも..."" liệt kê song song. ""パソコンの"" ghép với ""スキルも高いし、"" (kỹ năng máy tính cao). Tiếp theo là ""敬語の使い方も"" (cách dùng kính ngữ cũng) đi kèm với nhận xét tích cực ""丁寧で素晴らしい。"" ở đuôi câu."
し,～し,N4,①もう遅いしこれで失礼します。,明日の会議の資料はすでに作成しましたし、これで本日の業務は終了とさせていただきます。,明日の会議の資料は,すでに,作成しましたし、,これで本日の業務は,終了とさせていただきます。,,"Dùng ""し"" để nêu lý do kết thúc ngày làm việc. Phó từ ""すでに"" (đã) đi cùng ""作成しましたし、"" (đã làm xong rồi, nên...). Tiếp nối là cụm ""これで本日の業務は"" (công việc hôm nay đến đây là) ghép với cách nói kính ngữ xin phép ra về ""終了とさせていただきます。""."
し,～し、～から,N4,①この子はまだ10歳だし、体が弱いから留学は無理だ。,彼は営業の経験が豊富だし、人脈も広いから、新規プロジェクトの責任者に適任だ。,彼は営業の,経験が豊富だし、,人脈も,広いから、新規プロジェクトの,責任者に適任だ。,,"Nêu lý do tiến cử nhân sự. '経験が豊富だし、' (kinh nghiệm phong phú và...) đi trước, tiếp theo là cụm '人脈も' (mối quan hệ cũng) ghép với '広いから、新規プロジェクトの' (...rộng, nên rất thích hợp làm người chịu trách nhiệm của dự án mới)."
し,Nは～し、Nは～しで,N2,①子供は生まれるし、金はないしで大変だ。,決算期で経理部は、請求書の確認は多いし、システムのトラブルは起きるしで大騒ぎだ。,決算期で経理部は、,請求書の確認は,多いし、,システムのトラブルは,起きるしで大騒ぎだ。,,"Cấu trúc liệt kê những lý do tiêu cực dẫn đến tình trạng vất vả. ""請求書の確認は"" đi với ""多いし、"" (kiểm tra hóa đơn thì nhiều). Tiếp đó là ""システムのトラブルは"" (lỗi hệ thống thì) kết hợp với ""起きるしで大騒ぎだ。"" (...xảy ra, nên làm loạn cả lên)."
し,Nじゃあるまいし,N2,①子供じゃあるまいしそんなこと一人でやりなさい。,学生のアルバイトじゃあるまいし、無断欠勤など社会人として絶対に許されない。,学生の,アルバイトじゃ,あるまいし、無断欠勤など,社会人として絶対に,許されない。,,"Cấu trúc ""～じゃあるまいし"" (Có phải là... đâu mà). ""学生の"" bổ nghĩa cho ""アルバイトじゃ"". Nối tiếp là ""あるまいし、無断欠勤など"" (Có phải là làm thêm đâu, nên những việc như nghỉ không phép...). Cuối cùng là thái độ nghiêm khắc trong công sở ""社会人として絶対に"" đi với ""許されない。""."
しいしい,,N1,①女は遠慮しいしい部屋の片隅に座った。,新入社員は、社長の機嫌を伺いしいしい、恐る恐る昨日のミスの報告書を提出した。,新入社員は、,社長の,機嫌を,伺いしいしい、恐る恐る昨日の,ミスの報告書を提出した。,,"""～しいしい"" diễn tả hành động làm gì đó một cách rụt rè, e ngại hoặc lặp đi lặp lại. ""社長の"" bổ nghĩa cho tân ngữ ""機嫌を"". Động từ ""伺う"" (thăm dò) ghép với ""しいしい"" tạo thành ""伺いしいしい、恐る恐る昨日の"" (vừa dò xét tâm trạng vừa nơm nớp lo sợ, của ngày hôm qua), dẫn đến hành động chính ""ミスの報告書を提出した。""."
しか,N（＋助詞）しか～ない,N5,①朝はコーヒーしか飲まない。,本日のプロジェクト会議には、マーケティング部のメンバーしか出席していません。,本日のプロジェクト会議には、,マーケティング部の,メンバー,しか出席して,いません。,,"Cấu trúc ""しか～ない"" (chỉ/ngoài ra không). ""マーケティング部の"" (của phòng marketing) bổ nghĩa cho danh từ ""メンバー"". Trợ từ ""しか"" gắn ngay sau danh từ này kết hợp với động từ ""出席して"" và đuôi phủ định lịch sự ""いません。"" để nhấn mạnh chỉ có thành viên phòng đó có mặt."
