Grammar,Usage,JLPT Level,Reference Example,Original Example,Prefix,Chunk1,Chunk2,Chunk3,Chunk4,Suffix,Explanation
せっかく,せっかく～からには,N2,①せっかく留学するからには、できる限り多くの知識を身につけて帰りたい。,"せっかく遠方からお越しいただくからには、十分なご提案をさせていただきたいと存じます。","せっかく","遠方から","お越しいただく","からには、","十分なご提案を","させていただきたいと存じます。","Cấu trúc 'せっかく...からには' biểu thị ý nghĩa 'một khi đã cất công... thì'. Cụm từ kính ngữ '遠方からお越しいただく' (khách hàng cất công đến từ xa) đi liền sau 'せっかく'. Tiếp theo là 'からには' chỉ quyết tâm hoặc trách nhiệm. Vế sau '十分なご提案を' (đề xuất đầy đủ) kết hợp với đuôi câu khiêm nhường ngữ 'させていただきたいと存じます' để thể hiện mong muốn được phục vụ."
せっかく,せっかく～けれども,N3,①せっかくここまできたけれども、雨がひどくなってきたから引き返そう。,"せっかくご提案いただいたけれども、予算の都合上今回は見送らせていただきます。","せっかく","ご提案","いただいた","けれども、","予算の都合上","今回は見送らせていただきます。","Mẫu 'せっかく...けれども' diễn tả sự tiếc nuối khi lòng tốt hay cơ hội bị lãng phí. 'ご提案' đi kèm với 'いただいた' tạo thành cụm từ tôn vinh hành động của đối tác. Tiếp theo là từ nối tương phản 'けれども'. Trạng ngữ '予算の都合上' giải thích lý do cho hành động từ chối lịch sự '今回は見送らせていただきます' ở đuôi câu."
せっかく,"「せっかくXがY」などの形で、 Xにはまれな機会や努力、骨折りを伴ってなされた行為などが示され、 Yではそれが無駄になることが示され、無駄になって残念だ、申し訳ないなどの話し手の気持ちが表される。せっかく～のだから",N3,①せっかく来たのだから夕飯を食べて行きなさい。,"せっかく新商品のサンプルを作ったのだから、次の会議でクライアントに提示しましょう。","せっかく","新商品のサンプルを","作った","のだから、","次の会議で","クライアントに提示しましょう。","Mẫu 'せっかく...のだから' nhấn mạnh lý do vì đã tốn công sức làm việc gì đó nên vế sau cần tận dụng. Cụm '新商品のサンプルを' làm tân ngữ cho động từ '作った'. Tiếp theo là cấu trúc chỉ căn cứ 'のだから'. Trạng ngữ thời gian '次の会議で' bổ nghĩa cho hành động đề xuất 'クライアントに提示しましょう' ở phần đuôi."
せっかく,せっかく～のだったら,N3,①せっかくピアノを習うのだったら、少しくらい高くてもいい先生についた方がいい。,"せっかくシステムを導入するのだったら、全社員が使いこなせるように研修を行うべきだ。","せっかく","システムを","導入する","のだったら、","全社員が使いこなせるように","研修を行うべきだ。","Mẫu 'せっかく...のだったら' đưa ra điều kiện giả định dựa trên một cơ hội hoặc khoản đầu tư lớn. 'システムを' làm tân ngữ cho động từ '導入する'. Tiếp theo là vế giả định 'のだったら'. Cụm từ chỉ mục đích '全社員が使いこなせるように' bổ nghĩa cho lời khuyên mang tính bắt buộc '研修を行うべきだ' ở đuôi câu."
せっかく,せっかく ～のに／～ても,N3,①せっかく招待していただいたのに、伺えなくてすみません。,"せっかくスケジュールを調整していただいたのに、会議が延期になってしまい申し訳ありません。","せっかく","スケジュールを","調整していただいた","のに、","会議が延期になってしまい","申し訳ありません。","Mẫu 'せっかく...のに' thể hiện sự tiếc nuối và cáo lỗi sâu sắc khi nỗ lực của đối phương bị lãng phí. 'スケジュールを' làm tân ngữ cho cụm kính ngữ '調整していただいた'. Tiếp theo là trợ từ tương phản 'のに'. Vế '会議が延期になってしまい' nêu lý do khách quan không mong muốn trước lời xin lỗi công sở '申し訳ありません'."
せっかく,せっかく＋連体修飾句＋N,N3,①せっかく書いた原稿をなくしてしまった。,"せっかく作成した企画書に多くの誤字が見つかり、上司に叱られた。","せっかく","作成した","企画書に","多くの誤字が","見つかり、","上司に叱られた。","Cấu trúc 'せっかく + định ngữ + Danh từ' biểu thị thực thể đó là kết quả của một quá trình đầu tư công sức. Động từ thể quá khứ '作成した' đóng vai trò định ngữ bổ nghĩa cho danh từ '企画書に'. Cụm '多くの誤字が' đóng vai trò chủ ngữ cho động từ '見つかり' ở thể liên dụng nối câu, dẫn đến kết quả bị động '上司に叱られた' ở phần đuôi."
せっかく,せっかくですが,N3,①A：もう遅いですから、泊まっていらしたらいかがですか。B：せっかくですが、あしたは朝から用事がありますので。,"A：本日の打ち合わせの後に、軽い親睦会はいかがですか。B：せっかくですが、本日は別の約束がございますので失礼いたします。","A：本日の打ち合わせの後に、軽い親睦会はいかがですか。B：","せっかくですが、","本日は","別の約束が","ございますので","失礼いたします。","'せっかくですが' là công cụ ngôn ngữ dùng để từ chối khéo lời mời lịch sự trong kinh doanh. Cụm này đứng đầu câu trả lời của B. Trạng ngữ thời gian '本日は' định vị bối cảnh. Cụm danh từ '別の約束が' đi kèm kính ngữ 'ございますので' để nêu lý do khách quan trước khi đưa ra câu chào từ biệt lịch sự '失礼いたします'."
せっかく,せっかくですから,N3,①A：食事の準備がしてありますので、うちで召し上がってくださいよ。B：せっかくですから、お言葉に甘えて、そうさせていただきます。,"A：弊社の新製品のカタログをお持ちしましょうか。B：せっかくですから、一部いただくことは可能でしょうか。","A：弊社の新製品ของカタログをお持ちしましょうか。B：","せっかくですから、","一部","いただくことは","可能","でしょうか。","'せっかくですから' dùng để tiếp nhận lòng tốt hoặc đề nghị của đối phương một cách trân trọng trong công sở. Cụm này đứng đầu lời thoại của B. Từ chỉ số lượng '一部' bổ nghĩa cho hành động nhận. Cụm từ danh từ hóa khiêm nhường ngữ 'いただくことは' đóng vai trò là chủ đề chính được đưa ra cân nhắc kết hợp với đuôi câu hỏi ý kiến tôn kính '可能でしょうか'."
せつな,V－たせつな,N1,①目を離したせつな、子供は波にのまれていった。,"パソコンの電源を切ったせつな、保存していないデータがあることに気がついた。","パソコンの","電源を","切った","せつな、","保存していないデータがあることに","気がついた。","Cấu trúc 'V-たせつな' diễn tả một sự việc diễn ra ngay lập tức trong khoảnh khắc vừa kết thúc một hành động. '電源を' làm tân ngữ cho động từ thể quá khứ '切った'. Danh từ 'せつな' định vị thời điểm tức thì đó. Vế tiếp theo '保存していないデータがあることに' là cụm bổ nghĩa bổ sung nội dung cho sự nhận biết của động từ kết thúc '気がついた'."
ぜひ,,N5,①ぜひ一度遊びにきてください。,"ぜひ弊社のオフィスに来てください。","","ぜひ","弊社の","オフィスに","来て","ください。","Phó từ 'ぜひ' đứng đầu câu để nhấn mạnh ước muốn hoặc lời mời gọi thiết tha. Định ngữ '弊社の' bổ nghĩa cho danh từ chỉ địa điểm 'オフィスに'. Động từ thể Te '来て' kết hợp với cấu trúc yêu cầu lịch sự 'ください' ở phần đuôi câu để hoàn chỉnh một câu mời khách hàng ghé thăm văn phòng phù hợp với trình độ N5."
せめて,せめて,N3,①夏はせめて一週間ぐらい休みがほしい。,"繁忙期であっても、せめて進捗状況の共有は毎日行うべきだ。","繁忙期であっても、","せめて","進捗状況の","共有は","毎日","行うべきだ。","Trạng từ 'せめて' diễn tả ước muốn đạt được một mức độ tối thiểu trong một hoàn cảnh không lý tưởng ('繁忙期であっても'). 'せめて' đứng trước danh từ cần giới hạn. Cụm từ '進捗状況の' bổ nghĩa cho chủ đề '共有は'. Trạng từ '毎日' bổ nghĩa cho hành động đưa ra lời khuyên mang tính nghĩa vụ '行うべきだ' ở cuối câu."
せめて,せめて～だけでも,N3,①せめて一晩だけでも泊めてもらえませんか。,"契約の締結が難しいなら、せめて資料の確認だけでもお願いできませんでしょうか。","契約の締結が難しいなら、","せめて","資料の","確認","だけでも","お願いできませんでしょうか。","Cấu trúc 'せめて...だけでも' nhấn mạnh yêu cầu đặt ra một giới hạn tối thiểu duy nhất để tháo gỡ hoàn cảnh khó khăn. Trạng từ 'せめて' đi trước danh từ. '資料の' bổ nghĩa cho danh từ '確認'. Trợ từ 'だけでも' thể hiện ý niệm 'chỉ cần... thôi cũng được'. Vế sau kết hợp với cấu trúc nhờ vả kính ngữ bậc cao 'お願いできませんでしょうか' ở phần đuôi."
せめて,せめて～なりとも,N2,①せめて一目なりとも子供に会いたいものだ。,"ご多忙中恐れ入りますが、せめてお電話なりともいただけると幸いです。","ご多忙中恐れ入りますが、","せめて","お電話","なりとも","いただけると","幸いです。","'なりとも' là ngữ pháp N2 trang trọng tương đương với 'dù chỉ là...'. Trạng từ 'せめて' đứng trước danh từ 'お電話' để thiết lập giới hạn tối thiểu trong bối cảnh lịch sự 'ご多忙中恐れ入りますが'. Sự kết hợp 'お電話なりとも' làm tiền đề điều kiện cho vế kết thúc thể hiện mong muốn kính ngữ 'いただけると幸いです'."
せめて,せめてものN,N2,①ひどい事故だったが、死者が出なかったのがせめてもの救いだ。,"多大な損害を出してしまったが、顧客の信頼を失わなかったのがせめてもの救いだ。","多大な損害を出してしまったが、","顧客の","信頼を","失わなかったのが","せめてもの","救いだ。","Cấu trúc 'せめてものN' diễn tả một điểm tích cực nhỏ nhoi hiếm hoi còn sót lại trong một tình huống tồi tệ. '顧客の' bổ nghĩa cho tân ngữ '信頼を'. Cụm phủ định danh từ hóa '失わなかったのが' đóng vai trò chủ ngữ cho vế sau. Cụm từ định ngữ 'せめてもの' đi liền trước và bổ nghĩa trực tiếp cho danh từ kết câu '救いだ'."
せられたい,Nせられたい R－られたい,N1,①上記三名の者ただちに出頭せられたい。,"各位、今期の売上報告書を至急提出せられたい。","各位、","今期の","売上報告書を","至急","提出","せられたい。","'～せられたい' là dạng văn viết hành chính hoặc thông báo chính thức mang sắc thái mệnh lệnh trang trọng của tổ chức. Từ xưng hô '各位' đặt ở đầu câu để định rõ đối tượng tiếp nhận. Định ngữ '今期の' bổ nghĩa cho tân ngữ '売上報告書を'. Trạng từ '至急' bổ nghĩa cho danh động từ '提出' trước khi kết hợp với cấu trúc vĩ tố hành chính 'せられたい'."
ぜんぜん～ない,,N5,①テレビ、消そう。ぜんぜんおもしろくない。,"このパソコンは古くて、ぜんぜん動かなくなりました。","このパソコンは","古くて、","ぜんぜん","動か","なくなり","ました。","Phó từ 'ぜんぜん' ở trình độ N5 luôn đi kèm với cấu trúc phủ định ở cuối câu để biểu thị ý nghĩa 'hoàn toàn không'. 'このパソコンは' thiết lập chủ ngữ cho câu. Tính từ '古くて' chỉ nguyên nhân. 'ぜんぜん' đứng trước động từ để bổ nghĩa mức độ phủ định. Động từ '動か' kết hợp với thể phủ định quá khứ 'なくなりました' ở phần đuôi."
そう～ない,,N3,①夕食はそうおいしくなかったが全部食べた。,"今回のトラブルの解決はそう簡単ではないが、全力を尽くします。","今回の","トラブルの解決は","そう","簡単では","ないが、","全力を尽くします。","Cấu trúc 'そう～ない' diễn tả ý nghĩa phủ định nhẹ nhàng 'không đến mức như thế'. Định ngữ '今回の' bổ nghĩa cho danh từ chủ đề 'トラブルの解決は'. Phó từ 'そう' đứng ngay trước tính từ đuôi na phủ định '簡単ではない'. Trợ từ nối tương phản 'が' liên kết với vế bộc lộ quyết tâm công sở '全力を尽くします' ở đuôi."
そういえば,,N4,①A：なんだか今夜はしずかね。B：そういえばいつものカラオケがきこえないね。,"A：佐藤さんはまだ席に戻っていませんね。B：そういえば、先ほどクライアントからの電話に対応していました。","A：佐藤さんはまだ席に戻っていませんね。B：","そういえば、","先ほど","クライアントからの電話に","対応して","いました。","Liên từ 'そういえば' dùng để chuyển tiếp câu thoại khi người nói sực nhớ ra một thông tin liên quan mật thiết đến chủ đề đang bàn luận. Trạng vụ thời gian '先ほど' bổ nghĩa cho thời điểm hành động xảy ra. Cụm từ 'クライアントからの電話に' làm tân ngữ chỉ đối tượng tương tác của động từ hành động ở thể tiếp diễn quá khứ '対応していました'."
そうしたら,前の文と後の文を時間的な順序でつなぐ用法。さらにくだけた言い方に「そしたら」がある。そうしたら＜未果＞,N4,①娘は大学に入ったら下宿すると言っている。そうしたら、家の中が静かになるだろう。,"来週の月曜日までにスケジュールを調整してください。そうしたら、新しい計画を立てましょう。","来週の月曜日までにスケジュールを調整してください。","そうしたら、","私たちが","新しい計画を","立てま","しょう。","Liên từ 'そうしたら' biểu thị mối quan hệ hệ quả giả định trong tương lai 'nếu làm như thế thì...'. Nó đứng đầu câu thứ hai để liên kết với câu cầu khiến phía trước. Cụm chủ ngữ '私たちが' thực hiện hành động. Cụm '新しい計画を' làm tân ngữ trực tiếp đi kèm dạng ý chí tập thể '立てましょう' ở phần vĩ tố câu."
そうしたら,そうしたら＜過去＞,N4,①暑いので窓を開けた～そうしたら大きなガが飛び込んで来た。,"取引先にメールを送信しました。そうしたら、すぐに丁寧な返信が届きました。","取引先にメールを送信しました。","そうしたら、","すぐに","丁寧な返信が","届き","ました。","Liên từ 'そうしたら' dùng để nối tiếp một sự việc đã xảy ra trong quá khứ dẫn tới một kết quả diễn tiến tiếp theo. Nó đứng ở đầu câu thứ hai. Trạng từ 'すぐに' bổ nghĩa mức độ nhanh chóng. Cụm chủ ngữ '丁寧な返信が' đi kèm với tự động từ được chia ở thì quá khứ lịch sự '届きました' ở đuôi câu nhằm tường thuật lại sự việc."