Grammar,Usage,JLPT Level,Reference Example,Original Example,Prefix,Chunk1,Chunk2,Chunk3,Chunk4,Suffix,Explanation
なにも,なにもかも,N3,①嫌なことは何もかも忘れて楽しみましょう。,今回のプロジェクトについては、些細なことも何もかも私に報告してください。,今回のプロジェクトについては、,些細な,ことも,何もかも,私に,報告してください。,"""些細な"" bổ nghĩa cho danh từ ""こと"". Trợ từ ""も"" kết hợp với ""何もかも"" để nhấn mạnh ý nghĩa ""bất cứ việc gì, toàn bộ mọi thứ"". Cụm ""私に"" chỉ đối tượng tiếp nhận hành động, đi kèm với động từ ""報告してください"" ở vế sau cùng."
なにやら,なにやら,N3,①なにやら変な臭いがする。,会議室からなにやら深刻な話し合いの声が聞こえてきます。,会議室から,なにやら,深刻な,話し合いの,声が,聞こえてきます。,"""なにやら"" (không hiểu sao, có vẻ như) là phó từ đứng trước để bổ nghĩa cho tính từ ""深刻な"". Tính từ ""深刻な"" bổ nghĩa cho danh từ ""話し合い"". Cụm danh từ ""深刻な話し合いの声"" đóng vai trò làm chủ ngữ đi với trợ từ ""が"" và động từ trạng thái ""聞こえてきます""."
なにやら,～やらなにやら Nやらなにやら A－い／V－る やらなにやら,N2,①お菓子やらなにやらを持ち寄ってパーティーを開いた。,明日のプレゼンのために、資料やらサンプルやらなにやらを急いで準備しました。,明日のプレゼンのために、,資料やら,サンプルやら,なにやらを,急いで,準備しました。,"Cấu trúc ""AやらBやらなにやら"" dùng để liệt kê các sự vật, hiện tượng cùng loại mang tính bộn bề (""nào là... nào là... và nhiều thứ khác""). Cụm ""資料やらサンプルやらなにやら"" kết hợp thành cụm danh từ làm tân ngữ, đi với trợ từ ""を"". Phó từ ""急いで"" bổ nghĩa cho động từ hành động ""準備しました""."
なより,なより,N3,①料理を作るのがなにより得意です。,弊社にとっては、お客様の信頼を得ることがなにより重要でございます。,弊社にとっては、,お客様の,信頼を,得ることが,なにより,重要でございます。,"""お客様の"" bổ nghĩa cho danh từ ""信頼"". Cụm ""信頼を得ること"" danh từ hóa hành động ""nhận được sự tin tưởng"", đóng vai trò làm chủ ngữ đi với trợ từ ""が"". Phó từ ""なにより"" (hơn tất cả mọi thứ) đứng trước tính từ ""重要"" để nhấn mạnh mức độ cao nhất. Kết thúc bằng kính ngữ ""でございます""."
なより,なよりだ,N3,①お元気そうでなによりです。,新プロジェクトが無事に成功いたしまして、私どもとしてもなによりでございます。,新プロジェクトが,無事に,成功いたしまして、,私どもとしても,なによりで,ございます。,"""無事に"" là phó từ bổ nghĩa cho cụm từ khiêm nhường ngữ ""成功いたしまして"". ""私どもとしても"" chỉ lập trường đối trọng của người nói (""về phía chúng tôi cũng""). ""なによりでございます"" là dạng kính ngữ trang trọng của ""なによりだ"", thể hiện niềm vui hoặc sự nhẹ nhõm tột cùng của người nói khi sự việc tốt đẹp diễn ra."
なまじ,,N1,①なまじ急いでタクシーに乗ったために、渋滞に巻き込まれてかえって遅刻してしまった。,顧客との商談で、なまじ業界の知識があったために、かえって信用を失ってしまいました。,顧客との商談で、,なまじ,業界の,知識が,あったために、,かえって信用を失ってしまいました。,"Phó từ ""なまじ"" (dở dở ương ương, nửa vời, thà không có còn hơn) bổ nghĩa cho vế lý do ""知識があった"". Cụm ""業界の"" bổ nghĩa cho ""知識"". Cấu trúc ""～ために"" chỉ nguyên nhân trực tiếp dẫn đến một kết quả xấu đáng tiếc ở vế sau là ""かえって信用を失ってしまいました"" (ngược lại đã đánh mất lòng tin)."
なら1,名詞を直接「なら」が受け、主題を表す。「ならば」の形で使われることもある。Nなら,N4,①A：めがねはどこかな。B：めがねなら、タンスの上に置いてありましたよ。,お探しの契約書なら、あちらの金庫の中に保管されております。,お探しの,契約書,なら、,あちらの,金庫の,中に保管されております。,"""契約書なら"" đưa danh từ ""契約書"" lên làm chủ đề câu hỏi hoặc đối thoại (""Nếu là tập hợp đồng anh tìm thì...""). ""あちらの"" bổ nghĩa cho danh từ ""金庫"". Cụm ""金庫の中"" chỉ vị trí không gian, đi với trợ từ ""に"" và động từ bị động/kính ngữ ""保管されております""."
なら1,NならNだ,N3,①山ならやっぱり富士山だ。,今後の取引先ならやっぱり田中テクノロジー社が一番信頼できます。,今後の,取引先,なら,やっぱり,田中テクノロジー社が,一番信頼できます。,"""取引先なら"" dùng để xác định chủ đề đưa ra bàn luận (""Nếu nói về đối tác kinh doanh...""). Phó từ ""やっぱり"" nhấn mạnh một kết luận hoặc quyết định mang tính hiển nhiên. ""田中テクノロジー社が"" là chủ ngữ bổ nghĩa cho năng lực/trạng thái ""一番信頼できます"" (đáng tin cậy nhất)."
なら1,～（助詞）なら,N4,①あの人となら結婚してもいい。,信頼できる御社となら、長期的なパートナーシップを築くことができると確信しております。,信頼できる,御社,と,なら、,長期的な,パートナーシップを築くことができると確信しております。,"""御社"" kết hợp với trợ từ ""と"" thành cụm ""御社と"" (với quý công ty). Thêm trợ từ liên kết giả định ""なら"" tạo thành cụm chủ đề ""御社となら"" (Nếu là hợp tác với quý công ty...). Tính từ đuôi な ""長期的な"" bổ nghĩa cho danh từ ""パートナーシップ"" đóng vai trò tân ngữ."
なら2,N／Naなら N／Naだった（の）なら A－い／A－かった（の）なら V－る／V－た（の）なら 述語の辞書形・タ形を受け、「実情・状況がそのようであれば」という意味を表す。「のならば」「のなら」「ならば」の形も使われる。話しことばでは「の」は「ん」となることが多い。「の」の有無による意味の違いは、はっきりとは認められない場合が多いが、「の」がある場合は、聞き手の発言や具体的な状況を受けて「あなたがそう言うなら」「それが事実ならば」「実情がそのようであれば」という意味を表すのに対し、「の」がない場合は、「一般的にそのような場合は」「そうする場合は」という意味を表す傾向がある。名詞、ナ形容詞を直接受ける場合は「の」は使われないことが多い。動詞、イ形容詞に続く場合、「（の）なら」と「のだったら」は類義的で、互いに言いかえが可能だが、「のだったら」の「の」は省略できない。（誤）知っているだったら教えてほしい。（正）知っている（の）なら教えてほしい。知っているのだったら教えてほしい。～（の）なら＜仮定条件＞,N4,①A：風邪をひいてしまいまして。B：風邪なら早く帰って休んだほうがいいよ。,もし明日の会議に出席するのなら、事前にこの資料を読んでおいてください。,もし,明日の,会議に,出席する,のなら、,事前にこの資料を読んでおいてください。,"""明日の"" bổ nghĩa cho danh từ ""会議"". ""会議に出席する"" là hành động đi kèm với cấu trúc ""のなら"" nhằm đưa ra giả định dựa trên ý định thực tế của đối phương (""Nếu anh định tham gia...""). Vế sau đưa ra một yêu cầu hoặc lời khuyên cần thực hiện trước: ""事前にこの資料を読んでおいてください""."
なら2,～（の）なら＜反事実＞,N3,①電話をくれるのなら、もう少し早い時間に電話してほしかった。,納品スケジュールが変更になるのなら、先週のうちに連絡してほしかったです。,納品,スケジュールが,変更に,なる,のなら、,先週のうちに連絡してほしかったです。,"""スケジュールが"" làm chủ ngữ cho cụm tự động từ ""変更になる"". Kết hợp với ""のなら"" ở dạng giả thuyết trái thực tế (phía đối phương đã thay đổi lịch nhưng báo muộn). Vế sau thể hiện tâm trạng nuối tiếc, trách móc nhẹ nhàng trong công việc bằng cấu trúc ""連絡してほしかったです"" (ước gì anh đã liên lạc)."
なら2,Vーる（の）なら～がいい,N4,①靴を買うならイタリア製がいい。,新しくオフィスのパソコンを買い換えるなら、最新 of モデルのほうがいいです。,新しく,オフィスの,パソコンを,買い換える,なら、,最新 of モデルのほうがいいです。,"""オフィスの"" bổ nghĩa cho danh từ ""パソコン"". ""パソコンを買い換える"" là một cụm vị ngữ làm điều kiện giả định, kết hợp trực tiếp với ""なら"" thành ""買い換えるなら"" (Nếu thay mới...). Vế sau đưa ra lời gợi ý hoặc lựa chọn tối ưu hơn ""最新のモデルのほうがいいです""."
なら2,V－る（の）なら～しろ／～するな,N3,①何事もやるなら最後まで徹底的にやれ。,弊社の代表として交渉に行くなら、絶対に妥協するな。,弊社の,代表として,交渉に,行く,なら、,絶対に妥協するな。,"""代表として"" mang ý nghĩa với tư cách, vị thế là người đại diện. ""交渉に行く"" là cụm động từ di chuyển kèm mục đích làm điều kiện. Thêm ""なら"" tạo điều kiện giả định hành vi. Vế sau kết thúc bằng thể cấm đoán nghiêm khắc ""絶対に妥協するな"" (tuyệt đối không được thỏa hiệp) thể hiện chỉ thị dứt khoát của cấp trên."
なら2,～（の）なら～で NaならNaで A（の）ならAで V（の）ならVで,N2,①嫌なら嫌で、そう言ってくれたらよかったのに。今となっては遅すぎるよ。,もしも予算が不足しているなら不足しているで、別のプランを提案すればいい。,もしも,予算が,不足している,なら,不足しているで、,別のプランを提案すればいい。,"Cấu trúc ""AならAで"" diễn tả ý ""nếu trong tình trạng A (dù không lý tưởng) thì sẽ có cách xử lý theo kiểu A"". Hành động ""予算が不足している"" (ngân sách thiếu hụt) được lặp lại ở hai vế để nhấn mạnh hiện trạng chấp nhận thực tế, vế sau đưa ra phương án giải quyết tương thích ""別のプランを提案すればいい""."
なら2,～（の）なら～と NならN（だ）と NaならNa（だ）と A（の）ならAと V（の）ならVと,N3,①欠席なら欠席と前もって知らせておいてください。,万が一納期が遅れるなら遅れると、至急担当者に連絡してください。,万が一,納期が,遅れる,なら,遅れると、,至急担当者に連絡してください。,"Cấu trúc ""AならAと"" dùng để yêu cầu đối phương phải thông báo rõ ràng, dứt khoát về bản chất vấn đề A (""nếu trễ thì bảo là trễ""). ""納期が遅れる"" là cụm chủ vị điều kiện. Cụm ""遅れると"" sử dụng trợ từ ""と"" để dẫn cú pháp cho hành động phát ngôn hoặc thông báo ở vế sau ""至急担当者に連絡してください""."
なら2,ならべつだが A／V（の）ならべつだが,N2,①そんなに勉強がつまらない（の）なら別だが、自分の心構えについても反省してみてはどうだろうか。,天災など不可抗力の理由があるのなら別だが、寝坊で商談に遅れるのは社会人として許されません。,天災など,不可抗力の,理由が,あるの,なら別だが、,寝坊で商談に遅れるのは社会人として許されません。,"""不可抗力の"" bổ nghĩa cho danh từ ""理由"". Cụm ""理由がある"" đi với cấu trúc ""のなら別だが"" tạo thành nghĩa giả định loại trừ ""Nếu có lý do... thì lại là chuyện khác, đằng này..."". Vế sau chỉ ra thực tế phê phán hành vi phi lý của một nhân viên công sở."
なら2,～というのなら,N3,①A：明日はほかに用事があってお邪魔できないのですが。B：来たくないと言うのなら来てもらわなくてもいい。,貴社がこの価格ではどうしても合意できないというのなら、他社との取引も検討せざるを得ません。,貴社が,この価格では,どうしても,合意できない,というのなら、,他社との取引も検討せざるを得ません。,"""この価格では"" chỉ phạm vi điều kiện mức giá. Phó từ ""どうしても"" đi với thể phủ định ""合意できない"" thể hiện sự bế tắc. Cấu trúc ""というのなら"" trích dẫn lại lập trường khẳng định mang tính ép buộc của đối phương để đưa ra hệ quả tất yếu khách quan ở vế sau ""検討せざるを得ません""."
なら2,～ということなら,N3,①癌だということなら退院させてくれるはずがない。,今回のシステム障害の原因が弊社側にあるということなら、直ちに対応しなければなりません。,今回の,システム障害の,原因が,弊社側にある,ということなら、,直ちに対応しなければなりません。,"""システム障害の"" bổ nghĩa cho danh từ ""原因"". Cụm chủ vị ""原因が弊社側にある"" (nguyên nhân nằm ở phía công ty chúng tôi) bổ nghĩa cho cấu trúc xác thực tình huống ""ということなら"" (Nếu sự thật là như vậy...). Vế sau đưa ra nghĩa vụ hành động bắt buộc, khẩn cấp."
なら3,なら（ば）,N4,①10人一緒なら団体の割り引き料金になる。,今回のご注文が100個以上の大口注文ならば、10パーセントの割引が適用されます。,今回のご注文が,100個以上の,大口注文,なら,ば、,10パーセントの割引が適用されます。,"""100個以上の"" bổ nghĩa cho danh từ ""大口注文"" (đơn hàng lớn). Danh từ ghép này đi trực tiếp với cấu trúc giả định điều kiện toán học/thương mại ""ならば"" (được băm nhỏ thành ""なら"" và ""ば、""). Vế sau chỉ kết quả hiển nhiên đi kèm ""10パーセントの割引が適用されます""."
なら3,NがNならNはNだ,N4,①銀座が東京の中心なら心斎橋(しんさいばし)は大阪の中心だ。,当社において東京本社が営業の中心なら、大阪支社は製造の中心です。,当社において,東京本社が,営業の中心,なら、,大阪支社は,製造の中心です。,"Cấu trúc song hành đối chiếu tương quan giữa hai thực thể trong cùng một tổ chức: ""AがBなら、CはDだ"" (Nếu A là B thì C là D). ""東京本社が"" kết hợp với danh từ chỉ bộ phận chiến lược ""営業の中心"" kèm liên từ ""なら"". Vế đối chiếu tương đương ở sau dùng cấu trúc chủ ngữ trợ từ ""は"" đi với ""製造の中心です""."
