Grammar,Usage,JLPT Level,Reference Example,Original Example,Prefix,Chunk1,Chunk2,Chunk3,Chunk4,Suffix,Explanation
かぎり,Nかぎり,N3,①彼女は今年限りで定年退職することになっている。,弊社の新サービスは、会員の皆様に限り、無料でご利用いただけます。,弊社の新サービスは、,会員の,皆様に,限り、,無料で,ご利用いただけます。,"Ngữ pháp「Nに限り」nghĩa là ""chỉ giới hạn đối với N"". 「会員の皆様」 (mọi thành viên) là danh từ chỉ đối tượng được giới hạn bổ nghĩa cho 「限り」. Sau đó là trạng từ 「無料で」 (miễn phí) bổ nghĩa cho hành động phía sau 「ご利用いただけます」 (có thể sử dụng - kính ngữ)."
かぎり,～かぎり　Nのかぎり　V－るかぎり,N2,①力の限り戦ったのだから負けても悔いはない。,弊社といたしましては、誠意の限りを尽くして、御社の課題解決にあたる所存です。,弊社といたしましては、,誠意の,限りを,尽くして、,御社の課題解決に,あたる所存です。,"Ngữ pháp「N của かぎり」nghĩa là ""hết mức, toàn bộ N"". Cụm ""誠意の限りを尽くして"" nghĩa là dốc hết toàn bộ sự thành ý. Cụm này đứng trước để thể hiện thái độ đối với hành động tiếp theo ở vế sau là ""御社の課題解決にあたる"" (giải quyết vấn đề của quý công ty). Cuối cùng kết thúc bằng cấu trúc khiêm nhường biểu thị quyết tâm 「～所存です」."
かぎり,V－る／V－ている／V－た　かぎり,N3,①私の知る限り、彼は絶対そんなことをするような人ではない。,私が昨日調べた限りでは、このデータに不備は見当たりませんでした。,私が昨日,調べた,限りでは、,このデータに,不備は,見当たりませんでした。,"Ngữ pháp「V-た限りでは」nghĩa là ""theo như những gì đã (V)..."". Động từ thể quá khứ 「調べた」 kết hợp trực tiếp với 「限りでは」 tạo thành vế phạm vi ""theo như những gì đã điều tra"". Cụm này làm tiền đề để đưa ra nhận định ở vế sau. Do đó cụm bổ ngữ ""このデータに"" đứng trước cụm danh từ chủ ngữ của vị ngữ sau là 「不備は」."
かぎり,V－る／V－ている　かぎり,N3,①この山小屋にいる限りは安全だろう。,契約書を更新し続けている限り、この条件で取引が継続されます。,契約書を,更新し続けている,限り、,この条件で,取引が,継続されます。,"Ngữ pháp「V-ている限り」biểu thị ý nghĩa ""chừng nào mà còn tiếp diễn hành động V thì trạng thái sau vẫn giữ nguyên"". Động từ 「更新し続けている」 (đang tiếp tục gia hạn) đi với 「限り」 tạo thành vế chỉ điều kiện trạng thái. Tiếp theo, cụm trạng ngữ 「この条件で」 (với điều kiện này) đóng vai trò bổ nghĩa cho phương thức thực hiện hành động 「取引が継続されます」 (giao dịch sẽ được tiếp tục)."
かぎり,V－ないかぎり,N3,①練習しない限り、上達もありえない。,秘密保持契約を結ばない限り、詳しい仕様書をお渡しすることはできません。,秘密保持契約を,結ばない,限り、,詳しい仕様書を,お渡しすることは,できません。,"Ngữ pháp「V-ない限り」có nghĩa là ""nếu không V, trừ khi V"". Động từ thể phủ định 「結ばない」 (không ký kết) kết hợp với 「限り」 tạo thành điều kiện bắt buộc. Vế sau thể hiện kết quả tiêu cực nếu điều kiện đó không thỏa mãn: 「詳しい仕様書を」 (bản thông số kỹ thuật chi tiết) làm tân ngữ cho danh từ hóa dạng khiêm nhường ngữ 「お渡しすることは」 (việc trao/gửi), kết thúc bằng 「できません」."
かぎる,～にかぎる　Nにかぎる　Naなのにかぎる　Aのにかぎる　V－るにかぎる,N3,①和菓子ならこの店にかぎる。,スケジュールのミスを防ぐには、社内カレンダーで共有するに限ります。,スケジュールの,ミスを,防ぐには、,社内カレンダーで,共有するに,限ります。,"Ngữ pháp「V-るに限る」mang ý nghĩa ""là tốt nhất, là cách hay nhất"". Vế đầu xác định mục đích bằng 「ミスを」 + 「防ぐには」 (để phòng tránh sai sót). Sau đó, phương pháp tối ưu được đề xuất là dùng phương tiện 「社内カレンダーで」 (bằng lịch nội bộ công ty) đi kèm động từ thể từ điển 「共有する」 kết hợp trực tiếp với 「に限ります」."
かぎる,Nにかぎったことではない,N2,①あの人が遅刻するのは今日にかぎったことではない。,納期遅延によるトラブルは、今回の案件に限ったことではない。,納期遅延による,トラブルは、,今回の,案件に,限ったことでは,ない。,"Ngữ pháp「Nに限ったことではない」có nghĩa là ""không chỉ giới hạn ở N / không riêng gì N"". Danh từ chủ ngữ chính của câu là 「トラブルは」 được định ngữ bởi cụm 「納期遅延による」. Danh từ đứng trước ngữ pháp là 「今回の案件」 (dự án lần này), trong đó 「今回の」 bổ nghĩa cho 「案件に」. Cụm phủ định 「限ったことではない」 kết thúc câu để khẳng định tính phổ biến."
かくして,,N1,①かくして市民による革命が成し遂げられたのであった。,かくして、長年にわたる両社の交渉は無事に妥結へと至ったのであった。,かくして、,長年にわたる,両社の交渉は,無事に,妥結へと,至ったのであった。,"Từ nối 「かくして」 nghĩa là ""sau đó, cứ như thế, và như vậy"", đứng đầu câu để dẫn dắt kết quả. Chủ ngữ 「両社の交渉は」 được bổ nghĩa bởi cụm tính từ 「長年にわたる」 (kéo dài nhiều năm). Trạng từ 「無事に」 bổ nghĩa cho hướng biến đổi 「妥結へと」 (hướng tới sự thỏa hiệp), kết hợp với động từ kết thúc câu 「至ったのであった」."
かけ,R－かけ,N3,①やりかけの仕事が残っていたので、会社に戻った。,机の上に書きかけの報告書があったので、急いで仕上げました。,机の上に,書き,かけの,報告書が,あったので、,急いで仕上げました。,"Ngữ pháp「R-かけの + N」diễn tả hành động đang làm dở giữa chừng. Động từ 「書く」 bỏ masu thành 「書き」, kết hợp với 「かけの」 để bổ nghĩa cho danh từ 「報告書」. Vì 「報告書が」 là chủ ngữ của vế nguyên nhân nên đi với 「あったので」, dẫn tới hành động kết quả ở vế sau là 「急いで仕上げました」."
かける,R－かける＜働きかけ＞,N3,①電車の中で酔っぱらいに話しがわからないふりをすることにしている。,お客様が展示ブースで迷われている様子なら、積極的に話しかけるようにしてください。,お客様が,展示ブースで,迷われている,様子なら、,積極的に,話しかけるようにしてください。,"Ngữ pháp 「R-かける」 biểu thị hành động tác động hướng tới đối tượng khác (働きかけ), ở đây là 「話しかける」 (bắt chuyện). Cấu trúc câu gồm vế giả định: 「展示ブースで」 bổ nghĩa cho trạng thái kính ngữ 「迷われている」, đi với 「様子なら」 (nếu có dáng vẻ). Vế sau dùng trạng từ 「積極的に」 để bổ nghĩa cho hành động lời khuyên 「話しかけるようにしてください」."
かける,R－かける＜途中＞,N3,①友達に大事な相談の手紙を書きかけたとき、玄関のベルが鳴った。,部長が何かを言いかけたとき、会議室の電話が突然鳴り出した。,部長が,何かを,言い,かけた,とき、,会議室の電話が突然鳴り出した。,"Ngữ pháp 「R-かける」 biểu thị hành động đang bắt đầu hoặc làm dở giữa chừng (途中). Động từ 「言う」 bỏ masu thành 「言い」, đi với 「かけた」 tạo thành cụm định ngữ bổ nghĩa cho danh từ thời gian 「とき」. Vế trước có tân ngữ 「何かを」. Vế sau diễn tả sự việc đột ngột chen ngang làm gián đoạn hành động."
がさいご,V－たがさいご,N1,①ここで会ったが最後、謝ってもらうまでは逃がしはしない。,ネット上で一度信用を失ったが最後、ビジネスの回復は極めて困難になります。,ネット上で,一度,信用を,失ったが,最後、,ビジネスの回復は極めて困難になります。,"Ngữ pháp「V-たが最後」nghĩa là ""một khi đã... thì (kết quả xấu tất yếu xảy ra)"". Động từ thể quá khứ 「失った」 kết hợp với 「が最後」 tạo thành điều kiện giả định không thể cứu vãn. Trạng từ 「一度」 bổ nghĩa cho hành động tác động lên tân ngữ 「信用を」. Vế sau đưa ra hệ quả tiêu cực tất yếu."
がたい,R－がたい,N2,①信じがたいことだが本当なのだ。,このような初歩的なミスは、プロのエンジニアとして到底受け入れがたい。,このような,初歩的な,ミスは、,プロの,エンジニアとして,到底受け入れがたい。,"Ngữ pháp「R-gatai」nghĩa là ""khó mà làm gì"" (về mặt tâm lý/đạo đức). Động từ 「受け入れる」 bỏ masu thành 「受け入れ」 kết hợp với 「がたい」. Chủ ngữ câu là 「ミスは」 được bổ nghĩa bằng tính từ 「初歩的な」. Thành phần 「エンジニアとして」 đi kèm bổ nghĩa cho 「プロの」. Phó từ 「到底」 đi với từ mang nghĩa phủ định/khó khăn để nhấn mạnh ý ""hoàn toàn khó lòng chấp nhận""."
かたがた,Nかたがた,N1,①友達が風邪をひいたというので、お見舞いかたがた家を訪ねることにした。,本日は、先日のプロジェクトのお礼かたがた、新商品のご案内にお伺いいたしました。,本日は、,先日のプロジェクトの,お礼,かたがた、,新商品の,ご案内にお伺いいたしました。,"Ngữ pháp「Nかたがた」nghĩa là ""nhân tiện N, đồng thời kết hợp làm N"" (dùng kính ngữ trang trọng trong công việc). Danh từ 「お礼」 kết hợp với 「かたがた」. Trước đó là cụm định ngữ 「先日のプロジェクトの」 bổ nghĩa cho 「お礼」. Vế sau chỉ mục đích song song 「新商品の」 bổ nghĩa cho 「ご案内」, kết thúc bằng khiêm nhường ngữ 「にお伺いいたしました」."
かたわら,～かたわら＜そば＞　Nのかたわら　V－るかたわら,N1,①母が編み物をするかたわらで、女の子は折り紙をして遊んでいた。,先輩が顧客と商談を進めるかたわらで、新人の私は必死にメモを取っていた。,先輩が,顧客と,商談を,進める,かたわらで、,新人の私は必死にメモを取っていた。,"Ngữ pháp「V-るかたわらで」ở nghĩa không gian/hành động song song bên cạnh (そば) diễn tả ""bên cạnh lúc ai đó đang làm gì"". Động từ 「進める」 bổ nghĩa trực tiếp cho 「かたわらで」. Vế trước gồm tân ngữ 「商談を」 và đối tượng 「顧客と」. Vế sau diễn tả hành động song song của chủ ngữ chính 「新人の私は」."
かたわら,～かたわら＜副次的動作＞　Nのかたわら　V－るかたわら,N1,①その教授は、自分の専門の研究をするかたわら、好きな作家の翻訳をすることを趣味としている。,彼は本業のマーケティング業務を行うかたわら、週末は経営大学院で講師を務めている。,彼は,本業の,マーケティング業務を,行う,かたわら、,週末は経営大学院で講師を務めている。,"Ngữ pháp「V-るかたわら」ở nghĩa làm công việc phụ (副次的動作) có nghĩa là ""bên cạnh công việc chính là V thì còn thực hiện song song một công việc khác"". Động từ chính 「行う」 đi với 「かたわら」. Tân ngữ là 「マーケティング業務を」 được bổ nghĩa bởi 「本業の」. Vế sau chỉ công việc phụ diễn ra vào cuối tuần."
がち,Nがち,N3,①その作家は、ここ数年病気がちでなかなかまとまった仕事ができないと言っている。,社長は最近、海外出張が多くて留守がちなので、連絡はメールでお願いします。,社長は最近、,海外出張が,多くて,留守,がちなので、,連絡はメールでお願いします。,"Ngữ pháp「Nがち」diễn tả xu hướng thường xảy ra một trạng thái không tốt. Danh từ 「留守」 kết hợp với 「がち」 kèm lý do 「なので」. Trước đó, nguyên nhân sâu xa được đưa ra là 「海外出張が」 + 「多くて」 (thể te chỉ nguyên nhân). Vế sau đưa ra giải pháp/đề nghị thích hợp."
がち,R－がち,N3,①寒い季節は家の中にこもりがちだが、たまには外にでて体を動かした方がいい。,業務多忙な時期は、顧客への返信が遅れがちになるので注意してください。,業務多忙な,時期は、,顧客への,返信が,遅れ,がちになるので注意してください。,Ngữ pháp「R-gachi」diễn tả việc thường có xu hướng phát sinh một trạng thái không mong muốn. Động từ 「遅れる」 bỏ masu thành 「遅れ」 kết hợp với 「がちになるので」. Chủ ngữ của vế này là 「返信が」 được bổ nghĩa bởi cụm 「顧客への」. Giai đoạn thời gian được đưa ra ở đầu câu là 「業務多忙な」 bổ nghĩa cho 「時期は」.
かつ,RかつV,N1,①これで、福祉会館建設に関する議案を提出するのに必要かつ十分な条件が整った。,トラブルに対しては、迅速かつ適切な対応を取ることが最も重要です。,トラブルに対しては、,迅速,かつ,適切な,対応を,取ることが最も重要です。,"Ngữ pháp「Tính từ đuôi na (bỏ na) + かつ + Tính từ/Động từ」diễn tả hai đặc tính tồn tại đồng thời (""vừa... vừa...""). Từ gốc 「迅速」 kết hợp với 「かつ」 và tính từ tiếp theo 「適切な」 để cùng bổ nghĩa cho danh từ 「対応を」. Cụm này làm tân ngữ bổ nghĩa cho hành động chủ ngữ 「取ることが」, hướng tới đối tượng ở đầu câu 「トラブルに対しては」."
かつて,,N2,①このあたりは、かつては有名な米の産地だった。,当社はかつて競合他社であったA社と、共同で新プロジェクトを立ち上げました。,当社は,かつて,競合他社,であった,A社と、,共同で新プロジェクトを立ち上げました。,"Trạng từ 「かつて」 mang nghĩa ""đã từng, trong quá khứ"". Nó đứng trước bổ nghĩa cho trạng thái 「競合他社であった」 (đã từng là công ty đối thủ). Cụm định ngữ 「かつて競合他社であった」 bổ nghĩa cho danh từ 「A社と」. Cuối cùng kết hợp với vế hành động chính của chủ ngữ 「当社は」 ở đầu câu."
