Grammar,Usage,JLPT Level,Reference Example,Original Example,Prefix,Chunk1,Chunk2,Chunk3,Chunk4,Suffix,Explanation
よう1,R－ようで（は）,N2,①気の持ちようで何とでもなることだ。,クライアントからの要望も、こちらの受け止めようでは、ビジネスの好機なり得ます。,クライアントからの要望も、,こちらの,受け止め,ようでは、,ビジネスの,好機なり得ます。,Cấu trúc 'R-ようでは' nghĩa là 'tùy thuộc vào cách làm X'. Động từ '受け止める' (đón nhận) chuyển sang thể liên dụng (bỏ ます) thành '受け止め' kết hợp với 'ようでは'. 'こちらの' bổ nghĩa cho hành động phía sau để chỉ 'cách đón nhận của chúng ta'.
よう1,R－ようによっては,N2,①考えようによっては、彼らの人生も幸せだったと言えるのかもしれない。,この新しい企画書も、伝えようによっては、先方にご納得いただけるかと存じます。,この新しい企画書も、,伝え,ようによっては、,先方に,ご納得,いただけるかと存じます。,Cấu trúc 'R-ようによっては' chỉ cách thức 'tùy thuộc vào cách làm X thì...'. Động từ '伝える' bỏ ます thành '伝え' đi liền với ngữ pháp. '先方に' (cho phía đối tác) làm tân ngữ cho động từ kính ngữ 'ご納得いただける' ở vế sau.
よう2,V－よう＜意志＞,N5,①夏休みには海に行こう。,明日の会議の資料を、今から急いで準備しよう。,明日の会議の,資料を、,今から,急いで,準備,しよう。,Thể ý chí (V-よう) dùng để thể hiện quyết tâm của người nói. Ở trình độ N5 câu từ đơn giản trong văn phòng: '資料を' đi với trợ từ bổ nghĩa cho hành động '準備しよう'. Thừa số chỉ thời gian '今から' và phó từ '急いで' đứng trước động từ để bổ nghĩa.
よう2,V－よう＜申し出＞,N5,①足が痛いのか。おぶってやろう。,その重そうな荷物は、僕が代わりに運ぼう。,その重そうな,荷物は、,僕が,代わりに,運,ぼう。,Thể ý chí ở đây dùng với mục đích đưa ra lời đề nghị giúp đỡ đối phương (để tôi làm cho). Động từ '運ぶ' thuộc nhóm 1 chuyển sang thể ý chí thành '運ぼう'. Chủ ngữ '僕が' đi kèm phó từ '代わりに' (thay thế) đặt trước động từ để làm rõ ý nghĩa.
よう2,V一よう＜誘いかけ＞,N5,①君もいっしょに行こうよ。,今日の昼休みは、新しいレストランへ一緒に行こう。,今日の,昼休みは、,新しい,レストランへ,一緒に,行こう。,Thể ý chí dùng để rủ rê người khác thực hiện hành động (hãy cùng làm). Động từ nhóm 1 '行く' chuyển thành '行こう'. Trạng từ '一緒に' thường đi kèm để làm rõ lời mời gọi và đặt ngay trước động từ.
よう2,V－よう＜呼びかけ＞,N5,①横断する時は左右の車に注意しよう。,メールのミスを防ぐために、送信前に必ず確認しよう。,メールの,ミスを,防ぐために、,送信前に,必ず,確認しよう。,Thể ý chí mang tính kêu gọi mọi người cùng thực hiện một nguyên tắc chung tại công sở. Cụm chỉ mục đích 'ミスを防ぐために' đứng trước đầu câu. Cụm thời gian '送信前に' kết hợp phó từ nhấn mạnh '必ず' đứng trước động từ '確認しよう' (hãy xác nhận).
よう2,もらおう／V－てもらおう,N5,①ビールをもう一本もらおう。,このデータの確認は、午後に田中さんに手伝ってもらおう。,このデータの,確認は、,午後に,田中さんに,手伝って,もらおう。,Cấu trúc 'V-てもらおう' thể hiện ý chí muốn nhờ vả ai đó làm gì cho mình. Động từ '手伝う' chuyển sang thể て thành '手伝って' kết hợp với 'もらおう'. Đối tượng được nhờ đi với trợ từ 'に' (田中さんに).
よう2,V－よう,N2,①場合によっては延期されることもあろう。,新技術の導入により、当社の生産性は飛躍的に向上しよう。,新技術の導入により、,当社の,生産性は,飛躍的に,向上,しよう。,Trong văn viết trang trọng của N2 'V-よう' (ở đây là しよう của する) biểu thị sự suy đoán của người nói giống như 'だろう'. Chủ ngữ '生産性は' được bổ nghĩa bởi phó từ '飛躍的に' (mang tính bứt phá) trước khi đi vào động từ phán đoán.
よう2,V－ようか,N2,①結論としては、次のようなことが言えようか。,このようなずさんな計画で、プロジェクトが果たして成功しようか。,このようなずさんな計画で、,プロジェクトが,果たして,成功,しよう,か。,Cấu trúc 'V-ようか' ở trình độ N2 biểu thị câu hỏi tu từ mang sắc thái hoài nghi hoặc phủ định mạnh mẽ (~liệu có thể... không? Không thể). Phó từ '果たして' (quả thực/liệu rằng) thường đi kèm để nhấn mạnh tính chất nghi vấn phản bác.
よう2,V－ようか＜意志＞,N4,①どうしようか。,予算の件について、一度部長に相談しようか。,予算の,件について、,一度,部長に,相談,しようか。,Thể ý chí đi với 'か' thể hiện sự tự hỏi hoặc cân nhắc xem bản thân có nên thực hiện hành động đó hay không. '相談する' thành '相談しようか'. Đối tượng hướng tới là '部長に' và phó từ chỉ tần suất '一度' đứng trước.
よう2,V－ようか＜申し出＞,N4,①君の代わりに僕がやろうか。,会議室の準備を、私が先に済ませておこうか。,会議室の,準備を、,私が,先に,済ませて,おこうか。,Cấu trúc 'V-ようか' dùng để đề nghị làm giúp ai đó việc gì (Tôi làm giúp nhé?). Động từ '済ませる' đi với cấu trúc làm sẵn '～ておく' chuyển sang thể ý chí thành '済ませておこうか' để thể hiện hành động chuẩn bị trước.
よう2,V－ようか＜誘いかけ＞,N5,①結婚しようか。,今日の作業も終わったので、そろそろ一緒に退社しようか。,今日の作業も,終わったので、,そろそろ,一緒に,退社,しようか。,"Dùng để rủ rê đối phương cùng làm việc gì một cách nhẹ nhàng (Chúng ta cùng... nhé?). Cụm từ chỉ nguyên nhân '終わったので' đứng trước, theo sau là các phó từ 'そろそろ' (chuẩn bị) và '一緒に' bổ nghĩa cho hành động '退社しようか'."
よう2,もらおうか／V－てもらおうか,N4,①お茶を一杯もらおうか。,修正版の見積書は、すぐに担当者に作ってもらおうか。,修正版の,見積書は、,すぐに,担当者に,作って,もらおうか。,"Cấu trúc 'V-てもらおうか' thể hiện ý định hoặc lời gợi ý nhẹ nhàng mang tính chỉ thị rằng mình sẽ nhờ ai làm gì. Động từ '作る' chuyển sang thể て thành '作って' kết hợp với 'もらおうか', người thực hiện hành động nhận trợ từ 'に'."
よう2,V－ようが,N2,①どこで何をしようが私の勝手でしょう。,どれほど優れた成果を上げようが、ルール違反は許されません。,どれほど,優れた成果を,上げ,ようが、,ルール違反は,許されません。,Cấu trúc 'V-ようが' mang ý nghĩa 'cho dù có làm gì đi nữa thì cũng không liên quan/không thay đổi'. Động từ '上げる' chuyển thành thể ý chí '上げ' + 'ようが'. Thường đi kèm cụm 'どれほど' (cho dù bao nhiêu) ở đầu vế.
よう2,うがV－ようが,N2,①出掛けようが家にいようが、あなたの自由です。,外部の企業に委託しようが自社で開発しようが、コスト削減は不可避です。,外部の企業に,委託,しようが,自社で,開発,しようが、コスト削減は不可避です。,Cấu trúc song hành 'V1-ようが V2-ようが' mang ý nghĩa 'cho dù chọn phương án A hay phương án B thì kết quả vẫn vậy'. Hai động từ '委託する' và '開発する' đều được biến đổi sang thể ý chí kèm 'が' tạo nên sự tương phản lựa chọn.
よう2,V－ようがV－まいが,N2,①あなたが出席しようがしまいが、私は出席します。,競合他社が新商品を発売しようがしまいが、我々の計画に変更はありません。,競合他社が,新商品を,発売,しようが,しまいが、,我々の計画に変更はありません。,Cấu trúc 'V-ようがV-まいが' nghĩa là 'cho dù có làm X hay không làm X'. Động từ '発売する' chia ở thể ý chí '発売しようが' kết hợp với dạng phủ định định hướng 'しまいが' (đối với động từ nhóm 3 する).
よう2,V－ようじやないか,N3,①一緒に飲もうじゃないか。,プロジェクトの成功に向けて、全員で力を合わせて頑張ろうじゃないか。,プロジェクトの成功に向けて、,全員で,力を,合わせて,頑張ろう,じゃないか。,"Ngữ pháp 'V-ようじゃないか' là lời kêu gọi, động viên mạnh mẽ từ phía người nói đối với tập thể (Hãy cùng nhau làm việc gì đó nào!). Động từ '頑張る' chia thể ý chí thành '頑張ろう' kết hợp với 'じゃないか'."
よう2,V－ようと,N2,①なにをしようと私の自由でしょう。,今後どのようなトラブルが発生しようと、納期は厳守してください。,今後どのような,トラブルが,発生,しようと、,納期は,厳守してください。,"Cấu trúc 'V-ようと' tương đương với 'V-ようが', mang nghĩa 'cho dù có xảy ra chuyện gì đi nữa'. Động từ '発生する' biến đổi thành '発生しようと'. Vế đầu thường chứa từ nghi vấn 'どのような' để nhấn mạnh tính giả định."
よう2,V－ようとV－ようと,N2,①努力しようと怠けようと結果がすべてだ。,新規事業を立ち上げようと、既存の業務を継続しようと、顧客第一の姿勢は変わりません。,新規事業を,立ち上げようと、,既存の業務を,継続,しようと、,顧客第一の姿勢は変わりません。,Cấu trúc liệt kê song hành 'V1-ようと V2-ようと' thể hiện ý niệm 'cho dù là việc A hay việc B'. Động từ '立ち上げる' thành '立ち上げようと' và '継続する' thành '継続しようと' được băm nhỏ tương ứng với tân ngữ của chúng.
よう2,V－ようとV一まいと,N2,①行こうと行くまいとあなたの自由だ。,先方が条件に合意しようとしまいと、次の手続きを進めます。,先方が,条件に,合意,しようと,しまいと、,次の手続きを進めます。,Cấu trúc 'V-ようとV-まいと' mang nghĩa 'cho dù đối phương có đồng ý hay không'. Động từ '合意する' (nhóm 3) được chia thành thể ý chí '合意しようと' đi kèm dạng phủ định 'しまいと' để hoàn chỉnh cấu trúc giả định tương phản.
