Grammar,Usage,JLPT Level,Reference Example,Original Example,Prefix,Chunk1,Chunk2,Chunk3,Chunk4,Suffix,Explanation
なんら～ない,なんらV－ない,N2,①彼らがどう言おうと、私にはなんらかかわりのないことだ。,今回のシステム障害について、弊社のデータ管理にはなんら問題はありません。,今回のシステム障害について、,弊社の,データ管理には,なんら,問題は,ありません。,"Thành phần ""今回のシステム障害について"" đóng vai trò bối cảnh. ""弊社のデータ管理には"" chỉ đối tượng bị tác động. Phó từ ""なんら"" đi kèm với dạng phủ định ở cuối câu ""ありません"" để nhấn mạnh ý nghĩa hoàn toàn không có vấn đề gì, tạo cấu trúc ""なんら問題はありません""."
なんら～ない,なんらのNもV－ない,N1,①彼らの対応にはなんらの誠意も感じられない。,先方から提示された新しい条件には、我が社に対するなんらのメリットも感じられません。,先方から提示された,新しい条件には、,我が社に対する,なんらの,メリットも,感じられません。,"Cụm ""先方から提示された新しい条件には"" là bối cảnh đánh giá. ""我が社に対する"" bổ nghĩa cho danh từ ""メリット"". Cấu trúc N1 ""なんらの N も + Phủ định"" kết hợp tạo thành chuỗi diễn đạt thống nhất ""なんらのメリットも感じられません""."
に,R－にV,N1,①待ちに待った帰国の日がついにやってきた。,企画部で考えに考えた新規事業プランが、ついに役員会で承認されました。,企画部で,考えに,考えた,新規事業プランが、,ついに役員会で,承認されました。,"Cấu trúc ""V-masu + に + V-past"" (考えに考えた) thể hiện một hành động được lặp đi lặp lại nhiều lần với mức độ tập trung cao. Cụm này đóng vai trò bổ nghĩa cho danh từ ""新規事業プランが"", làm chủ ngữ cho hành động bị động ""承認されました"" ở vế đuôi."
に,V－るにV－れない,N2,①人手が足りないのでやめるにやめられない。,既に多額の資金を投入しているため、このプロジェクトは今さら引くに引けない状況です。,既に多額の資金を投入しているため、,このプロジェクトは,今さら,引くに,引けない,状況です。,"Vế đầu chỉ nguyên nhân kinh doanh. Cấu trúc ""V-るにV-れない"" (引くに引けない) thể hiện tình thế tiến thoái lưỡng nan, muốn thực hiện hành động rút lui nhưng thực tế không thể làm được. Cụm này bổ nghĩa cho danh từ ""状況です"" để kết thúc câu."
にあたって,Nにあたって　V－るにあたって,N2,①開会にあたってひとことご挨拶を申し上げます。,新商品の発売にあたって、プロジェクトチーム一同、全力を尽くす所存です。,新商品の,発売に,あたって、,プロジェクトチーム一同、,全力を尽くす,所存です。,"Cấu trúc ""N + にあたって"" diễn tả thời điểm đặc biệt mang tính bước ngoặt khi bắt đầu một sự kiện quan trọng (ở đây là tung ra sản phẩm). Chủ ngữ ""プロジェクトチーム一同"" kết hợp với cụm động từ hành động ""全力を尽くす"" và hình thức khiêm nhường ngữ thể hiện quyết tâm ""所存です""."
にあたり,Nにあたり　V－るにあたり,N1,①代表団の選出にあたり、被選挙人名簿を作成した。,新オフィスの移転にあたり、業務時間の一部が変更となりますのでご留意ください。,新オフィスの,移転に,あたり、,業務時間の,一部が変更と,なりますのでご留意ください。,"Cấu trúc ""N + にあたり"" là hình thức trang trọng hơn của ""にあたって"", hoàn toàn phù hợp với bối cảnh viết văn bản thông báo thương mại. Cụm ""業務時間の一部が"" làm chủ ngữ cho biến đổi trạng thái ""変更となります"", đi kèm vế đuôi nhắc nhở lịch sự ""ご留意ください""."
にあって,Nにあって,N1,①異国の地にあって、仕事を探すこともままならない。,激しい市場競争にあって、弊社は独自の技術開発により確固たる地位を築いてしてきました。,激しい,市場競争に,あって、,弊社は独自の,技術開発により,確固たる地位を築いてしてきました。,"Cấu trúc N1 ""N + にあって"" mang ý nghĩa ""trong hoàn cảnh, tình huống đặc biệt khó khăn hoặc quan trọng đó"". Ở đây ""激しい市場競争にあって"" làm bối cảnh để chủ ngữ ""弊社は"" thực hiện phương thức ""独自の技術開発により"" nhằm đạt được kết quả ở vế sau."
にあって,Nにあっても,N1,①彼は苦境にあっても、まげずに頑張っている。,厳しい経済状況にあっても、我が社は新規採用を削減することなく継続しております。,厳しい,経済状況に,あっても、,我が社は,新規採用を,削減することなく継続しております。,"Cấu trúc ""N + にあっても"" mang ý nghĩa nhượng bộ tương đương với ""ngay cả trong hoàn cảnh... vẫn..."". Cụm ""厳しい経済状況にあっても"" làm nền cho hành động kiên trì của chủ ngữ ""我が社は"", kết hợp cụm phủ định cách ""削減することなく継続しております""."
にあって,Nにあっては＜状況＞,N1,①こんな厳寒の地にあっては、新鮮な野菜が食卓に上るなど、滅多にないことだ。,デジタル化が急速に進む現代にあっては、従来の営業手法だけでは生き残るのが難しい。,デジタル化が急速に進む,現代に,あっては、,従来の,営業手法だけでは,生き残るのが難しい。,"Cấu trúc ""N + にあっては"" (với nghĩa điều kiện, bối cảnh) nhấn mạnh vào thời đại ""現代"" đã được định ngữ hóa. Cụm ""従来の営業手法だけでは"" đóng vai trò điều kiện giới hạn nghiêm ngặt, dẫn đến hệ quả đánh giá tiêu cực ở vế đuôi ""生き残るのが難しい""."
にあって,Nにあっては＜人＞,N1,①高橋さんにあっては、どんな強敵でも勝てそうにありませんね。,鈴木社長にあっては、いかなる困難な商談であっても見事に成立させてしまいます。,鈴木,社長に,あっては、,いかなる困難な,商談であっても,見事に成立させてしまいます。,"Cấu trúc ""N + にあっては"" khi đi với danh từ chỉ người mang nghĩa ""nếu là người đó / đối với vị đó"" (thường thể hiện sự đánh giá đặc biệt). ""鈴木社長にあっては"" làm chủ đề chính, theo sau là cụm từ nhượng bộ ""いかなる困難な商談であっても"" và vế khẳng định năng lực xuất sắc."
にいたる,書きことば的な表現。～にいたる　N／V　にいたる,N2,①この川は大草原を横切って流れ、やがては海に至る。,数ヶ月にわたる交渉の末、ようやく本日、契約の締結にいたりました。,数ヶ月にわたる交渉の末、,ようやく,本日、,契約の,締結に,いたりました。,"Thành phần trạng ngữ ""数ヶ月にわたる交渉の末"" chỉ quá trình tích tụ kéo dài. Cụm mục tiêu ""契約の締結に"" đi liền với động từ ""いたる"" ở dạng lịch sự ""いたりました"" nhằm biểu thị việc đạt tới một kết quả cuối cùng sau chuỗi hành động diễn tiến."
にいたる,Nにいたるまで,N2,①旅行中に買ったものからハンドバッグの中身に至るまで、厳しく調べられた。,弊社の新入社員研修では、ビジネスマナーから実務の基礎にいたるまで徹底的に教え込まれます。,弊社の新入社員研修では、,ビジネスマナーから,実務の,基礎に,いたるまで,徹底的に教え込まれます。,"Cấu trúc ""A から B にいたるまで"" dùng để biểu thị phạm vi bao quát toàn bộ từ sự vật cơ bản A đến mức độ cực hạn là B. Cụm ""ビジネスマナーから実務の基礎にいたるまで"" làm rõ phạm vi nội dung bổ nghĩa cho hành động đào tạo nghiêm túc ở vế đuôi câu."
にいたる,～にいたって　N／V　にいたって,N1,①編集段階に至って、初めて撮影したビデオの映像が使いものにならないことがわかったが、すでに遅かった。,最終テストの段階にいたって、初めて重大なシステムバグが発見され、対応に追われました。,最終テストの,段階に,いたって、,初めて重大な,システムバグが,発見され、対応に追われました。,"Cấu trúc ""N にいたって初めて"" diễn tả ý nghĩa ""mãi đến khi sự việc tiến triển tới giai đoạn muộn màng N thì mới phát hiện ra"". Cụm ""最終テストの段階にいたって"" thể hiện mốc thời gian, kết hợp từ nhấn mạnh ""初めて"" và chủ ngữ ""システムバグが"" đi với bị động."
にいたる,Nにいたっては,N1,①父も母も私の転職に大反対し、姉にいたっては、そんなことより早く結婚しろと言い出す始末だった。,A社もB社も我が社の提案を断り、C社にいたっては、メールの返信すらしてこない始末です。,A社もB社も我が社の提案を断り、,C社に,いたっては、,メールの,返信すら,してこない始末です。,"Vế đầu đưa ra các tiền lệ thông thường mang tính tiêu cực. Cấu trúc ""N にいたっては"" được dùng để đưa ra một ví dụ cực đoan, tồi tệ nhất (C社). Cụm ""メールの返信すら"" chứa trợ từ nhấn mạnh ""すら"" đi kèm kết cấu tiêu cực ở cuối ""～始末です""."
にいたる,～にいたっても　N／V　にいたっても,N1,①投票率が史上最低という事態に至っても、なお自分たちが国民から信頼されていると信じて疑わない政治家も少なくない。,顧客から数多くの苦情が寄せられる事態にいたっても、上層部はなんの対策も講じようとしませんでした。,顧客から数多くの苦情が寄せられる,事態に,いたっても、,上層部は,なんの対策も,講じようとしませんでした。,"Định ngữ bổ nghĩa cho danh từ ""事態"". Cấu trúc ""事態にいたっても"" mang nghĩa ""ngay cả khi sự việc đã đi đến tình trạng nghiêm trọng như vậy"". Chủ ngữ ""上層部は"" đi liền với tân ngữ ""なんの対策も"" và mẫu phủ định ý chí hành động ""講じようとしませんでした""."
にいわせれば,Nにいわせれば,N2,①あの人に言わせれば、こんな辞書はまったく使いものにならないということらしい。,開発部の担当者に言わせれば、営業部が提示した納期は到底不可能なスケジュールだそうです。,開発部の,担当者に,言わせれば、,営業部が提示した,納期は到底,不可能なスケジュールだそうです。,"Cấu trúc ""N に言わせれば"" mang ý nghĩa ""theo ý kiến hoặc góc nhìn chuyên môn của N"". Cụm định ngữ ""営業部が提示した"" bổ nghĩa cho chủ ngữ ""納期は"", kết hợp phó từ đi kèm phủ định/tiêu cực ""到底"" và danh từ đuôi trích dẫn lời nói ""～だそうです""."
において,Nにおいて＜状況＞,N2,①卒業式は大講堂において行われた。,今期の定時株主総会は、本社ビル1階の大会議室において執り行われますのでご案内申し上げます。,今期の定時株主総会は、,本社ビル1階の,大会議室に,おいて,執り行われます,のでご案内申し上げます。,"Chủ đề câu là ""今期の定時株主総会は"". Cấu trúc ""N + において"" đóng vai trò chỉ địa điểm diễn ra sự kiện mang tính trang trọng và chính thức (大会議室). Động từ trang trọng ""執り行われます"" (được tổ chức) liên kết logic với vế thông báo phía sau."
において,Nにおいて＜領域＞,N2,①絵付けの技術において彼にかなうものはいない。,セキュリティ技術の分野において、当社と肩を並べる企業は国内には存在しません。,セキュリティ技術の,分野に,おいて、,当社と肩を,並べる企業は,国内には存在しません。,"Cấu trúc ""N + において"" ở đây mang ý nghĩa giới hạn phạm vi, lĩnh vực (""trong lĩnh vực công nghệ bảo mật""). Cụm danh từ đóng vai trò so sánh ""当社と肩を並べる企業は"" làm chủ ngữ chính cho trạng thái phủ định tuyệt đối ở vế cuối câu."
におうじて,Nにおうじて,N2,①物価の変動に応じて給料を上げる。,弊社では、お客様のご予算に応じて最適なプランをご提案いたします。,弊社では、,お客様の,ご予算に,応じて,最適なプランを,ご提案いたします。,"Cấu trúc ""N + に応じて"" mang nghĩa ""ứng với / phụ thuộc vào sự thay đổi của N"" (ngân sách khách hàng). Cụm danh từ cụ thể ""最適なプランを"" đóng vai trò tân ngữ trực tiếp cho động từ khiêm nhường ngữ thể hiện sự tôn kính cao ""ご提案いたします""."
におかれましては,Nにおかれましては,N1,①先生におかれましては、お元気そうでなによりです。,さて、貴社におかれましては、ますますご清栄のこととお慶び申し上げます。,さて、,貴社に,おかれましては、,ますますご清栄の,こととお慶び,申し上げます。,"Trạng từ ""さて"" mở đầu một đoạn văn. Cấu trúc kính ngữ đỉnh cao ""N + におかれましては"" dùng để chỉ đối phương (貴社) một cách tôn kính tối đa trong thư tín thương mại, đi kèm cụm từ chúc tụng mang tính ước định trang trọng ở vế đuôi."
