Grammar,Usage,JLPT Level,Reference Example,Original Example,Prefix,Chunk1,Chunk2,Chunk3,Chunk4,Suffix,Explanation
ではないか2,～（の）ではないかとおもう,N3,①こんなうまい話は、うそではないかと思う。,このプロジェクトの見積もりは、少々高いのではないかと思います。,このプロジェクトの見積もりは、,少々,高い,のではないかと,思い,ます。,"Đầu tiên, phó từ 「少々」(một chút) bổ nghĩa cho tính từ 「高い」(đắt). Tiếp theo, cấu trúc 「～のではないかと」 đi sau tính từ thể từ điển 「高い」 để đưa ra suy đoán mang tính giảm nhẹ, lịch sự. Cuối cùng, động từ 「思い」 kết hợp với đuôi kính ngữ 「ます」 tạo thành vị ngữ hoàn chỉnh 「思います」 ở cuối câu."
ではないだろうか,N／Na（なの）ではないだろうか　A／V　のではないだろうか,N2,①ひょっとして、これは悪い病気ではないだろうか。,新商品のマーケティング戦略は、見直す必要があるのではないだろうか。,新商品のマーケティング戦略は、,見直す,必要が,あるの,ではないだろう,か。,Động từ 「見直す」 bổ nghĩa cho danh từ 「必要」 tạo thành cụm 「見直す必要」(cần xem xét lại). Trợ từ 「が」 đi kèm với động từ 「ある」 thành 「必要がある」(có sự cần thiết). Cấu trúc 「～のではないだろうか」 kết hợp với dạng thông thường của động từ 「ある」 qua phái sinh danh từ hóa 「の」 để đưa ra ý kiến suy đoán một cách lịch sự trong cuộc họp.
ではなかったか,N／Na（なの）ではなかったか　A／V　のではなかったか　過去の状況について推測したり、現状が過去と異なることに対する不満を表す書きことば的表現。話しことばでは「（ん）じゃなかったか」（男性）「（ん）じゃなかったの」（女性）などが用いられる。～（の）ではなかったか＜推測＞,N2,①古代人にとってはこれも貴重な食物ではなかったか。,今回のトラブルの原因は、初期段階の確認不足ではなかったか。,今回のトラブルの原因は、,初期段階の,確認,不足,ではなかった,か。,Cụm danh từ 「初期段階の」(ở giai đoạn đầu) bổ nghĩa cho danh từ 「確認不足」(thiếu xác nhận). Cấu trúc 「ではなかったか」 đi trực tiếp sau danh từ 「確認不足」 để thể hiện sự suy đoán mang sắc thái văn viết trang trọng trong báo cáo công việc.
ではなかったか,～（の）ではなかったか＜反期待＞,N2,①昔はとなり近所の人々は互いにもっと協力的ではなかったか。,契約書は送付する前に、再度確認する決まりではなかったか。,契約書は送付する前に、,再度,確認する,決まり,ではなかった,か。,Phó từ 「再度」(một lần nữa) bổ nghĩa cho động từ 「確認する」(xác nhận). Cụm động từ 「確認する」 bổ nghĩa cho danh từ 「決まり」(quy định). Đuôi câu 「ではなかったか」 đi sau danh từ để thể hiện sự nhắc nhở hoặc bất mãn nhẹ về một quy định đáng ra phải tuân thủ.
ではなかろうか,N／Na（なの）ではなかろうか　A／V　のではなかろうか,N1,①彼の成績では、この大学は無理ではなかろうか。,現行の戦略のままでは、今期の売上目標の達成は困難ではなかろうか。,現行の戦略のままでは、,今期の,売上目標の,達成は,困難ではなかろう,か。,"Định ngữ 「今期の」 bổ nghĩa cho 「売上目標の」, cụm này tiếp tục bổ nghĩa cho danh từ 「達成」 làm chủ ngữ cho vế sau. Tính từ đuôi な 「困難」 đi trực tiếp với cấu trúc trang trọng bậc nhất 「ではなかろうか」 để đưa ra nhận định mang tính khách quan và chuyên nghiệp."
ではなくて,N／Na（なの）ではなくて　Aのではなくて　Vのではなくて,N4,①彼がこの前一緒に歩いていた女性は、恋人ではなくて、妹なのだそうだ。,この資料は課長ではなくて、お客様に渡すものです。,この資料は,課長,ではなくて、,お客様に,渡す,ものです。,Cấu trúc 「～ではなくて」 đi sau danh từ 「課長」 để phủ định đối tượng này. Tiếp theo là bổ ngữ chỉ đối tượng nhận hành động 「お客様に」. Động từ 「渡す」 bổ nghĩa cho danh từ 「もの」 ở cuối câu để tạo thành cụm giải thích mục đích.
てはならない,V－てはならない,N3,①一度や二度の失敗であきらめてはならない。,会社の機密情報を外部に漏らしてはならない。,会社の,機密情報を,外部に,漏らしては,なら,ない。,Danh từ 「機密情報」 làm tân ngữ bổ nghĩa cho hành động. Trạng ngữ 「外部に」 chỉ phương hướng bổ nghĩa cho động từ 「漏らす」. Động từ chia sang thể て kết hợp với 「はならない」 tạo thành quy tắc cấm đoán nghiêm túc trong công ty.
てみせる,V－てみせる,N3,①かれは柔道の型を教えるためにまずやってみせた。,今月の営業目標を絶対に達成してみせます。,今月の営業目標を,絶対に,達成,して,みせ,ます。,"Phó từ 「絶対に」 bổ nghĩa cho hành động phía sau. Động từ nhóm 3 「達成する」 chuyển sang thể て thành 「達成して」. Cấu trúc 「～てみせる」 thể hiện quyết tâm mạnh mẽ chứng tỏ bản thân trước tập thể, ở đây được chia ở dạng lịch sự 「みせます」."
てみる,V－てみる,N5,①一度そのめずらしい料理が食べてみたい。,このビジネスの本を読んでみたいです。,このビジネスの,本を,読んで,みた,い,です。,"Danh từ 「本」 làm tân ngữ với trợ từ 「を」. Động từ 「読む」 chia ở thể て thành 「読んで」 kết hợp với cấu trúc thử làm gì 「てみる」. Nhằm thể hiện nguyện vọng trong môi trường công sở, 「みる」 chuyển sang thể 「みたい」 đi cùng đuôi kính ngữ 「です」."
てみる,V－てみてはじめて,N3,①病気になってみてはじめて健康の大切さが身にしみた。,自分でプロジェクトを担当してみてはじめて、管理の難しさが分かった。,自分でプロジェクトを,担当して,みて,はじめて、,管理の,難しさが分かった。,"Động từ 「担当する」 chia thể て thành 「担当して」 kết hợp với cấu trúc 「～てみてはじめて」(chỉ sau khi thử làm gì mới nhận ra). Tiếp theo, cụm danh từ 「管理の」 bổ nghĩa cho 「難しさ」 làm chủ ngữ cho hành động nhận thức ở vế sau."
てみる,V－てみると,N3,①表にして比べてみると、両者は実際にはあまり違いがないということがわかる。,クライアントに直接会って話してみると、違う要望があることが分かった。,クライアントに,直接,会って,話して,みると、,違う要望があることが分かった。,Phó từ 「直接」 bổ nghĩa cho hành động 「会って」. Hành động tiếp nối liên kết qua thể て thành 「話して」. Cấu trúc 「～てみると」 (khi thử làm gì thì phát hiện ra) đi sau động từ 「話す」 để dẫn dắt đến tình huống bất ngờ ở vế sau.
てみる,V－てみたら,N3,①電話でたずねてみたら、もう切符は売り切れたと言われた。,システムのエラーログを確認してみたら、原因がすぐに判明した。,システムの,エラーログを,確認して,みたら、,原因が,すぐに判明した。,Danh từ 「エラーログ」 đóng vai trò tân ngữ cho hành động 「確認して」. Cấu trúc 「～てみたら」 (sau khi thử làm gì thì kết quả là) đi sau thể て của động từ để chỉ một hành động kiểm tra thực tế dẫn tới việc tìm ra chủ ngữ 「原因が」 ở vế sau.
てみる,V－てみたらどう,N4,①A：山下さんは全然わかってくれません。B：もう一度会って話してみたらどうですか。,スケジュールについて、課長に相談してみたらどうですか。,スケジュールについて、,課長に,相談して,みたら,どう,ですか。,"Danh từ chỉ đối tượng 「課長に」 đi kèm với cụm động từ thể て 「相談して」. Cấu trúc đưa ra lời khuyên hoặc gợi ý nhẹ nhàng 「～てみたらどうですか」 được hoàn thiện bằng cách kết hợp dạng điều kiện 「みたら」, từ nghi vấn 「どう」 và đuôi câu hỏi 「ですか」."
てみる,V-てもみない,N3,①この作品がコンクールに入選するなんて考えてもみなかった。,私がこのプロジェクトのリーダーに選ばれるなんて、考えてもみなかった。,私がこのプロジェクトのリーダーに,選ばれる,なんて、,考えても,みなかっ,た。,"Động từ thể bị động 「選ばれる」 kết hợp với từ nhấn mạnh thái độ ngạc nhiên 「なんて」. Động từ 「考える」 chia sang thể て + も thành 「考えても」, kết hợp với thể phủ định quá khứ 「みなかった」 để tạo nên mẫu câu biểu thị việc chưa từng nghĩ tới."
てみる,V-てもみないで,N3,①本を読んでもみないで､何が書いてあったかどうしてわかるだろう。,その提案をやってもみないで、無理だと決めつけるのはよくない。,その提案を,やっても,みないで、,無理だと,決めつけるの,はよくない。,"Động từ 「やる」 chia sang dạng 「やっても」 kết hợp với 「みないで」 tạo thành cấu trúc hành động tương phản 「～てもみないで」(mà không thèm thử làm). Tiếp theo, cụm trạng ngữ 「無理だと」 bổ nghĩa cho hành động danh từ hóa 「決めつけるの」 làm chủ ngữ vế sau."
ても,でも　A-くても　V-ても　述語のテ形と｢も｣の組合わさったもの。名詞､ナ形容詞の場合は｢でも｣となる。くだけた話しことばでは｢たって｣｢だって｣の形も使われる。～ても<逆条件>,N5,①この仕事は､病気でも休めない。,明日は天気が悪くても、出張は中止になりません。,明日は,天気が,悪くても、,出張は,中止に,なりません。,Cụm chủ vị 「天気が悪い」 được chuyển đổi sang thể điều kiện ngược của tính từ đuôi い bằng cách bỏ い thêm くても thành 「悪くても」. Tiếp theo là chủ đề vế sau 「出張は」 kết hợp cụm biến đổi trạng thái 「中止になりません」.
ても,～ても,N5,①を二乗すると4になりますが､2を二乗しても4になります。,この件は田中さんも知っていますが、佐藤さんに聞いても分かります。,この件は田中さんも知っていますが、,佐藤さんに,聞いて,も,分かり,ます。,"Bổ ngữ chỉ đối tượng hành động là 「佐藤さんに」. Động từ 「聞く」 chia thể て thành 「聞いて」 đi liền với trợ từ 「も」 biểu thị ý nghĩa ngay cả khi thực hiện việc đó. Cuối cùng, kết thúc bằng động từ trạng thái khách quan 「分かります」."
ても,～ても～ても,N4,①うちの子供は､ニンジンでもピーマンでも､好き嫌いを言わないで食べます。,平日でも週末でも、私は会社のメールを確認します。,,平日でも,週末でも、,私は会社の,メールを,確認します。,Hai danh từ thời gian 「平日」 và 「週末」 kết hợp cấu trúc song hành 「～でも～でも」 tạo nghĩa bất kể lúc nào. Định ngữ nhân xưng sở hữu 「私は会社の」 bổ nghĩa cho danh từ tân ngữ 「メールを」 của động từ hành động chính 「確認します」.
ても,V-てもV-なくても,N3,①今回のレポートは出しても出さなくても､成績には全く影響ありません。,明日の懇親会は参加しても参加しなくても、本日中に連絡してください。,明日の懇親会は,参加しても,参加しなくても、,本日中に,連絡して,ください。,Động từ 「参加する」 được đặt song hành ở dạng khẳng định thể ても 「参加しても」 và phủ định thể なくても 「参加しなくても」 tạo nghĩa cho dù có làm hay không. Trạng từ thời gian 「本日中に」 bổ nghĩa cho yêu cầu hành động 「連絡してください」.
ても,V－てもV－ても,N3,①このズボンは洗っても洗っても汚れが落ちない。,プレゼンの練習をしてもしても、本番は緊張してしまいます。,プレゼンの,練習を,しても,しても、,本番は,緊張してしまいます。,Cụm từ chỉ đối tượng 「練習を」 đi với động từ 「する」 lặp lại ở dạng thể ても thành 「してもしても」 nhằm biểu thị tần suất hành động nhiều lần nhưng không đổi kết quả. Trạng ngữ 「本番は」 dẫn dắt tới hệ quả ngoài ý muốn 「緊張してしまいます」.
