Grammar,Usage,JLPT Level,Reference Example,Original Example,Prefix,Chunk1,Chunk2,Chunk3,Chunk4,Suffix,Explanation
くらい,Nくらい,N3,①子供じゃないんだから、自分のことぐらい自分で決めなさい。,報道機関において、これくらいの些細なミスであっても、読者の信頼を失うことになりかねない。,報道機関において、,これくらいの,些細な,ミスであっても、,読者の信頼を,失うことになりかねない。,Cấu trúc 「Nくらい」 (cỡ như) bổ nghĩa cho danh từ 「些細なミス」 (lỗi nhỏ nhặt) tạo thành vế 「これくらいの些細なミスであっても」 (cho dù là lỗi nhỏ cỡ này). Cụm danh từ 「読者の信頼」 (sự tin tưởngのđộc giả) đóng vai trò tân ngữのđộng từ 「失う」 trong cấu trúc phủ định phỏng đoán 「～かねない」 (có nguy cơ làm gì) ở cuối câu.
くらい,～のは～ぐらいのものだ,N2,①息子が電話をよこすのは、金に困った時ぐらいのものだ。,あの作家の孤独を理解できたのは、亡くなった妻くらいのものだろう。,あの作家の孤独を,理解できた,のは、亡くなった,妻くらい,のもの,だろう。,Cấu trúc 「～のは～くらいのものだ」 biểu thị ý nghĩa 「chỉ có... là...」. Ở đây 「理解できた」 bổ nghĩa cho danh từ hóa 「のは」 (việc có thể hiểu được). 「亡くなった」 bổ nghĩa cho 「妻」 (vợ). 「妻くらいのもの」 có nghĩa là 「chỉ có người vợ」. 「だろう」 được thêm vào cuối câu để thể hiện sự suy ngẫm trong văn phong tiểu thuyết.
くわえて,NくわえてN,N2,①規則正しい食事、適度な運動、くわえて近所の人達との日常的なつきあい、そういったものがこの村のお年寄りの長生きの秘訣と考えられる。,記録的な猛暑、くわえて長引く水不足が、農業に深刻な打撃を与えている。,記録的な猛暑、,くわえて,長引く,水不足が、,農業に深刻な,打撃を与えている。,Liên từ 「くわえて」 (thêm vào đó) dùng để liên kết hai sự việc tiêu cực là 「記録的な猛暑」 (nắng nóng kỷ lục) và 「長引く水不足」 (thiếu nước kéo dài) để làm rõ nguyên nhân. 「水不足が」 đóng vai trò chủ ngữ chính trong câu tác động lên tân ngữ gián tiếp 「農業に」 (đối với nông nghiệp) kết hợp với động từ 「打撃を与えている」 (gây ra đòn đả kích) ở cuối câu.
げ,Naげ　A－げ　R上げ,N2,①その人は退屈げに雑誌のページをめくっていた。,主人公は、どこか悲しげな瞳で、去り行く電車の後ろ姿を見送っていた。,主人公は、,どこか,悲しげな,瞳で、去り行く,電車の後ろ姿を,見送っていた。,Đuôi 「-げ」 (có vẻ) kết hợp với tính từ đuôi i 「悲しい」 (buồn) bằng cách bỏ 「い」 để tạo thành tính từ đuôi na 「悲しげな」 bổ nghĩa cho danh từ 「瞳」 (đôi mắt). Cụm từ 「去り行く電車の後ろ姿」 (bóng dáng đoàn tàu đi xa dần) đóng vai trò tân ngữ cho động từ 「見送っていた」 (nhìn tiễn đưa) ở cuối câu.
けっか,Nのけっか　V－たけっか,N3,①投票の結果、議長には山田さんが選出された。,数ヶ月に及ぶ捜査の結果、警察は容疑者の居場所を突き止めた。,数ヶ月に及ぶ,捜査の,結果、,警察は,容疑者の居場所を,突き止めた。,Cấu trúc 「Nの結果」 (kết quảのN) ở đây liên kết danh từ 「捜査」 (điều tra) để biểu thị hệ quảのmột quá trình lâu dài 「数ヶ月に及ぶ」 (kéo dài vài tháng). Chủ ngữ 「警察は」 (cảnh sát) thực hiện hành động 「突き止めた」 (đã định vị/tìm ra) tác động lên tân ngữ 「容疑者の居場所」 (nơi lấn trốnのnghi phạm).
けっきょく,,N3,①バーゲンセールに行ったが、結局何も買わないで帰ってきた。,何度も迷ったが、結局彼はその古い手紙を燃やすことにした。,何度も迷ったが、,結局,彼は,その古い,手紙を燃やす,ことにした。,"Phó từ 「結局」 (chung cuộc, cuối cùng thì) đứng ở đầu vế câu sau để biểu thị kết quả cuối cùngのviệc đắn đo 「何度も迷ったが」 (dù đã đắn đo nhiều lần). Chủ ngữ 「彼は」 (anh ấy) thực hiện hành động quyết định 「ことにした」 (quyết định làm việc...) đối với cụm tân ngữ 「古い手紙を燃やす」 (đốt bức thư cũ)."
けっして～ない,,N4,①あなたのことはけっしてわすれません。,あの日の約束を、私はけっして忘れることはない。,あの日の約束を、,私は,けっして,忘れる,ことは,ない。,"Phó từ 「けっして」 (tuyệt đối không) luôn đi kèm cấu trúc phủ định ở cuối câu để biểu thị quyết tâm cực kỳ mạnh mẽ. Ở đây, nó bổ nghĩa cho cấu trúc phủ định 「忘れることはない」 (sẽ không bao giờ quên)のchủ ngữ 「私は」 đối với đối tượng 「あの日の約束を」 (lời hứa ngày hôm ấy)."
けど,けど,N5,①A：この本は、恵子にやるつもりだ。B：けど、それじゃ、良子がかわいそうよ。,この古い家を売るつもりだ。」「けど、それじゃ、みんなの思い出が消えてしまうよ。,この古い家を売るつもりだ。」「,けど、,それじゃ、,みんなの,思い出が,消えてしまうよ。,Liên từ nghịch tiếp 「けど」 (nhưng) đứng ở đầu lời thoại thứ hai để thể hiện sự phản đối hoặc đưa ra ý kiến trái ngược với ý định bán nhà ở câu trước. Cụm 「それじゃ」 (nếu thế thì) dẫn dắt hệ quả tiêu cực đến chủ ngữ 「思い出が」 (kỷ niệm) đi kèm động từ 「消えてしまうよ」 (sẽ biến mất hoàn toàn) ở phần cuối.
けど,～けど,N5,①みんながあの映画はいいと言うけど、わたしにはちっともおもしろいと思えない。,何度もドアをノックしたけど、中からは何の返事もなかった。,何度も,ドアを,ノックした,けど、中からは,何の返事も,なかった。,Trợ từ liên kết nghịch tiếp 「けど」 (nhưng) dùng để nối vế hành động 「ノックした」 (đã gõ cửa) với vế kết quả trái với kỳ vọng ở phía sau 「中からは何の返事もなかった」 (không có bất cứ phản hồi nào từ bên trong). Cụm 「何の返事も」 kết hợp với thể phủ định 「なかった」 để nhấn mạnh trạng thái trống rỗng.
けれど,けれど,N4,①2時間待った。けれど、彼は姿を表さなかった。,雨は上がった。けれど、彼女の心は暗いままだった。,雨は上がった。,けれど、,彼女の,心は,暗い,ままだった。,"Liên từ nghịch tiếp 「けれど」 (tuy nhiên, nhưng) đứng đầu câu thứ hai để diễn tả sự tương phản tâm trạng đối lập với thời tiết 「雨は上がった」 (mưa đã tạnh) ở câu trước. Chủ ngữ 「彼女の心は」 (lòng cô ấy) đi kèm với tính từ 「暗い」 và cấu trúc 「ままだった」 (vẫn giữ nguyên trạng thái tối tăm u uất)."
けれど,～けれど,N4,①2時間待ったけれど、彼は姿を現さなかった。,何度も真実を話したけれど、彼は信じてくれなかった。,何度も,真実を,話した,けれど、彼は,信じて,くれなかった。,Trợ từ nghịch tiếp 「けれど」 (mặc dù... nhưng) liên kết vế giả định/vế hành động 「真実を話した」 (đã nói ra sự thật) với kết quả phản tác dụng ở vế sau. Chủ ngữ 「彼は」 thực hiện hành động phủ định lợi ích 「信じてくれなかった」 (đã không tin cho tôi) ở phần đuôi câu.
けれど,～けれど,N4,①いま母は留守なんですけれど。,昨日起きた事故についてお聞きしたいんですけれど。,昨日,起きた,事故について,お聞き,したいんです,けれど。,"Trợ từ 「けれど」 được dùng ở cuối câu lửng để làm dịu bớt giọng điệu, thể hiện sự dè dặt, ngập ngừng lịch sự khi người nói muốn thăm dò hoặc đưa ra yêu cầu. Động từ 「起きた」 bổ nghĩa cho danh từ 「事故」 tạo thành cụm 「昨日起きた事故について」 (về vụ tai nạn xảy ra hôm qua), đi kèm mong muốn 「お聞きしたいんです」 (tôi muốn hỏi)."
けれども,けれども,N4,①2時間待った。けれども、一郎は姿を現さなかった。,彼は戻ると約束した。けれども、何年経っても連絡はなかった。,彼は戻ると約束した。,けれども、,何年,経っても,連絡は,なかった。,"Liên từ nghịch tiếp 「けれども」 (tuy nhiên) mang sắc thái trang trọng, đứng đầu câu mới để biểu thị sự trái ngược hoàn toàn với lời hứa ở câu trước 「戻ると約束した」. Cụm 「何年経っても」 (dù bao nhiêu năm trôi qua) làm rõ hoàn cảnh thời gian vô vọng cho sự việc phủ định 「連絡はなかった」 (không có liên lạc)."
けれども,～けれども,N4,①結婚式の日取りはまだ決まっていないんですけれども、たぶん夏ごろになると思います。,犯人の行方はまだnull分かっていないけれども、警察は全力で捜査を続けている。,犯人の行方はまだnull,分かって,いない,けれども、警察は,全力で捜査を,続けている。,Trợ từ liên kết nghịch tiếp 「けれども」 (mặc dù... nhưng) nối vế thông tin tiêu cực 「分かっていない」 (chưa biết hành tung) với vế hành động tích cực phía sau. Chủ ngữ 「警察は」 (cảnh sát) đi liền với trạng từ 「全力で」 (hết sức mình) và động từ tiếp diễn 「捜査を続けている」 (đang tiếp tục điều tra).
げんざい,,N2,①彼が死んでしまった現在、もうそんなことを言っても意味がないよ。,景気が低迷している現在、若者の失業率の上昇が懸念されている。,景気が,低迷している,現在、,若者の,失業率の,上昇が懸念されている。,Danh từ 「現在」 (hiện tại) được bổ nghĩa bởi cụm động từ trạng thái 「低迷している」 (đang trì trệ) để thiết lập bối cảnh nền kinh tế 「景気が低迷している現在」 (trong bối cảnh kinh tế suy thoái hiện nay). Cụm danh từ 「若者の失業率の」 (tỷ lệ thất nghiệpのgiới trẻ) làm bổ ngữ cho danh từ chỉ sự chuyển biến 「上昇」 (sự gia tăng) đi kèm dạng bị động khách quan 「懸念されている」 (đang bị lo ngại).
ごし,Nごし＜空間＞,N2,①となりの人とへいごしにあいさつした。,ガラス窓ごしに、雨の中を歩く彼女の姿が見えた。,ガラス,窓ごしに、,雨の中を,歩く,彼女の姿が,見えた。,Hậu tố 「ごし」 (qua/xuyên qua khoảng không gian) kết hợp với danh từ 「窓」 tạo thành trạng ngữ 「窓ごしに」 (qua cửa sổ) bổ nghĩa cho động từ khả năng 「見えた」 (nhìn thấy) ở cuối câu. Cụm từ 「雨の中を歩く」 (đi trong mưa) đóng vai trò bổ nghĩa cho danh từ chính 「彼女の姿」 (bóng hình cô ấy) để làm rõ đối tượng được quan sát.
ごし,Nごし＜時間＞,N1,①3年ごしの話し合いで、やっと離婚した。,10年ごしの計画が、ついに今月から動き出すことになった。,10年,ごしの,計画が、,ついに今月から,動き出す,ことになった。,Hậu tố 「ごし」 (kéo dài suốt một khoảng thời gian) kết hợp với danh từ chỉ thời gian 「10年」 thông qua trợ từ 「の」 để bổ nghĩa cho danh từ 「計画」 (kế hoạch) tạo thành 「10年ごしの計画」 (kế hoạch kéo dài suốt 10 năm). 「計画が」 làm chủ ngữ chính kết hợp với cụm động từ chỉ sự khởi đầu và quyết định 「動き出すことになった」 (đã được quyết định triển khai).
こそ,Nこそ,N3,①A：よろしくお願いします。B：こちらこそよろしく。,今回の失敗こそ、君の将来にとって大切な教訓になるはずだ。,今回の,失敗こそ、,君の,将来にとって,大切な教訓に,なるはずだ。,Trợ từ nhấn mạnh 「こそ」 (chính là) đứng sau danh từ 「失敗」 (thất bại) để nhấn mạnh tầm quan trọng đặc biệtのbiến cố này. Cụm 「君の将来にとって」 (đối với tương laiのcậu) bổ nghĩa cho danh từ 「大切な教訓」 (bài học quý giá) đi kèm động từ liên kết 「なる」 và đuôi phán đoán chắc chắn 「はずだ」 (chắc chắn sẽ trở thành) ở cuối câu.
こそ,～こそ　あれ／すれ　Nこそすれ　Naでこそあれ　R－こそすれ,N1,①あなたのその言い方は、皮肉でこそあれ、けっしてユーモアとは言えない。,この新政策は、国民に負担を強いるものでこそあれ、決して救いにはならない。,この新政策は、,国民に,負担を強いる,ものでこそあれ、,決して救いには,ならない。,Cấu trúc 「ものでこそあれ」 (tuyệt đối chỉ là cái thứ... chứ không thể khác) nhấn mạnh vào bản chất thực tếのchủ từ 「この新政策」 (chính sách mới này) là 「負担を強いるもの」 (thứ bắt người dân gánh vác gánh nặng). Vế sau sử dụng phó từ phủ định tuyệt đối 「決して」 kết hợp với danh từ 「救い」 (sự cứu giúp/giải pháp cứu cánh) đi kèm động từ phủ định 「ならない」 (không trở thành) để phủ nhận hoàn toàn giá trị tích cực.
こそ,～こそ～が　Nこそ～が　Naでこそあるが　R－こそするが,N2,①この靴は、デザインこそ古いが、とても歩きやすい。,この小説は、ストーリーこそ単純であるが、描写が非常に美しい。,この小説は、,ストーリーこそ,単純で,あるが、,描写が非常に,美しい。,"Cấu trúc 「Nこそ...が」 (tuy N thì... nhưng...) được dùng để nhượng bộ, thừa nhận một khuyết điểm nhỏのtác phẩm là 「ストーリーこそ単純である」 (cốt truyện tuy đơn giản) nhằm tôn vinh và làm nổi bật ưu điểm tuyệt đối ở vế sau. Chủ ngữ phụ 「描写が」 (ngòi bút miêu tả) đi kèm phó từ mức độ 「非常に」 (vô cùng) và tính từ 「美しい」 (đẹp đẽ) làm kết luận."
