Grammar,Usage,JLPT Level,Reference Example,Original Example,Prefix,Chunk1,Chunk2,Chunk3,Chunk4,Suffix,Explanation
には,V－るには,N3,①そこに行くには険しい山を超えなければならない。,難関大学の入試を突破するには、学習計画を根本から見直す必要がある。,難関大学の入試を突破するには、,学習計画を,根本から,見直す,必要がある。,,"Để vượt qua kỳ thi (突破するには), cần kết nối động từ thể từ điển 突破する với には. Tiếp theo, đối tượng chịu tác động là kế hoạch học tập (学習計画を), đi kèm trạng từ bổ nghĩa 'từ gốc rễ' (根本から) cho động từ 'xem xét lại' (見直す) và kết thúc bằng mẫu 'cần thiết' (必要がある)。"
には,V－るにはVが,N2,①行くには行くが、彼に会えるかどうかは分からない。,この学術論文を提出するには提出するが、審査を通過できるかは甚だ疑問だ。,この学術論文を,提出するには,提出するが、,審査を,通過できるかは,甚だ疑問だ。,"Mẫu V-るにはV-が thể hiện sự nhượng bộ. Động từ 提出する đi với には tạo thành 提出するには, lặp lại động từ ở dạng liên kết 提出するが. Phân cú sau nói về tính khả thi của việc thông qua vòng thẩm định (審査を通過できるかは) đi với vị ngữ thể hiện sự nghi ngờ cực kỳ (甚だ疑問だ)。"
にはあたらない,V－るにはあたらない,N1,①中学校で教師をしている友人の話によると、学校でのいじめが深刻だという。しかし驚くにはあたらない。大人の社会も同じなのだから。,最新の研究結果は従来の定説を覆すにはあたらないと結論づけられた。,最新の研究結果は,従来の,定説を,覆すには,あたらないと,結論づけられた。,"Cấu trúc にはあたらない (không đáng/không đến mức) đi sau động từ thể từ điển 覆す (lật đổ, bác bỏ). Định ngữ 従来の bổ nghĩa cho danh từ 定説 (giả thuyết đã định). Đối tượng của động từ 覆す đi kèm trợ từ を (定説を). Cuối cùng kết thúc bằng trích dẫn khẳng định (と結論づけられた)。"
にはおよばない,～にはおよばない　Nにはおよばない　V－るにはおよばない,N2,①検査では何も異常は見つかりませんでした。すっかり元気になりましたから、ご心配には及びません。,今回の実験データは極めて明確であり、再調査を行うには及ばないと判断された。,今回の実験データは,極めて明確であり、,再調査を,行うには,及ばないと,判断された。,"Mẫu には及ばない (không cần thiết phải làm gì) đi sau động từ thể từ điển 行う (tiến hành). Trước đó, 'tiến hành tái khảo sát' dùng trợ từ を (再調査を行う). Vế trước chỉ lý do 'cực kỳ rõ ràng' (極めて明確であり) dẫn tới việc không cần khảo sát lại, kết nối với trích dẫn phán đoán (と判断された)。"
にはおよばない,それにはおよばない,N3,①A：車で家までお送りしましょう。B：いいえ、それには及びません。歩いても5分ほどの所ですから、どうぞご心配なく。,追加の参考資料を提出したいとの申し出だが、すでに十分なためそれには及ばない。,追加の参考資料を,提出したいとの,申し出だが、,すでに十分なため,それには,及ばない。,"Cụm それには及ばない biểu thị việc không cần thiết đến mức đó. Danh từ 申し出 (đề xuất) được bổ nghĩa bởi mệnh đề 'muốn nộp tài liệu tham khảo bổ sung' (追加の参考資料を提出したいとの). Lý do được đưa ra là 'vì đã đủ' (すでに十分なため), dẫn tới kết luận không cần thiết (それには及ばない)。"
にはんし,Nにはんし,N1,①大方の予想に反して、我らのチームが圧勝した。,従来の学界における共通認識に反し、この新仮説は正当性が証明された。,従来の学界における共通認識に反し、,この新仮説は,正当性が,証明,された。,,Cấu trúc に反し (trái với) kết hợp trực tiếp với danh từ 共通認識 (nhận thức chung). Định ngữ 従来の学界における (trong giới học thuật truyền thống) bổ nghĩa cho danh từ này. Vế sau giới thiệu chủ thể 'giả thuyết mới này' (この新仮説は) cùng 'tính đúng đắn của nó' (正当性が) được chứng minh.
にはんして,Nにはんして,N2,①予想にはんして、今年の試験はそれほど難しくはなかったそうだ。,研究者たちの当初の仮説に反して、実験は全く予期せぬ結果をもたらした。,研究者たちの当初の仮説に反して、,実験は,全く,予期せぬ,結果をもたらした。,,"Mẫu に反して (trái ngược với...) kết nối với danh từ 仮説 (giả thuyết). Giả thuyết này được bổ nghĩa bởi cụm danh từ 'ban đầu của các nhà nghiên cứu' (研究者たちの当初の). Chủ ngữ chính là 実験は (cuộc thực nghiệm), và vị ngữ là 'đã mang lại kết quả hoàn toàn ngoài dự kiến' (全く予期せぬ結果をもたらした)。"
にひきかえ,Nにひきかえ,N1,①兄にひきかえ弟はだれにでも好かれる好青年だ。,厳格な検証を重ねた先行研究にひきかえ、彼の論文は論理的整合性に欠けている。,厳格な検証を重ねた,先行研究に,ひきかえ、,彼の論文は,論理的整合性に,欠けている。,Mẫu にひきかえ (trái ngược hoàn toàn với...) dùng để so sánh danh từ 先行研究 (nghiên cứu đi trước) - được bổ nghĩa bởi cụm 'đã qua kiểm chứng nghiêm ngặt' (厳格な検証を重ねた) - với chủ thể ở vế sau là 'luận văn của anh ấy' (彼の論文は). Trạng thái thiếu hụt đi với trợ từ に (論理的整合性に欠けている)。
にほかならない,Nにほかならない,N1,①この会を成功のうちに終わらせることが出来ましたのは、皆様がたのご協力のたまものに他なりません。,この古代文明が急速に衰退した最大の要因は、急激な気候変動にほかならない。,この古代文明が急速に,衰退した,最大の,要因は、,急激な気候変動に,ほかならない。,"Cấu trúc にほかならない (chính là/không gì khác ngoài) đi sau danh từ chỉ nguyên nhân 'sự biến đổi khí hậu đột ngột' (急激な気候変動). Chủ ngữ chính của câu là 要因は (nguyên nhân là), được bổ nghĩa bởi mệnh đề 'văn minh cổ đại này suy thoái nhanh chóng' (この古代文明が急速に衰退した) kết hợp với từ chỉ mức độ 'lớn nhất' (最大の)。"
にほかならない,～にほかならない　～から／～ため　にほかならない,N1,①父が肝ガンになったのは、あの工場で長年働いたために他ならない。,当該政策の実施が失敗に終わったのは、政府が世論を軽視したためにほかならない。,当該政策の実施が,失敗に終わったのは、,政府が世論を,軽視した,ために,ほかならない。,Mẫu ためにほかならない diễn đạt ý 'chính là vì...'. Vế trước nêu sự việc 'việc thực thi chính sách kết thúc trong thất bại' (当該政策の実施が失敗に終わったのは). Nguyên nhân được đưa ra là 'chính phủ coi thường dư luận' (政府が世論を軽視した) kết hợp với ため (vì) và ほかならない để nhấn mạnh.
にむかって,Nにむかって＜方向＞,N4,①この飛行機は現在ボストンに向かっています。,観測船は調査データを収集するため、北極海に向かってゆっくりと進んでいる。,観測船は調査データを収集するため、,北極海に,向かって,ゆっくりと進んで,いる。,,"Cụm に向かって chỉ hướng di chuyển, kết nối danh từ địa điểm 'Bắc Băng Dương' (北極海) với hành động 'tiến lên' (進んでいる). Mục đích của tàu quan trắc được đưa ra trước ở vế chỉ mục đích 'để thu thập dữ liệu' (収集するため), và trạng từ 'chậm rãi' (ゆっくりと) bổ nghĩa trực tiếp cho động từ cuối câu。"
にむかって,Nにむかって＜対面＞,N4,①机に向かって本を読む。,受験生は試験中、常に画面に向かって正しく着席しなければならない。,受験生は試験中、常に画面に,向かって,正しく,着席,しなければならない。,,"Ý nghĩa 'đối diện, hướng mặt về phía' của に向かって liên kết danh từ 'màn hình' (画面) với hành động ngồi 'chính trực/ngay ngắn' (正しく着席する). Trạng từ 'luôn luôn' (常に) đứng đầu câu bổ nghĩa cho toàn bộ trạng thái trong suốt kỳ thi (試験中)。"
にむかって,Nにむかって＜相手＞,N3,①親に向かって乱暴な口をきくな。,厳格な学術審査会に向かって、根拠のない主張を繰り返すのは不適切だ。,厳格な,学術審査会に,向かって、,根拠のない主張を,繰り返すのは,不適切だ。,"Mẫu に向かって ở đây hướng tới đối tượng nhận phát ngôn là 'Hội đồng thẩm định học thuật nghiêm ngặt' (厳格な学術審査会). Hành động bị chỉ trích là 'lặp lại những khẳng định vô căn cứ' (根拠のない主張を繰り返す) được danh từ hóa bằng のは, đi kèm tính từ kết luận 'không thích hợp' (不適切だ)。"
にむけて,Nにむけて＜方向＞,N3,①入口に背を向けて座っている。,太陽光パネルは、最大の発電効率を得るため南に向けて設置されている。,太陽光パネルは、,最大の発電効率を,得るため,南に,向けて,設置されている。,Mẫu に向けて chỉ phương hướng vật lý được điều chỉnh hướng về. Danh từ 'hướng nam' (南) đi với 向けて bổ nghĩa cho động từ bị động 'được lắp đặt' (設置されている). Vế mục đích 'để đạt hiệu suất phát điện tối đa' (最大の発電効率を得るため) bổ nghĩa cho toàn bộ hành động phía sau。
にむけて,Nにむけて＜目的地＞,N3,①飛行機はヨーロッパに向けて飛び立った。,無人宇宙探査機は、新たなデータを収集すべく火星に向けて打ち上げられた。,無人宇宙探査機は、,新たなデータを,収集すべく,火星に,向けて,打ち上げられた。,"Mẫu に向けて thể hiện đích đến của hành trình, gắn kết với danh từ địa điểm 'sao Hỏa' (火星) và hành động bị động 'được phóng đi' (打ち上げられた). Mục đích trang trọng 'để thu thập dữ liệu mới' dùng dạng trang trọng すべく (収集すべく)。"
にむけて,Nにむけて＜相手＞,N2,①人々に向けて戦争の終結を訴えた。,大学総長は、新入生に向けて学問探求の重要性を説く式辞を述べた。,大学総長は、,新入生に,向けて,学問探求の,重要性を説く,式辞を述べた。,"Mẫu に向けて hướng hành động/thông điệp đến đối tượng tiếp nhận cụ thể là 'sinh viên mới' (新入生). Cụm bổ nghĩa cho danh từ bài phát biểu (式辞) là mệnh đề 'giảng giải về tầm quan trọng của việc tìm tòi học thuật' (学問探求の重要性を説く), kết hợp với vị ngữ 'đọc diễn văn' (式辞を述べた)。"
にむけて,Nにむけて＜目標＞,N3,①スポーツ大会に向けて厳しい練習が続けられた。,当研究所では、来年度の実用化に向けて新技術の開発を急いでいる。,当研究所では、,来年度の,実用化に,向けて,新技術の,開発を急いでいる。,Mẫu に向けて ở đây chỉ mục tiêu hướng tới trong tương lai 'sự ứng dụng thực tiễn của năm tới' (来年度の実用化). Mục tiêu này đi kèm 向けて để bổ nghĩa cho hành động 'đang đẩy nhanh việc phát triển công nghệ mới' (新技術の開発を急いでいる)。
にめんして,Nにめんして＜対面＞,N2,①美しい庭に面して、バルコニーが広がっている。,閑静な敷地内の公園に面して、近現代的な大学図書館が建設された。,閑静な敷地内の公園に面して、,近現代的な,大学図書館が,建設,された。,,"Cụm に面して chỉ vị trí địa lý hướng ra/mặt tiền giáp với 'công viên trong khuôn viên yên tĩnh' (閑静な敷地内の公園). Chủ ngữ chính của câu là 'thư viện đại học mang phong cách cận hiện đại' (近現代的な大学図書館が), đi kèm với vị ngữ bị động 'đã được xây dựng' (建設された)。"
にめんして,Nにめんして＜直面＞,N1,①彼女は非常事態に面しても適切な行動の取れる強い精神力の持ち主なのだ。,深刻な財政危機に面して、理事会は抜本的な構造改革を断行せざるを得なかった。,深刻な財政危機に面して、,理事会は,抜本的な,構造改革を,断行せざるを得なかった。,,"Mẫu に面して mang nghĩa đối mặt với tình thế khó khăn 'khủng hoảng tài chính nghiêm trọng' (深刻な財政危機). Chủ thể hành động là 'Hội đồng quản trị' (理事会は), tiến hành 'cải cách cơ cấu mang tính triệt để' (抜本的な構造改革を), đi với mẫu 'không thể không' (断行せざるを得なかった)。"
にも,Nにも　＜時・場所・方向・相手なと＞,N5,①あそこにも人がいます。,提出された論文の結論部分にも、重大な数値の誤りが発見された。,提出された論文の結論部分にも、,重大な,数値の,誤りが,発見された。,,Trợ từ ghép にも mang nghĩa 'ngay cả ở/cũng ở' chỉ địa điểm trừu tượng 'phần kết luận của luận văn' (論文の結論部分). Lỗi sai thuộc tính 'sai sót về số liệu nghiêm trọng' (重大な数値 of 誤り) làm chủ ngữ đi kèm với động từ thể bị động 'được phát hiện' (発見された)。
