Grammar,Usage,JLPT Level,Reference Example,Original Example,Prefix,Chunk1,Chunk2,Chunk3,Chunk4,Suffix,Explanation
じゃない,じゃない,N5,①A：雨？B：いや、雨じゃない。,あの人はこの新聞社の人じゃない。,あの人は,この,新聞社の,人,じゃない,。,"Cấu trúc khẳng định/phủ định danh từ N5: [N + じゃない] (không phải là N). Ở đây, cụm danh từ 「この新聞社の人」 (ngườiのtòa soạn báo này) được kết hợp từ 「この新聞社」 (tòa soạn báo này) nối với 「人」 (người) qua trợ từ 「の」. Sau đó đi kèm với 「じゃない」 để biểu thị ý phủ định 「không phải là...」."
じゃないか1,N／Na／A／V　じゃないか　「ではないか1」のくだけた形で、話しことばの文末で主として男性が使う。女性は「じゃないの」「じゃない」の形を使うことが多い。「じゃん」はさらにくだけた言い方で、男女共に使う。丁寧形は「じゃないですか」「じゃありませんか」→【ではないか1】～じゃないか＜驚き・発見＞,N4,①すごいじゃないか。大発見だね。,見てくれ、古い洋館の窓に人影が見えるじゃないか！,見てくれ、,古い洋館の,窓に,人影が,見えるじゃないか,！,"Biểu thị sự ngạc nhiên, phát hiện khi nhìn thấy điều gì đó bất ngờ. Động từ 「見える」 (nhìn thấy) ở thể từ điển kết hợp trực tiếp với 「じゃないか」 để tạo thành cụm biểu thị sự phát hiện: 「見えるじゃないか」 (chẳng phải là nhìn thấy... sao!). Thứ tự kết hợp: 「古い洋館の」 bổ nghĩa cho 「窓」 (cửa sổ), 「窓に」 chỉ địa điểm tồn tại/xuất hiệnの「人影」 (bóng người), 「人影が」 đi với tự động từ 「見える」 làm chủ ngữ."
じゃないか1,～じゃないか＜非難＞,N4,①どうしたんだ。遅かったじゃないか。,また約束の時間を守らなかったじゃないか」と編集者は怒った。,また,約束の,時間を,守らなかった,じゃないか,」と編集者は怒った。,"Biểu thị ý phê phán, trách móc (非難). Động từ 「守る」 chuyển sang thể phủ định quá khứ 「守らなかった」 (đã không giữ) để thể hiện sự việc đã xảy ra, kết hợp với 「じゃないか」 tạo thành lời trách móc: 「守らなかったじゃないか」 (Chẳng phải là đã không giữ... hay sao!). Thứ tự cú pháp: 「約束の」 (hứa hẹn) bổ nghĩa cho danh từ 「時間」 (thời gian) tạo thành tân ngữ cho động từ 「守らなかった」."
じゃないか1,～じゃないか＜確認＞,N4,①ほら、覚えていないかな。同じクラスに加藤って子がいたじゃないか。,覚えているだろう、去年の夏にあの事件が起きたじゃないか,覚えているだろう、,去年の,夏に,あの事件が,起きたじゃないか,,"Dùng để xác nhận lại một sự thật mà người nói cho rằng người nghe cũng biết (確認). Động từ 「起きた」 (đã xảy ra) kết hợp với 「じゃないか」 thành 「起きたじゃないか」 (chẳng phải đã xảy ra... sao). Thứ tự cú pháp: 「去年の」 (năm ngoái) bổ nghĩa cho danh từ thời gian 「夏」 (mùa hè), trợ từ 「に」 chỉ thời điểm xảy ra hành động, 「あの事件」 (vụ án đó) là chủ ngữ đi với trợ từ 「が」 kết hợp với động từ 「起きた」."
じゃないか1,V－ようじゃないか,N3,①頑張って勝ち抜こうじゃないか。,この困難な時代を市民の力で乗り越えようじゃないか。,この,困難な,時代を,市民の力で,乗り越えようじゃないか,。,"Cấu trúc [V-ようじゃないか] thể hiện lời kêu gọi, đề xuất mạnh mẽ cùng nhau làm gì đó (hướng tới tập thể). Động từ 「乗り越える」 (vượt qua) chuyển sang thể ý chí (意向形) thành 「乗り越えよう」 kết hợp với 「じゃないか」. Thứ tự từ: Tính từ đuôi na 「困難な」 (khó khăn) bổ nghĩa cho danh từ 「時代」 (thời đại) làm tân ngữ đi với trợ từ 「を」, 「市民の力で」 (bằng sức mạnhのngười dân) đóng vai trò là phương thức thực hiện hành động."
じゃないか2　,N／Na（なん）じゃないか　A／V　んじゃないか,N3,①隣、ひょっとして留守じゃないか。,容疑者のアリバイはすべて嘘なんじゃないか、と刑事は疑った。,容疑者のアリバイは,すべて,嘘,なん,じゃないか,、と刑事は疑った。,"Biểu thị sự phỏng đoán, nghi ngờ mang tính không chắc chắn [N + なんじゃないか]. 「嘘」 (lời nói dối) là danh từ nên kết hợp với 「なんじゃないか」. Thứ tự từ: 「容疑者のアリバイ」 (chứng cứ ngoại phạmのnghi phạm) là chủ đềのcâu, 「すべて」 (hoàn toàn/tất cả) là phó từ bổ nghĩa cho 「嘘」 (danh từ) tạo thành vế phỏng đoán 「嘘なんじゃないか」 (chẳng phải là lời nói dối hay sao)."
じゃないが,Nじゃないが,N2,①非難するわけじゃないけど、どうしてあなたの部屋はこんなに散らかっているの。,自慢じゃないが、この作品は私が生涯で書いた最高の小説だ。,自慢,じゃないが、,この作品は,私が生涯で書いた,最高の小説,だ。,"Cấu trúc [N じゃないが] được dùng như một cụm cố định hoặc mang nghĩa 「không phải là N nhưng mà...」 (ví dụ 「自慢じゃないが」 - không phải khoe khoang gì đâu nhưng...). Trong câu này, danh từ 「自慢」 (khoe khoang) đi với 「じゃないが」 mở đầu cho một nhận định tự hào phía sau. Thứ tự cú pháp: 「この作品は」 (tác phẩm này) làm chủ ngữ chính, được làm rõ bởi mệnh đề định ngữ 「私が生涯で書いた」 (mà tôi đã viết trong cả cuộc đời) bổ nghĩa cho danh từ 「最高の小説」 (cuốn tiểu thuyết tuyệt vời nhất)."
じゃないだろうか,くなん）じゃないだろうか　A／V　んじゃないだろうか,N3,①もう帰ってしまったんじゃないだろうか。,このまま温暖化が進めば、地球の環境は取り返しのつかないことになるんじゃないだろうか。,このまま温暖化が進めば、,地球の,環境は,取り返しのつかないことに,なるんじゃないだろうか,。,"Cấu trúc [V + んじゃないだろうか] diễn tả sự phỏng đoán, suy đoán mang tính nghi vấn nhẹ nhàng hoặc đưa ra ý kiến một cách lịch sự, gián tiếp trong văn nghị luận/báo chí. Động từ 「なる」 (trở nên) kết hợp với 「んじゃないだろうか」 tạo thành 「なるんじゃないだろうか」 (chẳng phải sẽ trở nên... hay sao). Thứ tự từ: 「地球の」 bổ nghĩa cho 「環境は」 (môi trườngのTrái Đất) làm chủ ngữ, 「取り返しのつかないことに」 (trạng thái không thể cứu vãn) bổ nghĩa cho động từ 「なる」."
じゅう,Nじゅう＜空間＞,N4,①学校中にうわさが広まった。,その衝撃的なニュースは、瞬く間に日本中に知れ渡った。,その衝撃的なニュースは、,瞬く間に,日本,中に,知れ渡った,。,"Hậu tố 「中（じゅう）」 đi sau danh từ chỉ nơi chốn/không gian để biểu thị phạm vi 「toàn bộ, khắp nơi」 [N + じゅう]. Ở đây, 「日本」 (Nhật Bản) kết hợp với 「中」 thành 「日本中」 (khắp nước Nhật), đi kèm trợ từ 「に」 chỉ phạm vi lan rộngのhành động. Thứ tự từ: 「瞬く間に」 (trong chớp mắt) là phó từ bổ nghĩa cho động từ 「知れ渡った」 (được lan truyền rộng rãi)."
じゅう,Nじゅう＜時間＞,N4,①一晩中起きている。,事件のショックで、彼女は一晩中眠ることができなかった。,事件のショックで、,彼女は,一晩,中,眠ることができなかった,。,"Hậu tố 「中（じゅう）」 đi sau danh từ chỉ thời gian để biểu thị ý nghĩa 「suốt một khoảng thời gian」 [N + じゅう]. 「一晩」 (một đêm) đi với 「中」 tạo thành 「一晩中」 (suốt cả đêm). Cú pháp: 「彼女は」 làm chủ ngữ, thực hiện hành động ở thể khả năng phủ định quá khứ 「眠ることができなかった」 (đã không thể ngủ)."
しゅんかん,Nのしゅんかん　V－たしゅんかん,N3,①立ち上がった瞬間に、家がぐらっと大きく揺れた。,容疑者がドアを開けた瞬間に、警察官が一斉に踏み込んだ。,容疑者が,ドアを,開けた,瞬間,に,、警察官が一斉に踏み込んだ。,"Cấu trúc [V-た + 瞬間 + に] biểu thị hành động ở vế sau xảy ra ngay lập tức tại thời điểm hành động vế trước vừa mới hoàn thành. Động từ 「開ける」 (mở) chia ở thể quá khứ 「開けた」 để bổ nghĩa trực tiếp cho danh từ 「瞬間」 (khoảnh khắc). Thứ tự từ: 「容疑者が」 (nghi phạm) là chủ ngữ thực hiện hành động tác động lên tân ngữ 「ドアを」 (cửa), tạo thành cụm bổ nghĩa cho 「瞬間」, sau đó đi với trợ từ 「に」 để chỉ mốc thời gian xảy ra hành động tiếp theo ở vế sau."
じょう,Nじょう,N2,①子供にお金を与えるのは教育上よくない。,この古い文書は、歴史上きわめて価値が高い資料である。,この古い文書は、,歴史,上,きわめて価値が,高い資料である,。,"Hậu tố 「上（じょう）」 đi sau danh từ để tạo thành trạng từ mang nghĩa 「về mặt N/ xét theo khía cạnh N」 [N + 上]. Ở đây, 「歴史」 (lịch sử) kết hợp với 「上」 thành 「歴史上」 (về mặt lịch sử). Cú pháp: 「歴史上」 bổ nghĩa cho cụm danh từ 「価値が高い資料」 (tài liệu có giá trị cao), trong đó 「きわめて」 (cực kỳ) bổ nghĩa cho tính từ 「高い」 (cao)."
しょうがない,しょうがない,N3,①誰もやらないならしょうがない、私一人でもやる。,犯人を逃してしまったのはしょうがない、今は次の手がかりを探そう。,犯人を,逃して,しまったのは,しょうがない,、今は次の,手がかりを探そう。,"Cấu trúc 「しょうがない」 dùng để thể hiện sự chấp nhận thực tế, 「không còn cách nào khác/đành chịu」. Động từ 「逃す」 (để sổng mất) đi với cấu trúc nuối tiếc 「てしまう」 thành 「逃してしまう」, danh từ hóa bằng 「のは」 để làm chủ ngữ cho vị ngữ 「しょうがない」. Thứ tự từ: 「犯人を」 (phạm nhân) là tân ngữのhành động 「逃して」, tiếp theo là 「しょうがない」 (không còn cách nào khác), vế sau đưa ra giải pháp tiếp theo 「今は次の」 (bây giờ thì manh mối tiếp theo) bổ nghĩa cho danh từ 「手がかり」 (manh mối) ở phần đuôi."
ず,文語の助動詞「ず」から。否定の意味を表す。書きことばや慣用的な表現でしか用いない。話しことばでは「なくて」「ないで」が使われる。「V－ない」の「ない」を「ず」に変えて作る。「する」は「せず」となる。V－ず,N3,①途中であきらめず、最後までがんばってください。,彼は周囲の反対に屈せず、自分の信念を貫き通した。,彼は,周囲の,反対に,屈せず、,自分の信念を,貫き通した。,"「ず」 là hình thức phủ định cổ/văn viết tương đương với 「ないで/なくて」. Động từ nhóm 1 「屈する」 (khuất phục) chuyển sang thể phủ định 「ず」 thành 「屈せず」 (không khuất phục). Cú pháp: 「周囲の」 (xung quanh) bổ nghĩa cho danh từ 「反対」 (phản đối), đi với trợ từ 「に」 chỉ đối tượng tác độngのđộng từ 「屈せず」. Vế sau 「自分の信念を」 (niềm tinのbản thân) làm tân ngữ cho động từ 「貫き通した」 (giữ vững đến cùng)."
ず,～ず、～ず　A－からず、A－からず　V－ず、V－ず,N2,①飲まず食わずで三日間も山中を歩きつづけた。,彼は数日間、休まず眠らずで、行方不明になった子供を捜し歩いた。,彼は数日間、,休まず,眠らずで、,行方不明になった,子供を,捜し歩いた。,"Cấu trúc phủ định song hành [V1-ず V2-ず] (không làm V1 cũng không làm V2) dùng trong văn viết để nhấn mạnh trạng thái liên tục, khắc nghiệt. Động từ 「休む」 (nghỉ ngơi) thành 「休まず」 và 「眠る」 (ngủ) thành 「眠らず」 kết hợp với 「で」 đóng vai trò trạng ngữ chỉ trạng thái. Thứ tự cú pháp: 「行方不明になった」 (đã bị mất tích) là mệnh đề bổ nghĩa cho danh từ 「子供」 (đứa trẻ) làm tân ngữ cho động từ ghép 「捜し歩いた」 (đi tìm kiếm khắp nơi)."
すえに,Nのすえに　V－たすえに,N3,①今月のすえに、首相が訪中する。,長時間の議論の末に、両国はついに平和条約に署名した。,長時間の,議論の,末に、,両国はついに,平和条約に,署名した。,"Cấu trúc [N + の末に] (sau khi trải qua một quá trình lâu dài, vất vả thì đạt được kết quả). Ở đây, 「議論」 (thảo luận/nghị luận) là danh từ kết hợp với 「の末に」. Thứ tự cú pháp: 「長時間の」 (thời gian dài) bổ nghĩa cho danh từ 「議論の」 dẫn tới 「末に」 (kết quả sau cùng). Vế sau có chủ ngữ 「両国はついに」 (hai nước cuối cùng đã) thực hiện hành động 「署名した」 (ký kết) tác động vào đối tượng 「平和条約に」 (hiệp ước hòa bình)."
すぎない,N／Na／A／V　にすぎない,N2,①その件は責任者にきいてください。私は事務員にすぎませんので。,彼の甘い言葉は、有権者の支持を得るためのパフォーマンスにすぎない。,彼の甘い言葉は、,有権者の,支持を,得るための,パフォーマンスにすぎない,。,"Cấu trúc [N + にすぎない] biểu thị ý nghĩa 「chỉ là...」, 「không quá...」, dùng để đánh giá thấp hoặc giới hạn tính chấtのsự việc. Danh từ 「パフォーマンス」 (màn trình diễn/chiêu trò) kết hợp trực tiếp với 「にすぎない」. Thứ tự cú pháp: 「有権者の」 (của cử tri) bổ nghĩa cho 「支持」 (sự ủng hộ) làm tân ngữ cho động từ 「得る」 (đạt được), cụm 「得るための」 (nhằm để đạt được) bổ nghĩa cho danh từ 「パフォーマンス」."
すぎる,すぎる　A－すぎる　R－すぎる　～すぎる,N4,①この役は思春期の役だから10歳では子供すぎて話にならない。,この事件の真相は、複雑すぎて私には理解できない。,この事件の真相は、,複雑,すぎて,私には,理解できない,。,"Cấu trúc [Na + すぎる] biểu thị mức độ quá đà, vượt quá giới hạn thông thường. Tính từ đuôi na 「複雑」 (phức tạp) bỏ 「na」 kết hợp với 「すぎる」 ở thể Te thành 「複雑すぎて」 (vì quá phức tạp nên...). Cú pháp: 「この事件の真相は」 (chân tướngのvụ án này) làm chủ ngữ, 「私には」 (đối với tôi) chỉ đối tượng gặp khó khăn trong việc thực hiện hành động 「理解できない」 (không thể hiểu được)."
すぎる,～すぎ　R－すぎだ　R－すぎのN,N4,①太郎、遊びすぎですよ。もうちょっと勉強しなさい。,あなたは働きすぎだ、少しは体を休めたほうがいい。,あなたは,働き,すぎだ、,少しは体を,休めたほうがいい,。,"Cấu trúc [V-ます (bỏ ます) + すぎだ] biểu thị trạng thái thực hiện hành động quá mức. Động từ 「働く」 (làm việc) bỏ 「ます」 thành 「働き」 kết hợp với 「すぎだ」 (quá mức). Thứ tự cú pháp: 「あなたは」 làm chủ ngữ chính, vế sau khuyên nhủ bằng cấu trúc 「～ほうがいい」 (nên làm gì), trong đó 「少しは」 (một chút thì) bổ nghĩa cho cụm 「体を休めた」 (cho cơ thể nghỉ ngơi)."
すぎる,～ても～すぎることはない,N2,①冬山登山は注意しても、し過ぎることはない。,災害への備えは、どれだけ準備しても準備しすぎることはない。,災害への備えは、,どれだけ,準備しても,準備し,すぎることはない,。,"Cấu trúc [V-ても + V-すぎることはない] có nghĩa là 「dù có làm V thế nào đi nữa thì cũng không bao giờ là quá thừa/quá mức」, dùng để nhấn mạnh tầm quan trọngのhành động V. Động từ 「準備する」 (chuẩn bị) nhóm 3 chuyển thành thể Te 「準備しても」 ở vế trước, và bỏ 「ます」 thành 「準備し」 kết hợp với 「すぎることはない」 ở vế sau. Thứ tự cú pháp: 「災害への」 (đối với thiên tai) bổ nghĩa cho 「備えは」 (sự phòng bị) làm chủ đề câu, 「どれだけ」 (bao nhiêu đi nữa) là phó từ bổ nghĩa cho 「準備しても」."
