Grammar,Usage,JLPT Level,Reference Example,Original Example,Prefix,Chunk1,Chunk2,Chunk3,Chunk4,Suffix,Explanation
しか,Nでしかない,N3,①どんなに社会的な地位のある人でも死ぬときはひとりの人間でしかない。,"どんなに輝かしい栄光も、過ぎ去ってしまえば一時の幻影でしかない。","どんなに輝かしい栄光も、","過ぎ去って","しまえば","一時の","幻影でしか","ない。","'過ぎ去って' (V-te) liên kết với 'しまえば' (thể điều kiện giả định của しまう) tạo nghĩa giả định 'nếu trôi qua'. '一時の' (danh từ + の) đóng vai trò định ngữ bổ nghĩa cho '幻影'. Cấu trúc 'N + でしかない' biểu thị sự giới hạn phủ định 'chẳng qua chỉ là'. Thứ tự sắp xếp đúng cú pháp: [Điều kiện giả định] -> [Định ngữ] -> [Danh từ + でしか] + [phủ định ない]."
しか,V－るしかない,N3,①高すぎて買えないから、借りるしかないでしょう。,"避難勧告が出た以上、私たちは持ち物をまとめて山を下りるしかない。","避難勧告が出た以上、","私たちは","持ち物を","まとめて","山を下りるしか","ない。","'私たちは' là chủ ngữ thực hiện hành động. '持ち物を' là tân ngữ chịu tác động của động từ liên kết 'まとめて' (V-te). Hành động tiếp nối tiếp theo là '山を下りる' (xuống núi). Cấu trúc 'V-ru + しかない' thể hiện ý chí không còn lựa chọn nào khác ngoài việc thực hiện hành động V. Thứ tự đúng: [Chủ ngữ] -> [Tân ngữ + Động từ nối] -> [Động từ chính + しか] + [phủ định ない]."
しか,～としか～ない,N2,①今はただ悪かったとしか言えない。,"政府の今回の対応は、国民の声を無視した暴挙としか言いようがない。","政府の今回の対応は、","国民の","声を無視した","暴挙としか","言いようが","ない。","'国民の' là cụm bổ nghĩa danh từ sở hữu cho '声'. '声を無視した' là mệnh đề định ngữ bổ nghĩa cho danh từ '暴挙' (hành vi ngang ngược). Cụm '暴挙としか' (chỉ có thể coi là hành vi ngang ngược) đi kèm cấu trúc 'V-masu + ようがない' (không còn cách nào để V) thể hiện qua cụm '言いようがない' (không còn cách nào diễn tả). Thứ tự cú pháp: [Định ngữ] -> [Danh từ + としか] -> [Động từ chia thể liên dụng + ようが] + [phủ định ない]."
しかし,,N4,①手紙を出した。しかし返事は来なかった。,"新薬の開発に成功した。しかし、実用化にはまだ時間がかかる。","新薬の開発に成功した。","しかし、","実用化には","まだ","時間が","かかる。","'しかし' là liên từ nối nghịch cảnh (tuy nhiên) đứng đầu câu sau. '実用化には' (đối với việc đưa vào thực tiễn) là cụm giới hạn phạm vi tác động. 'まだ' là phó từ chỉ trạng thái chưa hoàn thành bổ nghĩa cho vị ngữ. '時間が' là chủ ngữ của tự động từ 'かかる' (tốn thời gian). Thứ tự logic tự nhiên: [Liên từ] -> [Phạm vi tác động] -> [Phó từ] -> [Chủ ngữ] + [Động từ]."
しかしながら,,N1,①彼の計画は思いつきとしてはすばらしいと思います。しかしながら、実現は不可能です。,"経済は回復の兆しを見せている。しかしながら、地方の雇用情勢は依然として厳しいままだ。","経済は回復の兆しを見せている。","しかしながら、","地方の","雇用情勢は","依然として","厳しいままだ。","'しかしながら' là liên từ chỉ sự tương phản mang sắc thái trang trọng (tuy nhiên). '地方の' (ở địa phương) bổ nghĩa cho danh từ '雇用情勢' (tình hình việc làm). '依然として' là phó từ bổ nghĩa cho cụm vị ngữ '厳しいままだ' (vẫn còn nghiêm trọng) để nhấn mạnh trạng thái không đổi. Thứ tự logic tự nhiên: [Liên từ trang trọng] -> [Định ngữ] -> [Chủ ngữ chính] -> [Phó từ] + [Tính từ vị ngữ]."
しかたがない,しかたがない,N4,①電話の通じない所で、しかたがないから電報を打った。,"汽車がすでに出てしまったのだから、ここで一晩待つしかたがない。","汽車がすでに出てしまったのだから、","ここで","一晩","待つ","しかたが","ない。","'ここで' chỉ vị trí xảy ra hành động (tại đây). '一晩' là lượng từ chỉ thời gian (một đêm) bổ nghĩa cho động từ. '待つ' bổ nghĩa trực tiếp cho danh từ 'しかた' trong cấu trúc 'V-ru + しかたがない' (không còn cách nào khác ngoài việc V). Thứ tự đúng: [Địa điểm] -> [Thời gian] -> [Động từ] -> [chủ thể ngữ pháp しかたが] + [phủ định ない]."
しかも,でしかも A－くてしかも,N3,①いいアパートを見つけた。部屋が広くて、南向きでしかも駅から歩いて5分だ。,"その新型スマートフォンは、画面が美しくてしかも操作が非常に滑らかだ。","その新型スマートフォンは、","画面が","美しくて","しかも","操作が","非常に滑らかだ。","Mệnh đề thứ nhất '画面が美しくて' kết thúc bằng thể liên kết 'くて' của tính từ đuôi -i. Liên từ 'しかも' (hơn thế nữa) dùng để bổ sung thông tin tích cực cùng chiều. Mệnh đề thứ hai tiếp tục với chủ ngữ '操作が' bổ nghĩa cho vị ngữ '非常に滑らかだ'. Thứ tự cú pháp: [Mệnh đề 1 dạng liên kết] -> [Liên từ bổ sung しかも] -> [Chủ ngữ 2] + [Vị ngữ 2]."
しだい,Nしだいだ,N3,①するかしないかは、あなたしだいだ。,"被災地の復興がどこまで進むかは、政府や民間の今後の支援体制しだいだ。","被災地の復興がどこまで進むかは、","政府や","民間の","今後の","支援体制","しだいだ。","'政府や' (chính phủ và...) liên kết ngang hàng với '民間の' (thuộc tư nhân) để làm định ngữ. '今後の' (từ nay về sau) bổ nghĩa thêm cho danh từ trung tâm '支援体制' (thể chế hỗ trợ). Cấu trúc 'N + しだいだ' chỉ sự phụ thuộc quyết định vào danh từ đó. Thứ tự logic: [Định ngữ liên hợp 1] -> [Định ngữ 2] -> [Định ngữ 3] -> [Danh từ chính] + [しだいだ]."
しだい,R－しだい,N2,①落し物が見つかりしだい、お知らせします。,"記者会見の準備が整い次第、こちらから中継を開始します。","記者会見の","準備が","整い","次第、","こちらから","中継を開始します。","'準備が' là chủ ngữ của tự động từ '整う' chia ở thể liên dụng (Masu-stem) thành '整い'. Cấu trúc 'V-masu + 次第' mang nghĩa 'ngay sau khi V'. 'こちらから' (từ phía chúng tôi) chỉ nguồn xuất phát của hành động chính '中継を開始します'. Thứ tự cú pháp: [Chủ ngữ phụ] -> [Động từ thể liên dụng] -> [次第] -> [Cụm từ chỉ hướng] + [Vị ngữ chính]."
しだい,V－る／V－た しだいだ,N2,①とりあえずお知らせした次第です。,"今回のシステム障害により、皆様に多大なご迷惑をおかけした次第です。","今回のシステム障害により、","皆様に","多大な","ご迷惑を","おかけした","次第です。","'皆様に' chỉ đối tượng chịu ảnh hưởng của hành động phiền hà. '多大な' là tính từ đuôi -na bổ nghĩa cho danh từ 'ご迷惑'. 'おかけした' là dạng kính ngữ/khiêm nhường của hành động làm phiền (V-ta) bổ nghĩa cho danh từ '次第です' trong cấu trúc 'V-ta + 次第だ' dùng để trình bày, giải thích đầu đuôi sự tình. Thứ tự logic: [Đối tượng] -> [Tính từ] -> [Danh từ] -> [V-ta kính ngữ] + [次第です]."
しだい,こととしだいによって,N1,①ことと次第によって、計画を大幅に変更しなければならなくなるかもれない。,"事と次第によっては、この古い同盟を破棄せざるを得ないだろう。","","事と","次第に","よっては、","この古い","同盟を破棄せざるを得ないだろう。","'事と' liên kết với '次第' tạo thành thành ngữ cố định '事と次第' (tình hình sự việc). 'によっては' đứng sau danh từ mang nghĩa 'tùy thuộc vào'. 'この古い' (cũ kỹ này) bổ nghĩa trực tiếp cho danh từ '同盟' ở vị ngữ chính. Thứ tự logic: [事と] -> [次第に] -> [よっては] -> [Định từ chỉ định và tính từ] + [Tân ngữ + Vị ngữ]."
したがって,,N2,①このあたりは非常に交通の便がよい。したがって地価が高い。,"原材料の価格が高騰している。したがって、来月から製品 của 価格を値上げする。","原材料の価格が高騰している。","したがって、","来月から","製品の","価格を","値上げする。","'したがって' (Vì vậy/Do đó) là liên từ đứng đầu vế sau để nối kết quả nguyên nhân. '来月から' chỉ mốc thời gian bắt đầu. '製品の' bổ nghĩa cho danh từ '価格' để tạo thành cụm tân ngữ đi kèm trợ từ 'を'. Hành động tác động cuối cùng là '値上げする'. Thứ tự logic: [Liên từ nhân quả] -> [Mốc thời gian] -> [N-no] -> [Tân ngữ + を] + [Động từ]."
じつは,じつは,N4,①今まで黙っていたけれど、実は先月、会社を首になったんだ。,"彼はいつも自信に満ちているが、実は内面は不安でいっぱいなのだ。","彼はいつも自信に満ちているが、","実は","内面は","不安で","いっぱい","なのだ。","'実は' (Thực ra) là trạng từ đứng đầu mệnh đề giải thích sự thật khuất tất. '内面は' đóng vai trò chủ ngữ của mệnh đề này. '不安で' (bởi sự lo lắng) là cụm chỉ trạng thái/nguyên nhân đi kèm với bổ ngữ 'いっぱい' (đầy rẫy). 'なのだ' là dạng nhấn mạnh sự thật của 'だ'. Thứ tự đúng: [Trạng từ] -> [Chủ ngữ -wa] -> [Cụm nguyên nhân -de] -> [ippai] + [vị ngữ kết thúcなのだ]."
じつは,じつをいうと,N3,①A：なんだか、元気がないな。B：うん、実を言うuと金がないんだ。もう少ししたら入るはずなんだけど。,"彼は何食わぬ顔をしていたが、実を言うと彼がその秘密を漏らした張本人だった。","彼は何食わぬ顔をしていたが、","実を","言うと","彼がその","秘密を","漏らした張本人だった。","'実を言うと' (Nói thật ra thì) là cụm phó từ cố định tách từ '実' và '言う'. '彼がその' gồm chủ ngữ '彼' đi với trợ từ 'が' và từ chỉ định 'その' bổ nghĩa cho '秘密'. '秘密を' là tân ngữ chịu tác động của mệnh đề bổ ngữ '漏らした' (đã làm rò rỉ) bổ nghĩa cho danh từ chỉ người '張本人' (kẻ cầm đầu/chủ mưu). Thứ tự logic: [Cụm phó từ tiết lộ sự thật] -> [Chủ ngữ + chỉ định từ] -> [Tân ngữ + を] + [Định ngữ + Danh từ vị ngữ]."
じつは,じつのところ,N3,①A：山口さん、また仕事中に寝てましたよ。B：実のところ、僕も彼には囲っているんだ、無断欠勤も多いし。,"華やかな舞台に見えるが、実のところ、運営の舞台裏はかなり混乱している。","華やかな舞台に見えるが、","実の","ところ、","運営の","舞台裏は","かなり混乱している。","'実のところ' là cụm phó từ cố định có nghĩa là 'thực chất là/thực tế là'. '運営の' bổ nghĩa cho danh từ '舞台裏' (phía sau cánh gà/hậu trường). '舞台裏は' đóng vai trò chủ ngữ chính của mệnh đề tiếp theo, đi với vị ngữ chỉ trạng thái 'かなり混乱している' (khá hỗn loạn). Thứ tự logic: [Cụm phó từ] -> [Định ngữ N-no] -> [Chủ ngữ -wa] + [Vị ngữ trạng thái]."
しはする,R－はする,N2,①坂田さんはアルバイトに遅れはするが、ぜったいに休まない。,"彼女は私の忠告を聞き入れはするものの、決して行動を改めようとはしなかった。","彼女は私の忠告を","聞き入れ","はする","ものの、","決して","行動を改めようとはしなかった。","'聞き入れ' là dạng liên dụng (Masu-stem) của động từ '聞き入れる' (nghe theo). Liên kết với cấu trúc 'はする' tạo nghĩa nhấn mạnh việc thừa nhận 'tuy có làm việc này thật'. 'ものの' là liên từ chỉ sự nhượng bộ phản bác (nhưng...). '決して' là phó từ nhấn mạnh đi kèm thể phủ định ở vị ngữ sau. Thứ tự cú pháp: [V-masu stem] -> [はする] -> [ものの] -> [Phó từ phủ định] + [Vị ngữ phủ định]."
しまつだ,V－るしまつだ,N1,①彼女は夫の欠点を延々と並べ上げ、あげくの果てには離婚すると言って泣き出す始末だった。,"彼はギャンブルに溺れ、借金を重ねた挙句、会社の金にまで手を染める始末だ。","彼はギャンブルに溺れ、借金を重ねた挙句、","会社の","金にまで","手を","染める","始末だ。","'会社の' đóng vai trò định ngữ sở hữu bổ nghĩa cho danh từ '金'. '金にまで' là cụm chỉ mức độ cực đoan đi kèm trợ từ 'まで' (đến tận mức...). '手を染める' (nhúng tay vào/dính chàm) là cụm động từ bổ nghĩa trực tiếp cho danh từ '始末' trong cấu trúc ngữ pháp 'V-ru + 始末だ' diễn tả một kết cục tồi tệ không mong muốn. Thứ tự đúng: [N-no] -> [N-ni made] -> [Tân ngữ + を] -> [Động từ V-ru] + [始末だ]."
じゃあ,「では2」のくだけた言い方。長く引き伸ばして「じゃあ」と言うこともある。じゃ（あ）＜推論＞,N5,①A：風邪をひいて熱があるんですよ。B：じゃあ、試合に出るのは無理ですね。,"「明日は大雨になるらしいよ。」「じゃあ、明日のハイキングは中止だね。」","「明日は大雨になるらしいよ。」「","じゃあ、","明日の","ハイキングは","中止","だね。」","'じゃあ' là liên từ dùng trong hội thoại mang tính suy luận (Thế thì/Vậy thì) dựa trên thông tin người kia vừa nói. '明日の' là định ngữ chỉ thời gian bổ nghĩa cho 'ハイキング'. 'ハイキングは' là chủ đề chính được thảo luận. '中止だね' là danh từ vị ngữ đi kèm từ biểu thị cảm xúc 'ね'. Thứ tự logic: [Liên từ suy luận] -> [Định ngữ] -> [Chủ ngữ -wa] -> [Vị ngữ] + [Trợ từ cuối câu]."
じゃあ,じゃ（あ）＜態度表明＞,N5,①A：先生、終わりました。B：じゃあ、帰ってもいい。,"「もう遅いから帰らなくちゃ。」「じゃあ、僕が駅まで送るよ。」","「もう遅いから帰らなくちゃ。」「","じゃあ、","僕が","駅まで","送る","よ。」","'じゃあ' thể hiện thái độ đưa ra đề xuất hành động dựa trên tình hình của đối phương. '僕が' là chủ ngữ thực hiện hành động. '駅まで' chỉ điểm đích đến của hành động di chuyển. '送る' là động từ chính thể từ điển biểu thị ý chí. Thứ tự hợp lý: [Liên từ đề xuất] -> [Chủ ngữ -ga] -> [Đích đến] -> [Động từ] + [Trợ từ khẳng định]."
じゃあ,じゃ（あ）＜転換＞,N5,①じゃ、次の議題に入りましょう。,"「この話はここまでですね。」「じゃあ、次の議題に移りましょう。」","「この話はここまでですね。」「","じゃあ、","次の","議題に","移り","ましょう。」","'じゃあ' là liên từ dùng để chuyển đổi chủ đề nói chuyện (Thế thì/Sau đây...). '次の' bổ nghĩa cho danh từ '議題' (đề tài thảo luận tiếp theo). '議題に' chỉ hướng đích đến đi kèm trợ từ 'に'. '移りましょう' là dạng ý chí kêu gọi 'ましょう' của động từ '移る' chia ở thể liên dụng. Thứ tự logic: [Liên từ chuyển đổi] -> [Định ngữ] -> [Danh từ chỉ hướng -ni] -> [V-masu stem] + [ましょう]."