Grammar,Usage,JLPT Level,Reference Example,Original Example,Prefix,Chunk1,Chunk2,Chunk3,Chunk4,Suffix,Explanation
ないで,動詞の否定形がテ形の形をとったもので、後に続く動作や状態がどんな様子・状況・事情のもとに成立するかを表す。V－ないで＜付帯状況＞,N5,①息子は今朝もご飯を食べないで出かけた。,主人公は傘を持たないで雨の街を歩き続けた。,主人公は,傘を,持たないで,雨の街を,歩き,続けた。,「傘を」 (tân ngữ) kết hợp với động từ 「持たないで」 (không mang theo) để chỉ trạng thái đi kèmのhành động phía sau. 「雨の街を」 (danh từ chỉ địa điểm + trợ từ 「を」) làm tân ngữ cho động từ ghép 「歩き続けた」 (tiếp tục đi bộ). Cấu trúc biểu thị hành động đi bộ trong trạng thái không mang theo ô.
ないで,V－ないで＜代わりに＞,N4,①親が来ないで子供が来た。,容疑者は真実を語らないで嘘をつき通した。,容疑者は,真実を,語らないで,嘘を,つき,通した。,「真実を」 làm tân ngữ cho động từ phủ định 「語らないで」 (thay vì nói ra sự thật). 「嘘を」 là tân ngữのđộng từ ghép 「つき通した」 (nói dối đến cùng). Cấu trúc biểu thị sự thay thế: Thay vì thực hiện hành động 1 (nói thật) thì chủ ngữ lại thực hiện hành động 2 (nói dối).
ないで,V－ないで＜原因＞,N4,①子供がちっとも勉強しないで困っています。,その事件の真相が明らかにならないで国民は皆怒っている。,その事件の,真相が,明らかにならないで,国民は,皆怒って,いる。,Mệnh đề 「真相が明らかにならないで」 chỉ nguyên nhân (do chân tướng sự việc không sáng tỏ). Vế sau 「国民は皆怒っている」 biểu thị kết quả trạng thái cảm xúc (người dân ai nấy đều tức giận). 「明らかに」 là tính từ đuôi na bổ nghĩa cho động từ phủ định 「ならないで」.
ないである,V－ないである,N3,①手紙は書いたけれど、出さないである。,被災地の復興計画はまだ決定されないである状態だ。,被災地の復興計画はまだ,0,決定,されない,である,状態だ。,「復興計画は」 đóng vai trò chủ ngữ chính. Trạng từ 「まだ」 (vẫn chưa) bổ nghĩa cho động từ bị động phủ định 「決定されない」. Kết hợp với 「である」 tạo thành cấu trúc 「V-ないである」 biểu thị trạng thái một sự việc vẫn đang được giữ nguyên ở dạng phủ định (vẫn chưa được quyết định).
ないでいる,V－ないでいる,N4,①昨日から何も食べないでいる。,彼は真実を他人に話さないでいるようだ。,彼は,真実を,他人に,話さない,でいる,ようだ。,"「真実を」 (tân ngữ) và 「他人に」 (đối tượng tiếp nhận) bổ nghĩa trực tiếp cho động từ phủ định 「話さない」. Cấu trúc 「V-ないでいる」 ở đây biểu thị trạng thái liên tục, kéo dàiのviệc không thực hiện hành động (vẫn tiếp tục giữ kín không nói ra sự thật). Vĩ tố 「ようだ」 thể hiện sự phỏng đoán."
ないでおく,V－ないでおく,N4,①時間がないので昼ご飯は食べないでおこう。,犯人の手がかりは警察に伝えないでおこうと決めた。,犯人の,手がかりは,警察に,伝えない,でおこう,と決めた。,「手がかりは」 là chủ đề được đưa lên đầu câu. 「警察に」 chỉ đối tượng hướng tớiのhành động 「伝えない」. Cấu trúc 「V-ないでおく」 chia sang thể ý chí 「でおこう」 diễn tả quyết định chủ động cứ để nguyên trạng thái không làm gì (không báo cho cảnh sát) để chuẩn bị cho mục đích sau này.
ないでくれ,,N4,①危険なことはしないでくれよ。,「私の過去を誰にも話さないでくれ」と彼は嘆願した。,「私の過去を,誰にも,話さない,でくれ」と,彼は,嘆願した。,"Trong câu trích dẫn trực tiếp, 「私の過去を」 (tân ngữ) và 「誰にも」 (đại từ phủ định đi với trợ từ) bổ nghĩa cho 「話さないでくれ」 (xin đừng nói). Trợ từ liên kết 「と」 kết nối mệnh đề yêu cầu cầu xin này với chủ ngữ 「彼は」 và động từ tường thuật hành động 「嘆願した」 (khẩn khoản)."
ないですむ,V－ないですむ,N3,①道がすいていたので、遅刻しないですんだ。,新しい法律の施行により、この企業は罰金を払わないですんだようだ。,新しい法律の施行により、,この企業は,罰金を,払わない,ですんだ,ようだ。,Vế mở đầu chỉ nguyên nhân 「新しい法律の施行により」. Chủ ngữ 「この企業は」 đi kèm tân ngữ 「罰金を」 bổ nghĩa cho động từ 「払わない」. Ngữ pháp 「V-ないですむ」 biểu thị việc tránh được một nghĩa vụ hay một việc không mong muốn (không phải nộp phạt) một cách thuận lợi.
ないではいられない,V－ないではいられない,N2,①こんな悲しい話を聞いたら、泣かないではいられない。,彼の悲惨な過去を聞くと、誰もが涙を流さないではいられない。,彼の,悲惨な過去を,聞くと、,誰もが,涙を,流さないではいられない。,「悲惨な過去を」 làm tân ngữ cho động từ chỉ điều kiện giả định tự nhiên 「聞くと」. Chủ từ hành động là 「誰もが」 (ai cũng). Tân ngữ 「涙を」 đi liền với động từ thể phủ định kết hợp ngữ pháp 「流さないではいられない」 biểu thị cảm xúc dâng trào tự nhiên không thể kìm nén được (không thể không rơi lệ).
ないではおかない,V－ないではおかない,N1,①この作品は、読む者の胸を打たないではおかないだろう。,その凄惨な光景は、目撃者の心を揺さぶらないではおかない。,その凄惨な,光景は、,目撃者の,心を,揺さぶらないでは,おかない。,"Chủ ngữ 「光景は」 (cảnh tượng) kết hợp định ngữ 「その凄惨な」. Cụm 「目撃者の心を」 làm tân ngữ cho động từ 「揺さぶる」 (lay động). Ngữ pháp 「V-ないではおかない」 thể hiện một tác động mang tính tất yếu và mạnh mẽ, chắc chắn sẽ gây ra trạng thái đó (nhất định sẽ làm lay động tâm can người chứng kiến)."
ないではすまない,V－ないではすまない,N2,①知り合いに借りたキャンプ用のテントをひどく破ってしまった。新しいのを買って返さないではすまないだろう。,これほどの不祥事を起こした以上、社長は社会的な責任を取って辞任しないではすまない。,これほどの不祥事を起こした以上、,社長は,社会的な,責任を取って,辞任しないでは,すまない。,"Cụm 「起こした以上」 chỉ tiền đề (một khi đã gây ra...). Chủ ngữ 「社長は」 đi cùng cụm liên kết hành động 「責任を取って」 (nhận trách nhiệm). Ngữ pháp 「V-ないではすまない」 biểu thị tính bắt buộc về mặt đạo đức xã hội hoặc lẽ thường, không thể tránh khỏi việc phải từ chức."
ないでもない,動詞の否定形や形容詞「ない」を受けて、そのようなことが全くないわけではなく、それが存在したり成立することもあるという意味を表す。「～ないこともない」「～なくもない」とも言う。V－ないでもない,N3,①A：納豆はお好きですか。B：食べないでもないですが、あまり好きじゃありません。,彼の小説の結末には、少し納得がいかないでもない。,彼の小説の結末には、少し,0,納,得が,いかないでも,ない。,"Cụm danh từ chủ đề 「結末には」 (đối với kết cục). Phó từ mức độ 「少し」 (một chút) bổ nghĩa cho trạng thái tiếp theo. Cụm từ cố định 「納得がいく」 (thấu hiểu/đồng tình) được chia sang phủ định kép 「いかないでもない」 để diễn đạt ý kiến một cách dè dặt, mập mờ (không hẳn là không đồng tình)."
ないでもない,Nがないでもない,N3,①時には、一人になりたいと思うことがないでもない。,政治家の発言に対して、国民の間に不信感がないでもない。,政治家の発言に対して、,国民の,間に,不信感が,ないでも,ない。,Cụm giới từ 「発言に対して」 (đối với phát ngôn). Giới hạn phạm vi 「国民の間に」 (trong lòng người dân). Danh từ chủ ngữ 「不信感が」 (sự bất tín) đi với ngữ pháp phủ định kép 「ないでもない」 nhằm khẳng định nhẹ nhàng rằng sự nghi ngờ hay bất tín đó thực tế vẫn đang hiện hữu.
ないでもよい,V－ないで（も）よい,N4,①この欄には何も書かないでもよい。,この極秘書類は今日中に役所に提出しないでもよいそうだ。,この極秘書類は,今日中に,役所に,提出しない,でもよい,そうだ。,Chủ ngữ 「極秘書類は」 (tài liệu tối mật này). Trạng ngữ thời gian 「今日中に」 và nơi chốn chỉ hướng tới 「役所に」 bổ nghĩa cho động từ 「提出する」. Ngữ pháp 「V-ないでもよい」 (không cần làm cũng được) biểu thị việc không bắt buộc nộp ngay trong ngày. Đuôi câu kết thúc bằng truyền đạt thông tin 「そうだ」.
ないと,でないと　A－くないと　V－ないと　～ないと＋マイナス評価の内容,N4,①急がないと遅刻するよ。,地球温暖化の対策を急がないと人類の未来は暗い。,地球温暖化の,対策を,急がないと,人類の,未来は,暗い。,"Mệnh đề điều kiện giả định phủ định 「対策を急がないと」 (nếu không khẩn trương thực hiện biện pháp). Chủ đề vế sau là 「人類の未来は」 đi kèm tính từ biểu thị kết quả tiêu cực 「暗い」 (tăm tối), thể hiện mối quan hệ nhân quả giả địnhのngữ pháp 「～ないと」."
ないと,～ないと～ない,N4,①平均70点以上でないと合格できない。,厳しい選考を通過しないと次の面接に進めない。,厳しい,選考を,通過しないと,次の,面接に,進めない。,Định ngữ 「厳しい」 bổ nghĩa cho danh từ 「選考を」. Mệnh đề điều kiện 「通過しないと」 (nếu không vượt qua). Vế sau là kết quả phủ định tương ứng 「次の面接に進めない」 (không thể tiến tới cuộc phỏng vấn tiếp theo). Cấu trúc biểu thị điều kiện cần bắt buộc.
ないと,～ないと　いけない／だめだ,N5,①風邪を防ぐには十分な休養を取らないといけません。,新聞記者なら事実を公平に報道しないといけないのだ。,新聞記者なら,事実を,公平に,報道しないと,いけない,のだ。,"Vế giả định điều kiện vai trò 「新聞記者なら」 (nếu là nhà báo). Tân ngữ 「事実を」 đi kèm phó từ cách thức 「公平に」 (một cách công bằng) để bổ nghĩa cho động từ 「報道しないと」. Cấu trúc 「V-ないといけない」 biểu thị nghĩa vụ, bổn phận bắt buộc phải thực hiện."
ないといい,でないといい　A－くないといい　V－ないといい,N3,①あそこの奥さん、もうちょっとおしゃべりでないといいんだけど。,明日の会見で無駄な混乱が起きないといいがと願う。,明日の会見で,無駄な,混乱が,起きないと,いいが,と願う。,Trạng từ chỉ bối cảnh 「明日の会見で」 (tại cuộc họp báo ngày mai). Chủ từのhiện tượng 「無駄な混乱が」 (sự hỗn loạn vô ích) đi liền với động từ phủ định chỉ điều kiện 「起きないと」. Đi kèm cụm 「いいが」 thể hiện mong muốn hoặc hy vọng sự việc tiêu cực sẽ không xảy ra.
ないともかぎらない,,N2,①今日は父の命日だから、誰かが突然訪ねてこないともかぎらない。,この深刻な不況が速やかに改善しないともかぎらないのだ。,この深刻な,不況が,速やかに,改善しないとも,かぎらない,のだ。,Định ngữ 「この深刻な」 bổ nghĩa cho chủ ngữ 「不況が」. Trạng từ 「速やかに」 (nhanh chóng) bổ nghĩa cho động từ phủ định 「改善しないとも」. Ngữ pháp 「V-ないともかぎらない」 diễn tả khả năng sự việc có thể xảy ra (không hẳn là không cải thiện/biết đâu lại cải thiện).
ないまでも,V－ないまでも,N2,①毎日とは言わないまでも、週に2、3度は掃除をしようと思う。,完璧な解決とは言えないまでも、事態は確実に好転したようだ。,完璧な解決とは,言えないまでも、,事態は,確実に,好転した,ようだ。,Cụm từ trích dẫn 「完璧な解決とは」 đi với động từ khả năng phủ định 「言えないまでも」 (dù không thể nói là...). Vế sau diễn đạt tình trạng thực tế đạt được: chủ ngữ 「事態は」 đi với trạng từ 「確実に」 bổ nghĩa cho động từ 「好転した」 (đã chuyển biến tốt lên/gióng tốt).
