Grammar,Usage,JLPT Level,Reference Example,Original Example,Prefix,Chunk1,Chunk2,Chunk3,Chunk4,Suffix,Explanation
といっても,といっても,N3,①ビデオの作品を作った。といっても、せいぜい10分の短い作品だが。,彼は新しい小説を書き上げた。といっても、わずか数ページの短編にすぎないが。,彼は新しい小説を書き上げた。,といっても、,わずか数ページの,短編に,すぎない,が。,"Đầu tiên, liên từ 「といっても」 được dùng ở đầu câu tiếp theo để đính chính hoặc giới hạn lại thông tin ở câu trước. Tiếp theo, định ngữ 「わずか数ページの」 (chỉ vỏn vẹn vài trang) bổ nghĩa cho danh từ 「短編」 (truyện ngắn). Cấu trúc ngữ pháp 「～にすぎない」 (chỉ là...) đi liền sau danh từ 「短編」 để biểu thị sự giới hạn, tạo thành cụm 「短編にすぎない」. Cuối cùng, trợ từ 「が」 ở cuối câu để kết thúc câu với sắc thái lấp lửng. Do đó thứ tự là: Chunk1 -> Chunk2 -> Chunk3 -> Chunk4."
といっても,～といっても,N3,①A：休みには故郷へ帰ります。B：じゃあ、当分お目にかかれませんね。A：いや、帰るといっても、二週間程度で、すぐまた帰って来ます。,景気は回復しているといっても、一部の大企業に限られた現象である。,景気は,回復している,といっても、,一部の大企業に,限られた,現象である。,"Chủ ngữのcâu là 「景気は」 (Kinh tế). Động từ trạng thái 「回復している」 (đang hồi phục) đi trước cấu trúc 「といっても」 (dẫu nói là...) để thể hiện sự nhượng bộ. Tiếp theo, cụm chỉ giới hạn 「一部の大企業に」 (ở một bộ phận doanh nghiệp lớn) bổ nghĩa cho động từ bị động chia ở thể định ngữ 「限られた」 (bị giới hạn). Cụm định ngữ này bổ nghĩa trực tiếp cho danh từ kết thúc vế sau 「現象である」 (là hiện tượng). Thứ tự hợp lý là: Chunk1 -> Chunk2 -> Chunk3 -> Chunk4."
といっても,ひとくちに～といっても,N2,①一口にアジアといっても、広大で、多種多様な文化があるのです。,一口に現代文学といっても、そのジャンルは多岐にわたっている。,,一口に,現代文学と,いっても、その,ジャンルは,多岐にわたっている。,Cấu trúc 「一口に～といっても」 (dẫu có gọi chung là... thì bề trong vẫn). Bóc tách sự đa dạng ẩn sau một khái niệm 「一口に現代文学といっても」 (dẫu có nói tóm gọn bằng bốn chữ văn học hiện đại đi chăng nữa). Đi sâu vào bản thể 「そのジャンルは多岐にわたっている」 (thể loại của nó cũng tỏa nhánh rộng khắp muôn vàn lĩnh vực).
といっても,～といってもいいだろう,N3,①これは、この作家の最高の傑作だといってもいいだろう。,彼の最新作は、今年の文芸界を代表する名作だといってもいいだろう。,彼の最新作は、,今年の文芸界を,代表する,名作だと,いっても,いいだろう。,Cấu trúc xác quyết phỏng đoán 「～といってもいいだろう」 (hoàn toàn có thể khẳng định rằng). Tôn vinh giá trị của tác phẩm 「彼の最新作は今年の文芸界を」 (tác phẩm mới nhất của anh ấy năm nay trên văn đàn). Gắn cho nó danh xưng 「代表する名作だと」 (được xem là kiệt tác đại diện). Lời tán dương được chốt lại bằng 「いってもいいだろう」 (cho dù có nói như thế cũng chẳng ngoa).
といっても,～といってもいいすぎではない,N2,①環境破壊の問題は、これから世界の最も重要な課題になるといっても言い過ぎではない。,電子書籍の普及は、読書習慣の革命だといっても言い過ぎではない。,電子書籍の普及は、,読書習慣の,革命だと,いっても,言い過ぎでは,ない。,Cấu trúc cường điệu hóa sự việc 「～といっても言い過ぎではない」 (dẫu nói là... thì cũng chẳng có gì là phóng đại). Đánh giá sức công phá của 「電子書籍の普及は読書習慣の」 (sự bành trướng của sách điện tử đối với thói quen đọc sách). Gán cho nó nhãn hiệu 「革命だといっても」 (dù có gọi đó là một cuộc cách mạng đi chăng nữa). Thì cũng 「言い過ぎではない」 (chẳng hề nói ngoa chút nào).
といわず～といわず,NといわずNといわず,N1,①風の強い日だったから、口といわず、目といわず、すなぽこりが入ってきた。,その豪雪の夜は、屋根といわず、庭といわず、すべてが白一色に染まった。,その豪雪の夜は、,屋根といわず、,庭,と,いわず、,すべてが白一色に染まった。,"Cấu trúc liệt kê bao trùm 「～といわず～といわず」 (bất kể là... hay là...). Màn đêm trắng bao phủ vạn vật 「屋根といわず、庭といわず」 (không màng là trên mái ngói, hay là dưới mảnh sân). Sự đồng nhất không ranh giới 「すべてが白一色に染まった」 (tất thảy vạn vật đều bị nhuộm thắm một màu tang trắng)."
どうしても,どうしてもR－たい,N4,①次の休みには、どうしても北海道へ行きたい。,私はあの時、どうしてもnull真実を彼女に伝えたかった。,私はあの時、どうしてもnull,真,実を,彼女に,伝えた,かった。,"Cấu trúc khát vọng bùng cháy 「どうしても～たい」 (dù thế nào đi nữa cũng muốn...). Quay ngược dòng kýức 「私はあの時どうしても」 (vào cái lúc bấy giờ, tôi đã dặn lòng bất chấp mọi giá). Một khao khát duy nhất 「真実を彼女に」 (đem sự thật này đến cho cô ấy). Khao khát ấy tuôn trào qua 「伝えたかった」 (khao khát truyền đạt lại)."
どうしても,とうしても～ない,N4,①仕事がひどぐ忙しいので、今月末までは、どうしてもあなたのところへは行けません。,過去のつらい記憶は、どうしてもnull頭から消し去ることができない。,過去のつらい記憶は、どうしてもnull,頭,から,消し去ることが,でき,ない。,"Cấu trúc bất lực tận cùng 「どうしても～ない」 (dù có làm gì đi nữa cũng mãi chẳng thể). Những vết sẹo thời gian 「過去のつらい記憶はどうしても」 (những ký ức đớn đau của quá khứ, dù có cố gắng cách mấy). Nỗ lực gột rửa 「頭から消し去ることが」 (việc muốn tẩy trắng chúng ra khỏi tâm trí). Đều trở nên vô vọng 「できない」 (chẳng tài nào thực hiện được)."
どうじに,～とどうじに　Nとどうじに　V－る／V－た（の）とどうじに,N3,①スタートの合図と同時に、選手達はいっせいに走り出した。,新政府の発足と同時に、新しい経済政策が発表された。,,新政府の,発足と,同時に、新しい,経済政策が,発表された。,"Cấu trúc song hành thời gian 「～と同時に」 (vào đúng khoảnh khắc đó, cùng lúc). Sự kiện bùng nổ 「新政府の発足と同時に」 (ngay vào giây phút chính phủ mới vừa tuyên thệ nhậm chức). Một làn sóng mới lập tức dội tới 「新しい経済政策が発表された」 (những chính sách kinh tế tân tiến cũng đồng loạt được ban bố)."
どうじに,であるとどうじに　A／V　とどうじに〕,N2,①この手術はかなりの危険を伴うと同時に費用もかかる。,彼は優れた小説家であると同時に、鋭い社会批評家でもある。,彼は,優れた小説家,であると,同時に、鋭い,社会批評家,でもある。,"Cấu trúc hiện thân kép 「～であると同時に」 (vừa mang thân phận này, lại đồng thời gánh vác vai trò kia). Con người anh ta đa diện 「彼は優れた小説家であると同時に」 (anh không chỉ đơn thuần là một cây bút tiểu thuyết tài ba). Bản ngã thứ hai của anh ta là 「鋭い社会批評家でもある」 (mà còn thủ vai một nhà phê bình xã hội đầy tính gai góc)."
どうじに,どうじに,N2,①医者という職業は体力を必要とする。同時に、人間の繊細な心理に対する深い理解も要求される。,旅は未知の世界を教えてくれる。同時に、自分自身を見つめ直す絶好の機会でもある。,旅は未知の世界を教えてくれる。,同時に、,自分自身を,見つめ直す,絶好の,機会でもある。,Liên từ 「同時に」 (song song với đó) mở ra một chiều kích khác của sự việc. Cơ hội thứ hai hiện hình 「同時に、自分自身を見つめ直す」 (đó đồng thời cũng là lúc để ta tự phán xét lại chính bản ngã của mình). Và nó được đánh giá là 「絶好の機会でもある」 (một thời cơ ngàn năm có một).
どうせ,どうせ,N3,①どうせ私は馬鹿ですよ。,どうせ私の小説なんて、誰にも理解されないのだろう。,,どうせ,私の小説,なんて、誰にも,理解されない,のだろう。,"Phó từ buông xuôi 「どうせ」 (dẫu sao thì, đằng nào cũng) nhuốm màu yếm thế. Cảm giác bất lực tự ti 「どうせ私の小説なんて」 (rút cục thì dăm ba cái cuốn tiểu thuyết rẻ tiền của tôi). Niềm tin sụp đổ hoàn toàn 「誰にも理解されないのだろう」 (cũng chẳng có lấy một ai thấu cảm nổi đâu)."
どうせ,どうせ～（の）なら,N3,①どうせやるならもっと大きいことをやれ。,どうせ記事を書くのなら、読者の心を揺さぶるものを書きたい。,,どうせ記事を,書くのなら、,読者の心を,揺さぶるものを,書きたい。,"Cấu trúc phá vỡ lối mòn 「どうせ～のなら」 (nếu đã trót bề nào cũng vậy, chi bằng). Lựa chọn nổi loạn 「どうせ記事を書くのなら」 (đã mất công chắp bút viết nên một bài báo). Đích ngắm phải là 「読者の心を揺さぶるものを」 (thứ gì đó đủ sức xé toạc và làm chấn động tâm can độc giả). Tham vọng ấy bùng nổ qua 「書きたい」 (khao khát được viết ra)."
どうせ,どうせV－るいじょう（は）　どうせV－るからには,N2,①やる以上は必ず成功して戻ってこい。,どうせこの道を選ぶ以上は、途中で諦めるわけにはいかない。,,どうせこの道を,選ぶ以上は、,途中で,諦めるわけには,いかない。,Cấu trúc trói buộc sinh tử 「～以上は」 (một khi đã... thì không có đường lui). Bản án đã được định đoạt 「どうせこの道を選ぶ以上は」 (một khi thân này đã quyết dấn bước vào con đường đó). Lệnh ân xá là điều xa xỉ 「途中で諦めるわけにはいかない」 (thì chẳng có cái tư cách gì mà đòi giương cờ trắng đầu hàng giữa chừng cả).
どうせ,どうせ～のだから,N3,①どうせ間に合わないのだから、いまさらあわてても仕方がない。,どうせ誰も読んでいないのだから、自由に自分の思いを書けばいい。,,どうせ誰も,読んでいないのだから、,自由に自分の,思いを,書けばいい。,"Cấu trúc buông thả 「どうせ～のだから」 (cái cơ sự đằng nào nó cũng đã vậy, nên cứ). Bứt đứt sợi dây kìm kẹp 「どうせ誰も読んでいないのだから」 (đằng nào thì cũng có ma nào thèm đọc đâu). Tâm thế tự tại 「自由に自分の思いを書けばいい」 (tội gì mà không mặc sức múa bút tuôn trào hết tâm tư cho nhẹ nhẹ lòng)."
どうせ,どうせ（のこと）だから,N3,①どうせのことだから、とびきり高級なホテルに泊まろう；き,どうせのことだから、この結末はハッピーエンドにしよう。,,どうせの,ことだから、,この結末は,ハッピーエンドに,しよう。,"Cụm trạng ngữ mặc kệ đời 「どうせのことだから」 (nước đã đến chân rồi, tới đâu thì tới). Lời thú tội 「どうせのことだから、この結末は」 (sự thể cũng đã đến nước này, vậy cái kết cục này). Quyết định nhắm mắt đưa chân 「ハッピーエンドにしよう」 (thôi thì cứ phết cho nó một cái kết có hậu đi cho xong chuyện)."
とうぜん,Nとうぜん,N2,①実の娘同然に大切に育ててくれた。,彼は私を実の弟同然に扱い、優しく見守ってくれた。,彼は私を,実の弟,同然に,扱い、,優しく,見守ってくれた。,"Cấu trúc đồng nhất hóa 「N同然に」 (xem như thể là, y hệt như). Ranh giới huyết thống bị lu mờ 「彼は私を実の弟同然に扱い」 (anh ấy bao bọc tôi coi tôi hệt như núm ruột của mình). Sự quan tâm vô điều kiện 「優しく見守ってくれた」 (luôn dành cho tôi ánh nhìn chở che hiền từ nhất)."
とうぜん,～もとうぜん　Nもとうぜん　V－たもとうぜん,N2,①この子は本当は姪ですが、小さいころから一緒に暮らしているので娘も同然です。,この段階に達すれば、計画は成功したも同然であると言える。,この段階に達すれば、,計画は,成功したも,同然,であると,言える。,"Cấu trúc coi như đã an bài 「V-たも同然だ」 (coi như mười mươi là đã...). Sự quả quyết chắc nịch 「計画は成功したも同然であると」 (phi vụ này coi như ván đã đóng thuyền, nắm chắc phần thắng). Phán quyết cuối cùng 「言える」 (có thể ngẩng cao đầu mà tuyên bố như vậy)."
とうてい～ない,,N2,①うちの息子の実力では、東大合格はとうてい無理だ。,現在の極端な不況下では、新規採用の拡大はとうてい望めない。,現在の極端な不況下では、,新規採用の,拡大は,とうてい,望め,ない。,"Phó từ triệt tiêu hy vọng 「とうてい～ない」 (nhắm mắt cũng thấy là vô phương). Cánh cửa khép lại 「新規採用の拡大はとうてい」 (với tình cảnh này, đòi hỏi phải mở rộng quy mô chiêu mộ nhân tài). Thì cái sự hão huyền đó 「望めない」 (bói đâu ra cửa sáng mà mộng với mơ)."
とうとう,とうとうV－た,N4,①夏休みも、とうとう終わってしまった。,長い旅の末に、私はとうとう約束の場所にたどり着いた。,長い旅の末に、,私は,とうとう,約束の場所に,たどり,着いた。,"Phó từ điểm huyệt thời gian 「とうとう」 (rốt cuộc thì, sau bao biến cố thì cuối cùng). Đánh dấu sự khép lại của chặng đường trầy trật 「私はとうとう約束の場所に」 (bản thân tôi trải qua bao sóng gió, rốt cục cũng lết được thân xác tới điểm hẹn). Kết thúc viên mãn bằng hành động 「たどり着いた」 (đã chạm chân đến đích)."
