Grammar,Usage,JLPT Level,Reference Example,Original Example,Prefix,Chunk1,Chunk2,Chunk3,Chunk4,Suffix,Explanation
とする2,0人来るとして、会費は一人いくらぐらいにすればよいでしょうか。,N2,①それはそうとして、我々はどうしたらよいでしょうか。,この小説の初版を5000部刷るとして、宣伝費にはいくら割くべきだろうか。,この小説の,初版を,5000部,刷るとして、,宣伝費には,いくら割くべきだろうか。,"Thứ tự sắp xếp hợp lý dựa trên cấu trúc ngữ nghĩa của câu: (1) '初版を' đóng vai trò tân ngữ cho hành động in ấn ở Chunk 3, (2) '5000部' là lượng từ bổ nghĩa chỉ số lượng in, (3) '刷るとして' sử dụng mẫu ngữ pháp 'V-るとして' (giả sử là...), (4) '宣伝費には' giới thiệu chủ thể thảo luận ở vế sau. Do đó, ta có trình tự tự nhiên: 初版を -> 5000部 -> 刷るとして -> 宣伝費には."
とする2,～とする　N／Na（だ）とする　A／V　とする,N2,①酔ったうえでの失言（だ）として、彼の責任は問われないことになった。,政府は今回の報道を単なるデマだとして、正式なコメントを避けた。,政府は今回の,報道を,単なるデマ,だとして、,正式な,コメントを避けた。,"'報道を' là tân ngữ chịu tác động của sự đánh giá. '単なるデマ' (tin đồn thuần túy) kết hợp với 'だとして' (xem như là/cho là, cấu trúc Nだとして). '正式な' là tính từ đuôi na bổ nghĩa cho danh từ ở phần Suffix 'コメント'. Sự liên kết tự nhiên tạo thành chuỗi ý nghĩa: 報道を -> 単なるデマ -> だとして -> 正式な."
とする2,～こととする「～と見なす」「～と判断する」「～と決める」　という意味を表す。,N2,①≪規則≫会議を欠席する場合は、事前に議長宛に届けを提出することとする。,当編集部では、匿名による情報提供は掲載しないこととする方針だ。,当編集部では、,匿名による,情報提供は,掲載しない,こととする,方針だ。,'匿名による' bổ nghĩa cho danh từ '情報提供は' (việc cung cấp thông tin ẩn danh). Động từ phủ định '掲載しない' (không đăng tải) đi liền với ngữ pháp 'こととする' (quy định/quyết định việc gì) tạo thành một cụm bổ nghĩa cho danh từ '方針だ' (phương châm) ở phần Suffix. Sự kết hợp logic: 匿名による -> 情報提供は -> 掲載しない -> こととする.
とする2,～ものとする,N2,①意見を言わない者は賛成しているものとする。,署名が完了した時点で、本契約は有効に成立したものとするのが妥当だ。,署名が完了した時点で、,本契約は,有効に,成立した,ものとする,のが妥当だ。,'本契約は' đóng vai trò chủ ngữ của vế sau. Trạng từ '有効に' (một cách có hiệu lực) bổ nghĩa cho động từ '成立した' (đã thiết lập/thành lập). Động từ này đi kèm cấu trúc pháp lý 'ものとする' (được quy định là/mặc định là). Toàn bộ cụm này được danh từ hóa bằng 'の' để đi với vị ngữ 'が妥当だ' ở Suffix. Thứ tự chuẩn: 本契約は -> 有効に -> 成立した -> ものとする.
とする2,V－ようとする,N3,①時計は正午を知らせようとしている。,沈みゆく太陽が、荒れ果てた戦場を赤く染めようとしている。,沈みゆく太陽が、,荒れ果てた,戦場を,赤く,染めようと,している。,'荒れ果てた' là định ngữ bổ nghĩa cho danh từ tân ngữ '戦場を' (chiến trường hoang tàn). Trạng từ '赤く' (màu đỏ) bổ nghĩa cho hành động '染めようとする' (định nhuộm/sắp nhuộm). Mẫu ngữ pháp chỉ hành động sắp sửa xảy ra 'V-ようとしている' được chia thành '染めようと' và tiếp nối bằng 'している' ở phần Suffix. Thứ tự sắp xếp: 荒れ果てた -> 戦場を -> 赤く -> 染めようと.
とする2,NをNとする,N2,①私は恩師の生き方を手本としている。,被災地の復興を最優先課題とする政府の基本方針が発表された。,被災地の,復興を,最優先課題,とする,政府の,基本方針が発表された。,"Áp dụng cấu trúc 'N1をN2とする' (coi N1 là N2) với '復興を' là N1 và '最優先課題' là N2, đi kèm với 'とする'. Cụm '最優先課題とする' đóng vai trò định ngữ bổ nghĩa cho danh từ sở hữu '政府の' (của chính phủ), tiếp tục liên kết với danh từ trung tâm ở phần Suffix. Trình tự logic: 復興を -> 最優先課題 -> とする -> 政府の."
とすると,だとすると　A／V　とすると,N3,①医学部に入るとすると、一体どのくらいお金が必要なのだろうか。,この目撃証言が真実だとすると、犯人の逃走経路は限られてくる。,この目撃証言が,真実だ,とすると、,犯人の,逃走経路は,限られてくる。,"Danh từ '真実だ' đi liền với cấu trúc điều kiện giả định 'とすると' (nếu giả thiết là...) tạo nên vế điều kiện. Ở vế kết quả, danh từ sở hữu '犯人の' (của thủ phạm) bổ nghĩa cho chủ ngữ '逃走経路は' (lộ trình trốn chạy) để dẫn tới động từ ở phần Suffix. Thứ tự tự nhiên: 真実だ -> とすると -> 犯人の -> 逃走経路は."
とすると,だとすると　A／V　とすると,N3,①1時間待ってまだ何の連絡もないとすると、途中で事故にでもあったのかもしれない。,被害者が午後10時に襲われたとすると、容疑者のアリバイは成立する。,被害者が,午後10時に,襲われた,とすると、,容疑者の,アリバイは成立する。,Cụm trạng từ thời gian '午後10時に' bổ nghĩa cho động từ bị động '襲われた' (bị tấn công). Động từ này kết hợp trực tiếp với mẫu ngữ pháp giả định 'とすると' (giả sử như là). Tiếp theo là danh từ sở hữu '容疑者の' bổ nghĩa cho danh từ ở phần Suffix 'アリバイは成立する'. Thứ tự liên kết: 午後10時に -> 襲われた -> とすると -> 容疑者の.
とすると,（だ）とすると,N3,①A：今年の2月の平均気温は平年より数度も高いそうですよ。B：とすると、桜の開花も早くなるでしょうね。,A：「裏口の鍵が開いていました。」B：「だとすると、内部の協力者がいたことになる。,A：「裏口の鍵が開いていました。」B：「,だとすると、,内部の,協力者が,いたことに,なる。,Câu thoại của nhân vật B bắt đầu bằng liên từ 'だとすると' (nếu vậy thì) để tiếp nối ý của người A. '内部の' (thuộc nội bộ) là định ngữ bổ nghĩa cho danh từ chủ ngữ '協力者が' (đồng phạm/người giúp đỡ). Động từ 'いた' (đã có) đi liền với cấu trúc kết luận 'ことになる' ở Suffix. Trình tự lắp ghép: だとすると -> 内部の -> 協力者が -> いたことに.
とすれば1,Nとすれば,N2,①夫とすれば家事をおろそかにする妻には不満も多いだろうと思う。,報道記者とすれば、取材源の秘匿は命よりも重い義務である。,報道記者,とすれば、,取材源の,秘匿は,命よりも,重い義務である。,"Danh từ '報道記者' (nhà báo) đi với cấu trúc 'とすれば' biểu thị góc độ, cương vị (đứng trên lập trường của...). Vế sau bắt đầu bằng danh từ sở hữu '取材源の' (của nguồn tin) bổ nghĩa cho chủ ngữ '秘匿は' (việc giữ kín). Cụm so sánh '命よりも' (hơn cả sinh mạng) bổ nghĩa cho tính từ '重い' ở Suffix. Trình tự logic: とすれば -> 取材源の -> 秘匿は -> 命よりも."
とすれば2,だとすれば　A／V　とすれば,N3,①死ぬとすれば10歳年上の私の方が早いはずだ。,この戦いに敗れるとすれば、我々を待ち受けるのは破滅のみだ。,この戦いに,敗れる,とすれば、,我々を,待ち受けるのは,破滅のみだ。,"Động từ '敗れる' (thua cuộc) làm cơ sở cho giả thuyết và đi liền với mẫu câu điều kiện 'とすれば' (nếu giả sử). Vế kết quả bắt đầu bằng tân ngữ '我々を' chịu tác động của động từ định ngữ '待ち受けるのは' (điều đang chờ đợi chúng ta), liên kết với danh từ kết luận ở Suffix. Cách kết nối: 敗れる -> とすれば -> 我々を -> 待ち受けるのは."
とすれば2,だとすれば　A／V　とすれば,N3,①これだけ待っても来ないとすれば、もともと来る気がなかったんじゃないだろうか。,活字が真実を伝えないとすれば、文学の存在意義はどこにあるのか。,活字が,真実を,伝えない,とすれば、,文学の,存在意義はどこにあるのか。,'真実を' là tân ngữ của động từ phủ định '伝えない' (không truyền tải). Động từ này đi với cấu trúc giả định 'とすれば' (nếu giả sử rằng) để hoàn thành vế điều kiện. Cụm '文学の' (của văn học) bổ nghĩa cho danh từ chủ ngữ '存在意義' ở Suffix. Sắp xếp hợp lý: 真実を -> 伝えない -> とすれば -> 文学の.
とすれば2,（だ）とすれば,N3,①A：家に電話しても誰も出ないんですよ。B：だとすれば、もうこちらに向かっているということじゃないですか。,A：「彼女は日記を燃やしました。」B：「だとすれば、彼女は秘密を隠したかったのだろう。,A：「彼女は日記を燃やしました。」B：「,だとすれば、,彼女は,秘密を,隠したかったの,だろう。,"Câu thoại của B bắt đầu bằng liên từ nối 'だとすれば' (nếu đúng như vậy) để tiếp nhận thông tin từ A. '彼女は' là chủ ngữ, '秘密を' là tân ngữ của động từ '隠したかった' (muốn che giấu). Động từ này kết hợp cấu trúc phỏng đoán 'のだろう' với phần đuôi ở Suffix. Trình tự sắp xếp: だとすれば -> 彼女は -> 秘密を -> 隠したかったの."
とすれば2,NをNとすればNがNだとすれば,N2,①テレビがお茶の間のものとすれば、ラジオは個室のものである。,今回の事件を転換点とすれば、社会の意識は変わりつつある。,今回の,事件を,転換点,とすれば、,社会の,意識は変わりつつある。,"Sử dụng cấu trúc 'N1をN2とすれば' (Nếu coi N1 là N2) với '事件を' là N1 và '転換点' là N2, đi liền với 'とすれば'. Vế sau sử dụng cụm danh từ sở hữu '社会の' (của xã hội) bổ nghĩa cho chủ ngữ '意識は' ở Suffix. Sự liên kết tự nhiên: 事件を -> 転換点 -> とすれば -> 社会の."
とたん,V－たとたん（に）,N3,①ドアを開けたとたん、猫が飛び込んできた。,彼女が手紙を読んだとたん、目から大粒の涙がこぼれ落ちた。,彼女が,手紙を,読んだ,とたん、,目から,大粒の涙がこぼれ落ちた。,"'手紙を' đóng vai trò tân ngữ của động từ thể quá khứ '読んだ' (đã đọc). Động từ thể ta kết hợp trực tiếp với mẫu ngữ pháp 'とたん' (ngay khi/vừa mới). Vế sau diễn tả sự việc xảy ra đột ngột, bắt đầu bằng trạng ngữ chỉ nơi chốn '目から' (từ mắt) bổ nghĩa cho hành động ở Suffix. Trình tự: 手紙を -> 読んだ -> とたん -> 目から."
とたん,そのとたん（に）,N3,①友だちと30分ほど話して、受話器を置いた。そのとたんに再び電話のベルが鳴り出した。,鐘の音が響き渡った。そのとたんに、闇の奥から悲鳴が聞こえた。,鐘の音が響き渡った。,そのとたんに、,闇の,奥から,悲鳴が,聞こえた。,Câu thứ hai bắt đầu bằng liên từ chỉ thời gian cực ngắn 'そのとたんに' (ngay lập tức khi đó). Cụm danh từ '闇の' (của bóng tối) bổ nghĩa cho danh từ chỉ nơi chốn '奥から' (từ sâu thẳm). Danh từ chủ ngữ '悲鳴が' đi với động từ chỉ âm thanh tự phát '聞こえた' ở Suffix. Trình tự liên kết: そのとたんに -> 闇の -> 奥から -> 悲鳴が.
とたん,とたんにV,N3,①空が急に暗くなったと思ったら、途端に大粒の雨が降りだした。,その言葉を聞くと、彼は途端に顔色を変えて激しく立ち上がった。,その言葉を聞くと、彼は,途端に,顔色を,変えて,激しく,立ち上がった。,"Sau chủ ngữ '彼は' ở Prefix, phó từ '途端に' (đột nhiên/ngay lập tức) được đưa vào để nhấn mạnh tính phản xạ tức thì. '顔色を' là tân ngữ của động từ liên kết '変えて' (thay đổi sắc mặt). Trạng từ '激しく' (mãnh liệt) bổ nghĩa cho hành động '立ち上がった' ở Suffix. Thứ tự sắp xếp: 途端に -> 顔色を -> 変えて -> 激しく."
とちがって,Nと（は）ちがって　Naなのと（は）ちがって　A／V　のと（は）ちがって,N3,①弟は大柄な兄とちがって、やせていて背も低い。,前政権とは違って、現首相は世論の動向に極めて敏感である。,前政権,とは違って、,現首相は,世論の,動向に,極めて敏感である。,"Danh từ '前政権' đi liền với cấu trúc so sánh đối lập 'とは違って' (khác hẳn với...). Ở vế sau, '現首相は' là chủ ngữ chính, '世論の' (của dư luận) bổ nghĩa cho danh từ '動向に' (đối với xu hướng) làm bổ ngữ cho trạng từ và tính từ ở Suffix. Trình tự logic: とは違って -> 現首相は -> 世論の -> 動向に."
とちゅう,とちゅうで,N4,①いつもの時間に家を出たが、途中で忘れ物に気づいて引き返した。,村から逃げ出す途中で、彼は怪しげな旅人と出会った。,村から,逃げ出す,途中で、,彼は,怪しげな,旅人と出会った。,"Động từ '逃げ出す' (chạy trốn) đóng vai trò bổ nghĩa cho danh từ '途中', đi với trợ từ 'で' tạo trạng từ chỉ bối cảnh hành động xảy ra. '彼は' là chủ ngữ chính, '怪しげな' là tính từ đuôi na bổ nghĩa cho danh từ ở phần Suffix '旅人'. Trình tự tự nhiên: 逃げ出す -> 途中で -> 彼は -> 怪しげな."
とちゅう,～とちゅう（で／に）　Nのとちゅう（で／に）　V－るとちゅう（で／に）,N3,①通勤の途中、突然雨が降りだした。,事件を捜査する途中に、警察は新たな重要証拠を発見した。,事件を,捜査する,途中に、,警察は,新たな,重要証拠を発見した。,"'事件を' là tân ngữ của động từ hành động '捜査する' (điều tra). Động từ này làm định ngữ bổ nghĩa cho danh từ '途中' + trợ từ 'に' để chỉ thời gian hành động khác bất ngờ xen vào. '警察は' là chủ ngữ chính vế sau, '新たな' bổ nghĩa cho danh từ ở Suffix. Thứ tự logic: 捜査する -> 途中に -> 警察は -> 新たな."
