Grammar,Usage,JLPT Level,Reference Example,Original Example,Prefix,Chunk1,Chunk2,Chunk3,Chunk4,Suffix,Explanation
も,～もV－ない　NもV－ない　R－もしない,N4,①あいつは本当に失礼な奴だ。道であっても、挨拶もしない。,あの学生は来週試験があるのに、教科書を開きもしない。,あの学生は,来週試験があるのに、,教科書を,開き,も,しない。,"Cấu trúc ""V-stem + もしない"" (R-もしない) biểu thị ý nghĩa nhấn mạnh ""ngay cả hành động V cũng không làm"". Trong câu này, động từ 「開く」 (mở) được chuyển về dạng liên dụng (stem) là 「開き」 kết hợp với 「もしない」 để tạo thành 「開きもしない」 (ngay cả mở cũng không mở). Thứ tự sắp xếp tự nhiên là: Đưa ra bối cảnh 「来週試験があるのに」 (mặc dù tuần sau có kỳ thi), tiếp theo là tân ngữ 「教科書を」 (sách giáo khoa), và cuối cùng là cụm phủ định nhấn mạnh 「開きもしない」."
も,～もV－ずに,N2,①わたしは深く考えもせず、失礼なことを言ってしまった。,彼は十分な検証もせずに、新しい学説を発表してしまい、学会で批判された。,彼は,十分な,検証も,せずに、,新しい学説を,発表してしまい、学会で批判された。,"Cấu trúc ""V-stem もせずに"" (hoặc ""N もせずに"" với danh động từ nhóm 3) mang ý nghĩa ""mà không thèm làm gì/không thực hiện hành động..."". Ở đây, danh động từ 「検証」 (kiểm chứng) đi với 「もせずに」 thành 「検証もせずに」 (mà không thèm kiểm chứng). Thứ tự kết hợp: tính từ bổ nghĩa 「十分な」 đi trước danh từ 「検証もせずに」, sau đó là tân ngữ 「新しい学説を」 bổ nghĩa cho động từ hành động chính 「発表してしまい」 ở vế sau."
も,～もの／～ことも　V－ない　V－る　もの／こと　もV－ない,N2,①寝坊したので、食べるものも食べないであわてて会社へ行った。,受験生は極度の緊張から、休むことも休めないで勉強を続けている。,受験生は,極度の緊張から、,休むことも,休めないで,勉強を,続けている。,"Cấu trúc lặp ""V-る ことも V-potential-ない"" (hoặc ""V-る ものも V-ない"") diễn tả trạng thái cực đoan, ngay cả việc tối thiểu hoặc đương nhiên phải làm (ở đây là nghỉ ngơi 「休む」) cũng không thể làm được. Thứ tự sắp xếp: Lý do 「極度の緊張から」 dẫn đến trạng thái 「休むことも」 (việc nghỉ ngơi) + 「休めないで」 (không thể nghỉ ngơi được), tiếp theo là tân ngữ của hành động chính 「勉強を」 và động từ chính 「続けている」."
もう1,もう＋数量詞,N5,①すみません、もう5分ここにいてください。,先生、この問題が難しいので、もう一度説明してください。,先生、,この問題が,難しいので、,もう,一度,説明してください。,"Cấu trúc ""もう + số từ/lượng từ"" (ở đây là 「もう一度」) dùng để biểu thị việc lặp lại hành động thêm một lần nữa hoặc tăng thêm số lượng. Trình tự tự nhiên của câu: Nêu lý do 「この問題が難しいので」 (vì câu hỏi này khó), sau đó đặt phó từ 「もう」 đứng trước lượng từ 「一度」 để bổ nghĩa cho yêu cầu ở vế sau 「説明してください」 (xin hãy giải thích)."
もう1,もうすこし／もうちょっと＜量＞,N5,①もう少し、ミルクをください。,試験の前に、もう少し資料を読みたいです。,試験の,前に、,もう少し,資料を,読みたい,です。,"もう少し」 đóng vai trò phó từ chỉ số lượng ""thêm một chút nữa"". Ở đây, 「もう少し」 bổ nghĩa cho lượng danh từ 「資料」 (tài liệu). Thứ tự sắp xếp câu: Xác định thời điểm 「試験の前に」 (trước kỳ thi), tiếp theo là phó từ lượng chỉ mức độ tăng thêm 「もう少し」, đi liền trước tân ngữ 「資料を」 và kết thúc bằng cụm mong muốn 「読みたいです」."
もう1,もうすこし／もうちょっと＜程度＞,N4,①もう少しいい車を買いたい。,合格するために、もう少し難しい問題を練習しなければならない。,合格する,ために、,もう少し,難しい問題を,練習しなければ,ならない。,"もう少し」 ở đây chỉ mức độ (degree) - ""thêm một chút nữa (về mặt tính chất)"". Nó bổ nghĩa cho tính từ 「難しい」 (khó). Trình tự sắp xếp: Chỉ mục đích trước 「合格するために」, sau đó là trạng từ chỉ mức độ 「もう少し」 đặt ngay trước cụm tính từ + danh từ 「難しい問題を」, và cuối cùng là cụm biểu thị nghĩa vụ 「練習しなければならない」."
もう1,もうすこしでV－そうだった,N3,①もう少しでうまくいきそうだったのに、邪魔が入ってしまった。,昨日の模擬試験は、もう少しで満点が取れそうだったのに、最後にミスをした。,昨日の,模擬試験は、,もう少しで,満点が,取れそうだったのに、,最後にミスをした。,"Cấu trúc ""もう少しで + V-そうだった"" diễn tả một sự việc suýt chút nữa là xảy ra/suýt đạt được một trạng thái nào đó trong quá khứ. Ở đây, 「取れる」 (có thể lấy được) chuyển sang dạng phán đoán quá khứ là 「取れそうだった」 đi kèm với 「のに」 để biểu thị sự tiếc nuối. Thứ tự kết hợp: Chủ ngữ/chủ đề 「昨日の模擬試験は」, trạng từ chỉ trạng thái suýt soát 「もう少しで」, tân ngữ 「満点が」, cụm giả định suýt xảy ra 「取れそうだったのに」, và kết quả thực tế ở vế sau."
もう1,もうすこしでV－るところだった,N3,①もう少しでけがするところだった。,受験票を忘れて、もう少しで試験が受けられなくなるところだった。,受験票を,忘れて、,もう少しで,試験が,受けられなくなるところ,だった。,"Cấu trúc ""もう少しで + V-るところだった"" dùng để diễn tả một sự việc suýt nữa thì đã xảy ra (thường là kết quả xấu, ngoài ý muốn). Ở đây, động từ thể khả năng phủ định chuyển thành 「受けられなくなる」 (trở nên không thể dự thi) kết hợp với 「ところだった」 (suýt nữa thì). Thứ tự sắp xếp: Nguyên nhân 「受験票を忘れて」, phó từ suýt soát 「もう少しで」, chủ ngữ của vế phụ 「試験が」, cấu trúc suýt xảy ra 「受けられなくなるところ」, và kết thúc bằng trợ động từ quá khứ 「だった」."
もう2,もう＜完了＞,N5,①今日の仕事はもう全部終わった。,明日の試験の勉強は、もう全部終わりました。,明日の,試験の,勉強は、,もう,全部,終わりました。,"もう」 đóng vai trò là phó từ chỉ sự hoàn thành (đã... rồi). Thứ tự sắp xếp: Xác định danh từ làm chủ đề 「明日の試験の勉強は」 (việc học cho kỳ thi ngày mai), tiếp theo là phó từ chỉ sự hoàn thành 「もう」 kết hợp với phó từ chỉ mức độ toàn bộ 「全部」 để bổ nghĩa cho động từ chia ở thì quá khứ hoàn thành 「終わりました」."
もう2,もう＋時間／＋年齢,N5,①おしゃべりに夢中になっていたら、もう5時だ。,図書館で勉強していたら、もう夜の9時です。,図書館で,勉強して,いたら、,もう,夜の9時,です。,"もう + danh từ chỉ thời gian/tuổi tác」 biểu thị trạng thái thời gian hoặc độ tuổi đã đạt đến mốc đó (đã... rồi). Trình tự sắp xếp: Đưa ra giả định/phát hiện 「図書館で勉強していたら」 (khi đang học ở thư viện thì nhận ra), sau đó dùng 「もう」 để nhấn mạnh việc thời gian đã trôi qua nhanh, đứng ngay trước danh từ chỉ thời gian 「夜の9時」 và kết thúc bằng 「です」."
もう2,もうNaだ／もういい,N5,①もうおなかが一杯だ。,明日は大切な試験だから、もう準備は十分だ。,明日は,大切な,試験だから、,もう,準備は,十分だ。,"もう」 kết hợp với tính từ đuôi na 「十分だ」 (hoặc cấu trúc tương đương) để chỉ trạng thái đã đạt đến mức độ thỏa mãn/đầy đủ. Trình tự tự nhiên: Nêu nguyên nhân 「明日は大切な試験だから」 (vì ngày mai là kỳ thi quan trọng), tiếp theo là phó từ chỉ trạng thái hiện tại 「もう」 bổ nghĩa cho cụm danh từ chủ đề 「準備は」 và kết thúc bằng tính từ đuôi na 「十分だ」."
もう2,もう～ない,N5,①山田さんはもうここにはいません。,試験が終わったので、もう教室には誰もいません。,試験が,終わったので、,もう,教室には,誰も,いません。,"Cấu trúc ""もう + dạng phủ định (~ない)"" diễn tả ý nghĩa ""không còn... nữa"" (thay đổi trạng thái so với trước đây). Thứ tự kết hợp: Vế nguyên nhân chỉ sự kết thúc 「試験が終わったので」, theo sau bởi phó từ thay đổi trạng thái 「もう」, trạng ngữ chỉ địa điểm 「教室には」, từ nghi vấn làm đại từ phủ định 「誰も」 và động từ phủ định 「いません」."
もう2,もう＋否定的表現,N4,①こんな退屈な仕事はもうやめたい。,あのような難しい試験は、もう二度と受けたくない。,あのような,難しい試験は、,もう,二度と,受けたく,ない。,"Cấu trúc ""もう + biểu thức phủ định"" (ở đây là 「もう二度と～ない」) nhấn mạnh ý chí hoặc mong muốn không bao giờ lặp lại một hành động tiêu cực nào đó nữa. Thứ tự sắp xếp: Xác định đối tượng 「難しい試験は」, phó từ nhấn mạnh 「もう」 kết hợp với phó từ phủ định tuyệt đối 「二度と」 để bổ nghĩa trực tiếp cho động từ thể mong muốn phủ định 「受けたくない」."
もう2,もういい,N4,①A：ほかに出す書類がありますか。B：これでもういいです。,A：「この論文はまだ直すところがありますか。」B：「いいえ、これでもういいです。,A：「この論文はまだ直すところがありますか。」B：「いいえ、,これで,もう,いい,です,。,"Cụm ""もういい"" được dùng để biểu thị trạng thái ""đã ổn rồi/đã đủ rồi/không cần thêm nữa"". Trong ngữ cảnh thi cử học thuật này, việc sửa bài luận 「これで」 (bằng chừng này/đến mức này) kết hợp với 「もういいです」 để khẳng định bài viết đã đạt yêu cầu và không cần chỉnh sửa thêm. Trình tự: 「これで」 (với cái này) + 「もう」 (đã) + 「いい」 (tốt/được) + 「です」."
もう2,もう＜非難＞,N3,①お母さんたら、もう。わたしの友達の悪口を言うのはやめてよ。,教授ったら、もう。また私のレポートの細かいミスばかり指摘するんだから。,教授ったら、,もう。,また私の,レポートの,細かいミスばかり,指摘するんだから。,"Từ cảm thán 「もう」 ở đây được dùng độc lập để biểu thị thái độ bực bội, bất mãn hoặc trách móc (非難). Trình tự sắp xếp câu: Nêu đối tượng gây bực mình bằng cấu trúc suồng sã 「教授ったら」 (Giáo sư thật là...), theo sau ngay lập tức là từ cảm thán 「もう。」 để thể hiện sự ngán ngẩm, tiếp theo là trạng từ lặp lại 「また」 kết hợp cụm định ngữ 「私のレポートの」 bổ nghĩa cho danh từ 「細かいミスばかり」 (toàn lỗi nhỏ nhặt) và kết thúc bằng lời than phiền 「指摘するんだから」."
もうすぐ,,N5,①田中さんはもうすぐ来ます。,試験の開始時間はもうすぐですから、席に座ってください。,試験の,開始時間は,もうすぐ,ですから、,席に,座ってください。,"Phó từ 「もうすぐ」 có nghĩa là ""sắp sửa/chẳng mấy chốc"". Thứ tự sắp xếp câu: Xác định chủ đề câu 「試験の開始時間は」 (thời gian bắt đầu kỳ thi), đi kèm với trạng từ chỉ sự sắp sửa xảy ra 「もうすぐ」, nối tiếp bằng liên từ chỉ lý do 「ですから」 (vì sắp đến giờ rồi) để dẫn dắt hành động yêu cầu tiếp theo 「席に座ってください」 (hãy ngồi vào chỗ)."
もかまわず,N（に）もかまわず　Vの（に）もかまわず,N2,①喜びのあまり、人目もかまわず抱きついた。,彼は周囲の喧騒にもかまわず、図書館の片隅で猛勉強に没頭していた。,彼は,周囲の,喧騒にも,かまわず、,図書館の片隅で,猛勉強に没頭していた。,"Cấu trúc ""N（に）もかまわず"" mang ý nghĩa ""bất chấp/không bận tâm đến N"". Trong câu học thuật này, N là 「周囲の喧騒」 (sự ồn ào xung quanh). Thứ tự kết hợp: Chủ ngữ 「彼は」, cụm định ngữ 「周囲の」 bổ nghĩa cho danh từ 「喧騒にも」, đi với động từ phủ định dạng liên dụng 「かまわず」, sau đó là trạng ngữ chỉ địa điểm 「図書館の片隅で」 (ở một góc thư viện) và kết thúc bằng hành động chính 「猛勉強に没頭していた」 (mải miết học tập)."
もくされている,Nともくされている,N1,①今度の競馬では、マックィーンが一番人気と目されている。,彼の新規論文は、今年の学会賞の最有力候補ともくされている。,彼の新規論文は、,今年の,学会賞の,最有力候補と,もくされて,いる。,"Cấu trúc ""Nともくされている"" (được xem là/được đánh giá là N) dùng nhiều trong văn viết trang trọng, học thuật. Ở đây N là 「最有力候補」 (ứng cử viên nặng ký nhất). Thứ tự liên kết: Chủ đề của câu 「彼の新規論文は」, đi liền với định ngữ chỉ thời gian 「今年の」 bổ nghĩa cho 「学会賞の」, tiếp tục làm định ngữ cho danh từ chỉ vị trí/danh hiệu 「最有力候補と」, đi kèm với động từ bị động ở thể tiếp diễn 「もくされている」 để hoàn thành câu."
もさることながら,Nもさることながら,N1,①彼は、大学の成績もさることながら、スポーツ万能で親孝行という申し分のない息子だ。,この学説は、理論の新規性もさることながら、実用性の高さにおいても極めて優れている。,この学説は、,理論の,新規性も,さることながら、,実用性の高さに,おいても極めて優れている。,"Cấu trúc ""AもさることながらB"" có nghĩa là ""A là hiển nhiên rồi, nhưng ngay cả B cũng... (nhấn mạnh B)"". Ở đây, A là 「理論の新規性」 (tính mới mẻ của lý thuyết) và B là 「実用性の高さ」 (tính thực tiễn cao). Thứ tự sắp xếp câu: Đưa ra chủ đề nghiên cứu 「この学説は」, tiếp theo là danh từ phụ thuộc 「理論の」 bổ nghĩa cho danh từ chính 「新規性も」 kết hợp với cụm từ chức năng 「さることながら、」, tiếp tục dẫn ra vế so sánh thứ hai 「実用性の高さに」 và kết thúc bằng trạng từ + tính từ đánh giá 「おいても極めて優れている」."
もし,後に条件表現を伴い、ことがらを仮定的に設定する話し手の態度を表す副詞。文頭で用いられることが多い。類義表現に「かりに」「もしも」がある。「もしも」との違いについては「もしも」を参照。もし～たら,N4,①もし雨が降ってきたら、洗濯物を取り込んでおいてね。,もし来週の試験に合格したら、新しいパソコンを買ってもらうつもりだ。,もし,来週の,試験に,合格,したら、,新しいパソコンを買ってもらうつもりだ。,"Phó từ 「もし」 đặt đầu câu biểu thị giả định, thường đi kèm với các đuôi câu điều kiện như 「～たら」, 「～ば」. Thứ tự kết hợp: Khởi đầu bằng trạng từ giả định 「もし」, đi liền sau đó là định ngữ thời gian 「来週の」 bổ nghĩa cho mục tiêu hành động 「試験に」, kết hợp với động từ danh từ hóa hành động 「合格」 chia ở thể điều kiện quá khứ 「したら」 để tạo thành vế giả định 「もし来週の試験に合格したら」, trước khi chuyển sang kết quả mong muốn ở vế sau 「新しいパソコンを買ってもらうつもりだ」."
