Grammar,Usage,Meaning,Reference Example,Original Example,Prefix,Chunk1,Chunk2,Chunk3,Chunk4,Suffix,Explanation
あと1,～あと　Nのあと　V－たあと,,①試験の後はいつも気分が落ち込む。,ご飯を食べたあとはしっかり歯を磨きなさい。,ご飯を,食べた,あとは,しっかり,歯を,磨きなさい。,Cấu trúc 'V-たあと' diễn tả một hành động xảy ra sau khi kết thúc hành động khác. Động từ thể quá khứ '食べた' kết hợp trực tiếp với 'あとは'. Phó từ 'しっかり' đứng trước cụm '歯を磨きなさい' để bổ nghĩa cho hành động.
あと1,～あと（で／に）　Nのあと　で／に　V－たあと　で／に,,①田中さんにはお世話になったから、引っ越しの後で改めてお礼にうかがおう。,買い物の後でカフェに行って休もう。,,買い物の,後で,カフェに,行って,休もう。,"'Nの後で' biểu thị mốc thời gian sau một danh từ chỉ hành động (買い物). Cụm chỉ thời gian này đứng đầu câu, theo sau là danh từ chỉ nơi chốn kèm trợ từ 'カフェに', động từ nối '行って' và kết thúc bằng thể chí hướng '休もう'."
あと1,V－たあとから,,①募集を締め切ったあとから応募したいと言ってこられても困る。,約束を決めたあとから時間を変更したいと言われても困るよ。,約束を,決めた,あとから,時間を変更したいと,言われても,困るよ。,"Mẫu 'V-たあとから' diễn tả sự việc muộn màng xảy ra ngay sau khi một quyết định đã cố định. Thứ tự đi từ hành động gốc '決めた' nối với 'あとから', tiếp đến là nội dung yêu cầu '時間を変更したいと' đi với thể bị động giả định '言われても'."
あと2,あと,,①料理はこのくらいあれば十分ですね。あと、飲み物はこれで足りますか。,今日の夕食はカレーだよ。あと、冷蔵庫にプリンもあるからね。,今日の夕食はカレーだよ。,あと、,冷蔵庫に,プリンも,あるから,ね。,"'あと' đóng vai trò là liên từ đứng đầu câu tiếp theo để bổ sung thông tin. Sau liên từ là trạng ngữ chỉ vị trí '冷蔵庫に', chủ ngữ với trợ từ nhấn mạnh 'プリンも', và mệnh đề lý do 'あるから' đi kèm vĩ từ thân mật 'ね'."
あと2,あと＋数量詞,,①その仕事を片づけるにはあと3日で十分です。,楽しい時間はすぐに過ぎるね。あと1時間で家へ帰らなきゃいけない。,楽しい時間はすぐに過ぎるね。,あと,1時間で,家へ,帰らなきゃ,いけない。,"'あと + Số lượng từ' biểu thị giới hạn hoặc lượng còn lại. Cụm 'あと1時間で' đóng vai trò trạng ngữ chỉ thời gian giới hạn, tiếp theo là danh từ chỉ hướng đi '家へ' và cấu trúc bắt buộc '帰らなきゃいけない'."
あとから,,,①あとから文句を言われても困るので、何か言いたいことがある人は今のうちに出してください。,先に店に入って注文してて。私はあとからすぐに追いかけるから。,先に店に入って注文してて。,私は,あとから,すぐに,追いかける,から。,'あとから' làm trạng từ chỉ thời gian hành động muộn hơn người khác. Thứ tự sắp xếp tự nhiên theo cú pháp: Chủ ngữ '私は' -> Trạng từ thời gian 'あとから' -> Trạng từ mức độ 'すぐに' -> Động từ chính '追いかける'.
あとで,,,①あとでまた電話します。,今は忙しいから、宿題はあとでまとめてやるつもりだ。,今は忙しいから、,宿題は,あとで,まとめて,やる,つもりだ。,'あとで' là trạng từ chỉ thời điểm trong tương lai gần. Câu cấu trúc theo thứ tự: Chủ đề đưa lên đầu '宿題は' -> Trạng từ thời gian 'あとで' -> Trạng từ cách thức 'まとめて' -> Động từ hành động 'やる' bổ nghĩa cho cấu trúc dự định 'つもりだ'.
あとは～だけ,,,①メンバーはほとんどそろって、あとは田中さんだけなのだが、なぜか予定の時刻を過ぎても現れる気配がない。,野菜は全部切ったから、あとはお肉をフライパンで炒めるだけだ。,野菜は全部切ったから、,あとは,お肉を,フライパンで,炒める,だけだ。,"Cấu trúc 'あとは～だけ' thể hiện giai đoạn cuối cùng của công việc. 'あとは' mở đầu vế câu, theo sau là tân ngữ 'お肉を', danh từ chỉ công cụ 'フライパンで' bổ nghĩa cho động từ nguyên dạng '炒める' đi kèm cú pháp 'だけだ'."
あまり,話しことばで強めるときには「あんまり」となる。あまり／あんまり～ない　あまりNaではない　あまりA－くない　あまりV－ない,,①今はあまりおなかがすいていないので、ケーキはいりません。,この服のデザインは可愛いけど、値段があんまり安くないね。,この服のデザインは可愛いけど、,値段が,あんまり,安く,ない,ね。,'あんまり' bổ nghĩa cho thể phủ định của tính từ để giảm nhẹ mức độ phán đoán. Thứ tự cấu trúc: Chủ ngữ '値段が' -> Phó từ 'あんまり' -> Tính từ đuôi i đổi thành thể liên dụng '安く' -> Trợ động từ phủ định 'ない'.
あまり,あまりに（も）　あんまり（にも）,,①あまりにおかしくて涙が出た。,弟の部屋があっても汚くて足の踏み場もない。,,弟の部屋が,あまりにも,汚くて,足の踏み場も,ない。,'あまりにも' đứng trước tính từ '汚くて' để nhấn mạnh mức độ nghiêm trọng vượt quá bình thường. Cụm tính từ này bổ nghĩa nguyên nhân cho kết quả phía sau là thành ngữ '足の踏み場もない' (không có chỗ đặt chân).
あまり,あまりのN　に／で,,①あまりの驚きに声も出なかった。,スープがあまりの辛さに一口も飲むことができなかった。,スープが,あまりの,辛さに,一口も,飲むことが,できなかった。,'あまりの + Danh từ + に' chỉ nguyên nhân cực đại gây ra một trạng thái bất khả kháng. Thứ tự sắp xếp: Chủ thể 'スープが' -> Cụm nguyên nhân 'あまりの辛さに' -> Lượng từ giới hạn '一口も' -> Thể phủ định khả năng '飲むことができなかった'.
あまり,あまりに（も）～と　あんまり（にも）～と,,①あまりボリュームを上げると隣の人が文句を言いに来るから気をつけてね。,あんまりにも夜遅く寝ると次の日の朝が辛いよ。,,あんまりにも,夜遅く,寝ると,次の日の朝が,辛いよ。,'あんまりにも' đi kèm và bổ nghĩa cho cụm trạng từ thời gian '夜遅く' và động từ điều kiện '寝ると'. Vế sau thể hiện hệ quả tất yếu đối với chủ ngữ '次の日の朝が' đi với tính từ '辛いよ'.
あまり,～あまり（に）Nのあまり（に）　V－るあまり（に）,,①母は悲しみのあまり、病の床に就いてしまった。,欲しかったチケットが取れて、嬉しさのあまり友達に大声で電話した。,欲しかったチケットが取れて、,嬉しさの,あまり,友達に,大声で,電話した。,"'Danh từ chỉ cảm xúc + のあまり' đóng vai trò trạng ngữ chỉ nguyên nhân do cảm xúc quá độ. Sau cụm từ này là đối tượng tiếp nhận hành động '友達に', trạng từ cách thức '大声で' và động từ hành động '電話した'."
あまり,数量詞＋あまり,,①その会の出席者は100名あまりだった。,一緒に住み始めてから、もう3年あまりが速く経ちました。,一緒に住み始めてから、,もう,3年,あまりが,速く,経ちました。,"'数量詞 + あまり' bổ nghĩa cho số lượng để chỉ mức độ nhiều hơn một chút. Cụm '3年あまりが' đóng vai trò chủ ngữ trong vế câu, đứng trước trạng từ chỉ cách thức '速く' và động từ '経ちました'."
あらためる,R－あらためる,,①この文章の内容を子供向けに書き改めてくださいませんか。,すみません、サイズが合わないので、別の服を一から選びあらためることにします。,すみません、サイズが合わないので、,別の服を,一から,選び,あらためる,ことにします。,Mẫu ghép động từ 'V-stem + あらためる' biểu thị việc thực hiện lại hành động đó. Tân ngữ '別の服を' và trạng từ '一から' đứng trước để bổ nghĩa cho động từ phức. Động từ thể ます bỏ ます là '選び' phải đi liền trước 'あらためる'.
あるいは,N（か）あるいはN,,①黒あるいは青のペンで記入してください。,お支払いは現金あるいはクレジットカードで支払うようお願いします。,お支払いは,現金,あるいは,クレジットカードで,支払うよう,お願いします。,'あるいは' đóng vai trò liên từ nối hai danh từ lựa chọn ngang hàng '現金' và 'クレジットカード'. Trợ từ 'で' đi sau danh từ thứ hai để chỉ phương thức cho hành động '支払うよう' và động từ kết câu 'お願いします'.
あるいは,～か、あるいは,,①申し込み書類は、郵送するかあるいは事務所まで持参してください。,今週末は映画を見に行くか、あるいは家でゲームをしよう。,今週末は,映画を見に,行くか、,あるいは,家でゲームを,しよう。,"Dùng để nối hai mệnh đề lựa chọn hành động. Mệnh đề thứ nhất kết thúc bằng thể từ điển + か '行くか、', tiếp theo là liên từ 'あるいは', sau đó là cụm danh từ + tân ngữ của vế hai '家でゲームを' và kết thúc bằng thể ý chí 'しよう'."
あるいは,あるいは～かもしれない,,①このぶんでは、明日はあるいは雪かもしれない。,夕方からあるいは雨が降るかもしれないから、洗濯物を取り込んで。,夕方から,あるいは,雨が,降るかも,しれないから,洗濯物を取り込んで。,'あるいは' đứng đầu mệnh đề phỏng đoán để tăng sắc thái cho cấu trúc '～かもしれない'. Thứ tự tự nhiên: Trạng từ 'あるいは' -> Chủ ngữ '雨が' -> Cụm động từ phỏng đoán '降るかもしれない' kết hợp trợ từ chỉ lý do 'から'.
あるいは,あるいは～あるいは,,①高校を卒業した学生たちは、あるいは進学し、あるいは就職し、それぞれの進路を歩み始める。,今年の夏休み、友達はあるいは海へ行き、あるいは山へ登ったりして楽しそうだ。,今年の夏休み、友達は,あるいは海へ行き、,あるいは,山へ,登ったりして,楽しそうだ。,Cấu trúc lặp lại 'あるいは...あるいは...' dùng để liệt kê các hành động song song. Cú pháp chia tách theo mạch câu: Cụm hành động một 'あるいは海へ行き、' -> từ nối 'あるいは' -> bổ ngữ hướng đi '山へ' -> động từ liệt kê '登ったりして'.
あるまじき～だ,NにあるまじきNだ,,①業者から金品を受け取るなど公務員にあるまじきことだ。,子供に嘘をつくなんて、親にあるまじき卑劣な行為だ。,子供に嘘をつくなんて、,親に,あるまじき,卑劣な,行為,だ。,Cấu trúc 'N1にあるまじきN2' phê phán hành vi N2 không được phép có ở cương vị N1. Thứ tự bổ nghĩa bắt buộc: Danh từ cương vị + に '親に' -> Thành phần hạn định 'あるまじき' -> Tính từ bổ sung '卑劣な' -> Danh từ bị bổ nghĩa '行為'.
