Grammar,Usage,JLPT Level,Reference Example,Original Example,Prefix,Chunk1,Chunk2,Chunk3,Chunk4,Suffix,Explanation
せっかく,せっかく～からには,N2,①せっかく留学するからには、できる限り多くの知識を身につけて帰りたい。,せっかく新プロジェクトのリーダーに選ばれたからには、全力で成功させたいと思います。,せっかく,新プロジェクトの,リーダーに,選ばれた,からには、,全力で成功させたいと思います。,"「せっかく」 đi với 「からには」 thể hiện quyết tâm tận dụng cơ hội hiếm có trong công sở. 「新プロジェクトの」 bổ nghĩa cho danh từ 「リーダー」. 「リーダーに」 đi với động từ thể bị động 「選ばれた」 tạo thành mệnh đề điều kiện, theo sau là vế bày tỏ quyết tâm ý chí."
せっかく,せっかく～けれとも,N3,①せっかくここまできたけれども、雨がひどくなってきたから引き返そう。,せっかく取引先からご提案をいただきましたけれども、予算の都合でお断りせざるを得ません。,せっかく,取引先から,ご提案を,いただきました,けれども、,予算の都合でお断りせざるを得ません。,「せっかく」 thể hiện sự trân trọng đối với thành ý của đối tác. 「取引先から」 chỉ nguồn gốc hành động. 「ご提案を」 là tân ngữ của khiêm nhường ngữ 「いただきました」. 「けれども」 đóng vai trò liên từ nghịch tiếp nối với vế sau chỉ kết quả đáng tiếc.
せっかく,「せっかくXがY」などの形で、　Xにはまれな機会や努力、骨折りを伴ってなされた行為などが示され、　Yではそれが無駄になることが示され、無駄になって残念だ、申し訳ないなどの話し手の気持ちが表される。せっかく～のだから,N3,①せっかく来たのだから夕飯を食べて行きなさい。,せっかく遠方からお客様がお越しくださったのだから、丁寧にご案内してください。,せっかく,遠方から,お客様が,お越しくださった,のだから、,丁寧にご案内してください。,「せっかく...のだから」 nhấn mạnh một dịp đặc biệt hoặc công sức bỏ ra để đưa ra yêu cầu phù hợp ở vế sau. 「遠方から」 chỉ nơi chốn xuất phát. 「お客様が」 là chủ ngữ kết hợp với tôn kính ngữ 「お越しくださった」. Mệnh đề kết thúc bằng cấu trúc chỉ nguyên nhân 「のだから」.
せっかく,せっかく～のだったら,N3,①せっかくピアノを習うのだったら、少しくらい高くてもいい先生についた方がいい。,せっかく新しい会計システムを導入するのだったら、全社員向けの説明会を開くべきだ。,せっかく,新しい会計システムを,導入する,のだったら、,全社員向けの,説明会を開くべきだ。,「せっかく...のだったら」 đưa ra giả định dựa trên một sự kiện hoặc cơ hội có giá trị lớn trong doanh nghiệp. 「新しい会計システムを」 là tân ngữ của động từ 「導入する」. 「のだったら」 đóng vai trò đầu mối điều kiện giả định. Cụm 「全社員向けの」 đóng vai trò định ngữ bổ nghĩa cho danh từ bổ trợ phía sau.
せっかく,せっかく　～のに／～ても,N3,①せっかく招待していただいたのに、伺えなくてすみません。,せっかくお忙しい時間にお電話をいただいたのに、席を外しており大変失礼いたしました。,せっかく,お忙しい時間に,お電話を,いただいた,のに、,席を外しており大変失礼いたしました。,「せっかく...のに」 biểu thị sự tiếc nuối khi lòng tốt hoặc nỗ lực bị lãng phí do nghịch cảnh. 「お忙しい時間に」 là trạng ngữ chỉ thời gian bận rộn của khách hàng. 「お電話を」 là tân ngữ đi kèm khiêm nhường ngữ dạng nhận 「いただいた」. 「のに」 nối tiếp tương phản với vế cáo lỗi ở đuôi câu.
せっかく,せっかく＋連体修飾句＋N,N3,①せっかく書いた原稿をなくしてしまった。,せっかく作成した会議資料を社内に忘れてきてしまった。,せっかく,作成した,会議資料を,社内に,忘れてきて,しまった。,Cấu trúc 「せっかく + thể quá khứ định ngữ + Danh từ」 thể hiện danh từ đó là thành quả tốn nhiều công sức của nhân viên. 「作成した」 bổ nghĩa cho danh từ tân ngữ 「会議資料を」. 「社内に」 chỉ vị trí xảy ra lỗi. Động từ phối hợp 「忘れてきて」 kết thúc bằng vế tiếc nuối 「しまった」.
せっかく,せっかくですが,N3,①A：もう遅いですから、泊まっていらしたらいかがですか。B：せっかくですが、あしたは朝から用事がありますので。,A：本日の打ち合わせの後、食事でもいかがですか。B：せっかくですが、本日は先約がございますので、またの機会にお願いいたします。,A：本日の打ち合わせの後、食事でもいかがですか。B：せっかくですが、,本日は,先約が,ございます,ので、,またの機会にお願いいたします。,「せっかくですが」 là cụm từ cố định trong giao tiếp kinh doanh dùng để từ chối khéo léo lời mời lịch sự. 「本日は」 chỉ thời gian làm chủ đề. 「先約が」 đi với bổ ngữ lịch sự cao cấp 「ございます」. Liên từ chỉ lý do khách quan 「ので」 dẫn đến lời hẹn ước tinh tế ở cuối câu.
せっかく,せっかくですから,N3,①A：食事の準備がしてありますので、うちで召し上がってくださいよ。B：せっかくですから、お言葉に甘えて、そうさせていただきます。,A：よろしければ弊社の新製品の試供品をお持ち帰りください。B：せっかくですから、お言葉に甘えて、ありがたく頂戴いたします。,A：よろしければ弊社の新製品の試供品をお持ち帰りください。B：せっかくですから、,お言葉に,甘えて、,ありがたく,頂戴,いたします。,「せっかくですから」 thể hiện sự tiếp nhận lời mời hoặc ý tốt của đối phương một cách lịch sự. Cụm từ kinh doanh cố định 「お言葉に」「甘えて」 mang ý nghĩa xin nghe theo lời đề nghị của anh/chị. Trạng từ 「ありがたく」 bổ nghĩa cho khiêm nhường ngữ hành động nhận 「頂戴いたします」.
せつな,V－たせつな,N1,①目を離したせつな、子供は波にのまれていった。,契約書にサインをしたせつな、担当者の態度が急に冷たくなった。,契約書に,サインを,した,せつな、,担当者の態度が,急に冷たくなった。,Cấu trúc 「V-たせつな」 biểu thị một sự việc xảy ra ngay tích tắc sau khi hành động trước vừa hoàn thành. 「サインを」 là tân ngữ của động từ quá khứ định ngữ 「した」. Kết hợp tạo thành trạng ngữ 「したせつな」. Vế sau bắt đầu bằng chủ ngữ 「担当者の態度が」 và kết thúc bằng hành vi thay đổi đột ngột.
ぜひ,,N5,①ぜひ一度遊びにきてください。,明日の会議にぜひ来てください。お願いします。,明日の,会議に,ぜひ,来て,ください。,お願いします。,Phó từ 「ぜひ」 dùng để nhấn mạnh ý muốn thiết tha hoặc lời mời gọi nồng nhiệt. 「明日の」 bổ nghĩa cho danh từ chỉ địa điểm mục tiêu 「会議に」. 「ぜひ」 đứng ngay trước động từ thể Te 「来て」 để bổ sung ý nghĩa thúc đẩy. Cấu trúc yêu cầu căn bản được hoàn thành bằng dạng lịch sự 「てください」.
せめて,せめて,N3,①夏はせめて一週間ぐらい休みがほしい。,繁忙期でも、せめて週に一日は休みがほしいです。,繁忙期でも、,せめて,週に,一日は,休みが,ほしいです。,Phó từ 「せめて」 diễn tả mong muốn một mức độ tối thiểu để người nói cảm thấy mãn nguyện trong hoàn cảnh hạn chế. 「繁忙期でも」 thiết lập bối cảnh bận rộn cao điểm. 「週に」 chỉ tần suất thời gian. 「一日は」 làm rõ số lượng tối thiểu đi kèm chủ ngữ 「休みが」 cần thiết cho tính từ nguyện vọng 「ほしいです」.
せめて,せめて～だけでも,N3,①せめて一晩だけでも泊めてもらえませんか。,お忙しいのは承知しておりますが、せめて資料に目を通すだけでもお願いできませんか。,お忙しいのは承知しておりますが、,せめて,資料に,目を通す,だけでも,お願いできませんか。,Sự kết hợp 「せめて～だけでも」 nhằm đưa ra một đề nghị ở mức thấp nhất có thể đáp ứng nhằm giảm áp lực cho đối phương. 「資料に」 đi liền cụm từ chức năng 「目を通す」 (xem qua tài liệu). Thêm 「だけでも」 tạo giới hạn tối thiểu cuối cùng dẫn tới mẫu nhờ vả giảm nhẹ dạng phủ định lịch sự 「お願いできませんか」.
せめて,せめて～なりとも,N2,①せめて一目なりとも子供に会いたいものだ。,重要なお取引ですので、せめてメールなりとも一筆ご挨拶を差し上げるべきでした。,重要なお取引ですので、,せめて,メール,なりとも,一筆ご挨拶を,差し上げるべきでした。,Mẫu cấu trúc mang tính văn viết kinh doanh 「せめて～なりとも」 đề xuất một giải pháp tối thiểu thay thế cho điều lý tưởng. 「メール」 là danh từ phương thức kết hợp trợ từ 「なりとも」. Cụm danh từ tân ngữ 「一筆ご挨拶を」 đi kèm động từ khiêm nhường hệ quá khứ 「差し上げるべきでした」 chỉ sự nuối tiếc về nghĩa vụ.
せめて,せめてものN,N2,①ひどい事故だったが、死者が出なかったのがせめてもの救いだ。,トラブルはありましたが、納期に間に合ったのがせめてもの救いです。,トラブルはありましたが、,納期に,間に合った,のが,せめてもの,救いです。,Cụm từ 「せめてもの」 đóng vai trò bổ nghĩa cho danh từ theo sau nhằm diễn đạt điều may mắn ít ỏi trong hoàn cảnh tồi tệ. 「納期に」 bổ nghĩa hướng cho tự động từ quá khứ 「間に合った」. Trợ từ hóa danh từ 「のが」 biến vế trước thành chủ ngữ dẫn trực tiếp đến cụm định ngữ khẳng định 「せめてもの救いです」.
せられたい,Nせられたい　R－られたい,N1,①上記三名の者ただちに出頭せられたい。,本件に関する報告書は、今週金曜日までに提出せられたい。以上。,本件に関する報告書は、,今週,金曜日までに,提出,せられたい。,以上。,Mẫu 「Nせられたい」 (thể bị động trang trọng cổ) là văn phong mệnh lệnh hành chính chuyên dụng trong văn bản thông báo hoặc chỉ thị nội bộ doanh nghiệp. 「本件に関する報告書は」 cấu thành chủ đề chính. Cụm thời gian hạn chót 「今週」「金曜日までに」 bổ nghĩa trực tiếp cho hành động yêu cầu hành chính 「提出せられたい」.
ぜんぜん～ない,,N5,①テレビ、消そう。ぜんぜんおもしろくない。,このパソコンは古いので、ぜんぜん動きません。困りました。,このパソコンは,古いので、,ぜんぜん,動き,ません。,困りました。,Trạng từ phủ định tuyệt đối 「ぜんぜん」 bắt buộc đi với thể phủ định ở cuối câu nhằm chỉ trạng thái hoàn toàn không. 「このパソコンは」 là chủ thể. 「古いので」 chỉ nguyên nhân khách quan ở cấp độ sơ cấp. 「ぜんぜん」 bổ nghĩa trực tiếp cho động từ chia thể phủ định 「動きません」.
そう～ない,,N3,①夕食はそうおいしくなかったが全部食べた。,今月の売上目標を達成するのは、そう簡単ではない。,今月の,売上目標を,達成するのは、,そう,簡単では,ない。,Cấu trúc nhấn mạnh giảm nhẹ mức độ 「そう～ない」 mang ý nghĩa không đến mức như vậy. 「今月の」 bổ nghĩa danh từ. Mệnh đề danh từ hóa đóng vai trò chủ ngữ 「売上目標を達成するのは」 đứng đầu câu. Phó từ phủ định nhẹ 「そう」 đứng trước cụm tính từ đuôi na phủ định ngắn 「簡単ではない」.
そういえば,,N4,①A：なんだか今夜はしずかね。B：そういえばいつものカラオケがきこえないね。,A：田中部長、まだ出社されていませんね。B：そういえば、今日は直行でクライアントのオフィスへ行くとおっしゃっていました。,A：田中部長、まだ出社されていませんね。B：そういえば、,今日は,直行で,クライアントのオフィスへ,行くと,おっしゃっていました。,Liên từ 「そういえば」 dùng để khơi gợi một ký ức hoặc thông tin liên quan vừa chợt nhớ ra trong cuộc đối thoại công sở. 「今日は」 thiết lập mốc thời gian hành sự. Phương thức di chuyển thẳng 「直行で」 bổ nghĩa cho đích đến 「クライアントのオフィスへ」. Động từ 「行く」 kết hợp trợ từ trích dẫn 「と」 đi liền cấu trúc kính ngữ tôn kính 「おっしゃっていました」.
そうしたら,前の文と後の文を時間的な順序でつなぐ用法。さらにくだけた言い方に「そしたら」がある。そうしたら＜未果＞,N4,①娘は大学に入ったら下宿すると言っている。そうしたら、家の中が静かになるだろう。,来月から新しい営業ツールを導入します。そうしたら、業務の効率がもっと上がるでしょう。,来月から新しい営業ツールを導入します。そうしたら、,業務の,効率が,もっと,上がる,でしょう。,Liên từ nối kết câu mang tính giả định tương lai chưa xảy ra 「そうしたら＜未果＞」 chỉ kết quả tất yếu nếu hành động trước thực hiện. Mệnh đề sở hữu 「業務の」 xác định phạm vi cho chủ ngữ 「効率が」. Trạng từ mức độ tăng tiến 「もっと」 bổ nghĩa cho tự động từ phát triển 「上がる」 dưới dạng phán đoán lịch sự 「でしょう」.
そうしたら,そうしたら＜過去＞,N4,①暑いので窓を開けた～そうしたら大きなガが飛び込んで来た。,先ほどサポートセンターに問い合わせました。そうしたら、すぐに解決方法を教えてくれました。助かりました。,先ほどサポートセンターに問い合わせました。そうしたら、,すぐに,解決方法を,教えて,くれました。,助かりました。,Liên từ nối kết câu mang tính hệ quả quá khứ 「そうしたら＜過去＞」 chỉ một kết quả xảy ra ngoài mong đợi sau một hành động cụ thể. Trạng từ tốc độ 「すぐに」 đi trước bổ nghĩa cho tân ngữ hành vi 「解決方法を」. Động từ kết hợp thể Te 「教えて」 đi liền cấu trúc nhận ơn huệ hành động từ đối phương 「くれました」.
