Grammar,Usage,JLPT Level,Reference Example,Original Example,Prefix,Chunk1,Chunk2,Chunk3,Chunk4,Suffix,Explanation
について,Nについて,N4,①農村の生活様式について調べている。,今回のプロジェクトのスケジュールについて会議で話し合います。,今回の,プロジェクトの,スケジュール,について,会議で,話し合います。,プロジェクトの bổ nghĩa cho danh từ スケジュール. Cấu trúc Nについて (về N) đi sau danh từ để chỉ chủ đề. 会議で chỉ địa điểm diễn ra hành động. 話し合います là động từ kết thúc câu.
について,N＋数量詞＋について,N3,①車1台について5千円の使用料をちょうだいします。,弊社では資料1ページについて200円の印刷代を請求いたします。,弊社では,資料1ページ,について,200円の,印刷代を,請求いたします。,"弊社では làm chủ ngữ (tại công ty chúng tôi). 資料1ページ là Danh từ + Số lượng từ. Cấu trúc N＋数量詞＋について diễn tả tỷ lệ, mỗi một đơn vị N. 200円の bổ nghĩa cho danh từ 印刷代. 請求いたします là dạng khiêm nhường ngữ của 請求します làm vị ngữ kết thúc câu."
につき,Nにつき＜関して＞,N2,①本部の移転問題につき審議が行われた。,本日の会議では新規事業の進捗状況につきご報告申し上げます。,本日の会議では,新規事業の,進捗状況,につき,ご報告,申し上げます。,"本日の会議では là trạng ngữ chỉ bối cảnh. 新規事業の bổ nghĩa cho 進捗状況. につき ở đây mang nghĩa là liên quan đến/về (=に関して), trang trọng hơn について. ご報告申し上げます là thể khiêm nhường của 報告します đóng vai trò vị ngữ kết thúc câu."
につき,Nにつき＜理由＞,N2,①改装中につきしばらくお休みさせていただきます。,本日は社内研修につき17時で営業を終了させていただきます。,本日は,社内研修,につき,17時で営業を,終了させて,いただきます。,"本日は là trạng ngữ thời gian. 社内研修につき thể hiện lý do (vì lý do đào tạo nội bộ), mẫu Nにつき dùng nhiều trong thông báo trang trọng. 17時で営業を chỉ thời gian và đối tượng hành động. 終了させていただきます là cách nói xin phép lịch sự trong kinh doanh (cho phép chúng tôi kết thúc...)."
につき,N＋数量詞＋につき,N2,①参加者200人につき、5人の随行員がついた。,商品のご注文100個につき10個のサンプルを無料で差し上げます。,商品の,ご注文100個,につき,10個のサンプルを,無料で,差し上げます。,商品の bổ nghĩa cho ご注文100個. N＋数量詞＋につき biểu thị tỷ lệ (cứ mỗi 100 đơn hàng). 10個のサンプルを là đối tượng của hành động. 無料で là trạng từ chỉ phương thức (miễn phí). 差し上げます là khiêm nhường ngữ của あげる kết thúc câu.
につけ,Nにつけ,N2,①何事につけ我慢が肝心だ。,仕事では何事につけ事前の準備が成功の鍵となります。,仕事では,何事,につけ,事前の準備が,成功の,鍵となります。,仕事では thiết lập bối cảnh công việc. 何事につけ có nghĩa là dù trong bất kỳ việc gì/chuyện gì. 事前の準備が làm chủ ngữ cho vế sau. 成功の bổ nghĩa cho 鍵 (yếu tố quyết định). 鍵となります thành ngữ kết thúc câu.
につけ,V－るにつけ,N2,①彼女の姿を見るにつけ、その時のことが思い出される。,先輩の素晴らしいプレゼンを見るにつけ自分の未熟さを痛感します。,先輩の素晴らしい,プレゼンを,見る,につけ,自分の未熟さを,痛感します。,"先輩の素晴らしい bổ nghĩa cho プレゼン. V-るにつけ nghĩa là mỗi lần nhìn/làm V thì luôn có cảm xúc..., đi sau động từ thể từ điển 見る. 自分の未熟さを là tân ngữ của động từ tâm trạng 痛感します (thấu hiểu sâu sắc/thấm thía) ở cuối câu."
につけ,～につけ～につけ　AにつけAにつけ　VにつけVにつけ,N1,①いいにつけ悪いにつけ、あの人達の協力を仰ぐしかない。,景気が良いにつけ悪いにつけ我が社は常に独自の技術開発に注力すべきです。,景気が,良いにつけ,悪いにつけ,我が社は常に独自の,技術開発に,注力すべきです。,"景気が làm chủ ngữ cho tính từ. AにつけBにつけ có nghĩa dù A hay dù B, trong cả 2 trường hợp... 我が社は常に独自の chỉ chủ ngữ (công ty chúng ta luôn có... riêng). 技術開発に bổ ngữ cho hành động. 注力すべきです thể hiện lời khuyên/khẳng định mang tính nghĩa vụ ở cuối câu."
につれて,Nにつれて　V－るにつれて,N3,①町の発展につれて、前になかった新しい問題が生まれて来た。,事業の拡大につれて新しいオフィスの開設が必要になってきました。,事業の,拡大,につれて,新しいオフィスの開設が,必要に,なってきました。,事業の bổ nghĩa cho danh từ 拡大. Nにつれて chỉ sự thay đổi kéo theo (cùng với sự mở rộng). 新しいオフィスの開設が làm chủ ngữ cho vế sau (việc mở văn phòng mới). 必要に bổ nghĩa cho động từ xu hướng なってきました (trở nên cần thiết) ở cuối câu.
にて,Nにて,N3,①校門前にて写真撮影を行います。,本日のセミナーは3階の第1会議室にて開催いたします。,本日のセミナーは,3階の,第1会議室,にて,開催,いたします。,"本日のセミナーは là chủ đề của câu. 3階の bổ nghĩa cho địa điểm 第1会議室. Nにて là trợ từ cách thức/địa điểm, mang tính trang trọng hơn で, dùng nhiều trong bối cảnh công sở. 開催いたします dạng khiêm nhường của 開催します đóng vai trò vị ngữ."
にとって,Nにとって,N3,①彼にとってこんな修理は何でもないことです。,顧客からのフィードバックは我が社にとって最も貴重な財産です。,顧客からの,フィードバックは,我が社,にとって,最も貴重な,財産です。,顧客からの bổ nghĩa cho フィードバックは. Nにとって nghĩa là đối với N (đứng trên lập trường của N để đánh giá). 最も貴重な tính từ bổ nghĩa cho danh từ 財産. 財産です kết thúc câu khẳng định.
にどと～ない,にどとV－ない,N3,①こんな恐ろしい思いは二度としたくない。,このような重大なミスは二度と起こさないように注意いたします。,このような,重大なミスは,二度と,起こさない,ように,注意いたします。,このような bổ nghĩa cho cụm danh từ 重大なミスは. 二度と (không bao giờ... nữa) đi kèm với động từ phủ định 起こさない. Cấu trúc ～ように注意する nghĩa là chú ý để làm/không làm gì đó. 注意いたします là thể khiêm nhường ngữ kết thúc câu nhằm hứa hẹn lịch sự.
にとどまらず,Nにとどまらず,N2,①その流行は大都市にとどまらず地方にも広がっていった。,我が社の製品は国内にとどまらず海外市場でも高く評価されています。,我が社の製品は,国内,にとどまらず,海外市場でも,高く,評価されています。,我が社の製品は là chủ đề câu. Nにとどまらず có nghĩa là không chỉ dừng lại ở N (mà còn lan rộng ra phạm vi lớn hơn). 海外市場でも biểu thị địa điểm bổ sung (ngay cả thị trường nước ngoài). 高く là trạng từ bổ nghĩa cho thể bị động khách quan 評価されています (được đánh giá cao).
にともない,Nにともない　Vのにともない,N2,①高齢化にともない、老人医療の問題も深刻になりつつある。,組織の改編にともない業務の担当者が変更とnarimashita。,組織の,改編,にともない,業務の担当者が,変更と,narimashita。,"組織の bổ nghĩa cho 改編. Nにともない nghĩa là đồng thời với/kéo theo N, dùng trong văn viết hoặc báo cáo công sở. 業務の担当者が làm chủ ngữ của vế sau. 変更となりました cách nói trang trọng thay cho 変更しました để chỉ một sự việc đã được quyết định đổi thay."
にともなって,Nにともなって　Vのにともなって,N2,①気温の上昇にともなって湿度も上がり蒸し暑くなってきた。,新システムの導入にともなって全社員向けの研修を実施いたします。,新システムの,導入,にともなって,全社員向けの,研修を,実施いたします。,新システムの bổ nghĩa cho 導入. Nにともなって tương tự にともない nhưng diễn tả sự việc kéo theo sinh động hơn. 全社員向けの định ngữ bổ nghĩa cho 研修. 実施いたします là khiêm nhường ngữ của 実施します (tiến hành) ở cuối câu.
になく,Nになく,N2,①店の中はいつになく静かだった。,今年の夏商戦はいつになく激しい競争が予想されます。,今年の,夏商戦は,いつ,になく,激しい競争が,予想されます。,今年の bổ nghĩa cho 夏商戦は (trận chiến thương mại mùa hè). いつになく là cụm cố định từ mẫu Nになく mang nghĩa khác hẳn mọi khi/khác với thường ngày. 激しい競争が làm chủ ngữ cho động từ bị động khách quan 予想されます (được dự đoán) ở cuối câu.
ににあわず,Nににあわず,N2,①いつもの佐藤さんに似合わず口数が少なかった。,いつも冷静な部長に似合わず今日の会議ではかなり興奮していらっしゃいました。,いつも冷静な,部長,に似合わず,今日の会議では,かなり興奮して,いらっしゃいました。,いつも冷静な bổ nghĩa cho danh từ 部長. Nに似合わず nghĩa là không giống như N mọi khi/không xứng với N. 今日の会議では trạng ngữ chỉ thời gian địa điểm. かなり興奮して bổ nghĩa cho hành động. いらっしゃいました là tôn kính ngữ của いました diễn tả trạng thái của cấp trên ở cuối câu.
には,Nには＜時・場所・方向・相手なと＞,N5,①春には桜が咲きます。,弊社の受付にはいつもパンフレットが置いてあります。,弊社の,受付,には,いつもパンフレットが,置いて,あります。,弊社の bổ nghĩa cho địa điểm 受付. Nには ở đây kết hợp trợ từ chỉ vị trí に và trợ từ nhấn mạnh は (tại nơi đó thì...). いつもパンフレットが trạng từ và tân ngữ của trạng thái. 置いてあります diễn tả một hành động đã làm và kết quả vẫn lưu lại.
には,Nには＜評価の基準＞,N4,①このセーターは私には大きすぎる。,この複雑なシステム開発は新人の彼にはまだ難しいと思います。,この複雑なシステム開発は,新人の,彼,には,まだ難しいと,思います。,この複雑なシステム開発は chủ đề câu. 新人の bổ nghĩa cho 彼. Nには ở đây đóng vai trò là tiêu chuẩn đánh giá (đối với anh ấy - một người mới). まだ難しいと bổ nghĩa cho suy nghĩ. 思います động từ kết thúc câu diễn tả ý kiến cá nhân.
には,Nには＜尊敬の対象＞,N1,①皆様にはお変わりなくお過ごしのことと存じます。,木村社長にはますますご健勝のこととお慶び申し上げます。,木村,社長,には,ますますご健勝のことと,お慶び,申し上げます。,"木村 là họ của đối tượng. 社長 chức danh. Nには đóng vai trò là trợ từ kính ngữ chỉ đối tượng được tôn kính (thường dùng ở đầu thư tín, email kinh doanh trang trọng). ますますご健勝のことと cụm từ chúc mừng sức khỏe tốt đẹp hơn nữa. お慶び biểu thị sự chúc mừng chân thành kết hợp với khiêm nhường ngữ 申し上げます ở cuối câu."
