Grammar,Usage,JLPT Level,Reference Example,Original Example,Prefix,Chunk1,Chunk2,Chunk3,Chunk4,Suffix,Explanation
こと,～こと＜ことがら＞　Nのこと　Naなこと　A／V　こと,N5,①なにかおもしろいことないかなあ。,社長に新しい仕事のことを話しました。,社長に,新しい,仕事の,ことを,話しました,。,「新しい」 là tính từ bổ nghĩa cho danh từ 「仕事」. Cụm 「仕事のこと」 mang nghĩa là 「việc về công việc」. Động từ 「話しました」 đi kèm trợ từ 「ことを」 đóng vai trò là tân ngữ trực tiếp của câu.
こと,～（という）こと＜事実＞,N4,①山田さんが魚がきらいなことを知っていますか。,部長が来週出張することを知っていますか。,部長が,来週,出張する,ことを,知っています,か。,Mệnh đề 「来週出張する」 bổ nghĩa cho danh từ khái niệm 「こと」 để tạo thành cụm danh từ mang nghĩa 「việc tuần tới đi công tác」. Cụm danh từ này làm tân ngữ cho động từ 「知っています」 thông qua trợ từ 「を」.
こと,V－る／V－ない　こと＜命令＞,N3,①休むときは、かならず学校に達終すること。,退社するときは、かならずパソコンの電源を切ること。,退社するときは、,かならず,パソコンの,電源を,切る,こと。,"「こと」 đặt ở cuối câu sau động từ thể từ điển (V-る) để đưa ra mệnh lệnh, quy định công sở. Trạng từ 「かならず」 và cụm tân ngữ 「パソコンの電源を」 được liên kết trước động từ một cách tự nhiên."
こと,だこと／なこと　A－いこと　V－ていること,N3,①まあ、かわいいあかちゃんだこと。,取引先の新しいオフィスはずいぶん広いこと。,取引先の,新しい,オフィスは,ずいぶん,広いこと,。,"Cấu trúc cảm thán 「A-いこと」 thể hiện ấn tượng mạnh mẽ của người nói về văn phòng mới của đối tác. Các thành phần bổ nghĩa cho danh từ bắt đầu từ sở hữu 「取引先の」 đến tính chất 「新しい」, phó từ 「ずいぶん」 bổ nghĩa cho tính từ."
こと,NことN,N2,①小泉八雲ことラフカデイオ・ハーンはギリシャ生まれのイギリス人だ。,弊社のトップセールスマンこと鈴木部長は今月も契約を取りました。,弊社の,トップセールスマン,こと,鈴木部長は,今月も契約を,取りました。,"Cấu trúc 「N1ことN2」 mang nghĩa là 「N2, người được mệnh danh là N1」. Định ngữ 「弊社の」 bổ nghĩa cho danh hiệu 「トップセールスマン」, đi trước 「こと」 rồi mới đến chủ ngữ cụ thể 「鈴木部長は」."
こと,Nのこと,N4,①私のこと、すき？,明日のスケジュールのこと教えてください。,明日の,スケジュール,のこと,教えて,ください,。,Cấu trúc 「N của こと」 dùng để nói về các vấn đề xoay quanh danh từ N (lịch trình). Cụm 「明日のスケジュールのこと」 đóng vai trò tân ngữ trực tiếp (được lược bớt trợ từ 「を」 trong hội thoại) đi với mẫu cầu khiến lịch sự 「教えてください」.
ことうけあいだ,,N1,①こんどあの人のところに行くときは花を持って行くといい。よろこんでもらえること請け合いだよ。,このプランを提案すれば、取引先が満足すること請け合いだ。,このプランを提案すれば、,取引先が,満足する,こと,請け合い,だ。,Mẫu câu 「V-ること請け合いだ」 thể hiện sự khẳng định chắc chắn một kết quả sẽ xảy ra. Chủ ngữ của mệnh đề phụ 「取引先が」 đứng trước động từ thể từ điển 「満足する」 và kết hợp trực tiếp với cụm 「こと請け合いだ」.
ことか,疑問詞＋Naなことか　疑問詞＋　A／V　ことか,N2,①つまらない話を3時間も聞かされる身にもなってください。どれほど退屈なことか。,このプレゼンの準備に、どれほど多くの時間を費やしたことか。,このプレゼンの準備に、,どれほど,多くの時間を,費やした,ことか,。,Mẫu cảm thán 「疑問詞 + V-た + ことか」 dùng để nhấn mạnh mức độ to lớn của sự việc (đã tốn bao nhiêu thời gian). Từ nghi vấn 「どれほど」 đứng trước bổ nghĩa cho cụm tân ngữ 「多くの時間を」 và động từ 「費やした」.
ことがある,V－たことが　ある／ない,N4,①A：京都へ行ったことがありますか。B：いいえ、まだないんです。,私は取引先の社長と話したことがあります。,私は,取引先の,社長と,話したことが,あります,。,"Mẫu 「V-たことがある」 diễn tả kinh nghiệm trong quá khứ. Cụm định ngữ 「取引先の」 đứng trước bổ nghĩa cho 「社長」, trợ từ 「と」 chỉ đối tượng giao tiếp cùng động từ 「話した」, đi liền với vế 「ことがあります」."
ことがある,V－る／V－ない　ことがある,N4,①子供たちは仲がいいのですが、たまに喧嘩をすることがあります。,会社のシステムは、たまに動かないことがあります。,会社のシステムは、,たまに,動かない,ことが,あります,。,Mẫu 「V-ないことがある」 diễn tả một sự việc thỉnh thoảng xảy ra. Trạng từ tần suất 「たまに」 đặt trước động từ thể phủ định 「動かない」 để bổ nghĩa cho trạng thái lỗi của hệ thống công ty.
ことができる,V－ることができる,N5,①アラビア語を話すことができますか。,この会議室でインターネットを使うことができます。,この会議室で,インターネットを,使う,ことが,できます,。,Mẫu 「V-ることができる」 biểu thị khả năng thực hiện hành động. Tân ngữ 「インターネットを」 đứng trước động từ thể từ điển 「使う」 để tạo thành vế bổ nghĩa cho cấu trúc 「ことができます」.
ことこのうえない,Naなことこのうえない　A－いことこのうえない,N1,①丁重なことこの上ないごあいさつをいただき、恐縮しております。,クライアントからお褒めの言葉をいただき、光栄なことこの上ない。,クライアントからお褒めの言葉をいただき、,光栄,な,こと,この上ない,。,Mẫu 「Naなことこの上ない」 diễn tả trạng thái ở mức độ cao nhất (không gì sánh bằng). Tính từ đuôi na 「光栄」 đi kèm đuôi 「な」 rồi kết hợp với cấu trúc 「ことこの上ない」 tạo thành vế vị ngữ kết câu sâu sắc.
ごとし,文語で現在では書きことばにしか用いない。「ごとし」は文末に用いられる形で、「ごときN」、「ごとくV」のように活用する。ごとし　Nのごとし　Nであるがごとし,N1,①光陰矢のごとし。,ビジネスの市場の変化は、流れる水のごとし。,ビジネスの市場の変化は、,流れる,水の,ごと,し,。,"Mẫu so sánh cổ 「N của ごとし」 mang nghĩa 「như là N」. Định ngữ 「流れる」 bổ nghĩa cho danh từ 「水」, đi với trợ từ 「の」 và từ chỉ sự ví von 「ごとし」 được chia tách thành 「ごと」 và 「し」 theo đúng cấu trúc ngữ pháp."
ごとし,～かのごとし,N1,①彼女はそのことを知っているはずなのに、まったく聞いたことがないかのごとき態度だった。,彼の作成した企画書は、まるで専門家が作ったかのごとし。,彼の作成した企画書は、,まるで,専門家が,作った,かのごとし,。,"Cấu trúc ví von giả định 「まるで～かのごとし」 (cứ như thể là). Trạng từ 「まるで」 định hướng cho vế giả định phía sau, mệnh đề 「専門家が作った」 kết hợp trực tiếp với đuôi câu 「かのごとし」 để hoàn thành ý so sánh."
ことだ,V－る／V－ない　ことだ,N3,①日本語がうまくなりたければもっと勉強することです。それいがいに方法はありません。,取引先と仕事をスムーズに進めたければ、こまめに連絡することだ。,取引先と仕事をスムーズに進めたければ、,こまめに,連絡,する,ことだ,。,"Mẫu 「V-ることだ」 dùng để đưa ra lời khuyên cốt lõi hoặc quy tắc cần thiết trong công việc. Trạng từ 「こまめに」 đứng trước bổ nghĩa cho động từ 「連絡する」, kết hợp với cụm kết thúc câu 「ことだ」."
ことだ,～ことだ　Naなことだ　A－いことだ,N3,①家族みんな健康で、けっこうなことだ。,大型プロジェクトが成功して、本当に喜ばしいことだ。,大型プロジェクトが成功して、,本当に,喜ばしい,こと,だ,。,"Mẫu 「A-いことだ」 dùng để bộc lộ cảm thán, đánh giá chủ quan của người nói về một sự kiện. Phó từ 「本当に」 bổ nghĩa cho tính từ đuôi i 「喜ばしい」, đi liền với cụm danh từ hóa cảm thán 「ことだ」."
ことだから,Nのことだから,N3,①彼のことだからどうせ時間どおりにはこないだろう。,真面目な田中部長のことだからきっと資料を準備しているだろう。,真面目な,田中部長の,ことだから,きっと資料を,準備している,だろう。,"Mẫu 「N của ことだから」 đưa ra phán đoán dựa trên tính cách, đặc điểm quen thuộc của đối tượng N. Tính từ 「真面目な」 bổ nghĩa cho 「田中部長」, đi kèm cấu trúc 「ことだから」, theo sau là cụm phó từ và động từ phán đoán."
ことだし,であることだし　Naなことだし　A／V　ことだし,N3,①雨がふってきそうだから、きょうは散歩はやめておこうか。こどもたちもかぜをひいていることだし。,会議の資料も完成したことだし、今日は早く帰りましょう。,会議の資料も,完成した,ことだし、,今日は,早く,帰りましょう。,"Mẫu 「～ことだし」 nêu lên một lý do tiêu biểu trong số nhiều lý do để thực hiện hành động tiếp theo. Động từ thể quá khứ 「完成した」 kết hợp trực tiếp với 「ことだし」 làm vế nối lý do, vế sau gồm trạng từ bổ nghĩa cho động từ."
ことだろう,な／である　ことだろう　A／V　ことだろう,N2,①ながいあいだ会っていないが、山田さんのこどもさんもさぞおおきくなったことだろう。,今期の売上が大幅に伸びて、社長もさぞお喜びのことだろう。,今期の売上が大幅に伸びて、,社長も,さぞ,お喜びの,ことだろう,。,"Cấu trúc phán đoán đồng cảm 「さぞ～ことだろう」 (chắc hẳn là...). Chủ ngữ 「社長も」 đi với phó từ tương hợp 「さぞ」, bổ nghĩa cho cụm danh từ kính ngữ 「お喜び」 kết hợp với đuôi phán đoán 「ことだろう」."
ことで,Nのことで,N4,①さっきのお話のことで質問があるんですが。,今回の契約のことで、少し相談したいことがあります。,今回の,契約の,ことで、,少し相談したい,ことが,あります。,"Mẫu 「N của ことで」 chỉ chủ đề hoặc nguyên nhân sự việc (về việc...). Từ chỉ định 「今回の」 bổ nghĩa danh từ 「契約」, đi với trợ từ 「ことで」 làm trạng ngữ, phía sau là mệnh đề bổ nghĩa cho danh từ 「こと」 kết thúc bằng 「あります」."
