Grammar,Usage,JLPT Level,Reference Example,Original Example,Prefix,Chunk1,Chunk2,Chunk3,Chunk4,Suffix,Explanation
ひととおり,ひととおりではない,N2,①成功するまでの彼の努力は、一通りではなかった。,新規プロジェクトの立ち上げに際し、鈴木部長からいただいたご指導はひととおりではないほど貴重なものでした。,新規プロジェクトの立ち上げに際し、,鈴木部長から,いただいたご指導は,ひととおり,ではないほど,貴重なものでした。,"Liên kết danh từ chỉ hành động kính ngữ 「ご指導」 làm chủ ngữ đi với trợ từ 「は」. Cụm 「ひととおりではない」 mang ý nghĩa 「không phải tầm thường/rất nhiều」, bổ nghĩa cho tính từ tiếp theo qua hình thức liên kết 「ではないほど」 để nhấn mạnh mức độ quý giá của sự chỉ dẫn."
ひとり～だけでなく,ひとりNだけでなく,N1,①子供のいじめは、ひとり日本だけでなく世界諸国の問題でもある。,AI技術の導入は、ひとり我が社だけでなく業界全体の業務プロセスを変革するでしょう。,AI技術の導入は、,ひとり,我が社,だけでなく,業界全体の,業務プロセスを変革するでしょう。,Cấu trúc ngữ pháp N1 「ひとり～だけでなく」 dùng để nhấn mạnh phạm vi ảnh hưởng không chỉ giới hạn ở một đối tượng cốt lõi 「我が社」 (công ty chúng tôi) mà còn lan rộng ra đối tượng diện rộng khác là 「業界全体」 (toàn ngành). Trạng từ 「ひとり」 luôn đứng trước danh từ đi với 「だけでなく」.
ひとり～のみならず,ひとりNのみならず,N1,①環境汚染の問題は、ひとり我が国のみならず全世界の問題でもある。,今回の情報漏洩は、ひとり我が社のみならず取引先の信用をも失墜させかねない大問題です。,今回の情報漏洩は、,ひとり,我が社,のみならず,取引先の信用をも,失墜させかねない大問題です。,"Tương tự như 「だけでなく」, mẫu ngữ pháp trang trọng N1 「ひとり～のみならず」 nhấn mạnh tầm ảnh hưởng tiêu cực vượt ra ngoài phạm vi ban đầu. Trạng từ 「ひとり」 đi trước danh từ chỉ đối tượng trung tâm 「我が社」, theo sau là 「のみならず」 (không chỉ), rồi đến đối tượng bị ảnh hưởng tiếp theo là 「取引先の信用をも」."
ふう,Nふう,N4,①あの寺は中国風だ。,今回のプレゼン資料は、都会的で洗練されたヨーロッパ風に仕上げました。,今回のプレゼン資料は、,都会的で,洗練された,ヨーロッパ,風に,仕上げました。,"Hậu tố 「風（ふう）」 kết hợp trực tiếp sau danh từ chỉ phong cách/quốc gia 「ヨーロッパ」 (Châu Âu) để tạo thành một cụm từ mang ý nghĩa 「phong cách Châu Âu」. Khi đi kèm với trợ từ 「に」 thành 「ヨーロッパ風に」, cụm này đóng vai trò trạng ngữ bổ nghĩa cho động từ hành động 「仕上げました」."
ふう,～ふう＜様子＞　Naなふう　A－いふう　V－ている／V－た　ふう,N3,①そんなに嫌がっているふうでもなかった。,田中さんは突然の異動命令にも、慌てているふうはまったく見せませんでした。,田中さんは突然の異動命令にも、,慌てて,いる,ふうは,まったく,見せませんでした。,"Động từ chia ở thể tiếp diễn trạng thái 「慌てている」 (đang hoảng hốt) đi trực tiếp trước danh từ 「ふう」 để tạo thành cụm từ chỉ dáng vẻ 「慌てているふう」 (vẻ hoảng hốt, bối rối). Trợ từ 「は」 đi kèm trạng từ phủ định triệt để 「まったく」 và động từ 「見せませんでした」 để diễn tả việc không hề bộc lộ ra dáng vẻ đó."
ふう,こういうふう,N4,①こういうふうにやってごらん。,データの入力作業は、こういうふうに進めると効率が良くなりますよ。,データの入力作業は、,こういう,ふうに,進めると,効率が,良くなりますよ。,Cụm từ chỉ phương thức 「こういうふうに」 (theo cách như thế này) bổ nghĩa cho động từ 「進める」 (tiến hành). Mệnh đề giả định cấu trúc 「～と」 biểu thị nếu thực hiện theo phương pháp được chỉ định này thì kết quả tất yếu kéo theo là hiệu suất công việc sẽ tốt lên.
ふう,～というふうに,N2,①好きな時間に会社へ行き、好きな時間に帰るというふうにはいかないものだろうか。,トラブルが発生した際は、まず上司に報告するというふうに対応してください。,トラブルが発生した際は、,まず上司に,報告する,という,ふうに,対応してください。,"Mẫu ngữ pháp 「というふうに」 dùng để đưa ra một ví dụ cụ thể về cách thức hành động. Động từ 「報告する」 (báo cáo) liên kết với danh từ chỉ phương thức 「ふう」 qua cụm liên từ 「という」 tạo thành cụm trạng từ 「というふuに」 (theo cách là...), bổ nghĩa trực tiếp cho yêu cầu xử lý công việc 「対応してください」."
ふしがある,,N2,①彼はどうも行くのをいやがっているふしがある。,競合他社は、我が社の新製品のデザインを模倣しているふしがあります。,競合他社は、,我が社の,新製品のデザインを,模倣して,いるふしが,あります。,"Cấu trúc 「～ふしがある」 thể hiện sự suy đoán mang tính nghi vấn, dựa trên một vài dấu hiệu thực tế. Động từ hành động 「模倣する」 được chia ở thể tiếp diễn trạng thái 「模倣している」 (đang sao chép) đóng vai trò bổ nghĩa cho danh từ 「ふし」 (điểm nghi vấn, dấu hiệu), đi kèm động từ tồn tại 「あります」."
ふそくはない,,N2,①相手にとって不足はない。,提示された取引条件について、弊社としては何ら不足はございません。,提示された取引条件について、,弊社と,しては,何ら,不足は,ございません。,Cụm từ 「不足はない」 được chuyển đổi sang kính ngữ kinh doanh trang trọng là 「不足はございません」 (không có gì bất mãn/thiếu sót/phản đối). Cụm chủ ngữ 「弊社としては」 (về phía công ty chúng tôi) đi cùng trạng từ phủ định mạnh mẽ 「何ら」 (hoàn toàn không... gì cả) tạo nên câu đồng thuận tuyệt đối với các điều khoản đối tác.
ふと,ふと,N3,①彼は映画の広告を見つけて、ふと立ち止まった。,会議の資料を作成しているとき、ふと画期的なアイデアが頭に浮かびました。,会議の資料を作成しているとき、,ふと,画期的な,アイデアが,頭に,浮かびました。,"Trạng từ 「ふと」 diễn tả một hành động hoặc suy nghĩ xuất hiện một cách ngẫu nhiên, không có chủ ý từ trước. Nó bổ nghĩa cho toàn bộ cụm động từ 「頭に浮かびました」 (thoáng qua trong đầu). Chủ ngữ là cụm danh từ mang tính đột phá 「画期的なアイデア」."
ふと,ふとV－ると,N3,①ふと見上げると、空にはぽっかり白い雲が浮かんでいた。,朝、出社してふとメールの受信トレイを見ると取引先から緊急の連絡が入っていました。,朝、出社して,ふとメールの,受信トレイを,見ると,取引先から,緊急の連絡が入っていました。,Trạng từ chỉ sự tình cờ 「ふと」 kết hợp với hành động 「見る」 chia ở thể điều kiện 「～と」 (khi vừa nhìn...) tạo ra ngữ cảnh phát hiện bất ngờ ở vế sau. Sự việc phát hiện được là việc có thư liên lạc khẩn cấp từ đối tác 「取引先から緊急の連絡が入っていました」.
ふと,ふとしたN,N2,①長い一生の間には、ふとしたことで、人生が嫌になることがあるものだ。,ビジネスにおいては、ふとした一言がきっかけで大口の契約が決まることがあります。,ビジネスにおいては、,ふとした,一言が,きっかけで,大口の契約が,決まることがあります。,Cụm tính từ mang tính ngẫu nhiên 「ふとした」 bổ nghĩa trực tiếp cho danh từ 「一言」 (một lời nói vô tình). Cụm này làm chủ ngữ đi với danh từ chỉ cơ duyên/nguyên cớ 「きっかけで」 (nhờ vào/bắt nguồn từ) để dẫn đến một sự kiện quan trọng là hợp đồng lớn được quyết định 「大口の契約が決まる」.
ぶり,～ぶり　Nぶり　R－ぶり,N3,①最近の彼女の活躍ぶりは、みんなが知っている。,新入社員 của 佐藤くんの熱心な仕事ぶりは先輩たちからも高く評価されています。,新入社員 của 佐藤くんの,熱心な,仕事ぶりは,先輩たちからも,高く,評価されています。,Hậu tố chỉ phong thái/trạng thái 「～ぶり」 kết hợp trực tiếp sau danh từ 「仕事」 tạo thành danh từ ghép 「仕事ぶり」 (phong thái làm việc). Cụm danh từ này được bổ nghĩa bởi tính từ đuôi な 「熱心な」 và làm chủ ngữ đi kèm trợ từ 「は」 để tiếp nhận hành động đánh giá cao từ phía các tiền bối 「先輩たちからも高く評価されています」.
ぶり,～ぶり,N3,①10数年ぶりに国に帰った。,出張で、およそ3年ぶりに大阪支店を訪問しました。,出張で、,およそ,3年,ぶりに,大阪支店を,訪問しました。,"Hậu tố 「～ぶり」 ghép trực tiếp sau danh từ chỉ lượng thời gian 「3年」 đi kèm trợ từ 「に」 tạo thành trạng ngữ 「3年ぶりに」 mang ý nghĩa 「sau 3 năm gián đoạn/lần đầu tiên sau 3 năm」. Trạng từ 「およそ」 ước lượng thời gian đứng trước, toàn bộ cụm bổ nghĩa cho hành động viếng thăm 「訪問しました」."
ぶる,N／Naぶる,N2,①彼は、通ぶってフランスの上等なワインしか飲まない。,彼はまだ入社1年目なのに、ベテランぶって偉そうな態度をとっています。,彼はまだ入社1年目なのに、,ベテラン,ぶって,偉そうな,態度を,とっています。,"Hậu tố mang nghĩa tiêu cực 「～ぶる」 (tỏ vẻ, làm bộ như thể là) ghép trực tiếp sau danh từ chỉ đối tượng có kinh nghiệm 「ベテラン」 (lão luyện) tạo thành động từ 「ベテランぶる」. Động từ này chia ở thể て 「ベテランぶって」 đóng vai trò liên kết hành động tỏ vẻ với hành vi không tốt theo sau là hành động kiêu căng 「偉そうな態度をとる」."
ぶん,～ぶん　Nのぶん　Vぶん　期間を表す名詞＋ぶん,N3,①甘いものが大好きな弟は、私のぶんのケーキまで食べてしまった。,本日の会議に出席するメンバーのぶんの資料をあらかじめコピーしておいてください。,本日の,会議に,出席するメンバーの,ぶんの資料を,あらかじめ,コピーしておいてください。,Danh từ chỉ phần/suất 「ぶん（分）」 kết hợp với cụm định ngữ chỉ đối tượng 「出席するメンバーの」 để chỉ phần tài liệu dành riêng cho các thành viên tham dự. Cụm 「メンバーのぶんの資料」 đóng vai trò là tân ngữ trực tiếp chịu tác động của hành động chuẩn bị sẵn 「コピーしておいてください」.
ぶん,～ぶん（だけ）　Nのぶん　Naなぶん　A／V　ぶん,N2,①1年間の休職の分だけ、仕事がたまっていた。,ビジネスでは、自分が努力した分だけ営業成績も着実に上がっていきます。,ビジネスでは、,自分が,努力した,分だけ,営業成績も,着実に上がっていきます。,Danh từ chỉ mức độ/tỷ lệ 「分（ぶん）」 kết hợp trực tiếp sau động từ thể quá khứ 「努力した」 cùng trợ từ 「だけ」 tạo thành cụm chỉ mối quan hệ tương xứng 「努力した分だけ」 (tương đương với phần nỗ lực bỏ ra). Sự nỗ lực này dẫn tới kết quả tỷ lệ thuận là thành tích kinh doanh cũng tăng lên một cách đều đặn 「営業成績も着実に上がっていきます」.
ぶん,このぶんでいくと　このぶんでは,N2,①一年かかって、まだ半分も終わっていない。このぶんでいくと完成するには三年ぐらいかかりそうだ。,現在の進捗状況を見る限り、このぶんでいくと納期に間に合いそうです。,現在の進捗状況を見る限り、,この,ぶんで,いくと,納期に,間に合いそうです。,Cụm từ cố định chỉ sự suy đoán dựa trên tình hình hiện tại 「このぶんでいくと」 (nếu cứ theo đà này) đứng đầu mệnh đề dự báo. Nó đóng vai trò làm tiền đề đưa ra nhận định mang tính khả thi cao ở vế sau là sẽ kịp thời hạn bàn giao sản phẩm 「納期に間に合いそうです」.
ぶん,～ぶんには　Naなぶんには　A／V　ぶんには,N2,①はたで見ているぶんには楽そうだが、自分でやってみるとどんなに大変かがわかる。,今回の件について、社内で意見を言うぶんには問題ありませんが、社外への発言には注意してください。,今回の件について、,社内で意見を,言う,ぶんには,問題ありませんが、,社外への発言には注意してください。,Cấu trúc biểu thị giới hạn phạm vi điều kiện 「～ぶんには」 (nếu chỉ trong giới hạn...) đi sau động từ thể từ điển 「言う」 tạo thành cụm 「言うぶんには」 (nếu chỉ nói trong nội bộ). Vế này đi kèm nhận định không có vấn đề gì 「問題ありませんが」 để tương phản với lời nhắc nhở cần chú ý khi phát ngôn ra bên ngoài ở vế sau.
べからざる,V－るべからざる,N1,①川端康成は日本の文学史上、欠くべからざる作家だ。,取引先の機密情報を競合他社に漏らすのは、社会人として決して許すべからざる行為です。,取引先の機密情報を競合他社に漏らすのは、,社会人として,決して,許す,べからざる,行為です。,Mẫu ngữ pháp cổ mang tính văn viết đanh thép 「V-るべからざる」 (không được phép/không thể làm...) dùng để bổ nghĩa cho danh từ chỉ hành vi 「行為」. Động từ 「許す」 kết hợp với 「べからざる」 tạo thành cụm từ mang ý nghĩa phê phán nghiêm khắc hành động không thể tha thứ dưới tư cách người đi làm 「社会人として」.
