Grammar,Usage,JLPT Level,Reference Example,Original Example,Prefix,Chunk1,Chunk2,Chunk3,Chunk4,Suffix,Explanation
なにも,なにもかも,N3,①嫌なことは何もかも忘れて楽しみましょう。,今回のトラブルの件は、部長に何もかも包み隠さず報告すべきだと思います。,今回のトラブルの件は、,部長に,何もかも,包み隠さず,報告すべき,だと思います。,"""今回のトラブルの件は"" là chủ đề của câu. ""部長に"" (cho trưởng phòng) chỉ đối tượng nhận báo cáo. Phó từ ""何もかも"" (tất tần tật) bổ nghĩa cho hành động báo cáo. ""包み隠さず"" (không che giấu) bổ nghĩa tiếp cho động từ. ""報告すべき"" (nên báo cáo) kết hợp với ""だと思います"" để đưa ra ý kiến cá nhân."
なにやら,なにやら,N3,①なにやら変な臭いがする。,隣の会議室からなにやら重大な話し合いの声が聞こえてきます。,隣の会議室から,なにやら,重大な,話し合いの,声が,聞こえてきます。,"""隣の会議室から"" chỉ nguồn phát ra âm thanh. Phó từ ""なにやら"" (hình như, có chút gì đó) bổ nghĩa cho tính từ ""重大な"" (quan trọng) để diễn tả cảm giác không rõ ràng. ""重大な話し合いの声"" (tiếng thảo luận quan trọng) làm chủ ngữ cho tự động từ ""聞こえてきます"" (nghe thấy)."
なにやら,～やらなにやら　Nやらなにやら　A－い／V－る　やらなにやら,N2,①お菓子やらなにやらを持ち寄ってパーティーを開いた。,新規事業の立ち上げで、契約書の作成やらなにやら多くの雑務に追われています。,新規事業の立ち上げで、,契約書の作成,やらなにやら,多くの雑務に,追われて,います。,"""新規事業の立ち上げで"" chỉ nguyên nhân (do khởi động dự án mới). Cấu trúc ""Nやらなにやら"" dùng để liệt kê danh từ ""契約書の作成"" (lập hợp đồng) và các việc đại loại như thế. ""多くの雑務に"" chỉ đối tượng tác động của cụm từ bận rộn ""追われています"" (bị cuốn vào/bận ngập đầu)."
なにより,なにより,N3,①料理を作るのがなにより得意です。,弊社において、お客様との信頼関係を築くことがなにより重要だと考えております。,弊社において、,お客様との,信頼関係を,築くことが,なにより重要だと,考えております。,"""弊社において"" (Tại công ty chúng tôi) thiết lập bối cảnh. ""お客様との信頼関係を築くこと"" (Việc xây dựng mối quan hệ tin cậy với khách hàng) đóng vai trò là chủ ngữ của mệnh đề phụ. Phó từ ""なにより"" (hơn hết thảy) bổ nghĩa cho tính từ ""重要だ"" (quan trọng) để nhấn mạnh mức độ cao nhất, đi liền với cấu trúc diễn đạt ý kiến ""と考えております""."
なにより,なによりだ,N3,①お元気そうでなによりです。,新製品の評判が非常に良いと伺い、私どもとしてもなによりでございます。,新製品の,評判が,非常に良いと,伺い、,私どもとしても,なによりでございます。,"""新製品の評判が非常に良い"" (đánh giá về sản phẩm mới rất tốt) là nội dung nghe được. Động từ ""伺い"" (nghe nói - khiêm nhường ngữ) nối câu chỉ nguyên nhân. ""私どもとしても"" (về phía chúng tôi cũng) đóng vai trò bổ trợ bổ nghĩa cho vế sau. ""なによりでございます"" là dạng kính ngữ của ""なによりだ"" thể hiện sự vui mừng ở mức cao nhất."
なまじ,,N1,①なまじ急いでタクシーに乗ったために、渋滞に巻き込まれてかえって遅刻してしまった。,今回のプロジェクトは、なまじ過去に実績があるだけに、他のメンバーの意見を軽視して失敗してしまいました。,今回のプロジェクトは、,なまじ過去に,実績があるだけに、,他のメンバーの意見を,軽視して失敗して,しまいました。,"Phó từ ""なまじ"" diễn tả ý nghĩa ""nửa vời/dở dang/chỉ vì có chút ít mà gây họa"", bổ nghĩa cho ""過去に実績がある"" (có thành tích trong quá khứ). Cấu trúc ""~だけに"" chỉ nguyên nhân tương xứng. ""他のメンバーの意見を"" là tân ngữ của động từ ""軽視して"" (coi thường). ""しまいました"" kết hợp để tạo cấu trúc hoành thành chỉ kết quả tiêu cực."
なら1,名詞を直接「なら」が受け、主題を表す。「ならば」の形で使われることもある。Nなら,N4,①A：めがねはどこかな。B：めがねなら、タンスの上に置いてありましたよ。,A：会議の日程はどこで確認できますか。B：来週のスケジュールなら、こちらの共有カレンダーに記載されております。,A：会議の日程はどこで確認できますか。B：,来週の,スケジュールなら、,こちらの共有カレンダーに,記載されて,おります。,"Tiếp nhận chủ đề hỏi từ đối phương, danh từ ""来週のスケジュール"" đi với ""なら"" để thiết lập chủ đề thảo luận tiếp theo. ""こちらの共有カレンダーに"" chỉ địa điểm chính xác tồn tại thông tin. ""記載されております"" là dạng kính ngữ lịch sự của ""記載されています"" để kết thúc câu trong giao tiếp công sở."
なら1,NならNだ,N3,①山ならやっぱり富士山だ。,取引先との接待のレストランならやっぱり駅前の「松竹だ。,取引先との,接待の,レストランなら,やっぱり,駅前の「松竹,だ。,"""取引先との接待の"" (tiếp khách đối tác) đóng vai trò định ngữ bổ nghĩa cho danh từ ""レストラン"". Cấu trúc ""Nなら"" đưa ra chủ đề lựa chọn tốt nhất, đi kèm phó từ ""やっぱり"" (quả nhiên là) để nhấn mạnh quyết định. ""駅前の「松竹」だ"" là phần kết luận đóng vai trò là ""Nだ"" để hoàn thành cấu trúc biểu mẫu."
なら1,～（助詞）なら,N4,①あの人となら結婚してもいい。,信頼できる御社となら、長期的な取引が可能でございます。,信頼できる,御社と,なら、,長期的な,取引が,可能でございます。,"""信頼できる御社"" (Quý công ty đáng tin cậy) đi kèm trợ từ ""と"" (với) và trợ từ giả định ""なら"" tạo thành cụm trợ từ kết hợp ""御社となら"" (Nếu là hợp tác với quý công ty). ""長期的な"" bổ nghĩa cho danh từ ""取引"". Cấu trúc ""可能でございます"" bổ nghĩa trang trọng cho toàn câu."
なら2,N／Naなら　N／Naだった（の）なら　A－い／A－かった（の）なら　V－る／V－た（の）なら　述語の辞書形・タ形を受け、「実情・状況がそのようであれば」という意味を表す。「のならば」「のなら」「ならば」の形も使われる。話しことばでは「の」は「ん」となることが多い。「の」の有無による意味の違いは、はっきりとは認められない場合が多いが、「の」がある場合は、聞き手の発言や具体的な状況を受けて「あなたがそう言うなら」「それが事実ならば」「実情がそのようであれば」という意味を表すのに対し、「の」がない場合は、「一般的にそのような場合は」「そうする場合は」という意味を表す傾向がある。名詞、ナ形容詞を直接受ける場合は「の」は使われないことが多い。動詞、イ形容詞に続く場合、「（の）なら」と「のだったら」は類義的で、互いに言いかえが可能だが、「のだったら」の「の」は省略できない。（誤）知っているだったら教えてほしい。（正）知っている（の）なら教えてほしい。知っているのだったら教えてほしい。～（の）なら＜仮定条件＞,N4,①A：風邪をひいてしまいまして。B：風邪なら早く帰って休んだほうがいいよ。,A：契約内容について確認したいのですが。B：契約書の件なら、法務部の担当者に確認したほうがよろしいかと存じます。,A：契約内容について確認したいのですが。B：,契約書の,件なら、,法務部の,担当者に確認したほうが,よろしいかと存じます。,"Tiếp nhận bối cảnh thực tế đối phương đưa ra, danh từ ""契約書の件"" đi với ""なら"" để tạo điều kiện giả định dựa trên tình huống thực tế. ""法務部の"" bổ nghĩa cho ""担当者に"". Cấu trúc ""～たほうがよろしいかと存じます"" là thể kính ngữ của ""～たほうがいいと思います"" dùng để đưa ra lời khuyên lịch sự."
なら2,～（の）なら＜反事実＞,N3,①電話をくれるのなら、もう少し早い時間に電話してほしかった。,重要な会議に遅れるのなら、事前に一言連絡してほしかったです。,重要な,会議に,遅れるのなら、,事前に一言,連絡して,ほしかったです。,"""重要な"" bổ nghĩa cho danh từ ""会議に"". Động từ ""遅れる"" đi với ""のなら"" thể hiện giả định về một việc trái thực tế hoặc đáng lẽ phải tính trước. ""事前に一言"" bổ nghĩa cho hành động ""連絡して"". Cấu trúc ""～てほしかったです"" diễn tả sự nuối tiếc hoặc trách móc nhẹ nhàng trong công việc."
なら2,Vーる（の）なら～がいい,N4,①靴を買うならイタリア製がいい。,次回のセミナーを開催するなら、アクセスが良い駅前の会場がいいと思います。,次回の,セミナーを,開催するなら、,アクセスが良い,駅前の会場が,いいと思います。,"""次回の"" bổ nghĩa cho ""セミナーを"" (tân ngữ). Động từ thể từ điển ""開催する"" đi trực tiếp với ""なら"" để thiết lập điều kiện hành động. ""アクセスが良い"" (giao thông thuận tiện) làm mệnh đề định ngữ bổ nghĩa cho ""駅前の会場が"". Kết thúc bằng ""がいいと思います"" để đưa ra gợi ý tối ưu."
なら2,V－る（の）なら～しろ／～するな,N3,①何事もやるなら最後まで徹底的にやれ。,大事な報告書を提出するなら、事前に数字をしっかりと確認しろ。,大事な,報告書を,提出するなら、,事前に数字を,しっかりと,確認しろ。,"""大事な"" bổ nghĩa cho ""報告書を"" (tân ngữ). Động từ ""提出する"" đi với ""なら"" để thiết lập giả định trước khi thực hiện hành động. ""事前に数字をしっかりと"" bổ nghĩa cho động từ chia ở thể mệnh lệnh ""確認しろ"" (hãy kiểm tra), thể hiện sự chỉ đạo nghiêm khắc của cấp trên."
なら2,～（の）なら～で　NaならNaで　A（の）ならAで　V（の）ならVで,N2,①嫌なら嫌で、そう言ってくれたらよかったのに。今となっては遅すぎるよ。,開発予算が不足しているなら不足しているで、別の代替案を検討しますので早めにご相談ください。,開発,予算が不足しているなら,不足しているで、,別の代替案を,検討しますので,早めにご相談ください。,"""開発"" bổ nghĩa cho ""予算が"". Cấu trúc lặp lại ""V ているなら V ているで"" diễn tả ý: ""Nếu thực tế đúng là đang thiếu hụt thì chúng ta sẽ xử lý theo hướng thiếu hụt"". ""別の代替案を"" làm tân ngữ cho ""検討しますので"" (vì chúng tôi sẽ xem xét). Kết thúc bằng lời đề nghị lịch sự ""早めにご相談ください""."
なら2,～（の）なら～と　NならN（だ）と　NaならNa（だ）と　A（の）ならAと　V（の）ならVと,N3,①欠席なら欠席と前もって知らせておいてください。,部品の納入について、納期が遅れるなら遅れると、すぐに担当者に報告してくれないと困ります。,部品の納入について、,納期が遅れるなら,遅れると、,すぐに担当者に,報告してくれないと,困ります。,"""部品の納入について"" đưa ra bối cảnh công việc. Cấu trúc lặp lại ""VるならVると"" nhấn mạnh việc nếu xảy ra tình huống trễ hạn thì phải thông báo rõ ràng bằng từ ngữ cụ thể. ""すぐに担当者に"" chỉ thời gian và đối tượng tác động. Cụm điều kiện tiêu cực ""報告してくれないと"" dẫn đến hậu quả ""困ります""."
なら2,ならべつだが　A／V（の）ならべつだが,N2,①そんなに勉強がつまらない（の）なら別だが、自分の心構えについても反省してみてはどうだろうか。,体調不良など特別な事情があるのなら別だが、業務の締切は必ず厳守していただかなければなりません。,体調不良など,特別な事情が,あるのなら別だが、,業務の締切は,必ず厳守して,いただかなければなりません。,"""体調不良など"" nêu ví dụ bổ nghĩa cho ""特別な事情が"". Cấu trúc ""あるのなら別だが"" diễn tả ý loại trừ: ""Nếu có lý do đặc biệt thì là chuyện khác, nhưng thực tế thì không"". ""業務の締切は"" là chủ đề chính. Cụm từ ""必ず厳守していただかなければなりません"" thể hiện quy định bắt buộc mang tính chuyên nghiệp."
なら2,～というのなら,N3,①A：明日はほかに用事があってお邪魔できないのですが。B：来たくないと言うのなら来てもらわなくてもいい。,もし先方が契約を解除したいというのなら、条件を再度見直す必要があります。,もし,先方が契約を,解除したいと,いうのなら、,条件を再度,見直す必要があります。,"""もし"" là phó từ đưa vào câu giả định. ""先方が契約を"" là chủ ngữ và tân ngữ bổ nghĩa cho động từ muốn ""解除したいと"". Cấu trúc ""いうのなら"" tiếp nhận lời tuyên bố/khẳng định của đối tác để làm điều kiện giả định. ""条件を再度"" bổ nghĩa cho cụm từ cần thiết ""見直す必要があります""."
なら2,～ということなら,N3,①癌だということなら退院させてくれるはずがない。,今回の弊社の提案が却下されたということなら、早急に新しい案を練り直さなければなりません。,今回の,弊社の提案が,却下された,ということなら、,早急に新しい案を,練り直さなければなりません。,"""今回の"" bổ nghĩa cho ""弊社の提案が"". Động từ bị động ""却下された"" đi với cụm cấu trúc ""ということなら"" để biểu thị ý nghĩa: ""Nếu sự tình/kết quả đúng là như thế thì..."". Vế sau sử dụng phó từ ""早急に"" bổ nghĩa cho hành động bắt buộc ""新しい案を練り直さなければなりません""."
なら3,なら（ば）,N4,①10人一緒なら団体の割り引き料金になる。,今回の製品のご注文が100個以上ならば、特別割引を適用させていただきます。,今回の製品の,ご注文が,100個以上,ならば、,特別割引を,適用させていただきます。,"""今回の製品の"" bổ nghĩa cho danh từ chủ ngữ ""ご注文が"". ""100個以上"" là số lượng kết hợp trực tiếp với trợ từ liên kết giả định ""ならば"" để thiết lập điều kiện kinh doanh. ""特別割引を"" làm tân ngữ cho cụm từ khiêm nhường ngữ lịch sự ""適用させていただきます""."
なら3,NがNならNはNだ,N4,①銀座が東京の中心なら心斎橋(しんさいばし)は大阪の中心だ。,現代の企業において、営業部が我が社の顔なら開発部は我が社の心臓だ。,現代の企業において、,営業部が,我が社の顔なら,開発部は,我が社の心臓,だ。,"""現代の企業において"" tạo bối cảnh công sở chung. Cấu trúc so sánh song song ""N1がN2ならN3はN4だ"" dùng để đối chiếu hai thành phần có tầm quan trọng tương đương. ""営業部が我が社の顔なら"" hình thành vế giả định đối sánh thứ nhất, kết hợp cân xứng với vế thứ hai ""開発部は我が社の心臓だ"" để tạo ra khẳng định chắc chắn."
