Grammar,Usage,JLPT Level,Reference Example,Original Example,Prefix,Chunk1,Chunk2,Chunk3,Chunk4,Suffix,Explanation
あいだ,Nのあいだ＜空間＞,N5,①ステレオと本棚の間にテレビを置いた。,事務所の机と棚の間に新しいプリンターを置きました。,事務所の,机と,棚の,間に,新しいプリンターを,置きました。,'机と棚' là hai danh từ chỉ vị trí trong văn phòng. Cấu trúc 'N1 と N2 の間に' dùng để chỉ vị trí không gian ở giữa hai vật thể. Tân ngữ '新しいプリンターを' đứng trước động từ thể lịch sự '置きました' để hoàn thành câu.
あいだ,Nのあいだ＜関係＞,N4,①最近二人の間はうまくいっていないようだ。,A社と我が社の間は最近とてもスムーズです。,,A社と,我が社の,間は,最近とても,スムーズです。,'A社と我が社の間' là cụm danh từ biểu thị mối quan hệ giữa hai bên công ty (Đối tác A và công ty chúng tôi). Trạng từ '最近とても' bổ nghĩa cho tính từ đuôi na dạng lịch sự 'スムーズです' để chỉ mối quan hệ đang diễn ra rất trôi chảy.
あいだ,あいだ　Nのあいだ　A－いあいだ　V－ている／V－る　あいだ,N4,①彼は会議の間ずっといねむりをしていた。,社長はプレゼンの間ずっと熱心にメモを取っていました。,,社長は,プレゼンの,間ずっと,熱心にメモを,取っていました。,Danh từ 'プレゼン' (bài thuyết trình) kết hợp với 'の間' để chỉ toàn bộ khoảng thời gian sự kiện diễn ra. Phó từ 'ずっと' nhấn mạnh tính liên tục. Cụm '熱心にメモを' đóng vai trò tân ngữ và trạng từ bổ nghĩa cho hành động '取っていました'.
あいだ,あいだに　Nのあいだに　Naなあいだに　A－いあいだに〕V－ている／V－る　あいだに,N4,①留守の間にどろぼうが入った。,部長が外出している間に報告書を書き終えました。,,部長が,外出している,間に,報告書を,書き終えました。,Cấu trúc 'V-ている + 間に' dùng để diễn tả một hành động ngắn hoặc có tính dứt điểm ('報告書を書き終えました') xảy ra vào một thời điểm nào đó trong suốt khoảng thời gian mà một trạng thái/hành động khác đang diễn ra ('外出している').
あえて,あえて,N1,①私はあえてみなさんに規則の見直しを提案したいと思います。,社長のプランに対して、私はあえて反対の意見を述べさせていただきます。,社長のプランに対して、,私は,あえて,反対の,意見を,述べさせていただきます。,"'あえて' là phó từ thể hiện hành động dám làm một việc khó khăn hoặc dễ gây mất lòng. Trong văn cảnh này, người nói chủ động đưa ra '反対の意見を' (ý kiến phản đối) đối với kế hoạch của giám đốc và dùng dạng khiêm nhường ngữ '述べさせていただきます'."
あえて,あえてV－ば,N1,①反対されるのを承知であえて言えば、こんな計画は百害あって一利なしだ。,このプロジェクトのリスクについてあえて言えば予算が不足している点です。,,このプロジェクトの,リスクについて,あえて言えば,予算が,不足している点です。,"Cụm cụ thể 'あえて言えば' (Nếu buộc phải thẳng thắn mà nói) dùng để đưa ra nhận xét có tính rủi ro hoặc tiêu cực. Cụm 'リスクについて' định hướng chủ đề bổ nghĩa cho việc phát ngôn, và vế sau chỉ ra vấn đề cốt lõi."
あえて,あえて～ない,N1,①そのやり方にあえて反対はしないが、不満は残っている。,弊社としては、現行の戦略をあえて変更する必要はないと考えております。,弊社としては、,現行の,戦略を,あえて変更する,必要は,ないと考えております。,"Cấu trúc 'あえて～ない' thể hiện việc không cần thiết phải cố làm một điều gì đó mang tính mạo hiểm. Cụm 'あえて変更する' bổ nghĩa cho danh từ '必要', kết hợp với vế phủ định lịch sự 'ないと考えております'."
あがる,R－あがる＜上方向＞,N4,①彼は立ち上がってあたりを見回した。,クライアントが部屋に入ってきたとき、社員全員が席から立ち上がって迎えました。,クライアントが部屋に入ってきたとき、,社員,全員が,席から,立ち上がって,迎えました。,"Động từ phức '立ち上がる' (đứng dậy) thể hiện hướng chuyển động đi lên của cơ thể từ vị trí ngồi. Cụm '席から' (từ ghế ngồi) chỉ điểm khởi đầu của hành động, kết hợp nối tiếp bằng thể Te để dẫn đến hành động chào đón khách."
あがる,R－あがる＜極端な程度＞,N2,①長い間雨が降らないので、湖も干上がってしまった。,役員からの質問に新人は震え上がってしまいました。,,役員からの,質問に,新人は,震え上がって,しまいました。,Cấu trúc 'V-stem + 上がる' ở đây chỉ một trạng thái đạt đến mức độ cực đoan. '震え上がる' nghĩa là run rẩy tột độ vì sợ hãi hoặc căng thẳng. '質問に' đóng vai trò chỉ nguyên nhân tác động lên chủ ngữ '新人は'.
あがる,R－あがる＜完成＞,N3,①パンがおいしそうに焼きあがった。,来週の会議の資料がようやくきれいに書き上がりました。,,来週の,会議の資料が,ようやくきれいに,書き,上がりました。,"Cấu trúc 'V-stem + 上がる' biểu thị một hành động hoặc công việc đã được hoàn thành trọn vẹn. Gốc động từ '書き' kết hợp với trợ động từ '上がりました' tạo thành từ '書き上がる' (viết xong xuôi), chủ ngữ là '会議の資料が'."
あくまで,あくまで（も）＜意志＞,N1,①私はあくまでもこの方針を貫くつもりだ。,弊社の利益を守るため、私はあくまでも交渉を続けるつもりです。,弊社の利益を守るため、,私は,あくまでも,交渉を,続ける,つもりです。,"Phó từ 'あくまでも' thể hiện ý chí kiên định, quyết tâm theo đuổi tới cùng không bỏ cuộc. Nó đi kèm với cấu trúc biểu thị dự định mang tính quyết tâm cao '～つもりです' để củng cố hành động '交渉を続ける'."
あくまで,あくまで（も）＜主張＞,N1,①私が今申し上げたことはあくまでも試案ですので、そのおつもりで。,本日の発言はあくまでも個人の見解であります。,,本日の,発言は,あくまでも,個人の見解,であります。,'あくまでも' ở đây mang ý nghĩa khẳng định hoặc phân trần mang tính độc tôn (chỉ là / thuần túy là). Nó bổ nghĩa cho cụm danh từ '個人の見解' nhằm nhấn mạnh và làm rõ tính chất của '本日の発言は' để tránh hiểu lầm pháp lý trong kinh doanh.
あくまで,あくまで（も）＜強い程度＞,N1,①空はあくまでも青く澄み渡り、砂浜はどこまでも白く続いていた。,当社は社員に対してあくまでもプロフェッショナルな姿勢を求めます。,,当社は,社員に対して,あくまでも,プロフェッショナルな,姿勢を求めます。,"'あくまでも' đóng vai trò là phó từ nhấn mạnh mức độ cao nhất, triệt để (hoàn toàn / tuyệt đối). Nó đứng trước và bổ nghĩa cho tính từ đuôi na 'プロフェッショナルな' nhằm thể hiện tiêu chuẩn khắt khe về thái độ làm việc mà công ty yêu cầu."
あげく,～あげく　Nのあげく　V－たあげく,N2,①さんざん悩んだあげく、彼には手紙で謝ることにした。,幾度も議論を重ねたあげくそのプロジェクトは延期となりました。,,幾度も,議論を,重ねたあげく,そのプロジェクトは,延期となりました。,Cấu trúc 'V-た + あげく' diễn tả kết cục thường là tiêu cực hoặc đáng tiếc sau một quá trình dài nỗ lực hoặc lặp đi lặp lại. Hành động '議論を重ねた' (thảo luận nhiều lần) dẫn tới kết quả không mong muốn là dự án bị trì hoãn.
あげく,あげくのはてに（は）,N1,①部長はますます機嫌が悪くなり、あげくの果てには関係ない社員にまでどなり散らすようになった。,新システムはエラーが多発しあげくの果てには大切なデータが消えてしまいました。,,新システムは,エラーが多発し,あげくの果てには,大切なデータが,消えてしまいました。,Cấu trúc 'あげくの果てには' mang tính chất 'đỉnh điểm của sự tồi tệ' (cuối cùng thì / tệ hơn nữa là). Chuỗi sự kiện tiêu cực 'エラーが多発し' tiến tới kết cục xấu nhất là làm biến mất '大切なデータが'.
あげる,R－あげる＜上方向＞,N4,①男は大きな岩を軽々と持ち上げた。,倉庫で重い荷物を安全に持ち上げてください。,倉庫で,重い,荷物を,安全に,持ち,上げてください。,Động từ phức '持ち上げる' cấu thành từ gốc '持ち' và '上げる' chỉ hành động nâng một vật từ vị trí thấp lên vị trí cao hơn. Trạng từ '安全に' bổ nghĩa cho hành động này trong câu mệnh lệnh lịch sự '～てください'.
あげる,R－あげる＜完成＞,N3,①大事なお客さんが来るので、母は家中をぴかぴかにみがき上げた。,締め切りまでに素晴らしい企画書を書き上げることができました。,,締め切りまでに,素晴らしい,企画書を,書き,上げることができました。,Cấu trúc 'V-stem + 上げる' thể hiện việc nỗ lực hoàn thành xuất sắc một sản phẩm hoặc công việc đòi hỏi thời gian. '書き上げる' có nghĩa là viết xong toàn bộ một cách chỉnh chu. Cụm '企画書を' làm tân ngữ trực tiếp.
あたかも,あたかもN（であるか）の　ようだ　あたかもN（であるか）の　ことし　あたかもVかの　ようだ　あたかもVかの　ことし,N1,①その日はあたかも春のような陽気だった。,彼はあたかも自分がプロジェクトの責任者であるかのように話します。,,彼は,あたかも自分が,プロジェクトの,責任者であるかのように,話します。,Phó từ 'あたかも' đi đôi với cấu trúc giả định '～かのように' để tạo nên thể so sánh ví von 'như thể là'. Cụm 'プロジェクトの責任者である' được biến đổi thành dạng bổ nghĩa trạng thái cho động từ phát ngôn '話します'.
あっての,NあってのN,N1,①学生あっての大学だ。学生が来なければ、いくらカリキュラムが素晴らしくても意味がない。,お客様あってのビジネスですから感謝の気持ちを忘れてはいけません。,,お客様,あっての,ビジネスですから,感謝の,気持ちを忘れてはいけません。,Cấu trúc 'N1 あっての N2' nhấn mạnh mối quan hệ nhân quả tuyệt đối: N2 chỉ có thể tồn tại khi có N1 (Có khách hàng mới có kinh doanh). Cụm này đi với từ nối nguyên nhân 'ですから' để dẫn ra lời khuyên ở vế sau.
あと1,あと＜空間＞　Nのあと　V－る／V－た　あと,N5,①みんな私の後についてきてください。,,部長の後について会議室へ静かに移動してください。,,部長の,後について,会議室へ,静かに,移動してください。
