Grammar,Usage,JLPT Level,Reference Example,Original Example,Prefix,Chunk1,Chunk2,Chunk3,Chunk4,Suffix,Explanation
なくもない,Nがなくもない,N2,①再婚するつもりがなくもない。,"条件次第では、弊社としてもその新規プロジェクトに参画する可能性がなくもないです。","条件次第では、弊社としてもその新規プロジェクトに","参画する","可能性が","なくも","ないの","ですが、慎重に検討します。","Cấu trúc thể hiện sự phủ định hai lần để khẳng định nhẹ nhàng 「なくもない」 (không phải là không). Động từ thể từ điển 「参画する」(Chunk1) bổ nghĩa cho danh từ 「可能性」(Chunk2) tạo thành cụm từ chỉ khả năng. Cụm từ này đi liền với phần phủ định tương đối 「なくもない」(Chunk3+Chunk4) biểu thị ý nghĩa định hướng còn để ngỏ khả năng tham gia."
なけりゃ,でなけりゃ A－くなけりゃ V－くなけりゃ,N3,①この仕事はあなたでなけりゃ勤(つと)まらない。,"営業の経験者でなけりゃ、この重要な役職は務まらないでしょう。","営業の経験者","でなけりゃ、","この重要な","役職は","務まら","ないでしょう。","「でなけりゃ」 là dạng nói suồng sã/khẩu ngữ của điều kiện phủ định 「でなければ」 (nếu không phải là). Danh từ vế trước 「営業の経験者」(Prefix) kết hợp trực tiếp với cấu trúc này ở Chunk1. Vế sau đưa ra đánh giá về vị trí công việc 「この重要な役職は」(Chunk2+3) đi cùng với thể phủ định của động từ gánh vác 「務まらない」(Chunk4+Suffix)."
なければ,でなければ A－くなければ V－なければ 「する」は「しなければ」のほかに「せねば」という形がある。話しことばでは「なけりゃ」「なきゃ」の形も使われる。～なければ～ない,N4,①この映画は成人でなければ見ることができない。,"本日の件は、急ぎの用件でなければ、メールで連絡してください。","本日の件は、","急ぎの","用件で","なければ、","メールで","連絡してください。","Cấu trúc điều kiện giả định phủ định 「でなければ」 (nếu không phải là). Cụm danh từ 「急ぎの用件」(Chunk1+2) kết hợp với từ chỉ điều kiện phủ định 「なければ」(Chunk3). Mệnh đề sau chỉ cách thức giải quyết hành động thay thế bằng phương tiện email 「メールで」(Chunk4) đi liền với yêu cầu hành động 「連絡してください」(Suffix)."
なければ,～なければいけない ～なければならない ～なければだめだ,N4,①教師は、生徒に対して公平でなければならない。,"全社員は、会社の機密情報を厳重に守らなければなりません。","全社員は、","会社の","機密情報を","厳重に","守らなければ","なりません。","Cấu trúc mang tính bắt buộc nghĩa vụ trong môi trường công sở 「～なければなりません」 (phải làm gì). Trợ từ chỉ đối tượng hành động tác động vào 「機密情報を」(Chunk2) đi cùng phó từ cách thức 「厳重に」(Chunk3). Động từ bảo mật 「守る」 được chia sang dạng phủ định bỏ い nối tiếp cấu trúc nghĩa vụ tạo thành 「守らなければ」(Chunk4) kết hợp hoàn chỉnh với đuôi 「なりません」(Suffix)."
なければ,～なければV－た,N3,①彼が助けてくれなければ、この本は完成しなかっただろう。,"御社からのご協力がなければ、この契約は成立しなかったでしょう。","御社からの","ご協力が","なければ、","この契約は","成立しなかった","でしょう。","Cấu trúc điều kiện giả định một việc trái với thực tế đã xảy ra trong quá khứ 「～なければ～た」 (Nếu không có... thì đã không...). Chủ ngữ điều kiện đi với trợ từ 「ご協力が」(Chunk1) nối tiếp bằng từ phủ định giả định 「なければ」(Chunk2). Chủ thể ở vế kết quả 「この契約は」(Chunk3) kết hợp với dạng quá khứ phủ định của động từ 「成立しなかった」(Chunk4) để thể hiện sự nuối tiếc hoặc đánh giá tình huống."
なさい,R－なさい,N5,①うるさい。すこし静かにしなさい。,"遅れないように、明日の朝までに報告書を提出しなさい。","遅れないように、","明日の","朝までに","報告書を","提出し","なさい。","Cấu trúc câu mệnh lệnh nhẹ nhàng thường dùng của cấp trên chỉ thị cho cấp dưới trong công việc 「動詞のます形（連用形）＋なさい」. Trạng ngữ thời gian giới hạn 「朝までに」(Chunk2) và tân ngữ 「報告書を」(Chunk3) đứng trước bổ nghĩa cho động từ nhóm 3 「提出する」 khi bỏ ます biến thành dạng liên dụng 「提出し」(Chunk4) để tiếp nhận đuôi mệnh lệnh 「なさい」(Suffix)."
なさんな,V－なさんな,N3,①風邪などひきなさんな。,"体が一番大事だから、そんなに遅くまで無理をしなさんな。","体が一番大事だから、","そんなに","遅くまで","無理を","しな","さんな。","Cấu trúc mang tính chất khuyên nhủ hoặc cấm đoán nhẹ nhàng, thân mật của người lớn tuổi/cấp trên có thâm niên nói với cấp dưới 「動詞のます形＋なさんな」. Cụm phó từ chỉ mức độ thời gian 「そんなに遅くまで」(Chunk1+2) bổ nghĩa cho cụm hành động 「無理をする」. Động từ 「する」 chuyển thành dạng ます形 là 「し」(Chunk4) nối tiếp với thành phần 「さんな」(Suffix)."
なしでは～ない,Nなしでは～ない,N3,①あなたなしでは生きていけない。,"メンバー全員の協力なしでは、このプロジェクトは成功し得ない。","メンバー全員の","協力","なしでは、","このプロジェクトは","成功し得","ない。","Cấu trúc thể hiện điều kiện kiên quyết mang tính loại trừ 「Nなしでは～ない」 (nếu không có N thì không thể...). Danh từ đóng vai trò điều kiện cốt lõi 「協力」(Chunk1) đi trực tiếp với 「なしでは」(Chunk2). Vế sau chỉ kết quả tiêu cực không thể đạt được 「このプロジェクトは成功し得ない」(Chunk3+4+Suffix), trong đó 「成功し得る」 là có thể thành công, đi với 「ない」 tạo thành dạng phủ định hoàn toàn."
なしに,Nなしに,N2,①この山は、冬は届け出なしに登山してはいけないことになっている。,"セキュリティのため、上司の許可なしに入室してはいけません。","セキュリティのため、","上司の","許可","なしに","入室しては","いけません。","Cấu trúc chỉ trạng thái hành động diễn ra mà thiếu đi một yếu tố cần thiết 「Nなしに」 (mà không có N/không qua N). Danh từ chỉ điều kiện hành chính công sở 「許可」(Chunk2) đi liền với đuôi trạng ngữ 「なしに」(Chunk3) để bổ nghĩa trực tiếp cho hành vi mang tính chất cấm đoán nghiêm ngặt ở vế sau 「入室してはいけません」(Chunk4+Suffix)."
なぜか,,N4,①最近なぜか家族のことが気にかかってしかたがない。,"朝からなぜかパソコンの調子が悪くて、仕事が進みません。","朝から","なぜか","パソコンの","調子が","悪くて、","仕事が進みません。","Phó từ liên kết câu 「なぜか」 biểu thị ý nghĩa "không hiểu vì sao/không rõ lý do tại sao". Từ này đứng ở vị trí đầu mệnh đề (Chunk1) nhằm bổ nghĩa cho trạng thái kỳ lạ hoặc sự cố không rõ nguyên nhân ở vế tiếp theo liên quan đến thiết bị văn phòng 「パソコンの調子が悪くて」(Chunk2+3+4), dẫn tới kết quả công việc bị đình trệ ở phần Suffix."
なぜ～かというと,,N3,①なぜ遅刻したかというと、出かける前に電話がかかったからです。,"今回、なぜ方針を変更したかというと、顧客の要望があったからです。","今回、","なぜ方針を","変更したか","というと、","顧客の要望が","あったからです。","Cấu trúc dùng để mở đầu việc giải thích lý do cụ thể cho một sự việc trước đó 「なぜ～かというと、～からだ」 (Lý do là vì...). Mệnh đề nghi vấn chứa lý do cần giải thích kết thúc bằng trợ từ nghi vấn 「変更したか」(Chunk2) nối với cụm từ chuyển tiếp định hướng người nghe 「というと」(Chunk3), vế sau giải thích chi tiết nguyên nhân dẫn tới quyết định đó."
なぜかというと～からだ,,N3,①A：宇宙に行くとどうして物が落ちないのですか。B：なぜかというと、地球の引力が働かなくなるからです。,"その企画には反対です。なぜかというと、予算を大幅に超えてしまうからです。","その企画には反対です。","なぜか","というと、","予算を大幅に","超えてしまう","からです。","Cấu trúc nhấn mạnh việc trình bày nguyên nhân đứng đầu câu độc lập 「なぜかというと～からだ」. Từ nghi vấn ghép 「なぜか」(Chunk1) kết hợp thành phần chuyển tiếp giả định 「というと」(Chunk2) đóng vai trò làm liên từ nối câu. Mệnh đề phía sau giải thích về vấn đề tài chính doanh nghiệp 「予算を大幅に超えてしまう」(Chunk3+4) và kết thúc bắt buộc bằng đuôi chỉ lý do 「からです」(Suffix)."
なぜかといえば～からだ,,N2,①A：天気はなぜ西から東に変化して行くのでしょう。B：それはなぜかといえば、地球が自転しているからです。,"新製品の発売を延期します。なぜかといえば、品質管理に問題が見つかったからです。","新製品の発売を延期します。","なぜか","といえば、","品質管理に","問題が見つかった","からです。","Dạng biến thể trang trọng và mang tính văn viết cao hơn của cấu trúc giải thích lý do dùng trong các báo cáo kinh doanh 「なぜかといえば～からだ」. Cụm từ liên kết phân tách thành 「なぜか」(Chunk1) và dạng điều kiện của động từ nói 「といえば」(Chunk2). Mệnh đề giải trình nguyên nhân lỗi kỹ thuật (Chunk3+4) bắt buộc phải đi kèm đuôi cấu trúc tương ứng 「からです」(Suffix)."
なぜならば～からだ,,N2,①原子力発電には反対です。なぜならば、絶対に安全だという保証がないからです。,"開発投資を増やすべきです。なぜならば、将来の市場競争に勝つために必要だからです。","開発投資を増やすべきです。","なぜならば、","将来の","市場競争に","勝つために必要","だからです。","Liên từ trang trọng thường dùng trong thuyết trình hoặc văn bản kinh doanh để đưa ra luận cứ mạnh mẽ 「なぜならば～からだ」 (Lý do là vì/Bởi vì lẽ đó). Liên từ 「なぜならば」(Chunk1) đứng đầu câu giải trình cho nhận định ở câu trước. Sau đó là các thành phần bổ ngữ mục tiêu chiến lược 「将来の市場競争に勝つために」(Chunk2+3+4) kết hợp với đuôi kết luận nguyên nhân 「だからです」(Suffix)."
など,Nなど,N5,①ウエイトレスや皿洗いなどのアルバイトをして学費を貯めた。,"会議の前に、パンフレットや資料などの配布物を準備してください。","会議の前に、","パンフレットや","資料","などの","配布物を","準備してください。","Trợ từ phụ thuộc 「など」 biểu thị ý nghĩa liệt kê không triệt để, đưa ra các ví dụ tiêu biểu (như là..., vân vân). Danh từ liệt kê mẫu 「資料」(Chunk2) đi liền với 「などの」(Chunk3) đóng vai trò bổ nghĩa cho danh từ tổng quát làm tân ngữ phía sau là 「配布物」(Chunk4) trước khi đi đến động từ yêu cầu hành động ở phần Suffix."
など,V－るなどする,N4,①ひげをそるなどして、もうすこし身だしなみに気を付けてほしい。,"ミスを防ぐため、書類を見直すなどして、ダブルチェックを行ってください。","ミスを防ぐため、","書類を","見直す","などして、","ダブルチェックを","行ってください。","Cấu trúc chỉ ra hành động mang tính ví dụ đại diện cấu thành phương pháp thực hiện 「V-るなどして」 (bằng cách làm những việc như là...). Động từ thể từ điển hành vi văn phòng 「見直す」(Chunk2) đi kèm đuôi ví dụ hoá hành động 「などして」(Chunk3) nhằm làm trạng ngữ bổ nghĩa phương thức cho hành vi kiểm tra chéo 「ダブルチェックを行ってください」(Chunk4+Suffix)."
など,～などと,N3,①学校をやめるなどと言って、みんなを困らせている。,"無責任に会社を辞めるなどと言うのは避けてください。","無責任に","会社を","辞める","などと","言うのは","避けてください。","Trợ từ 「などと」 dùng để trích dẫn gián tiếp một nội dung lời nói hoặc ý nghĩ mang sắc thái phủ định, coi nhẹ hoặc bất ngờ (những lời kiểu như...). Động từ nội dung trích dẫn 「辞める」(Chunk2) đi liền cấu trúc trích dẫn mang tính phê phán 「などと」(Chunk3) làm thành phần bổ nghĩa cho động từ phát ngôn 「言うのは」(Chunk4)."
など,～など～ない,N3,①あなたの顔など見たくない。,"弊社としては、そのような不利な条件など受け入れられません。","弊社としては、","そのような","不利な","条件など","受け入れられ","ません。","Cấu trúc dùng trợ từ hạ thấp giá trị của sự vật đi kèm thể phủ định nhằm thể hiện lập trường kiên quyết 「Nなど～ない」 (những thứ như N thì không...). Danh từ chỉ đối tượng bị đánh giá thấp 「条件」(Chunk2) gắn trợ từ 「など」(Chunk3) đứng trước động từ thể khả năng chia phủ định lịch sự mang tính chất từ chối giao dịch 「受け入れられません」(Chunk4+Suffix)."
など,～など ～V－るものか,N2,①そんな馬鹿げた話など、だれが信じるものか。,"どんなに厳しくても、この程度のトラブルなど、諦めるものか。","どんなに厳しくても、","この程度の","トラブルなど、","諦める","もの","か。","Cấu trúc thể hiện sự phủ định cực kỳ mạnh mẽ mang tính bác bỏ hoặc thể hiện quyết tâm cao 「～など～ものか」 (đời nào/làm sao mà...được). Trợ từ 「など」(Chunk2) đứng sau danh từ sự cố để giảm nhẹ tính nghiêm trọng của khó khăn, đi liền động từ mang ý chí chiến đấu 「諦める」(Chunk3) kết hợp đuôi phủ định tuyệt đối 「ものか」(Chunk4+Suffix)."
なに～ない,なにひとつ～ない,N3,①家が貧しかったので、ほしいものは、なにひとつ買ってもらえなかった。,"新規プロジェクトの計画は、現時点ではなにひとつ決まっていない状況です。","新規プロジェクトの計画は、","現時点では","なにひとつ","決まって","いない","状況です。","Cấu trúc nhấn mạnh sự phủ định toàn bộ diện rộng áp dụng trong báo cáo công việc 「なにひとつ～ない」 (một điều nhỏ nhất cũng không / hoàn toàn chưa...). Trạng từ nhấn mạnh 「なにひとつ」(Chunk2) đứng trước động từ tự động trạng thái được chia ở thể phủ định kéo dài 「決まっていない」(Chunk3+Chunk4) để bổ nghĩa cho trạng thái hiện tại của dự án."