Grammar,Usage,JLPT Level,Reference Example,Original Example,Prefix,Chunk1,Chunk2,Chunk3,Chunk4,Suffix,Explanation
となると,N（のこと）となると,N2,①芸能人のスキャンダルとなると、マスコミは夢中になって追跡する。,弊社の新商品の不具合のこととなると、社長は非常に慎重に判断されます。,弊社の新商品の,不具合のこと,となると、,社長は非常に,慎重に,判断されます。,Ngữ pháp N2 「～のこととなると」 nghĩa là 'khi nói đến/vấn đề liên quan đến...'. Ở đây danh từ '不具合のこと' kết hợp với 'となると' tạo thành vế giả định tình huống. Cụm trạng từ '社長は非常に慎重に' bổ nghĩa cho động từ kính ngữ '判断されます' ở cuối câu.
となると,～かとなると,N1,①どうすればこの問題を解決できるかとなると、簡単には答えられない。,今期の営業目標をどのように達成するかとなると、そう容易には解決策が見つからない。,今期の営業目標を,どのように,達成するか,となると、そう,容易には,解決策が見つからない。,Cấu trúc N1 「～かとなると」 diễn tả ý 'khi tính đến chuyện.../khi đặt câu hỏi về...'. Từ nghi vấn 'markdown/どのように' đi với động từ thể từ điển và vĩ tố 'か' thành '達成するか' tạo mệnh đề danh từ hóa liên kết với 'となると'. Vế sau 'そう容易には' bổ nghĩa phủ định cho cụm từ tìm kiếm giải pháp.
となれば,～となれば　N／Na（だ）となれば　A／V　となれば,N2,①外国に住むとなれば、やはりその国の言葉ぐらいは勉強しておいたほうがよい。,他社との共同プロジェクトを立ち上げるとなれば、事前の綿密な打ち合わせが不可欠です。,他社との共同プロジェクトを,立ち上げる,となれば、,事前の綿密な,打ち合わせが,不可欠です。,Cấu trúc 「V-るとなれば」 dùng để giả định một tình huống chắc chắn hoặc sắp xảy ra trong tương lai. Động từ '立ち上げる' ở thể từ điển kết hợp trực tiếp với 'となれば'. Vế sau danh từ '打ち合わせ' được bổ nghĩa bởi cụm '事前の綿密な' và đi kèm với tính từ '不可欠です'.
となれば,いざとなれば,N2,①手持ちの現金では足りないかもしれないが、いざとなればクレジットカードを使うことができる。,予算案に多少の狂いが生じても、いざとなれば予備費を充当することができます。,予算案に多少の狂いが生じても、,いざ,となれば,予備費を,充当することが,できます。,Cụm từ cố định 「いざとなれば」 mang nghĩa 'khi cần thiết/khi đến nước này/khi xảy ra sự cố khẩn cấp'. Trạng từ 'いざ' đi kèm với 'となれば' tạo điều kiện giả định. Vế sau hành động '予備費を充当する' đi với cấu trúc '～ことができる' biểu thị khả năng xử lý tình huống.
となれば,N（のこと）となれば,N2,①いつもは生気のない彼の目もサッカーのこととなれば急に生き生きと輝やいてくる。,普段は物静かな彼もコスト削減のこととなれば急に熱く議論を始める。,普段は物静かな彼も,コスト削減の,こととなれば,急に熱く,議論を,始める。,Cấu trúc 「N của こととなれば」 chỉ một chủ đề đặc biệt mà khi chạm đến thì trạng thái của đối tượng thay đổi hoàn toàn. Danh từ 'コスト削減' nối với 'こととなれば'. Vế sau có cụm trạng từ '急に熱く' bổ nghĩa cho hành động '議論を始める'.
となれば,～かとなれば,N1,①どうすれば解決できるかとなれば、答えは簡単には出てこないものだ。,新規事業の資金をどこから調達するかとなれば、そう簡単には決定を下せない。,新規事業の資金を,どこから,調達するか,となれば、そう,簡単には,決定を下せない。,"Cấu trúc câu nghi vấn + 「かとなれば」 thể hiện ý nghĩa 'khi đối mặt với câu hỏi/vấn đề...'. Từ nghi vấn 'どこから' bổ nghĩa cho hành động '調達するか', kết hợp với 'となれば' tạo cụm điều kiện giả định. Vế sau cụm phó từ 'そう簡単には' bổ nghĩa cho động từ phủ định khả năng '決定を下せない'."
とにかく,あることがらや行為について、それはひとまずおいておいて、それより他のことがらや行為を優先させて扱うことを表す場合に用いる。「ともかく」とも言う。とにかく,N4,①あの人はとにかく大変な秀才です。,田中部長はとにかく仕事の処理が非常に早い方です。,田中部長は,とにかく,仕事の処理が,非常に早い,方,です。,"Phó từ 「とにかく」 được dùng để nhấn mạnh tính chất vượt trội của một sự việc (dù sao thì/trước hết là). Ở đây, 'とにかく' đứng trước cụm '仕事の処理gà非常に早い' nhằm nhấn mạnh năng lực làm việc của trưởng phòng Tanaka, bổ nghĩa cho danh từ '方' đi với đuôi hệ từ 'です'."
とにかく,とにかくV,N4,①うまくいくか分かりませんが、とにかくやってみます。,成功するか分かりませんが、とにかく新しい企画書を提出してみます。,成功するか分かりませんが、,とにかく,新しい,企画書を,提出して,みます。,Phó từ 「とにかく」 kết hợp trực tiếp với hành động phía sau nhằm biểu thị quyết tâm thử làm một việc gì đó trước mắt mà không quá bận tâm đến kết quả cuối cùng. 'とにかく' đi liền trước cụm tân ngữ - động từ '新しい企画書を提出して' kết hợp dạng ngữ pháp thử nghiệm 'みます'.
とにかく,Nはとにかく（として）,N3,①見かけはとにかく、味はよい。,費用の問題はとにかくとして、このデザインは実用性に欠けています。,費用の,問題は,とにかくとして、,このデザインは,実用性に,欠けています。,Cấu trúc 「N là とにかく（として）」 có nghĩa là 'khoan bàn đến N / gác N sang một bên để tập trung vào việc khác'. Danh từ '問題' được sở hữu bởi '費用の' kết hợp trực tiếp với cụm từ cố định 'はとにかくとして'. Vế sau nêu rõ thực trạng hiện tại của sản phẩm là '実用性に欠けている'.
との,～とのことだ,N3,①みなさんによろしくとのことでした。,先方から、明日の会議の時間を1時間遅らせてほしいとのことです。,先方から、,明日の会議の時間を,1時間,遅らせてほしい,との,ことです。,Cấu trúc 「～とのことだ」 dùng để truyền đạt lại thông tin nhận được từ người khác (nghe nói là/có lời nhắn rằng). Mệnh đề bày tỏ mong muốn '遅らせてほしい' kết hợp trực tiếp với danh từ gián tiếp 'との' và đuôi câu 'ことです' để truyền đạt lại yêu cầu thay đổi thời gian từ phía đối tác.
との,～とのN,N3,①恩師から結婚式には出席できないとの返事を受け取った。,鈴木様から、来週の契約締結式には出席できないとの連絡をいただきました。,鈴木様から、,来週の契約締結式には,出席できない,との,連絡を,いただきました。,Trợ từ kết hợp 「～との」 dùng để định nghĩa hoặc giải thích nội dung cụ thể cho danh từ đứng sau nó (tương đương với 'という'). Mệnh đề thông báo '出席できない' liên kết qua 'との' để bổ nghĩa cho danh từ '連絡'. Cả cụm đóng vai trò tân ngữ cho động từ khiêm nhường 'いただきました'.
とは,～とは＜定義づけ＞,N4,①パソコンとは、個人で使える小型のコンピュータのことだ。,稟議書とは、会社の承認を得るために作成する書類のことです。,稟議書,とは、,会社の承認を得るために,作成する,書類の,ことです。,"Cấu trúc 「～とは...のことだ」 dùng để định nghĩa hoặc giải thích một khái niệm, danh từ (nghĩa là/là...). Danh từ chuyên môn trong công sở '稟議書' kết hợp với 'とは、', tiếp sau là mệnh đề định nghĩa '会社の承認を得るために作成する' bổ nghĩa cho danh từ '書類' đi với đuôi kết thúc câu 'ことです'."
とは,～とは＜引用＞,N3,①A：森山さん、会社退職するそうですよ。B：えっ、退職するとは、結婚するということですか。,A：今回のプロジェクト、A社に断られたそうですよ。B：えっ、断られたとは、一体どういう理由からですか。,A：今回のプロジェクト、A社に断られたそうですよ。B：えっ、,断られた,とは、,一体どういう,理由,からですか。,Trợ từ 「とは」 ở đây đóng vai trò lặp lại một thông tin vừa nghe từ đối phương nhằm biểu thị sự ngạc nhiên hoặc muốn truy vấn làm rõ nguyên nhân. Thể bị động quá khứ '断られた' đi liền với 'とは、'. Theo sau là cụm từ nghi vấn mang tính nhấn mạnh '一体どういう' bổ nghĩa cho danh từ '理由'.
とは,～とは＜驚き＞,N3,①一人で5種目も優勝とは、まったく驚いた。,入社1年目の彼がこれほど大きな契約を成立させるとは、本当に驚きました。,入社1年目の彼が,これほど大きな契約を,成立させる,とは、,本当に,驚きました。,"Cấu trúc 「V-るとas」 hoặc 「Nとは」 diễn tả thái độ ngạc nhiên, thán phục hoặc không ngờ tới của người nói trước một sự thật khách quan. Động từ thể từ điển '成立させる' kết hợp với 'とは、' để tạo thành vế nguyên nhân gây ngạc nhiên, dẫn tới hành động '本当に驚きました' ở cuối câu."
とはいいながら,～とはいいながら,N2,①分かっているとはいいながら、やはり別れはつらいものだ。,景気は回復傾向にあるとはいいながら、中小企業の経営は依然として厳しい状況です。,景気は,回復傾向に,あるとはいいながら、,中小企業の経営は,依然として,厳しい状況です。,"Cấu trúc liên kết nghịch 「～とはいいながら」 mang nghĩa 'mặc dù nói là... nhưng thực tế thì...'. Cụm '回復傾向にある' bổ nghĩa diễn tả trạng thái hiện tại, đi với 'とはいいながら' để làm giảm mức độ khẳng định. Vế sau nêu lên thực tế khó khăn đối lập được bổ nghĩa bởi trạng từ '依然として'."
とはいいながら,とはいいながら,N2,①過ぎたことは悔やんでも仕方がない。とはいいながら、思い出すとつい涙が出てしまう。,今回のシステム障害は我が社の責任ではありません。とはいいながら、お客様にご迷惑をおかけしたことは事実です。,今回のシステム障害は我が社の責任ではありません。,とはいいながら、,お客様に,ご迷惑をおかけした,ことは,事実です。,"Từ nối đầu câu 「とはいいながら」 dùng để thừa nhận tính đúng đắn của câu phía trước nhưng ngay lập tức mở ra một thực tế hoặc trách nhiệm trái ngược ở câu sau (Tuy nói là như vậy, thế nhưng...). Cụm khiêm nhường ngữ 'ご迷惑をおかけした' bổ nghĩa cho danh từ hóa 'こと' tạo thành chủ ngữ cho mệnh đề khẳng định '事実です'."
とはいうものの,,N2,①フランス語は大学時代に習ったとはいうものの、もうすっかり忘れてしまった。,契約書にサインしたとはいうものの、詳細な条件についてはまだ交渉の余地があります。,契約書に,サインした,とはいうものの、,詳細な条件については,まだ交渉の,余地があります。,Cấu trúc tương phản 「～とはいうものの」 mang ý nghĩa 'mặc dù đã... nhưng trên thực tế vẫn...'. Động từ chia ở thể quá khứ xác thực 'サインした' kết hợp trực tiếp với 'とはいうものの' đóng vai trò mệnh đề nhượng bộ. Vế sau đưa ra thông tin bổ sung chỉ rõ thực tế là 'まだ交渉の余地があります'.
とはいえ,節や文を受け、「それはそうなのだが、しかし」といった意味を表す。前のことがらから予想・期待されることと結果が食い違うような場合に用いられる。書きことば。「とはいいながら」「とはいうものの」「と（は）いっても」に言いかえられる。～とはいえ　N／Na（だ）とはいえ　A／Vとはいえ,N2,①男女平等の世の中とはいえ、職場での地位や仕事の内容などの点でまだ差別が残っている。,新しく導入された規定では、管理職とはいえ、残業代が全く支給されないのは労働基準法上問題があります。,新しく導入された規定では、,管理職,とはいえ、,残業代が全く支給されないのは,労働基準法上,問題があります。,"Cấu trúc nhượng bộ 「Nとはいえ」 mang nghĩa 'mặc dù là N nhưng thực tế không hoàn toàn đúng với tiêu chuẩn thông thường'. Danh từ '管理職' (cấp quản lý) đứng trước 'とはいえ、'. Mệnh đề danh từ hóa '残業代が全く支給されないのは' làm chủ ngữ chính, đi kèm cụm chỉ phạm vi pháp lý '労働基準法上' để bổ nghĩa cho kết luận '問題があります'."
とはいえ,とはいえ,N2,①病状は危険な状態を脱して、回復に向かっている。とはいえ、まだ完全に安心するわけにはいかない。,新製品の売れ行きは非常に好調です。とはいえ、競合他社もすぐに類似品を投入してくるでしょう。,新製品の売れ行きは非常に好調です。,とはいえ、,競合他社も,すぐに類似品を,投入して,くるでしょう。,Từ nối liên kết văn bản 「とはいえ」 đứng đầu câu thứ hai nhằm thừa nhận bối cảnh tích cực ở câu trước nhưng cảnh báo một diễn biến tiêu cực hoặc thách thức ở câu sau (Tuy nhiên/Dù nói thế nhưng). Hành động '投入して' kết hợp trợ động từ chỉ xu hướng 'くる' biểu thị hành động đang hướng tới trong tương lai gần đi kèm phỏng đoán 'でしょう'.
とはいっても,,N3,①初めて小説を書いた。とはいっても、ごく短いものだけれど。,今月から新しいプロジェクトのリーダーを務めています。とはいっても、先輩社員のサポートを受けながらですが。,今月から新しいプロジェクトのリーダーを務めています。,とはいっても、,先輩社員の,サポートを,受けながら,ですが。,"Từ nối 「とはいっても」 dùng để bổ sung thông tin mang tính chất giới hạn hoặc làm rõ mức độ thực tế cho câu nói phía trước. Nó đứng đầu câu đính chính, đi kèm cụm danh từ sở hữu '先輩社員のサポート' kết hợp liên từ chỉ hành động song song '受けながら' và kết thúc bằng vĩ tố 'ですが' biểu thị sự khiêm nhường."
