Grammar,Usage,JLPT Level,Reference Example,Original Example,Prefix,Chunk1,Chunk2,Chunk3,Chunk4,Suffix,Explanation
むき,むきになる,N1,①むきになって言い張った。,会議で顧客からの厳しい指摘に対して、むきになって反論するのではなく、冷静に対応すべきです。,会議で顧客からの厳しい指摘に対して、,むきになって,反論する,のではなく、,冷静に,対応すべきです。,"Cụm ngữ pháp 「むきになって」 (nổi nóng) kết hợp với 「反論する」 (phản bác). Cấu trúc 「のではなく」 (thay vì) dùng để gạt bỏ hành vi sai lầm này, từ đó nhấn mạnh thái độ xử lý đúng đắn 「冷静に対応すべきです」 (cần bình tĩnh đối ứng) ở vế sau."
むく,,N3,①彼は学者としてはすぐれているが、教師にはむかない。,彼は新規開拓の営業にはあまりむかないが、データ分析の業務では非常に優秀です。,彼は,新規開拓の,営業には,あまり,むかないが、,データ分析の業務では非常に優秀です。,"Mẫu ngữ pháp 「Nに向く/むく」 mang nghĩa là phù hợp với N. Ở thể phủ định, 「むかない」 nghĩa là không phù hợp. Trong câu, danh từ ghép 「新規開拓」 (khai thác thị trường mới) bổ nghĩa cho 「営業」 (ngành sales/kinh doanh) qua trợ từ 「の」. Trợ từ 「には」 chỉ đối tượng hướng tới của sự thích hợp. Phó từ phủ định 「あまり」 (không... lắm) bổ nghĩa cho động từ phủ định 「むかない」. Từ nối 「が」 (nhưng) liên kết hai vế tương phản, dẫn tới vế sau ca ngợi năng lực phân tích dữ liệu của nhân viên. Thứ tự hợp lý là: Chủ ngữ -> Công việc không hợp (新規開拓の営業にはあまりむかないが) -> Đánh giá thế mạnh ở công việc khác."
むけ,NむけのN,N3,①この会社では、子供向けのテレビ番組を作っている。,当社は個人事業主向けの新しい管理システムを開発いたしました。,当社は,個人事業主,向けの,新しい,管理システムを,開発いたしました。,Mẫu ngữ pháp 「N向け」 có nghĩa là hướng tới đối tượng N. Cụm định ngữ 「個人事業主向けの」 (dành cho người tự doanh) kết hợp với tính từ 「新しい」 để làm rõ cho sản phẩm 「管理システム」 (hệ thống quản lý). Tân ngữ này đi liền với hành động khiêm nhường 「開発いたしました」 ở cuối câu.
むけ,Nむけに,N2,①当社では、輸出向けに左ハンドルの自動車を早くから生産している。,弊社は海外の投資家向けに、財務情報を英語で公開することにいたしました。,弊社は,海外の,投資家,向けに、,財務情報を,英語で公開することにいたしました。,Trạng ngữ 「海外の投資家向けに」 (hướng tới nhà đầu tư nước ngoài) làm bối cảnh cho hành động công khai thông tin. Tân ngữ 「財務情報」 (thông tin tài chính) đi với động từ 「公開する」 và chốt lại bằng cấu trúc quyết định chủ động 「～ことにいたしました」.
むけて,Nにむけて,N3,①全日空103便は8月十日午前8時に、成田からロンドンに向けて出発した。,来月の新規プロジェクトの発表に向けて、チーム一丸となって準備を進めております。,来月の,新規プロジェクトの,発表に,向けて、,チーム一丸となって,準備を進めております。,"Cấu trúc 「Nに向けて」 chỉ hướng tới mục tiêu/sự kiện cụ thể. Ở đây, trạng ngữ mục đích 「発表に向けて」 (hướng tới buổi công bố) dẫn dắt trạng từ thái độ 「チーム一丸となって」 (cả đội đồng lòng). Toàn bộ bổ trợ cho hành động khiêm nhường 「準備を進めております」 (đang tiến hành chuẩn bị)."
むしろ,むしろ,N3,①じゃましようと思っているわけではない。むしろ君たちに協力したいと思っているのだ。,今回のトラブルを理由に計画を中止すべきではない。むしろ、これを業務改善の良い機会と捉えるべきです。,今回のトラブルを理由に計画を中止すべきではない。,むしろ、,これを,業務改善の,良い機会と,捉えるべきです。,"Phó từ 「むしろ」 (thà rằng, ngược lại, đúng hơn là) dùng để đưa ra một lựa chọn, quan điểm tốt hơn/phù hợp hơn so với ý kiến phủ định ở câu trước. Ở câu đầu, hành động hủy bỏ kế hoạch bị phủ định bằng 「〜すべきではない」 (không nên). Câu tiếp theo bắt đầu bằng 「むしろ」 để giới thiệu giải pháp tích cực hơn. Đại từ 「これ」 (điều này - chỉ sự cố) đi với trợ từ 「を」 làm tân ngữ. Danh từ ghép 「業務改善」 (cải tiến nghiệp vụ) bổ nghĩa cho 「良い機会」 (cơ hội tốt) bằng trợ từ 「の」. Đi kèm với trợ từ chỉ nội dung 「と」 và động từ kết câu 「捉えるべきです」 (nên nhìn nhận/coi là). Thứ tự kết nối logic: Khẳng định ngược lại (むしろ) -> Chỉ định đối tượng (これを) -> Bản chất định nghĩa (良い機会と) -> Hành động tư duy (捉えるべきです)."
むしろ,～より（も）むしろ　Nより（も）むしろ　V－る／V－ている　より（も）むしろ,N3,①お盆のこむ時期には、旅行なんかするよりも、むしろ家でゆっくりしたい。,ビジネスにおいては、完璧な資料を作るよりも、むしろ早く進捗を報告することの方が重要です。,ビジネスにおいては、完璧な資料を,作るよりも、,むしろ早く,進捗を,報告することの,方が重要です。,Cấu trúc 「AよりむしろBの方が...」 thể hiện việc coi trọng B hơn A. Hành động bị xem nhẹ 「作るよりも」 nhường chỗ cho phó từ nhấn mạnh 「むしろ早く」. Mệnh đề B sau đó được danh từ hóa (報告すること) để so sánh và chốt lại bằng 「方が重要です」.
むしろ,V－るぐらいなちむしろ,N2,①行きたくない大学に無理をして行くぐらいなら、むしろ働きたいと思っている。,赤字になるような厳しい条件を受け入れるぐらいなら、むしろお断りした方が賢明だと思います。,赤字になるような,厳しい条件を,受け入れる,ぐらいなら、,むしろお断りした,方が賢明だと思います。,"Cấu trúc 「V-るぐらいなら、むしろ...」 thể hiện ý chí: thà làm việc ở vế sau (dù không lý tưởng) còn hơn là phải làm việc tồi tệ ở vế trước. Ở vế trước, động từ nguyên thể 「受け入れる」 (chấp nhận) bổ nghĩa cho cấu trúc giả định tiêu cực 「ぐらいなら」 (nếu đến mức phải...). Vế sau bắt đầu bằng phó từ 「むしろ」 (thà rằng) đi cùng hành động từ chối được chia ở thể quá khứ 「お断りした」 để kết hợp với cấu trúc khuyên nhủ/so sánh lựa chọn 「〜方が賢明だ」 (thì sángసూット hơn). Thứ tự lắp ghép: Điều kiện tệ hại (厳しい条件を受け入れるぐらいなら) -> Quyết định dứt khoát mang tính thà rằng (むしろお断りした) -> Đánh giá giải pháp (方が賢明だと思います)."
むしろ,というよりむしろ～だ,N3,①あの人は天才というより、むしろ努力の人です。,今回の納期遅れは、技術的な問題というよりむしろ、連絡不足が主な原因だと言えます。,今回の納期遅れは、,技術的な,問題と,いうより,むしろ、,連絡不足が主な原因だと言えます。,"Cấu trúc 「AというよりむしろBだ」 dùng để chỉnh lý lại một nhận định, chỉ ra rằng cách gọi/cách hiểu B thì chính xác hơn A. Ở đây, A là 「技術的な問題」 (vấn đề kỹ thuật), kết nối với đuôi so sánh qua trợ từ 「と」 tạo thành 「問題というより」. Tiếp theo, phó từ 「むしろ」 đứng ở đầu vế sau để nhấn mạnh tính chính xác của nguyên nhân B: 「連絡不足」 (thiếu liên lạc). Kết câu bằng khẳng định khách quan 「〜が主な原因だと言えます」 (có thể nói là nguyên nhân chính). Thứ tự liên kết: Chủ đề nói đến -> Định nghĩa sai lầm phổ biến (技術的な問題というより) -> Khẳng định tính chính xác của thực tế (むしろ、連絡不足が原因です)."
むやみに,,N2,①人の物にむやみにさわらないほうがいい。,社外の人に対して、社内の機密情報をむやみに話してはいけません。,社外の人に対して、,社内の,機密情報を,むやみに,話しては,いけません。,"Phó từ 「むやみに」 (bừa bãi, khinh suất) thường đứng trước hành vi bị cấm đoán. Định ngữ 「社内の」 làm rõ loại dữ liệu nhạy cảm 「機密情報を」. Phó từ khinh suất kết hợp cùng động từ 「話す」 và đuôi cấm đoán 「てはいけません」 tạo lời cảnh cáo mạnh mẽ."
むり,むり,N4,①無理を言わないでよ。,スケジュールが非常に厳しいようでしたら、どうぞ無理はなさらないでください。,スケジュールが,非常に,厳しい,ようでしたら、,どうぞ無理は,なさらないでください。,"Cụm từ 「無理をする」 (cố quá sức) chuyển thành kính ngữ 「無理はなさらないでください」 để thể hiện sự quan tâm. Phó từ 「非常に」 bổ nghĩa cho tính từ 「厳しい」 (gấp rút), liên kết với đuôi giả định lịch sự 「ようでしたら」 làm nền cho lời khuyên sức khỏe."
むり,～はむりだ,N4,①一日に新しい漢字を50も覚えるのは無理だ。,明日の朝までにこの大量の製品をすべて納品するのは無理です。,明日の朝までに,この大量の,製品を,すべて,納品するのは,無理です。,"Cấu trúc 「〜のは無理だ」 thể hiện việc thực hiện hành động nào đó là bất khả thi. Ở đây, hành động là giao hàng 「納品する」. Để bổ nghĩa cho danh từ hóa hành động này, ta dùng 「〜するのは」. Trước đó, cụm danh từ chỉ vật 「この大量の製品」 (lượng sản phẩm lớn này) được bổ nghĩa bởi phó từ chỉ số lượng toàn phần 「すべて」 (toàn bộ). Trợ từ 「を」 đóng vai trò chỉ đối tượng bị tác động bởi việc giao hàng. Thứ tự hợp lý: Giới hạn thời gian (明日の朝までに) -> Đối tượng giao hàng -> Hành động cụ thể hóa chủ ngữ (すべて納品するのは) -> Khẳng định tính bất khả thi (無理です)."
むり,～にはむりがある,N2,①今度の計画には無理がある。,わずか二人のメンバーでこの新規事業を立ち上げる計画には無理がある。,わずか二人のメンバーで,この,新規事業を,立ち上げる,計画には,無理がある。,"Cụm từ 「無理がある」 chỉ ra sự bất hợp lý hay không khả thi của một kế hoạch. Tiền đề nhân sự 「わずか二人のメンバーで」 đi liền hành động tác động 「新規事業を立ち上げる」. Cụm này làm định ngữ cho 「計画には」, dọn đường cho kết luận phản biện ở cuối câu."
むり,むりに,N3,①A：かばんが壊れちゃった。B：そんな小さなかばんに無埋に詰め込むからだよ。,顧客が必要としていない商品を、無理に勧めるべきではありません。,顧客が,必要と,していない商品を、,無理に,勧めるべきでは,ありません。,"Phó từ 「無理に」 (cưỡng ép) bổ nghĩa trực tiếp cho hành động chèo kéo 「勧める」. Mệnh đề phụ 「顧客が必要としていない」 nêu rõ tính chất của sản phẩm, gắn kết chặt chẽ với động từ và khép lại bằng quy tắc đạo đức 「べきではありません」 (không nên)."
むり,むりをする,N4,①無理をすると体をこわしますよ。,どんなに仕事が忙しくても、あまり無理をしないでください。,どんなに,仕事が,忙しくても、,あまり,無理を,しないでください。,"Cụm từ 「どんなに」 (cho dù thế nào) luôn đi cặp với đuôi tương phản 「～ても」 ở tính từ (忙しくても). Phó từ 「あまり」 đứng trước làm giảm nhẹ sắc thái của lời khuyên 「無理をしないでください」, thể hiện sự tinh tế trong giao tiếp."
むり,～のもむりもない　～のもむり（は）ない,N2,①あんなひどいことを言われては、彼が怒るのも無理はない。,事前連絡なしで納期が遅れたのだから、先方の担当者が怒るのも無理はない。,事前連絡なしで,納期が,遅れたのだから、,先方の担当者が,怒るのも,無理はない。,Cấu trúc 「〜のも無理はない」 thể hiện thái độ cảm thông (việc đó là đương nhiên). Nguyên nhân khách quan 「遅れたのだから」 dẫn đến phản ứng tức giận của đối tác 「怒る」. Hành động này được danh từ hóa bằng trợ từ 「の」 để làm chủ ngữ cho phán đoán hợp lý ở đuôi câu.
めく,Nめく,N2,①少しずつ春めいてきた。,取引先からのメールには、遠回しに不満を伝える、抗議めいた内容が含まれていました。,取引先からのメールには、,遠回しに,不満を伝える、,抗議,めいた内容が,含まれていました。,"Hậu tố 「〜めく」 ghép sau danh từ để tạo thành một động từ/tính từ mang ý nghĩa có vẻ như, có sắc thái của danh từ đó. Trong câu này, danh từ 「抗議」 (kháng nghị/khiếu nại) kết hợp với 「めく」 ở thể quá khứ bổ nghĩa cho danh từ 「抗議めいた内容」 (nội dung mang tính chất khiếu nại). Cụm trạng từ 「遠回しに」 (một cách gián tiếp/vòng vo) bổ nghĩa cho hành động 「不満を伝える」 (truyền đạt sự bất mãn). Cụm này đứng trước để bổ sung thông tin cho danh từ 「内容」. Động từ bị động kết câu 「含まれていました」 (đã được bao gồm). Thứ tự kết nối: Nguồn gốc và chủ thể của tài liệu -> Tính chất biểu đạt (遠回しに不満を伝える) -> Đặc trưng sắc thái cốt lõi (抗議めいた内容が) -> Động từ trạng thái khách quan."
めぐって,Nをめぐって,N2,①憲法の改正をめぐって国会で激しい論議が闘わされている。,新規プロジェクトの予算配分をめぐって、社内で激しい議論が交わされました。,新規プロジェクトの,予算,配分を,めぐって、,社内で激しい,議論が交わされました。,"Mẫu ngữ pháp 「Nをめぐって」 mang nghĩa xoay quanh vấn đề N. Tâm điểm tranh luận là danh từ ghép 「予算配分」. Cụm trạng ngữ bối cảnh 「社内で」 đi kèm tính từ 「激しい」 để bổ nghĩa trực tiếp cho chủ ngữ 「議論」 (cuộc tranh luận), kết thúc bằng động từ bị động trang trọng 「交わされました」."
めったに,めったに～ない,N4,①私は酒はめったに飲まない。,弊社の社長は非常に穏やかな方なので、仕事中にめったに怒ることはありません。,弊社の社長は,非常に穏やかな,方なので、,仕事中に,めったに,怒ることはありません。,"Mẫu ngữ pháp phủ định tần suất 「めったに〜ない」 mang nghĩa là hiếm khi, hầu như không làm gì. Ở đây, trạng từ 「めったに」 bắt buộc phải đi cùng động từ chia ở thể phủ định ở cuối câu là 「怒ることはありません」 (không bao giờ nổi giận - dạng lịch sự cao cấp của 怒らない). Ở vế nguyên nhân, tính từ đuôi na 「穏やか」 (ôn hòa) đi kèm danh từ kính ngữ 「方」 (vị/người) và từ chỉ nguyên nhân 「なので」 (vì là...). Cụm trạng ngữ chỉ thời gian 「仕事中に」 (trong giờ làm việc) bổ nghĩa cho hành vi nổi giận. Thứ tự kết nối logic: Chủ ngữ tôn kính -> Tính cách làm tiền đề nguyên nhân (非常に穏やかな方なので) -> Bối cảnh thời gian (仕事中に) -> Phó từ tần suất thấp (めったに) -> Hành vi bị phủ định hoàn toàn."
めったに,めったな,N1,①めったなことで驚かない私も、そのときばかりはさすがにうろたえてしまった。,これは社外秘の重要文書ですので、めったなことでは他人に口外してはなりません。,これは社外秘の重要文書ですので、,めったな,ことでは,他人に,口外しては,なりません。,"Mẫu ngữ pháp 「めったなN...ない」 (với N thường là こと) mang ý nghĩa là trong trường hợp thông thường thì không... (chỉ xảy ra ở những tình huống cực kỳ đặc biệt). Ở đây, cụm 「めったなことでは...ない」 đi kèm với mẫu câu cấm đoán trang trọng 「〜てはなりません」 (không được phép làm gì) để tạo thành ý nghĩa: trong điều kiện bình thường tuyệt đối không được tiết lộ cho người ngoài. Trạng từ chỉ đối tượng tiếp nhận 「他人に」 (cho người khác) bổ nghĩa cho động từ hành động 「口外する」 (tiết lộ/nói ra). Thứ tự ngữ pháp: Tiền đề lý do an toàn -> Trạng từ phủ định tình huống thông thường (めったなことでは) -> Đối tượng tiếp nhận (他人に) -> Hành vi bị nghiêm cấm (口外してはなりません)."
