Grammar,Usage,JLPT Level,Reference Example,Original Example,Prefix,Chunk1,Chunk2,Chunk3,Chunk4,Suffix,Explanation
みこんで,～をみこんで　Nをみこんで　V－るのをみこんで,N1,①君を見込んで頼むのだが、ぜひ今度の仕事に参加してほしい。,弊社では、来期の大幅な売上増を見込んで、新規プロジェクトの立ち上げを決定いたしました。,弊社では、,来期の,大幅な売上増を,見込んで、,新規プロジェクトの,立ち上げを決定いたしました。,"Cấu trúc 「Nを見込んで」 dùng để chỉ sự dự tính, kỳ vọng. Định ngữ 「来期の」 (kỳ tới) bổ nghĩa cho tân ngữ 「大幅な売上増」 (việc tăng doanh số đáng kể). Tân ngữ này đi với động từ 「見込んで」, tạo tiền đề để triển khai việc 「立ち上げ」 (khởi động) cho cụm 「新規プロジェクトの」 ở phần sau."
みせる,～をみせる　NがNに～をみせる,N5,①私は友だちにアルバムをみせた。,私は会議の前に、山田部長に新しいカタログを見せました。,私は会議の前に、,山田部長に,新しい,カタログを,見せました,。,Dựa trên cấu trúc cơ bản 「N1 cho N2 xem N3」. Đối tượng nhận hành động là 「山田部長に」. Tân ngữ chỉ vật 「カタログを」 được tính từ 「新しい」 (mới) bổ nghĩa và kết hợp với hành động 「見せました」 (đã cho xem) ở cuối câu.
みせる,かおをみせる　すがたをみせる,N3,①このごろ彼はちっとも学校に顔を見せない。,田中部長は体調不良のため、最近オフィスにまったく顔を見せないので、心配しております。,田中部長は体調不良のため、,最近,オフィスに,まったく,顔を見せない,ので、心配しております。,"Cụm từ 「顔を見せる」 nghĩa là xuất hiện, ló mặt tới (ở thể phủ định là 「顔を見せない」 - không xuất hiện). Câu sắp xếp theo thứ tự từ chỉ thời gian 「最近」 -> địa điểm đi với trợ từ 「オフィスに」 -> phó từ bổ nghĩa mức độ phủ định 「まったく」 -> cụm động từ chính 「顔を見せない」. Các thành phần kết hợp chặt chẽ tạo thành mạch câu hợp lý."
みせる,Nが～を～みせる　Nが～をNaにみせる　Nが～をA－くみせる　Nが～をV－ようにみせる,N3,①華やかな衣装が彼女を実際よ,このシンプルなデザインが、プレゼン資料のスライドをすっきりと美しく見せる効果があります。,このシンプルなデザインが、,プレゼン資料の,スライドを,すっきりと,美しく見せる,効果があります。,"Cấu trúc 「Nが Nを A-くみせる」 biểu thị việc tác động làm cho đối tượng có vẻ ngoài như thế nào (ở đây là 「美しく見せる」 - làm cho trông đẹp mắt). Danh từ xác định 「プレゼン資料の」 bổ nghĩa cho danh từ chỉ vật 「スライドを」. Phó từ 「すっきりと」 (gọn gàng, rõ ràng) bổ nghĩa cho hành động phía sau. Sự kết hợp logic là: slide của tài liệu -> một cách gọn gàng -> làm cho trông đẹp mắt."
みせる,～ようにみせる　Nのようにみせる　Naなようにみせる　A－いようにみせる　Vようにみせる,N3,①犯人は、わざとドアを壊して外部から侵入したように見せている。,彼は会議の席で、プロジェクトが順調に進んでいるように見せているが、実際は課題が多い。,彼は会議の席で、,プロジェクトが,順調に,進んでいる,ように見せている,が、実際は課題が多い。,Cấu trúc 「Vように見せる」 mang ý nghĩa giả vờ như thể đang làm V. Mệnh đề phụ 「プロジェクトが順調に進んでいる」 (dự án tiến triển thuận lợi) được đặt vào cấu trúc này để diễn tả một vẻ ngoài che đậy bản chất thật.
みたいだ,NみたいなN,N4,①この薬は、チョコレートみたいな味がする。,将来は、優秀な田中さんみたいな営業担当者になりたいと考えております。,将来は、,優秀な,田中さん,みたいな,営業担当者に,なりたいと考えております。,"Cấu trúc 「N1みたいなN2」 ví von 「N2 giống như N1」. Tính từ 「優秀な」 bổ nghĩa cho 「田中さん」, tiếp nối bằng liên từ 「みたいな」. Toàn cụm này làm rõ thêm cho danh từ mục tiêu 「営業担当者」 (người phụ trách kinh doanh) mà chủ thể mong muốn trở thành (なりたい)."
みたいだ,～みたいだ　N／V　みたいだ,N4,①すごい風だ。まるで台風みたいだ。,先ほどのメールを読む限り、取引先は我々の提案に満足しているみたいだ。,先ほどのメールを読む限り、,取引先は,我々の提案に,満足して,いるみたいだ,。,"Cấu trúc phán đoán 「Vみたいだ」 biểu thị suy đoán dường như, hình như là V. Động từ ở thể tiếp diễn 「満足している」 kết hợp với 「みたいだ」 thành 「満足しているみたいだ」. Chủ ngữ của câu là 「取引先は」, đối tượng nhận hành động hài lòng đi với trợ từ 「に」 là 「我々の提案に」. Thứ tự kết nối logic các thành phần câu là 1-2-3-4."
みたいだ,～みたいに　N／A／V　みたいに,N4,①もう9月も半ばなのに、真夏みたしミラ暑い。,新入社員の研修では、難しい専門用語を使わず、初心者に優しく教えるみたいに分かりやすく説明してください。,新入社員の研修では、難しい専門用語を使わず、,初心者に,優しく,教える,みたいに,分かりやすく説明してください。,"Cấu trúc 「Vみたいに + Adj/V」 mô tả cách thức hành động ""giống như là"". Cụm hành động 「初心者に優しく教える」 (dạy nhẹ nhàng cho người mới) đi liền với 「みたいに」, tạo thành bổ ngữ hình ảnh sinh động cho trạng từ 「分かりやすく」 và động từ chính."
みたいだ,～みたいなものだ　Nみたいなものだ　V－たみたいなものだ,N3,①僕の給料なんか、会社の儲けに比べたら、ただみたいなものさ。,クライアントから承認を得られたので、このプロジェクトは成功したみたいなものだと確信しています。,クライアントから,承認を,得られたので、,このプロジェクトは,成功したみたいなものだ,と確信しています。,"Cấu trúc 「V-たみたいなものだ」 biểu thị ý nghĩa 「hầu như là/coi như đã...」. Trong câu này, nguyên nhân 「承認を得られたので」 (vì nhận được sự phê duyệt) dẫn đến phán đoán mang tính chắc chắn 「成功したみたいなものだ」 (coi như đã thành công) đối với chủ ngữ 「このプロジェクトは」. Việc sắp xếp theo thứ tự 1-2-3-4 tạo nên mạch liên kết nhân quả và phán đoán rất chặt chẽ."
みたいだ,～みたいだ＜推量＞,N3,①誰も彼女の本名を知らないみたいだ。,社内の噂によると、営業部長は来期から東京本社へ異動するみたいだ。,社内の噂によると、,営業部長は,来期から,東京本社へ,異動するみたいだ,。,"Đuôi phán đoán 「みたいだ」 thể hiện sự suy đoán gián tiếp (nghe nói là). Trạng từ thời gian 「来期から」 và danh từ nơi chốn 「東京本社へ」 bổ nghĩa trực tiếp cho hành động thuyên chuyển 「異動する」, sau đó gắn mượt mà với phần đuôi phán đoán."
みたいだ,～みたい＜例示＞　NみたいなN　Nみたいに,N4,①東京や大阪みたいな大都会には住みたくない。,激しい市場競争を勝ち抜くには、A社みたいなスピード感のある迅速な意思決定が不可欠です。,激しい市場競争を勝ち抜くには、,A社,みたいな,スピード感のある,迅速な意思決定が,不可欠です。,"Cấu trúc 「N1みたいな」 ở đây đóng vai trò đưa ra ví dụ tiêu biểu (như công ty A). Cụm 「A社みたいな」 bổ nghĩa cho toàn bộ phần danh từ phía sau 「スピード感のある迅速な意思決定」 (quyết định nhanh chóng có cảm giác tốc độ). Cụm danh từ này làm chủ ngữ đi với 「が不可欠です」. Do đó, thứ tự bổ nghĩa đúng từ trái qua phải là 1-2-3-4."
みだりに,,N2,①みだりに動物にえさを与えないでください。,セキュリティ規約に基づき、社外秘の顧客情報をみだりに持ち出してはいけません。,セキュリティ規約に基づき、,社外秘の,顧客情報を,みだりに,持ち出しては,いけません。,"Phó từ 「みだりに」 (tự tiện) thường gắn liền với hành vi bị cấm đoán. Ở đây, nó trực tiếp bổ nghĩa cho hành động 「持ち出しては」 (không được mang ra). Phía trước đó, định ngữ 「社外秘の」 (mật) xác định rõ tính chất của tân ngữ 「顧客情報」 (thông tin khách hàng)."
みる,～をみる　Nをみる　Vのをみる,N5,①テレビを見るのが好きだ。,会議室に入る前に、壁に貼ってある予定表をみてください。,会議室に入る前に、,壁に,貼ってある,予定表を,みてください,。,"Cấu trúc 「Nをみる」 nghĩa là nhìn, xem cái gì đó (ở đây thể hiện bằng câu yêu cầu lịch sự 「みてください」). Cụm từ chỉ trạng thái 「壁に貼ってある」 (được dán trên tường) đóng vai trò làm định ngữ bổ nghĩa trực tiếp cho danh từ chỉ vật 「予定表」. Trình tự tự nhiên của câu là xác định vị trí -> trạng thái bổ nghĩa -> danh từ -> hành động yêu cầu: 1-2-3-4."
みる,Nを～みる　NをA－くみる　NがV－るとみる,N2,①試験を甘くみていると失敗しますよ。,見積もりの段階で、開発費用をあまりにも安くみると、計画が頓挫するおそれがあります。,見積もりの段階で、,開発費用を,あまりにも,安くみると、,計画が頓挫する,おそれがあります。,"Cụm 「安くみる」 mang nghĩa đánh giá quá thấp, xem nhẹ. Phó từ vượt ngưỡng 「あまりにも」 (quá mức) đặt ngay phía trước để nhấn mạnh hậu quả. Việc xem nhẹ chi phí này sẽ làm tiền đề cho hệ lụy xấu 「計画が頓挫する」 (kế hoạch đình trệ) ở vế sau."
みる,にみる,N1,①最近の新聞の論調にみる経済偏重の傾向は目にあまるものがある。,近年のベンチャー企業にみる人材の流動化は、組織の成長にとって大きな課題です。,近年の,ベンチャー企業に,みる,人材の流動化は、,組織の成長にとって,大きな課題です。,"Cấu trúc 「N1にみるN2」 mang nghĩa ""N2 được thể hiện ở N1"". Cụm 「ベンチャー企業にみる」 bổ nghĩa cho chủ ngữ 「人材の流動化は」 (sự lưu động nhân sự). Từ đó dẫn dắt sang đối tượng chịu tác động 「組織の成長にとって」 (đối với sự phát triển tổ chức)."
みる,～ところをみると,N3,①うれしそうな顔をしているところをみると、試験はうまくいったようだ。,先ほど担当者が笑顔で戻ってきたところをみると、契約は無事に締結できたようです。,先ほど,担当者が,笑顔で戻ってきた,ところをみると、,契約は無事に,締結できたようです。,"Cấu trúc 「V-たところをみると」 dựa vào hành động làm căn cứ để đưa ra phán đoán. Căn cứ ở đây là 「担当者が笑顔で戻ってきた」 (người phụ trách tươi cười quay về). Nhờ đó, người nói mới có thể phán đoán kết quả tích cực 「契約は無事に締結できたようです」."
みるからに,,N2,①部屋に入ってきたのは、見るからに品の良い中年の女性だった。,今回ご紹介いただいたパートナー企業は、見るからに技術力の高そうな優秀な会社だという印象を受けました。,今回ご紹介いただいた,パートナー企業は、,見るからに,技術力の高そうな,優秀な会社,だという印象を受けました。,"Phó từ 「見るからに」 mang nghĩa là 「nhìn bề ngoài đã thấy rõ, dễ dàng nhận thấy」. Nó dùng để bổ nghĩa cho cụm tính từ mô tả đặc điểm trực quan bên ngoài 「技術力の高そうな」 (có vẻ có năng lực kỹ thuật cao). Cụm này tiếp tục bổ nghĩa cho danh từ 「優秀な会社」 để làm rõ thuộc tính của chủ từ 「パートナー企業は」. Thứ tự kết nối logic và bổ nghĩa là 1-2-3-4."
むき,Nむき＜方向＞,N4,①南向きの部屋は明るくて暖かい。,今度移転する執務室は、南向きの明るい窓が多いので、非常に快適です。,今度移転する,執務室は、,南向きの,明るい窓が,多いので、,非常に快適です。,Hậu tố 「向き」 chỉ phương hướng (南向き - hướng Nam). Cụm 「南向きの」 đóng vai trò định ngữ bổ nghĩa cho danh từ 「明るい窓」. Khối nguyên nhân 「多いので」 (vì có nhiều) này trực tiếp tạo nên trạng thái 「非常に快適です」 (cực kỳ thoải mái) ở cuối câu.
むき,Nむき＜通性＞,N3,①女性向きのスポーツにはどんなものがありますか。,この新しいシステムは、ITの知識が少ない初心者向きに設計されておりますので、誰でも簡単に使えます。,この新しい,システムは、,ITの知識が少ない,初心者向きに,設計されて,おりますので、誰でも簡単に使えます。,Hậu tố 「向き」 mang nghĩa phù hợp cho đối tượng (初心者向きに - dành cho người mới). Định ngữ 「ITの知識が少ない」 mô tả chi tiết đối tượng 「初心者」. Sự chuẩn bị chu đáo này được nhấn mạnh qua động từ bị động lịch sự 「設計されております」 (được thiết kế).
むき,Vむきもある,N1,①君の活躍を快く思わないむきもあるようだから、はでな言動は慎んだ方がいい。,経営陣による急激な方針転換に対して、社内からは業務の混乱を懸念する向きもある。慎重に進めるべきだ。,経営陣による,急激な方針転換に対して、,社内からは,業務の混乱を,懸念する向きもある,。慎重に進めるべきだ。,Cấu trúc 「Vむきもある」 chỉ một nhóm người hay xu hướng ý kiến (ví dụ: 懸念する向きもある - cũng có luồng ý kiến lo ngại). Câu triển khai từ bối cảnh (sự thay đổi) đến đối tượng (phía nội bộ) và kết đọng lại ở những e ngại về sự xáo trộn công việc.
