Grammar,Usage,JLPT Level,Reference Example,Original Example,Prefix,Chunk1,Chunk2,Chunk3,Chunk4,Suffix,Explanation
みこんで,～をみこんで　Nをみこんで　V－るのをみこんで,N1,①君を見込んで頼むのだが、ぜひ今度の仕事に参加してほしい。,政府は、輸出企業の業績回復を見込んで、来年度の税収予測を上方修正した。,政府は、,輸出企業の,業績回復を,見込んで、,来年度の,税収予測を上方修正した。,Danh từ 輸出企業 (doanh nghiệp xuất khẩu) kết hợp sở hữu cách の bổ nghĩa cho danh từ 業績回復 (sự phục hồi thành tích kinh doanh). Cụm tân ngữ 業績回復を đi với động từ thể て 見込んで (dự đoán trước/tính toán trước) chỉ lý do hoặc tiền đề cho hành động phía sau. Cụm danh từ 来年度の (của năm tài chính tới) đứng trước để bổ nghĩa cho cụm danh từ ở phần suffix. Do đó thứ tự hợp lý là: 輸出企業の -> 業績回復を -> 見込んで -> 来年度の.
みせる,～をみせる　NがNに～をみせる,N5,①私は友だちにアルバムをみせた。,私は、昨日デパートで買った新しい洋服を友達に見せた。,私は、,昨日,デパートで買った,新しい洋服を,友達に,見せた。,Trạng từ chỉ thời gian 昨日 (hôm qua) đứng đầu để xác định mốc thời gian. Tiếp theo là cụm định ngữ デパートで買った (đã mua ở cửa hàng bách hóa) bổ nghĩa trực tiếp cho danh từ 新しい洋服を (quần áo mới). Danh từ này đi kèm với đối tượng tiếp nhận hành động là 友達に (cho bạn bè) để bổ nghĩa cho động từ chính 見せた (đã cho xem) ở phần suffix. Thứ tự tự nhiên: 昨日 -> デパートで買った -> 新しい洋服を -> 友達に.
みせる,かおをみせる　すがたをみせる,N3,①このごろ彼はちっとも学校に顔を見せない。,彼女は、何事もなかったかのように夜遅く邸宅に姿を見せた。,彼女は、,何事も,なかったかのように,夜遅く,邸宅に,姿を見せた。,Cụm từ phủ định hoàn toàn 何事も (không có chuyện gì) kết hợp với なかったかのように tạo thành trạng ngữ nghĩa là 'như thể không có chuyện gì xảy ra'. Tiếp theo là trạng từ chỉ thời gian 夜遅く (muộn đêm) và trạng ngữ chỉ địa điểm đến 邸宅に (tại biệt thự) để bổ nghĩa cho cụm động từ chính 姿を見せた (xuất hiện) ở phần suffix. Thứ tự hợp lý: 何事も -> なかったかのように -> 夜遅く -> 邸宅に.
みせる,Nが～を～みせる　Nが～をNaにみせる　Nが～をA－くみせる　Nが～をV－ようにみせる,N3,①華やかな衣装が彼女を実際よ,この漆黒のドレスは、彼女の細い首をより白く見せる。,この漆黒のドレスは、,彼女の,細い首を,より,白く,見せる。,"Cụm danh từ sở hữu 彼女の (của cô ấy) đứng trước bổ nghĩa cho cụm danh từ làm tân ngữ 細い首を (chiếc cổ thon). Trạng từ chỉ mức độ より (hơn nữa) đi kèm để bổ nghĩa cho tính từ đuôi い chia thể phó từ 白く (trắng), bổ trợ nghĩa cho động từ 見せる (làm cho trông có vẻ) ở phần suffix. Thứ tự đúng là: 彼女の -> 細い首u -> より -> 白く."
みせる,～ようにみせる　Nのようにみせる　Naなようにみせる　A－いようにみせる　Vようにみせる,N3,①犯人は、わざとドアを壊して外部から侵入したように見せている。,彼は、まるで財産家のように見せるために派手な生活を送っていた。,彼は、,まるで,財産家の,ように,見せる,ために派手な生活を送っていた。,Trạng từ so sánh まるで (như thể là) thường đi đầu mệnh đề so sánh giả định. Danh từ chỉ đối tượng 財産家 (nhà giàu/triệu phú) đi kèm trợ từ の để liên kết với từ so sánh ように. Động từ 見せる (tỏ ra/làm cho trông như) kết hợp với ように để tạo thành cụm 'làm cho giống như...'. Cụm này liên kết với cấu trúc mục đích ために ở phần suffix. Thứ tự hợp lý: まるで -> 財産家の -> ように -> 見せる.
みたいだ,NみたいなN,N4,①この薬は、チョコレートみたいな味がする。,彼女は、吸い込まれそうな人形みたいな瞳で私を見つめた。,彼女は、,吸い込まれそうな,人形,みたいな,瞳で,私を見つめた。,Cụm động từ bổ nghĩa định ngữ 吸い込まれそうな (như thể bị hút vào) đứng trước bổ nghĩa cho danh từ 人形 (búp bê). Danh từ 人形 kết hợp với từ so sánh みたいな (giống như) để tạo thành một cụm tính từ bổ nghĩa cho danh từ tiếp theo là 瞳で (bằng đôi mắt). Cụm này làm trạng ngữ chỉ phương thức cho hành động ở phần suffix. Thứ tự logic: 吸い込まれそうな -> 人形 -> みたいな -> 瞳で.
みたいだ,～みたいだ　N／V　みたいだ,N4,①すごい風だ。まるで台風みたいだ。,この激しい嵐は、まるで真夏の台風みたいだと住民は語った。,この激しい嵐は、,まるで,真夏の,台風,みたいだ,と住民は語った。,"Trạng từ so sánh まるで (như thể là) đứng đầu để nhấn mạnh ý so sánh. Cụm danh từ sở hữu 真夏の (giữa mùa hè) bổ nghĩa cho danh từ 台風 (bão). Danh từ 台風 liên kết trực tiếp với đuôi phán đoán so sánh みたいだ (giống như) tạo thành vị ngữ hoàn chỉnh cho câu gián tiếp, đứng trước trợ từ trích dẫn と ở phần suffix. Thứ tự logic: まるで -> 真夏の -> 台風 -> みたいだ."
みたいだ,～みたいに　N／A／V　みたいに,N4,①もう9月も半ばなのに、真夏みたしミラ暑い。,彼は、おもちゃを欲しがる子供みたいに激しく泣き叫んだ。,彼は、,おもちゃを,欲しがる,子供,みたいに,激しく泣き叫んだ。,Cụm tân ngữ おもちゃを đi với động từ bổ nghĩa 欲しがる (muốn có) đứng trước để bổ nghĩa cho danh từ 子供 (đứa trẻ). Danh từ 子供 kết hợp với cụm từ so sánh dạng trạng từ みたいに (giống như) để tạo thành trạng ngữ bổ nghĩa cho động từ chính ở phần suffix. Thứ tự logic là: おもちゃを -> 欲しがる -> 子供 -> みたいに.
みたいだ,～みたいなものだ　Nみたいなものだ　V－たみたいなものだ,N3,①僕の給料なんか、会社の儲けに比べたら、ただみたいなものさ。,円安が進む今、海外旅行に行くのは贅沢品を買うみたいなものだ。,円安が進む今、,海外旅行に,行くのは,贅沢品を,買う,みたいなものだ。,Mệnh đề chủ ngữ bắt đầu bằng cụm bổ ngữ 海外旅行に (du lịch nước ngoài) kết hợp động từ danh từ hóa 行くのは (việc đi). Tiếp theo là vế so sánh gồm tân ngữ 贅沢品を (hàng xa xỉ) và động từ 買う (mua). Động từ thể từ điển 買う liên kết trực tiếp với biểu thức みたいなものだ (gần như là/chẳng khác nào) để hoàn thành vị ngữ câu. Thứ tự logic: 海外旅行に -> 行くのは -> 贅沢品を -> 買う.
みたいだ,～みたいだ＜推量＞,N3,①誰も彼女の本名を知らないみたいだ。,隣国との国境付近で、新たな衝突が起きたみたいだと現地の記者が伝えた。,隣国との国境付近で、,新たな,衝突が,起きた,みたいだ,と現地の記者が伝えた。,"Tính từ đuôi な bổ nghĩa 新たな (mới) đi trước để bổ nghĩa cho danh từ chủ ngữ 衝突が (xung đột). Động từ thể quá khứ 起きた (đã xảy ra) làm vị ngữ cho mệnh đề phụ, liên kết trực tiếp với đuôi phỏng đoán みたいだ (hình như là/có vẻ như). Toàn bộ mệnh đề này đứng trước trợ từ trích dẫn と ở phần suffix. Thứ tự logic: 新たな -> 衝突が -> 起きた -> みたいだ."
みたいだ,～みたい＜例示＞　NみたいなN　Nみたいに,N4,①東京や大阪みたいな大都会には住みたくない。,私は、彼みたいな情熱的な作家になりたいと思っている。,私は、,彼,みたいな,情熱的な,作家,になりたいと思っている。,"Danh từ chỉ người 彼 (anh ấy) kết hợp với cấu trúc chỉ ví dụ みたいな (như là) để bổ nghĩa cho danh từ phía sau. Tiếp theo, tính từ đuôi な 情熱的な (nhiệt huyết) bổ nghĩa trực tiếp cho danh từ chỉ nghề nghiệp 作家 (nhà văn) để làm tân ngữ đích cho cụm động từ chuyển đổi trạng thái になりたい (muốn trở thành) ở phần suffix. Thứ tự logic: 彼 -> みたいな -> 情熱的な -> 作家."
みだりに,,N2,①みだりに動物にえさを与えないでください。,許可なくこの区域内にみだりに立ち入ることは法律で禁止されている。,許可なく,この,区域内に,みだりに,立ち入る,ことは法律で禁止されている。,Chỉ thị từ この (này) bổ nghĩa cho danh từ chỉ địa điểm 区域内に (trong khu vực). Phó từみだりに (tự tiện/vô cớ) đứng trước để bổ nghĩa cho động từ hành vi 立ち入る (xâm nhập). Động từ này đứng trước trợ từ danh từ hóa ことは ở phần suffix để làm chủ ngữ cho câu bị động nghiêm cấm. Thứ tự logic: この -> 区域内に -> みだりに -> 立ち入る.
みる,～をみる　Nをみる　Vのをみる,N5,①テレビを見るのが好きだ。,私は、海できれいな夕日を見るのが好きだ。,私は、,海で,きれいな,夕日を,見るのが,好きだ。,Cụm trạng ngữ chỉ địa điểm 海で (ở biển) đứng trước để chỉ nơi chốn xảy ra hành động. Tính từ きれいな (đẹp) bổ nghĩa trực tiếp cho danh từ tân ngữ 夕日を (hoàng hôn). Động từ chỉ hành vi 見る kết hợp với cụm danh từ hóa のが (việc xem...) để làm chủ ngữ cho tính từ biểu thị sở thích 好きだ (thích) ở phần suffix. Thứ tự logic: 海で -> きれいな -> 夕日を -> 見るのが.
みる,Nを～みる　NをA－くみる　NがV－るとみる,N2,①試験を甘くみていると失敗しますよ。,専門家は、市場の回復にはまだ時間がかかるとみている。,専門家は、,市場の,回復には,まだ時間が,かかると,みている。,Cụm danh từ sở hữu 市場の (của thị trường) bổ nghĩa cho danh từ 回復には (đối với sự phục hồi). Cụm phó từ và danh từ まだ時間が (vẫn cần thời gian) đi kèm động từ và trợ từ liên kết かかると (cho rằng mất/tốn...) để làm mệnh đề nội dung nhận định cho động từ phán đoán みている (đang nhìn nhận/cho rằng) ở phần suffix. Thứ tự logic: 市場 của -> 回復には -> まだ時間が -> かかると.
みる,にみる,N1,①最近の新聞の論調にみる経済偏重の傾向は目にあまるものがある。,近年の世論調査にみる政治不信の広がりは極めて深刻だ。,近年の,世論調査に,みる,政治不信の,広がりは,極めて深刻だ。,"Cụm giới từ 世論調査に (trong khảo sát dư luận) kết hợp động từ định ngữ みる (nhìn thấy ở...) bổ nghĩa cho cụm phía sau. Tiếp theo, danh từ sở hữu 政治不信の (sự bất tín nhiệm chính trị) bổ nghĩa cho danh từ làm chủ ngữ chính 広がりは (sự lan rộng). Toàn bộ cụm này đi với tính từ vị ngữ 極めて深刻だ (cực kỳ nghiêm trọng) ở phần suffix. Thứ tự logic: 世論調査に -> みる -> 政治不信の -> 広がりは."
みる,～ところをみると,N3,①うれしそうな顔をしているところをみると、試験はうまくいったようだ。,街灯が一斉に消えたところをみると、この地区で停電が発生したのだろう。,街灯が,一斉に,消えた,ところを,みると、,この地区で停電が発生したのだろう。,"Trạng từ 一斉に (đồng loạt) đứng trước bổ nghĩa cho động từ thể quá khứ 消えた (đã tắt). Động từ này làm định ngữ bổ nghĩa cho danh từ liên kết ところを kết hợp với みると, tạo thành cấu trúc chỉ căn cứ phán đoán ところをみると (nhìn từ việc.../nhìn vào chỗ...). Mệnh đề này dẫn tới phán đoán ở phần suffix. Thứ tự logic: 一斉に -> 消えた -> ところを -> みると、."
みるからに,,N2,①部屋に入ってきたのは、見るからに品の良い中年の女性だった。,彼の書斎には、見るからに重厚な革張りのソファが置かれていた。,彼の書斎には、,見るからに,重厚な,革張りの,ソファが,置かれていた。,"Phó từ 見るからに (nhìn qua đã thấy/trông có vẻ) đứng trước bổ nghĩa cho tính từ đuôi な 重厚な (sang trọng/uy nghiêm). Tiếp theo, cụm danh từ chất liệu 革張りの (bằng da) bổ nghĩa cho danh từ chủ ngữ ソファが (chiếc sofa). Danh từ này đi với vị ngữ chỉ trạng thái tồn tại 置かれていた (đang được đặt) ở phần suffix. Thứ tự logic: 見るからに -> 重厚な -> 革張りの -> ソファが."
むき,Nむき＜方向＞,N4,①南向きの部屋は明るくて暖かい。,彼が選んだ東向きの部屋には、毎朝まばゆい光が差し込んだ。,彼が選んだ,東,向きの,部屋には、,毎朝まばゆい,光が差し込んだ。,Danh từ chỉ phương hướng 東 (phía Đông) kết hợp với hậu tố chỉ hướng 向きの để bổ nghĩa cho danh từ chỉ địa điểm 部屋には (trong căn phòng). Cụm phó từ và tính từ 毎朝まばゆい (mỗi sáng rực rỡ) đứng trước bổ nghĩa trực tiếp cho danh từ chủ ngữ 光が (ánh sáng) đi kèm động từ 差し込んだ (chiếu vào) ở phần suffix. Thứ tự logic: 東 -> 向きの -> 部屋には -> 毎朝まばゆい.
むき,Nむき＜通性＞,N3,①女性向きのスポーツにはどんなものがありますか。,この新しい端末は、初心者向きに操作が簡略化されている。,この新しい端末は、,初心者,向きに,操作が,簡略化,されている。,"Danh từ chỉ đối tượng 初心者 (người mới bắt đầu) đi với hậu tố 向きに (phù hợp với/dành cho) đóng vai trò trạng ngữ bổ nghĩa phương thức. Tiếp theo, danh từ chủ ngữ phụ 操作が (thao tác) đi kèm danh từ chỉ hành động 簡略化 (giản lược hóa) để kết hợp với động từ bị động trạng thái されている ở phần suffix. Thứ tự logic: 初心者 -> 向きに -> 操作が -> 簡略化."
むき,Vむきもある,N1,①君の活躍を快く思わないむきもあるようだから、はでな言動は慎んだ方がいい。,政府の新たな計画に対して、時期尚早だと批判する向きもある。,政府の新たな計画に対して、,時期尚早,だと,批判する,向きも,ある。,Cụm tính động từ chỉ nhận định 時期尚早 (chưa đúng thời điểm/quá sớm) kết hợp hệ từ và trợ từ liên kết だと đứng trước bổ nghĩa cho động từ 批判する (phê phán). Động từ này làm định ngữ bổ nghĩa cho danh từ 向きも (phía/bộ phận người/giới). Toàn bộ cụm này đi với động từ tồn tại ある ở phần suffix để tạo thành nghĩa 'cũng có những ý kiến phê phán rằng...'. Thứ tự logic: 時期尚早 -> だと -> 批判する -> 向きも.
