Grammar,Usage,JLPT Level,Reference Example,Original Example,Prefix,Chunk1,Chunk2,Chunk3,Chunk4,Suffix,Explanation
ところ1,V－るところによると／よれば,N2,①聞くところによれば、あの二人は離婚したそうだ。,政府の発表するところによれば、今回の増税は来年春から実施されるという。,政府の,発表する,ところに,よれば、,今回の増税は来年春から,実施されるという。,"Cấu trúc ngữ pháp 「V-るところによれば」 dùng để chỉ nguồn thông tin khách quan (Theo như những gì...). Ở đây, danh từ 「政府」（Chính phủ） đi kèm trợ từ 「の」 để bổ nghĩa cho động từ 「発表する」（công bố）, tạo thành cụm chỉ nguồn tin 「政府の発表するところによれば」（Theo những gì chính phủ công bố）. Vế sau đưa ra nội dung thông tin được truyền lại bằng cách kết hợp cụm chủ vị 「今回の増税は来年春から」（việc tăng thuế lần này từ mùa xuân năm sau） với vị ngữ 「実施される」（được thực hiện） và kết thúc bằng vĩ tố truyền tin 「という」 thường dùng trong báo chí."
ところ1,V－る／V－ているところのN,N1,①私が知るところの限りでは、そのようなことは一切ございません。,彼が執筆しているところの小説は、現代社会の闇を鋭く告発している。,彼が,執筆して,いるところの,小説は、,現代社会の闇を,鋭く告発している。,"Cấu trúc trang trọng mang tính văn học 「V-ているところのN」 đóng vai trò định ngữ giải thích cho danh từ N đứng sau. Hành động 「執筆している」（đang chấp bút/viết） kết hợp với 「ところの」 để bổ nghĩa trực tiếp cho danh từ 「小説」（tiểu thuyết） làm chủ ngữ chínhのcâu. Vế sau bổ sung tân ngữ 「現代社会の闇」（bóng tốiのxã hội hiện đại） đi kèm trợ từ chỉ đối tác tác động 「を」 để làm rõ cho động từ mang tính báo chí phê phán 「鋭く告発している」（lên án sắc bén/tố cáo mạnh mẽ）, thể hiện lối viết nghị luận văn học đặc trưng."
ところ1,V－るところまでV,N1,①堕ちるところまで堕ちてしまった。,彼は自らの野心のために利用できるものは利用するところまで利用し尽くした。,彼は自らの野心のために,利用できるものは,利用する,ところまで,利用し,尽くした。,Cấu trúc 「V-るところまでV」 dùng để nhấn mạnh mức độ cực đoanのhành động (đến tận cùng/tới mức tối đa có thể). Chủ ngữ 「彼」 cùng trạng từ chỉ mục đích ích kỷ 「自らの野心のために」（vì dã tâmのbản thân） dẫn dắt đối tượng bị tác động 「利用できるものは」（những thứ có thể lợi dụng）. Động từ lặp lại 「利用する」 kết hợp với giới hạn 「ところまで」 và bổ ngữ động từ kết thúc 「利用し尽くした」（đã lợi dụng triệt để/sạch trơn） nhằm thể hiện sự tha hóa về nhân cách trong tiểu thuyết.
ところ1,V－ているところをみると,N2,①平気な顔をしているところをみると、まだ事故のことを知らされてないのだろう。,被告が終始うつむいているところをみると、反省の態度を示しているのかもしれない。,被告が,終始,うつむいている,ところを,みると、,反省の態度を示しているのかもしれない。,Cấu trúc 「V-ているところをみると」 dùng để đưa ra suy đoán dựa trên một chứng cứ thực tế đang diễn ra (Nhìn vào tình trạng đang... thì có lẽ...). Trạng từ chỉ sự liên tục 「終始」（suốt/từ đầu đến cuối） bổ nghĩa cho hành động cúi đầu 「うつむいている」のchủ ngữ 「被告」（bị cáo）. Sự kết hợp với 「ところをみると」 tạo thành căn cứ trực quan để người viết/nhà báo đưa ra phán đoán phỏng đoán khách quan ở vế sau 「反省の態度を示しているのかもしれない」（có lẽ đang thể hiện thái độ ăn năn hối lỗi）.
ところ2,V－たところ＜順接＞,N3,①先生にお願いしたところ、早速承諾のお返事をいただいた。,警察が現場の防犯カメラを解析したところ、不審な男の姿が映っていた。,警察が,現場の,防犯カメラを,解析した,ところ、,不審な男の姿が映っていた。,Cấu trúc 「V-たところ」 biểu thị quan hệ thuận nhân quả trong tường thuật (Sau khi thử làm việc gì đó thì phát hiện ra kết quả...). Cụm từ định vị vị trí 「現場の」（tại hiện trường） bổ nghĩa cho danh từ làm tân ngữ 「防犯カメラ」（camera an ninh）. Hành động chủ động 「解析した」（phân tích） kết hợp với 「ところ」 dẫn đến kết quả mang tính phát hiện bất ngờ ở vế sau 「不審な男の姿が映っていた」（hình ảnh một gã đàn ông khả nghi đã được ghi lại）.
ところ2,V－たところが＜逆接＞,N2,①親切のつもりで言ったところが、かえっで恨まれてしまった。,彼は真実を打ち明ければ許されると思ったところが、かえって彼女の怒りを買ってしまった。,彼は,真実を,打ち明ければ,許されると思った,ところが、,かえって彼女の怒りを買ってしまった。,Cấu trúc 「V-たところが」 biểu thị quan hệ nghịch lý ngoài dự kiến (Cứ ngỡ là/Sau khi làm thế thì ngược lại...). Mệnh đề giả định 「真実を打ち明ければ」（nếu thú nhận sự thật） đi liền với phán đoánのchủ ngữ 「許されると思った」（đã nghĩ là sẽ được tha thứ）. Việc liên kết cụm này với liên từ nghịch tiếp 「ところが」 tạo ra sự tương phản cực kỳ mạnh mẽ với kết cục tồi tệ ở vế sau 「かえって彼女の怒りを買ってしまった」（ngược lại còn chuốc lấy cơn thịnh nộのcô ấy）.
どころ,～どころか　N／Na（な）どころか　A－いどころか　V－るどころか,N2,①病気どころか、ぴんぴんしている。,我が国の経済は回復するどころか、ますます悪化の一途をたどっている。,我が国の経済は,回復する,どころか、,ますます,悪化の,一途をたどっている。,Cấu trúc 「V-るどころか」 mang ý nghĩa phủ định triệt để giả thuyết trước để nhấn mạnh thực tế tệ hơn rất nhiều ở vế sau (Chẳng những không... mà trái lại). Động từ kỳ vọng tích cực 「回復する」（hồi phục） đi với trợ từ tương phản 「どころか」 để bác bỏ hoàn toàn khả năng tốt lênのchủ đề 「我が国の経済」（nền kinh tế nước ta）. Tiếp nối bằng phó từ tăng tiến 「ますます」（ngày càng） và cụm thành ngữ báo chí 「悪化の一途をたどっている」（đang trên đà không ngừng tồi tệ đi）.
どころ,～どころか～ない　～どころか～さえ（も）～ない　～どころか～も～ない　～どころか～だって～ない,N2,①最近の大学生の中には、英語どころか日本語の文章さえもうまく書けない者がいる。,被災地では電気どころか、毎日の飲み水さえ満足に手に入らない状況だ。,被災地では,電気,どころか、,毎日の飲み水,さえ,満足に手に入らない状況だ。,Cấu trúc cực cấp 「N1どころか N2さえ...ない」 dùng để nhấn mạnh sự thiếu thốn nghiêm trọng: ngay cả điều cơ bản tối thiểu N2 còn không có thì nói gì đến N1 (Đến cả... cũng không nói chi là...). Danh từ cơ sở hạ tầng 「電気」（điện） đi với 「どころか」 để làm nền so sánh. Tiếp nối bằng danh từ sinh hoạt thiết yếu 「毎日の飲み水」（nước uống hàng ngày） đi cùng trợ từ nhấn mạnh 「さえ」 và vị ngữ phủ định hoàn toàn 「満足に手に入らない状況だ」（là tình trạng không thể có được một cách đầy đủ）.
どころ,～どころではない　Nどころではない　V－ているどころではない,N3,①この1か月は来客が続き、勉強どころではなかった。,会社が倒産の危機に瀕しており、今は休暇を取っているどころではない。,会社が倒産の危機に瀕しており、,今は,休暇を,取っている,どころではない。,,"Cấu trúc 「V-ているどころではない」 chỉ ra tình trạng cực kỳ khẩn cấp, khiến người nói không thể có thời gian hoặc tâm trí làm một việc thảnh thơi nào đó (Không phải là lúc để...). Bối cảnh nghiêm trọng 「会社が倒産の危機に瀕しており」（công ty đang đứng trước nguy cơ phá sản） loại bỏ hoàn toàn khả năng thực hiện hành động hưởng thụ 「休暇を取っている」（đang nghỉ phép）. Cụm từ chỉ thời gian 「今は」（bây giờ） kết hợp với ngữ pháp 「どころではない」 để khẳng định tính bất khả thiのviệc nghỉ ngơi lúc này."
どころ,Nところのはなしではない　Nどころのさわぎではない,N2,①受験生の息子を二人もかかえ、海外旅行どころの話ではありません。,今回の大規模な洪水被害は、一部の地域だけの問題どころの騒ぎではない。,今回の大規模な洪水被害は、,一部の,地域だけの,問題どころの,騒ぎではない。,,Cấu trúc mang tính phóng đại/nhấn mạnh trong báo chí 「Nどころの騒ぎではない」 thể hiện một sự việc nghiêm trọng vượt xa quy mô hay định nghĩa thông thường (Không dừng lại ở mức.../Không chỉ đơn giản là...). Chủ đề thời sự 「今回の大規模な洪水被害」（thiệt hại lũ lụt quy mô lớn lần này） được định lượng so sánh với 「一部の地域」（một bộ phận khu vực） và 「問題」（vấn đề）. Sự kết hợpの「問題どころの」 và vế phủ định mạnh 「騒ぎではない」 nhấn mạnh tính toàn quốc và mức độ thảm họa cực kỳ nghiêm trọngのsự kiện.
ところが,ところが＜反予測＞,N3,①天気予報では今日は雨になると言っていた。ところが、少し曇っただけで、結局は降らなかった。,彼は絶対に勝てると確信していた。ところが、無名の新人に一瞬で敗れ去った。,彼は絶対に勝てると確信していた。,ところが、,無名の,新人に,一瞬で,敗れ去った。,"Liên từ nghịch tiếp 「ところが」 dùng để chuyển ngoặt câu chuyện, mở đầu cho một thực tế hoàn toàn trái ngược với kỳ vọng hay phán đoán trước đó (Thế nhưng/Tuy nhiên). Câu đầu tạo tiền đề kỳ vọng cao 「絶対に勝てると確信していた」（đã tin chắc là mình sẽ thắng）. Sau liên từ 「ところが」, các thành phần định ngữ bổ nghĩa 「無名の」（vô danh）, tân ngữ tác nhân 「新人に」（trước tân binh） và trạng ngữ tốc độ 「一瞬で」（trong chớp mắt） kết hợp với động từ mang tính bi kịch văn học 「敗れ去った」（đã thất bại hoàn toàn） tạo ra cú sốc lớn cho độc giả."
ところが,ところが＜発見＞,N3,①急いで家を出た。ところが、途中で財布を忘れていることに気がつき、あわてて引き返した。,彼は引き出しの奥を探した。ところが、そこにあるはずの秘密の鍵が消えていた。,彼は引き出しの奥を探した。,ところが、,そこに,あるはずの,秘密の鍵が,消えていた。,"Liên từ 「ところが」 ở đây đóng vai trò liên kết hành động chủ động tìm kiếm ở câu trước với một phát hiện đột ngột, ngoài ý muốn ở câu sau (Ấy thế mà... lại thấy). Hành động tìm kiếm kịch tính 「引き出しの奥を探した」（đã tìm sâu trong ngăn kéo） dẫn tới liên từ chỉ sự bất ngờ 「ところが」. Trạng từ chỉ nơi chốn 「そこに」（ở đó） đi với cụm định ngữ chỉ giả định chắc chắn 「あるはずの」（đáng lẽ phải có） bổ nghĩa cho danh từ cốt truyện tiểu thuyết 「秘密の鍵」（chìa khóa mật）. Vĩ tố động từ trạng thái 「消えていた」（đã biến mất） hoàn tất phát hiện bất ngờ."
ところだ,V－たところだ,N4,①今帰ってきたところです。,編集長、ちょうど今、今週号の原稿を書き終えたところです。,編集長、ちょうど今、,今週号の,原稿を,書き終えた,ところです。,,Cấu trúc ngữ pháp cơ bản 「V-たところだ」 thể hiện một hành động vừa mới hoàn thành xong trong tích tắc so với thời điểm nói. Bối cảnh đối thoại văn học/báo chí với tổng biên tập 「編集長」 được nhấn mạnh bằng trạng từ thời gian cực kỳ khẩn cấp 「ちょうど今」（vừa đúng lúc này）. Định ngữ 「今週号の」（của số tuần này） bổ nghĩa cho danh từ tân ngữ 「原稿」（bản thảo）. Động từ phức kết thúc 「書き終えた」（đã viết xong） kết hợp với 「ところです」 để xác nhận trạng thái hoàn thành bản thảo ngay tức thì.
ところだ,V－ているところだ,N4,①A：もしもし、和雄君いますか。B：今お風呂に入っているところなんです。,現在、警察が現場付近で不審な車両を捜索しているところです。,現在、警察が,現場付近で,不審な,車両を,捜索している,ところです。,"Cấu trúc 「V-ているところだ」 nhấn mạnh một hành động cụ thể đang trong quá trình diễn ra tại thời điểm nói. Đây là phong cách đưa tin trực tiếp đặc trưngのbáo chí. Trạng từ thời gian 「現在」（hiện tại） và chủ ngữ hành động 「警察が」（cảnh sát） làm nền. Tiếp theo là địa điểm hành động 「現場付近で」（ở gần hiện trường）, tính từ bổ nghĩa cho phương tiện khả nghi 「不審な」（khả nghi） tác động lên danh từ tân ngữ 「車両」（xe cộ）. Động từ tiếp diễn 「捜索している」（đang lùng sục/tìm kiếm） kết hợp với 「ところです」 để truyền tải tính khẩn cấpのthời sự."
ところだ,V－ていたところだ,N3,①いい時に電話をくれました。私もちょうどあなたに電話しようと思っていたところなんです。,記者が訪ねて来た時、私は事件の真相について同僚と議論を交わしていたところだった。,記者が訪ねて来た時、私は,事件の,真相について,同僚と,議論を交わしていた,ところだった。,"Cấu trúc 「V-ていたところだ」 dùng để giải thích bối cảnh, mô tả một hành động đang trong quá trình diễn ra tại một thời điểm xác định trong quá khứ khi có sự việc khác cắt ngang. Bối cảnh bắt đầu bằng mệnh đề trạng ngữ chỉ thời gian 「記者が訪ねて来た時」（Khi phóng viên đến thăm） tác động lên chủ thể 「私は」. Tiếp đến, danh từ làm rõ nội dung tranh luận 「事件の」（của vụ án） bổ nghĩa cho danh từ đi kèm cấu trúc chủ đề 「真相について」（về chân tướng）. Đối tượng tham gia 「同僚と」（với đồng nghiệp） đứng trước động từ tiếp diễn quá khứ mang tính chuyên môn nghị luận 「議論を交わしていた」（đang trao đổi thảo luận） kết hợp hoàn chỉnh với ngữ pháp thời quá khứ 「ところだった」."
ところだ,V－るところだ,N4,①これから家を出るところですから、30分ほどしたら着くと思います。,首相はまもなく、記者団に向けて公式の声明を発表するところだ。,首相はまもなく、,記者団に,向けて,公式の声明を,発表する,ところだ。,"Cấu trúc 「V-るところだ」 dùng để diễn tả một hành động sắp sửa xảy ra ngay sau thời điểm nói (Chuẩn bị làm...). Trạng từ chỉ thời gian rất gần 「まもなく」（chẳng mấy chốc/sắp sửa） bổ nghĩa cho toàn bộ vị ngữ. Tiếp theo là cụm giới từ chỉ đối tượng hướng tới 「記者団に向けて」（hướng về phía giới báo chí）. Tân ngữ chínhのcâu phát ngôn là 「公式の声明」（tuyên bố chính thức） đi với trợ từ tân ngữ 「を」 và động từ hành động tương lai gần 「発表する」（phát biểu/công bố） kết hợp với 「ところだ」 tạo nên sắc thái trang trọng, chuẩn xácのtin tức thời sự."
ところだ,～たらVところだ,N2,①昔だったらそんな過激な発言をする人間は、処刑されているところだ。,独裁政権の時代であれば、このような記事を書いた記者は即座に逮捕されているところだ。,独裁政権の時代であれば、,このような,記事を書いた,記者は即座に,逮捕されている,ところだ。,"Cấu trúc giả định giả tưởng 「～ば/たら V-ているところだ」 dùng để đưa ra phán đoán về một kết cục chắc chắn đã xảy ra trong một hoàn cảnh giả định khác (Nếu là... thì đã bị... rồi). Bối cảnh giả định cực đoan 「独裁政権の時代であれば」（Nếu là thời kỳ chính quyền độc tài） đóng vai trò điều kiện. Tiếp nối là cụm từ chỉ đối tượng chịu tác động 「このような記事を書いた記者」（nhà báo đã viết bài viết như thế này） đi kèm trạng từ chỉ thời gian tức thì 「即座に」（ngay lập tức）. Cuối cùng, thể bị động tiếp diễn quá khứ giả định 「逮捕されている」（đã bị bắt giữ） đi với vĩ tố 「ところだ」 nhấn mạnh kết cục tất yếu đầy nguy hiểm trong bối cảnh xã hội."
ところだ,～ところだったV－るところだった　V－ていたところだった,N3,①もし気がつくのが遅かったら、大惨事になるところだった。,暗闇の中で足を踏み外し、危うく深い谷底へ転落するところだった。,暗闇の中で足を踏み外し、,危うく,深い,谷底へ,転落する,ところだった。,Cấu trúc 「V-るところだった」 dùng để diễn tả một trạng thái suýt chút nữa là đã dẫn đến một kết quả cực kỳ tồi tệ trong quá khứ nhưng thực tế đã may mắn không xảy ra (Suýt nữa thì...). Tình huống kịch tính trong tiểu thuyết bắt đầu bằng 「暗闇の中で足を踏み外し」（sảy chân trong bóng tối）. Trạng từ chỉ sự nguy hiểm cận kề 「危うく」（suýt chút nữa） dẫn dắt định ngữ bổ nghĩa cho đích đến hiểm nguy 「深い」（sâu） và 「谷底へ」（xuống đáy vực）. Động từ chỉ hành động tai nạn rơi ngã 「転落する」（rơi xuống） kết hợp với ngữ pháp quá khứ 「ところだった」 để khép lại khoảnh khắc nghẹt thở.
ところだ,～なら（ば）～ところ　だが／を,N2,①普通ならただではすまないところだが、今回だけは見逃してやろう。,本来なら厳しい法的処分を受けるところだが、深く反省しているため釈放された。,本来なら,厳しい,法的処分を,受ける,ところだが、,深く反省しているため釈放された。,"Cấu trúc tương phản giả định 「～なら...ところだが」 thể hiện ý nghĩa: Theo lẽ thường hay theo đúng quy định thì đáng lẽ phải chịu một kết cục như thế, nhưng thực tế nhờ lý do nào đó mà kết quả lại khác đi (Đáng lẽ ra... thế nhưng...). Cụm điều kiện lý tưởng 「本来なら」（Đáng lẽ ra/Theo đúng lý） dẫn dắt định ngữ tính từ mức độ 「厳しい」（nghiêm khắc） bổ nghĩa cho danh từ tân ngữ 「法的処分」（hình phạt pháp lý）. Động từ đón nhận 「受ける」（chịu/nhận） kết hợp với ngữ pháp tương phản 「ところだが」 tạo bước ngoặt chuyển ý sang thực tế khoan hồng ở vế sau 「深く反省しているため釈放された」（vì đã sâu sắc ăn năn hối lỗi nên đã được phóng thích）."
ところで,ところで,N4,①A：お元気そうですね。B：おかげさまで。A：ところで、この度は息子さんが大学に合格なさったそうで、おめでとうございます。,新しい工場の建設は順調に進んでいます。ところで、来期の予算案はもう確認されましたか。,新しい工場の建設は順調に進んでいます。,ところで、,来期の,予算案は,もう確認,されましたか。,"Liên từ 「ところで」 là một phó từ liên kết cực kỳ phổ biến dùng để chủ động chuyển đổi đề tài, thay đổi dòng suy nghĩ sang một chủ đề hoàn toàn mới trong hội thoại hoặc phóng sự viết. Sau khi hoàn thành việc thông tin về chủ đề cũ 「新しい工場の建設は順調に進んでいます」（Việc xây dựng nhà máy mới đang tiến triển thuận lợi）, người nói dùng 「ところで」 để ngắt dòng và mở đầu cho câu hỏi về chủ đề tài chính hành chính mới. Cụm định ngữ thời gian tương lai 「来期の」（của kỳ tới） bổ nghĩa cho danh từ chủ đề 「予算案」（dự thảo ngân sách）. Trạng từ hoàn thành 「もう」（đã... chưa） đi liền với động từ kính ngữ bị động 「確認されましたか」（đã xác nhận chưa） để hoàn tất câu hỏi chuyển đề tài một cách lịch sự."
