Grammar,Usage,JLPT Level,Reference Example,Original Example,Prefix,Chunk1,Chunk2,Chunk3,Chunk4,Suffix,Explanation
とやら,Nとやら,N2,①例の啓子さんとやらとは、うまくいっていますか。,編集者は、話題の新人作家とやらが執筆した新作原稿を、慎重に読み始めた。,編集者は、,話題の新人作家,とやら,が執筆した,新作原稿を、,慎重に読み始めた。,「Phân tích ngữ pháp: Nとやら」は不確かな情報や、聞き慣れない名前を引用する際に使います。文脈に合わせて「作家」の後に接続させます。
とやら,～とやら,N2,①私の答案を見て、先生がびっくりした顔をしていたとやら。,現場の目撃者は、空から光る物体が落ちてきたとやら、不可解な証言を繰り返している。,現場の目撃者は、,空から光る物体が,落ちてきた,とやら、,不可解な証言を,繰り返している。,「Phân tích ngữ pháp: ～とやら」で伝聞や不確かな事実を提示します。文中で「聞いた内容」を引用する役割を果たすため、文構造の途中に配置します。
とりわけ,,N3,①兄弟は3人とも頭がよいが、次男はとりわけ優秀だ。,今回の経済政策は国民全体に影響を与えるが、とりわけ地方の中小企業には厳しいものになるだろう。,今回の経済政策は,国民全体に,影響を与えるが、,とりわけ,地方の中小企業には,厳しいものになるだろう。,「Phân tích ngữ pháp: とりわけ」は「特に」という意味です。強調したい対象の前に置くことで、文の論理構成が明確になります。
とんだ,とんだN,N2,①あなたが邪魔したなどと、とんだ思い違いをしていました。,選挙戦の最中にスキャンダルが発覚し、候補者はとんだ災難に見舞われた。,選挙戦の最中に,スキャンダルが発覚し、,候補者は,とんだ,災難に,見舞われた。,「Phân tích ngữ pháp: とんだ」は思いがけない悪い事態を強調する際に使います。名詞「災難」を修飾する位置に配置します。
とんでもない,とんでもないN,N3,①子供は時々とんでもない質問をして親を困らせることがある。,犯人は、とんでもない方法で厳重な警備を突破し、宝石を盗み出した。,犯人は、,とんでもない,方法で,厳重な警備を,突破し、,宝石を盗み出した。,「Phân tích ngữ pháp: とんでもない」は、常識では考えられないほど驚くべき、という形容動詞として機能し、後に続く名詞「方法」を修飾します。
とんでもない,とんでもない,N4,①A：ずいぶん景気がよさそうですね。B：とんでもない。借金だらけで首が回りませんよ。,A：先生の功績は歴史的ですね。B：とんでもない。まだまだ研究の途中でございます。,A：先生の功績は歴史的ですね。B：,とんでもない。,まだまだ,研究の,途中で,ございます。,「Phân tích ngữ pháp: とんでもない」は相手の評価や提案を強く否定する慣用表現です。文頭で独立して使われます。
どんな,どんなN＋助詞＋も,N4,①母は、どんなことでもやさしく聞いてくれる。,彼はどんな困難に直面しても、決して夢を諦めなかった。,彼は,どんな,困難に,直面しても、,決して,夢を諦めなかった。,「Phân tích ngữ pháp: どんなN＋も」の形で「いかなる～も」という全否定・全肯定の強調表現を作ります。文脈上、「困難」を強調する語順です。
どんなに,どんなに～だろう（か）,N3,①希望校に合格できたら、どんなにいいだろうか。,長い監禁生活を経て、自由の空気がどんなに尊いものだろうか。どんなに～だろうか」は心情の深さを強調します。「どんなに」を形容詞「尊い」の直前に置くことで強調の効果が出ます。,長い監禁生活を経て、,自由の,空気が,どんなに,尊いものだろうか。,どんなに～だろうか」は心情の深さを強調します。「どんなに」を形容詞「尊い」の直前に置くことで強調の効果が出ます。,Đây là một cấu trúc ngữ pháp quan trọng cần ghi nhớ để nắm vững ý nghĩa câu. Mọi người chú ý nhé.
どんなに,どんなに～ても,N3,①どんなに金持ちでも愛惜に恵まれなければ幸福とは言えない。,どんなに世論が厳しくても、真実を報道するのがジャーナリストの使命だ。,,どんなに,世論が,厳しくても、,真実を報道するのが,ジャーナリストの使命だ。,「Phân tích ngữ pháp: どんなに～ても」は逆接の強調です。「厳しい」という形容詞の程度を「どんなに」で修飾し、文を繋げます。
ないか,「～ないか」　は主として男性が使う。丁寧な言い方の「～ませんか」や「か」を省略した「～ない？」は男女ともに使う。V－ない（か）＜勧誘＞,N4,①ちょっと、食べてみない？,さあ、ここで体制を変えるために立ち上がらないか。立ち上がらないか」は相手への勧誘です。文の終わりに配置し、文末を構成します。,さあ、,ここで,体制を,変えるために,立ち上がらないか。,立ち上がらないか」は相手への勧誘です。文の終わりに配置し、文末を構成します。,Đây là một cấu trúc ngữ pháp quan trọng cần ghi nhớ để nắm vững ý nghĩa câu. Mọi người chú ý nhé.
ないか,V－てくれない（か）＜依頼＞,N4,①お塩、とってくれない？,重要な証拠書類だから、すぐにコピーをとってくれないか。てくれないか」は丁寧さを少し抑えた依頼です。文末に来ることで、相手へのアクションを求める文構造となります。,重要な証拠書類だから、,すぐに,コピーを,とって,くれないか。,てくれないか」は丁寧さを少し抑えた依頼です。文末に来ることで、相手へのアクションを求める文構造となります。,Đây là một cấu trúc ngữ pháp quan trọng cần ghi nhớ để nắm vững ý nghĩa câu. Mọi người chú ý nhé.
ないか,V－ないか＜命令＞,N3,①おい待たないか。,敵の背後を突くぞ。全員、前進しないか！～しないか」は強い命令や促しを表します。「前進」という動詞的な名詞の後に、「しないか」を配置して文を作ります。,敵の背後を突くぞ。,全員、,前進,しない,か！,～しないか」は強い命令や促しを表します。「前進」という動詞的な名詞の後に、「しないか」を配置して文を作ります。,Đây là một cấu trúc ngữ pháp quan trọng cần ghi nhớ để nắm vững ý nghĩa câu. Mọi người chú ý nhé.
ないか,ではないか　A－くないか　V－ないか,N4,①A：彼が犯人じゃないですか。B：そうかな。,彼が隠蔽工作の黒幕ではないか。,,彼が,隠蔽工作の,黒幕では,ないか。,,「Phân tích ngữ pháp: ～ではないか」は断定や強い推測を表します。この文では主語「彼が」を文頭に配置し、最後に結論を置きます。
ないか,ではないか　A－くないか　V－ないか,N4,①彼が、東大に合格したなんて、何かの間違いではないか。,未知のウイルスが世界中で蔓延しているなんて、何かの陰謀ではないか。,未知のウイルスが世界中で蔓延しているなんて、,何かの,陰謀,では,ないか。,,「Phân tích ngữ pháp: ～ではないか」の形です。直前の「陰謀」という名詞に接続するため、「陰謀では」と文を分割します。
ないか,～ないかしら＜願望＞　V－ない／V－れない　かしら　V－てくれないかしら,N3,①また、あの人から手紙が来ないかしら。,遠い故郷にいる家族から、手紙が届かないかしらと毎日待っている。,遠い故郷にいる家族から、,手紙が,届かない,かしらと,毎日,待っている。,「Phân tích ngữ pháp: ～ないかしら」は独り言のような願望を表します。文中で「かしらと」と繋げることで、後の動詞「待っている」に繋げます。
ないか,ではないかしら　A－くないかしら　V－ないかしら,N3,①向こうからくる人、鈴木さんじゃないかしら。,あの赤い服の人物が、今回の事件の犯人ではないかしら。,あの赤い服の人物が、,今回の,事件の,犯人では,ないかしら。,,「Phân tích ngữ pháp: ではないかしら」は自信のない推測を表します。文末に置くことで、疑問や推測のニュアンスを出します。
ないかな,活用語の否定形に話し手の不確かな気持ちを表す「かな」がついたもの。自問と相手への質問のどちらにも用いられる。「かしら」とは異なり男女どちらでも使用できるが、丁寧な言い方ではないので、直接聞き手に対して質問するような場合は親しい間柄に限られる。～かな（あ）＜願望＞V－ない／V－れないかなあ　V－てくれないかなあ,N3,①早く夏休みにならないかなあ。,この過酷な現実から、早く解放されないかなあ。,この過酷な,現実から、,早く,解放されない,かなあ。,,「Phân tích ngữ pháp: ～ないかなあ」は強い願望の独り言です。動詞の否定形「解放されない」の後に配置して文を締めくくります。
ないかな,ではないかなあ　A－くないかなあ　V－ないかなあ,N3,①あの人、森田さんの奥さんじゃないかな。,あの老人が隠し持っているメモが、真実を記したものじゃないかな。,あの老人が,隠し持っている,メモが、,真実を記した,ものじゃないかな。,,「Phân tích ngữ pháp: ～じゃないかな」は推測の強調です。「もの」という形式名詞に続く形で文を終えます。
ないことはない,V－ないことはない,N3,①A：とても明日までには終わりそうにないんですけど～。B：いや、やる気があればできないことはありませんよ。,現段階では難しいが、可能性がまったくないことはない。,現段階では難しいが、,可能性が,まったく,ない,ことはない。,,「Phân tích ngữ pháp: ないことはない」は「二重否定」で肯定を強調します。「ない」を文の終端近くに置き、「ことはない」で完結させます。
ないこともない,V－ないこともない,N3,①よく考えてみれば、彼の言うことももっともだと思えないこともない。,彼の政治的姿勢に共感できないこともないが、強引な手法には賛成できない。,彼の政治的姿勢に,共感できない,ことも,ないが、,強引な手法には,賛成できない。,「Phân tích ngữ pháp: 共感できないこともない」という二重否定を文の繋ぎに使うことで、「一部は認めるが」というニュアンスを表現します。
