Grammar,Usage,JLPT Level,Reference Example,Original Example,Prefix,Chunk1,Chunk2,Chunk3,Chunk4,Suffix,Explanation
なに～ない,なに～ない,N3,①彼は父から受け継いだ大きな家に住んで、なに不自由なく暮らしている。,容疑者は事件についてなに一つ語ろうとはしなかった。,容疑者は,事件について,なに一つ,語ろうとは,しなかった,。,"Cấu trúc 「なに～ない」 (ở đây sử dụng dưới dạng なに一つ...ない) biểu thị ý nghĩa phủ định hoàn toàn (""không một điều gì""). Cụm 「事件について」 đóng vai trò bổ nghĩa cho hành động nói và cụm động từ thể ý chí phủ định 「語ろうとはしなかった」 đứng ở cuối câu để kết thúc mệnh đề một cách tự nhiên."
なにか,なにか＜物事＞,N5,①冷蔵庫に何か入っているから、お腹がすいたら食べなさい。,古い箱の中に何かあります。,古い,箱の,中に,何か,あります,。,Cấu trúc 「何か」 chỉ một vật gì đó không xác định rõ. Thứ tự sắp xếp tuân theo cú pháp cơ bản của tiếng Nhật: Tính từ 「古い」 bổ nghĩa cho danh từ 「箱
なにか,なにか＜様子＞,N4,①彼の態度は何か不自然だ。,裁判で彼の証言は何かおかしいと感じた。,裁判で,彼の,証言は,何か,おかしい,と感じた。,"Phó từ 「何か」 ở đây mang nghĩa ""có cái gì đó/dường như"", diễn tả một cảm giác mơ hồ, không rõ ràng của người nói về trạng thái sự vật. Về mặt cú pháp, danh từ sở hữu 「彼の」 bổ nghĩa cho chủ ngữ 「証言は」, sau đó phó từ 「何か」 bổ nghĩa trực tiếp cho tính từ vị ngữ 「おかしい」."
なにか,～かなにか　N／V　かなにか,N4,①コーヒーか何か飲みませんか。,ここでお茶か何か飲みながら話しましょう」と記者が言った。,ここで,お茶か,何か,飲みながら,話しましょう,」と記者が言った。,"Cấu trúc 「か何か」 dùng để đưa ra một gợi ý mang tính đại diện (""hoặc thứ gì đó tương tự""). Danh từ 「お茶」 kết hợp với 「か何か」 tạo thành cụm từ chỉ đối tượng, đi trước động từ phụ thể 「ながら」 (vừa uống vừa...) và kết thúc bằng động từ chính mang tính đề xuất 「話しましょう」."
なにか,Nやなにか,N4,①休みの日は雑誌や何かを読んでのんびり過ごします。,主人公は手紙や何かを燃やして部屋を出た。,主人公は,手紙や,何かを,燃やして,部屋を,出た。,"Cấu trúc 「や何か」 dùng để liệt kê danh từ kèm theo ý ""và những thứ tương tự"". Cụm 「手紙や何かを」 đóng vai trò tân ngữ đứng trước động từ 「燃やして」, thể 「て」 nối tiếp hành động này với hành động kế tiếp 「部屋を出た」 để tạo mạch truyện."
なにか,なにか＜詰問＞,N2,①それならなにか。この会社を辞めてもいいんだな。,男はなにか君は私を犯人だと疑っているのか」と怒鳴った。,男は,なにか,君は,私を犯人だと,疑っているのか,」と怒鳴った。,"なにか」 đặt ở đầu câu thoại mang tính chất chất vấn, vặn hỏi mạnh mẽ (""Ý câu là sao? Chẳng lẽ...""). Theo trật tự cú pháp, sau từ chất vấn 「なにか」 là chủ ngữ 「君は」, tiếp theo là bổ ngữ trích dẫn 「私を犯人だと」 và kết thúc bằng động từ nghi vấn vị ngữ 「疑っているのか」."
なにかしら,,N3,①なにかしらアルバイトをしているので、生活には困りません。,調査によると、現代人は誰もがなにかしらの悩みを抱えている。,調査によると、,現代人は,誰もが,なにかしらの,悩みを,抱えている。,"なにかしら」 biểu thị một thứ gì đó không rõ ràng nhưng chắc chắn tồn tại (""một chút gì đó/loại nào đó""). Khi đi ở dạng 「なにかしらのN」, cụm từ này đóng vai trò định ngữ bổ nghĩa trực tiếp cho danh từ 「悩み」, và cả cụm danh từ này làm tân ngữ cho động từ 「抱えている」."
なにかと,なにかと,N3,①なにかと雑用が多くてゆっくりできません。,新しい生活の時期はなにかと出費がかさむものだ。,新しい,生活の時期は,なにかと,出費が,かさむ,ものだ。,"Phó từ 「なにかと」 mang nghĩa ""này nọ, nhiều thứ, cách này hay cách khác"", dùng để bổ nghĩa cho toàn bộ trạng thái phía sau. Trong cấu trúc này, chủ ngữ thời gian 「新生活の時期は」 đứng đầu, tiếp theo là phó từ 「なにかと」, rồi đến chủ ngữ 「出費が」 đi kèm tự động từ 「かさむ」, kết thúc bằng cụm khẳng định bản chất 「ものだ」."
なにかと,なにかというと,N2,①あの人はなにかと言うと文句ばかり言っている。,その小説の中で、厳格な父親はなにかというと兄を叱っていた。,その小説の中で、,厳格な父親は,なにかというと,兄を,叱っていた,。,"Cấu trúc 「なにかというと」 nghĩa là ""hễ có chuyện gì là..."", biểu thị một hành động xảy ra thường xuyên mỗi khi có cớ. Trật tự câu đi từ chủ ngữ chỉ người thực hiện hành động 「厳格な父親は」, đến trạng từ chỉ tần suất/bối cảnh 「なにかというと」, tân ngữ 「兄を」 và cuối cùng là động từ hành động 「叱っていた」."
なにがなんでも,なにがなんでも＜意気込み＞,N2,①あの人には、なにがなんでも負けたくない。,新聞によると、首相はなにがなんでもこの法案を通す構えだという。,新聞によると、,首相は,なにがなんでも,この法案を,通す,構えだという。,"なにがなんでも」 thể hiện ý chí quyết tâm cực kỳ mạnh mẽ (""dù thế nào đi nữa/bằng bất cứ giá nào""). Cụm từ này đứng trước để bổ nghĩa cho hành động quyết tâm 「通す」. Tân ngữ 「この法案を」 phải đứng ngay trước động từ mà nó tác động, và câu kết thúc bằng cụm danh từ chỉ tư thế/sự chuẩn bị 「構えだ」."
なにがなんでも,なにがなんでも＋マイナス評価表現＜非難＞,N1,①この記事は、なにがなんでもひどすぎる。,社説は、政府の今回の対応はなにがなんでも理不尽極まりないと批判した。,社説は、,政府の,今回の対応は,なにがなんでも,理不尽極まりない,と批判した。,"Cấu trúc 「なにがなんでも」 khi đi với các biểu hiện tiêu cực sẽ mang sắc thái phê phán mạnh mẽ (""dù nhìn nhận thế nào cũng quá...""). Trật tự câu bắt đầu bằng thành phần định ngữ 「政府の」 bổ nghĩa cho chủ ngữ 「今回の対応は」, tiếp theo là trạng từ nhấn mạnh 「なにがなんでも」 và kết thúc bằng tính từ mang quán ngữ vị ngữ N1 「理不尽極まりない」."
なにかにつけて,,N2,①なにかにつけてその時のことが思い出される。,彼は故郷を離れて以来なにかにつけて母の料理が恋しくなると語った。,彼は,故郷を離れて以来,なにかにつけて,母の料理が,恋しくなる,と語った。,"Cấu trúc 「なにかにつけて」 mang nghĩa ""mỗi khi có dịp/hễ có chuyện gì là lại..."". Về mặt cú pháp, mệnh đề phụ chỉ thời gian 「故郷を離れて以来」 được đưa lên trước để làm nền cảnh, tiếp theo là cụm từ ngữ pháp 「なにかにつけて」 bổ nghĩa cho trạng thái tâm lý 「母の料理が恋しくなる」 ở phía sau."
なにげない,なにげないN　なにげなくV,N3,①何気ないその一言が私の心をひどく傷つけた。,作中において、彼女のなにげない仕草が彼の心を捉えて離さなかった。,作中において、,彼女の,なにげない仕草が,彼の心を,捉えて,離さなかった。,"Tính từ 「なにげない」 mang nghĩa ""vô tình, không cố ý, tự nhiên"". Nó đứng trước và bổ nghĩa cho danh từ 「仕草」 tạo thành cụm chủ ngữ 「なにげない仕草が」. Tân ngữ 「彼の心を」 đứng trước cụm liên kết hai động từ 「捉えて離さなかった」 để hoàn thiện cấu trúc vị ngữ."
なにしろ,,N3,①なにしろ彼は頭がいいから、私がどんなに頑張っても言い負かされてしまう。,特派員によると、なにしろ現地は通信環境が悪いため詳しい状況がわからないそうだ。,特派員によると、,なにしろ現地は,通信環境が,悪いため,詳しい状況が,わからないそうだ。,"Phó từ 「なにしろ」 dùng để nhấn mạnh một lý do khách quan, mang nghĩa ""dù sao đi nữa/vì thực tế là..."". Nó đứng ở đầu mệnh đề chỉ nguyên nhân, theo sau bởi chủ ngữ nhỏ 「通信環境が」 và tính từ chỉ nguyên nhân 「悪いため」, cuối cùng dẫn tới mệnh đề kết quả 「詳しい状況がわからない」."
なににもまして,,N2,①なににもまして健康が大切です。,記者は、紛争地域ではなににもまして人命の安全が最優先されるべきだと訴えた。,記者は、,紛争地域では,なににもまして,人命の安全が,最優先される,べきだと訴えた。,"Cấu trúc 「なににもまして」 mang nghĩa ""hơn tất cả mọi thứ/trên hết"". Trật tự từ được sắp xếp hợp lý khi thành phần trạng ngữ chỉ không gian 「紛争地域では」 đứng đầu câu, kế tiếp là cụm từ so sánh nhấn mạnh 「なににもまして」, sau đó là chủ ngữ 「人命の安全が」 bổ nghĩa cho động từ bị động kết hợp từ chỉ nghĩa vụ 「最優先されるべきだ」."
なにも,なにも～ない,N4,①外は暗くてなにも見えない。,その夜、濃い霧のせいで前方はなにも見えなかった。,その夜、,濃い霧のせいで,前方は,なにも,見えなかった,。,"Cấu trúc phủ định toàn diện 「なにも～ない」 mang nghĩa ""không một cái gì cả"". Câu tuân theo logic tự nhiên: Mệnh đề chỉ nguyên nhân 「濃い霧のせいで」 đứng đầu, tiếp theo là trạng ngữ chỉ phương hướng 「前方は」, rồi đến phó từ phủ định 「なにも」 đi liền với động từ thể khả năng dạng phủ định 「見えなかった」."
なにも,なにも～ない,N2,①なにも、みんなの前で、そんなに恥ずかしい話をしなくてもいいでしょう。,彼は、なにもそんなに自分を責める必要はない」と慰めた。,彼は、,なにも,そんなに,自分を,責める必要はない,」と慰めた。,"Từ 「なにも」 đứng ở đầu câu thoại khi đi với dạng phủ định sẽ mang sắc thái khuyên nhủ hoặc phản bác nhẹ nhàng (""đâu cần phải/làm gì đến mức""). Tiếp theo là phó từ chỉ mức độ 「そんなに」 bổ nghĩa cho tân ngữ 「自分を」 và cụm danh từ vị ngữ phủ định 「責める必要はない」."
なにも,なにも～わけではない,N2,①私はなにも、あなたがやっていることを非難しているわけではないんです。ただちょっと注意したほうがいいと思って忠告しているんじゃないですか。,報道によると、彼はなにも会社の決定に反対しているわけではないらしい。,報道によると、,彼は,なにも,会社の決定に,反対している,わけではないらしい。,"Cấu trúc 「なにも～わけではない」 dùng để phủ định một phần mang tính giải thích (""không hẳn là/không có nghĩa là...""). Trật tự câu đi từ chủ ngữ 「彼は」, phó từ giảm nhẹ 「なにも」, đến bổ ngữ gián tiếp 「会社の決定に」 đứng trước động từ hành động 「反対している」, và kết thúc bằng đuôi phủ định 「わけではない」."
なにも,Nもなにも,N3,①戦争で、家もなにも全てを失ってしまった。,あの災害で、津波は家もなにも全てを奪い去ったと証言した。,あの災害で、,津波は,家もなにも,全てを,奪い去った,と証言した。,"Cấu trúc 「Nもなにも」 dùng để nhấn mạnh việc bao gồm danh từ N và toàn bộ những thứ khác liên quan (""nhà cửa hay bất cứ thứ gì""). Cụm từ này đứng ở vị trí tân ngữ bổ sung ý nghĩa cho đại từ tổng hợp 「全てを」, trước khi bị tác động bởi động từ hành động mạnh 「奪い去った」."
なにも,～もなにも　A／V　もなにも,N2,①A：高田さん、あなた必ずやるって約束してくれたじゃないですか。B：約束するもなにも、私はそんなことを言った覚えもないですよ。,男は、断るもなにも私は最初から招待されていない」と言い放った。,男は、,断るも,なにも,私は最初から,招待されていない,」と言い放った。,"Cấu trúc 「Vもなにも」 dùng để phủ định mạnh mẽ tiền đề hoặc một giả định trước đó (""khoan bàn đến việc V, thực tế là...""). Động từ dạng từ điển 「断る」 kết hợp với trợ từ 「もなにも」 được đặt ở đầu vế đối thoại, theo sau bởi chủ ngữ 「私は最初から」 và kết thúc bằng sự thật ở dạng bị động phủ định 「招待されていない」."
