Grammar,Usage,JLPT Level,Reference Example,Original Example,Prefix,Chunk1,Chunk2,Chunk3,Chunk4,Suffix,Explanation
のだろう,～のだろう／～んだろう＜確認＞,N3,①A：10年ぶりの同窓会だね。君も行くんだろう？　B：うん、行くつもりだ。,君も来月からあの廃墟の調査に参加するのだろう？,君も来月から,あの廃墟の,調査に,参加する,のだろう？,,"Phần đầu (Prefix) là chủ ngữ và trạng ngữ chỉ thời gian 「君も来月から」 (Cậu cũng từ tháng sau). Danh từ 「廃墟」 (tàn tích) bổ nghĩa cho danh từ 「調査」 (điều tra) qua trợ từ 「の」 để tạo thành cụm danh từ 「あの廃墟の」. Cụm này bổ nghĩa cho danh từ đi kèm trợ từ chỉ mục đích 「調査に」 . Động từ thể từ điển 「参加する」 (tham gia) bổ nghĩa trực tiếp cho cấu trúc xác nhận, hỏi lại 「のだろう？」 (phải không?) ."
のだろう,～のだろうか／～んだろうか,N3,①子どもたちが公園にたくさんいる。今日は学校が休みなのだろうか。,AI của 進化は人間の創造性を奪うのだろうか。,AI của 進化は,人間の,創造性を,奪う,のだろうか。,,"Chủ ngữ chính của câu là 「AI của 進化は」 (Sự tiến hóa của AI) làm Prefix. Cụm bổ nghĩa 「人間の」 (của con người) bổ nghĩa cho danh từ tân ngữ 「創造性」 kết hợp trợ từ 「を」 để chỉ đối tượng bị tác động. Động từ thể thông thường 「奪う」 (cướp đi) kết hợp trực tiếp với cấu trúc tự hỏi, hoài nghi 「のだろうか」 (liệu có... hay không?) để tạo nên câu hỏi suy ngẫm."
ので,なので　A／Vので,N5,①雨が降りそうなので試合は中止します。,今日は風が強いので電車が少し遅れました。,今日は,風が,強い,ので,電車が,少し遅れました。,Trạng từ chỉ thời gian 「今日は」 (Hôm nay) làm Prefix. 「風が」 (gió) đóng vai trò chủ ngữ cho tính từ đuôi I 「強い」 (mạnh) để tạo thành vế chỉ nguyên nhân. Tính từ đuôi I kết hợp trực tiếp với trợ từ chỉ lý do 「ので」 (vì) . 「電車が」 (tàu điện) là chủ ngữ cho hành động ở phần đuôi (Suffix) 「少し遅れました」 (đã bị trễ một chút) để diễn tả kết quả.
のであった,なのであった　A／V　のであった,N1,①彼は大学を辞めて故郷に帰った。ようやく父のあとを受けて家業を継ぐ決心がついたのであった。,激しい戦いの末、その古い城塞はついに敵の手へと落ちたのであった。,激しい戦いの末、,その古い城塞は,ついに,敵の手へと,落ちた,のであった。,"Prefix 「激しい戦いの末、」 (Sau cuộc chiến khốc liệt,) mở đầu bối cảnh lịch sử. là chủ ngữ 「その古い城塞は」 (pháo đài cổ kính đó). Phó từ chỉ kết cục 「ついに」 (cuối cùng) bổ nghĩa cho động từ chính. Cụm chỉ phương hướng 「敵の手へと」 (vào tay kẻ thù) chỉ hướng di chuyển của hành động 「落ちた」 (sụp đổ/rơi vào) . Suffix 「のであった」 kết hợp với động từ thể quá khứ 「落ちた」 để tạo sắc thái kể chuyện, tường thuật lịch sử sâu sắc trong văn học."
のである,なのである　A／V　のである,N2,①解決には時間がかかりそうだ。問題は簡単ではないのである。,現代社会において、情報の信頼性を見極める力は不可欠なのでのである。,現代社会において、,情報の信頼性を,見極める力は,不可欠,なのでのである。,,"Prefix 「現代社会において、」 (Trong xã hội hiện đại,) là trạng từ chỉ bối cảnh. 「情報の信頼性を」 (tính tin cậy của thông tin) là cụm tân ngữ bổ nghĩa cho động từ định ngữ 「見極める」 (đánh giá/nhìn thấu) kết hợp với danh từ 「力」 và trợ từ chủ đề 「は」 để tạo thành chủ ngữ chính 「見極める力は」 (năng lực đánh giá...) . Tính từ đuôi Na 「不可欠」 (bất khả khuyết/không thể thiếu) đi kèm cấu trúc khẳng định, giải thích mang tính nghị luận báo chí 「なのである」 (đối với tính từ đuôi Na/danh từ, ta thêm 「な」 trước 「のである」)."
のです,なのです　A／V　のです　「のだ」の丁寧な言い方。話しことばでは丁寧な会話に用いられるが、普通は「んです」となることが多い。～のです＜説明＞,N4,①遅くなってすみません。途中で渋滞に巻き込まれてしまったのです。,この地域では大雨の影響で野菜の値段が上がってしまったのです。,この地域では,大雨の影響で,野菜の値段が,上がってしまった,のです。,,Prefix 「この地域では」 chỉ phạm vi địa điểm. 「大雨の影響で」 (do ảnh hưởng của mưa lớn) đóng vai trò trạng ngữ chỉ nguyên nhân. 「野菜 của giá が」 (giá rau) là chủ ngữ cho động từ biến đổi trạng thái ngoài ý muốn 「上がってしまった」 (đã bị tăng lên mất rồi) . Động từ ở thể thông thường quá khứ này kết hợp trực tiếp với cấu trúc giải thích sự tình một cách lịch sự 「のです」 .
のです,～のです＜主張＞,N3,①これからはあなたたちがこの店をまもり発展させて行くのです。,どんな困難があろうと、私たちは自らの道を突き進むのです。,どんな困難があろうと、,私たちは,自らの道を,突き進む,のです。,,"Prefix 「どんな困難があろうと、」 (Dù có khó khăn thế nào đi nữa) thể hiện điều kiện giả định nhượng bộ. 「私たちは」 (chúng ta) làm chủ ngữ chính cho hành động. Cụm danh từ tân ngữ 「自らの道を」 (con đường của chính mình) kết hợp với động từ thể hiện quyết tâm 「突き進む」 (dấn bước/tiến lên) . Cấu trúc khẳng định mạnh mẽ, thể hiện chủ trương quyết chí 「のです」 nằm đi trực tiếp sau động từ thể từ điển ."
のです,～のです＜話題のきっかけ＞,N3,①先週京都へ行ってきたのですが、そこで偶然高橋さんに会いましてね。相変わらず仕事に励んでいるようでした。,実は昨日新しい小説を読み始めたのですが、これがとても面白いんですよ。,実は昨日,新しい小説を,読み始めた,のですが、,これがとても,面白いんですよ。,"Prefix 「実はおととい」 (Thật ra hôm qua) là thành phần dẫn nhập câu chuyện. 「新しい小説を」 (quyển tiểu thuyết mới) là cụm tân ngữ bổ nghĩa cho động từ bắt đầu hành động 「読み始めた」 (đã bắt đầu đọc) . Cấu trúc làm mồi dẫn, khơi gợi chủ đề câu chuyện 「のですが、」 (thì/nhưng mà...) đi sau thể quá khứ của động từ . Vế tiếp theo bắt đầu bằng 「これがとても」 (cái này rất...) bổ nghĩa cho tính từ vị ngữ ở phần đuôi Suffix 「面白いんですよ」 (thú vị lắm đấy)."
のです,～のですか,N4,①どうして彼が犯人だとわかったのですか。,いつからあの古い時計は動かなくなったのですか。,いつから,あの古い時計は,動かなく,なった,のですか。,,"Prefix 「いつから」 (Từ khi nào) là từ nghi vấn thời gian. 「あの古い時計は」 (chiếc đồng hồ cổ kia) là chủ ngữ chính. 「動かなく」 là thể liên kết của tính từ phủ định 「動かない」 để bổ nghĩa cho động từ chuyển biến trạng thái 「なった」 (đã trở nên) . Cấu trúc hỏi tìm kiếm lời giải thích, nguyên nhân 「のですか」 đi sau động từ thể thông thường quá khứ 「なった」 để hoàn thành câu hỏi lịch sự."
のです,つまり～のです,N2,①締切は今月末、つまりあと5日しかないのです。,彼は沈黙を守った。つまり真犯人の正体を知っているのです。,彼は沈黙を守った。つまり,真犯人の,正体を,知っている,のです。,,"Prefix gồm một câu hoàn chỉnh biểu thị tiền đề và kết thúc bằng phó từ liên kết giải thích tóm gọn 「つまり」 (nghĩa là/tóm lại). 「真犯人の」 (của thủ phạm thực sự) bổ nghĩa cho danh từ tân ngữ 「正体」 đi với trợ từ 「を」 . Động từ chỉ trạng thái nhận thức 「知っている」 (đang biết) nhận tân ngữ này. Cấu trúc kết luận, giải thích sự thực khách quan 「のです」 đi trực tiếp sau động từ thể thông thường để đưa ra lập luận cuối cùng."
のです,だから～のだ,N3,①ずいぶん熱が高いですよ。だから頭がいたかったのですね。,昨夜は激しい嵐だった。だから庭の古い大木が倒れてしまったのだ。,昨夜は激しい嵐だった。だから,庭の,古い大木が,倒れてしまった,のだ。,,"Prefix đưa ra bối cảnh nguyên nhân khách quan và kết nối bằng phó từ kết quả 「だから」 (Vì thế/Cho nên). 「庭の」 (của khu vườn) bổ nghĩa cho danh từ chủ ngữ 「古い大木が」 (cây cổ thụ lớn) . Động từ thể hiện sự việc xảy ra ngoài ý muốn 「倒れてしまった」 (đã bị đổ mất) làm vị ngữ chính cho chủ ngữ . Cấu trúc khẳng định lý do, thấu suốt sự việc 「のだ」 đi sau động từ thể thông thường để kết thúc câu tự sự một cách thuyết phục."
のです,～のですから,N3,①時間はあるのですから、ゆっくりやって下さい。,まだ若いのですから、一度の失敗で諦める必要はありません。,,まだ若い,のですから、,一度の失敗で,諦める,必要はありません。,Không có Prefix. là tính từ đuôi I ở thể thông thường 「まだ若い」 (vẫn còn trẻ) làm vế điều kiện lý do hiển nhiên. Cấu trúc chỉ nguyên nhân hiển nhiên làm tiền đề cho lời khuyên 「のですから」 (bởi vì... nên) kết hợp trực tiếp với tính từ . 「一度の失敗で」 (chỉ vì một lần thất bại) đóng vai trò trạng ngữ chỉ cách thức/nguyên nhân bổ nghĩa cho động từ 「諦める」 (từ bỏ) . Động từ thể từ điển này bổ nghĩa trực tiếp cho danh từ và vị ngữ phủ định ở Suffix 「必要はありません」 (không cần thiết).
のでは,なのでは　A／V　のでは,N3,①そんなに臆病なのでは、どこにも行けませんよ。,そんなに体調が悪いのでは、明日の旅には同行できません。,,そんなに,体調が悪い,のでは、,明日の旅には,同行できません。,Không có Prefix. Phó từ chỉ mức độ 「そんなに」 (đến mức như vậy) bổ nghĩa cho cụm tính từ chỉ trạng thái sức khỏe 「体調が悪い」 (sức khỏe tồi tệ) . Cấu trúc giả định giả thuyết mang tính tiêu cực 「のでは、」 (nếu như... thì) đi sau tính từ thể thông thường để thiết lập điều kiện trái chiều. 「明日の旅には」 (đối với chuyến đi ngày mai) giới hạn phạm vi áp dụng cho trạng thái bất khả thi ở Suffix 「同行できません」 (không thể đồng hành).
のではなかったか,なのではなかったか　A／V　のではなかったか　～のではなかったか＜疑問＞,N2,①当時の人々は人間が空を飛ぶなどということは考えもしなかったのではなかったか。,その古い手紙は真実を隠すために書かれたのではなかったか。,その古い手紙は,真実を,隠すために,書かれた,のではなかったか。,,"Chủ ngữ chính 「その古い手紙は」 (Lá thư cổ đó) đóng vai trò Prefix. Cụm tân ngữ chỉ mục tiêu 「真実を」 (sự thật) bổ nghĩa cho cấu trúc chỉ mục đích hành động 「隠すために」 (để che giấu) . Động từ thể bị động quá khứ 「書かれた」 (đã được viết) làm vị ngữ chính cho chủ ngữ ở Prefix, và kết hợp trực tiếp với cấu trúc câu hỏi hoài nghi tu từ mang tính phán đoán 「のではなかったか」 (chẳng phải đã... hay sao) ."
のではなかったか,～のではなかったか＜非難＞,N1,①あなたたちは規律を守ると誓ったのではなかったか。,我々はどんな困難も共に乗り越えると誓い合ったのではなかったか。,我々は,どんな困難も,共に乗り越えると,誓い合った,のではなかったか。,,"Chủ ngữ tập thể 「我々は」 (Chúng ta) đóng vai trò Prefix. 「どんな困難も」 (bất chấp mọi khó khăn) đóng vai trò tân ngữ nhấn mạnh bổ nghĩa cho cụm hành động phối hợp 「共に乗り越えると」 (cùng nhau vượt qua và...) . Động từ thể hiện lời cam kết tương hỗ thể quá khứ 「誓い合った」 (đã thề thốt cùng nhau) kết hợp trực tiếp với cấu trúc chất vấn, khiển trách trách nhiệm 「のではなかったか」 (chẳng phải chúng ta đã... hay sao) ."
のに1,～のに＜逆原因＞,N4,①5月なのに真夏のように暑い。,もう12月なのにまるで春のように暖かい。,,もう12月,なのに,まるで春のように,暖かい。,,Không có Prefix. là danh từ chỉ thời gian 「もう12月」 (đã là tháng 12). Danh từ kết hợp với trợ từ nghịch lý biểu thị nguyên nhân trái ngược 「のに」 (mặc dù... thế mà) cần đi kèm với 「な」 tạo thành 「なのに」 . Cụm từ so sánh ví von 「まるで春のように」 (hệt như mùa xuân) bổ nghĩa cho trạng thái thời tiết 「暖かい」 (ấm áp) nhằm biểu hiện sự ngạc nhiên trước thực tế trái quy luật tự nhiên.
のに1,～のに＜対比＞,N4,①昨日はいい天気だったのに今日は雨だ。,観光地は賑やかなのに住宅地は静かだ。,観光地は,賑やかな,のに,住宅地は,静かだ。,,"Chủ thể đối sánh thứ nhất 「観光地は」 (Khu du lịch) đóng vai trò Prefix. Tính từ đuôi Na 「賑やかな」 (nhộn nhịp) kết hợp trực tiếp với trợ từ biểu thị sự đối nghịch, so sánh đối chiếu 「のに」 (trong khi/thế mà) . Đối tượng so sánh thứ hai 「住宅地は」 (khu dân cư) xuất hiện tương phản trực tiếp với trạng thái 「静かだ」 (yên tĩnh) để hoàn tất phép so sánh đối chiếu."
のに1,～のに＜予想外＞,N4,①合格すると思っていたのに、不合格だった。,何ヶ月も一生懸命準備したのに計画は失敗に終わった。,何ヶ月も,一生懸命,準備した,のに,計画は,失敗に終わった。,Trạng từ chỉ thời gian kéo dài 「何ヶ月も」 (suốt nhiều tháng) đóng vai trò Prefix. Phó từ chỉ nỗ lực 「一生懸命」 (hết sức mình) bổ nghĩa cho hành động ở thể quá khứ 「準備した」 (đã chuẩn bị) . Trợ từ nghịch lý chỉ kết quả ngoài dự kiến 「のに」 (thế mà/vậy mà) đi liền sau động từ thể thông thường . Vế sau bắt đầu bằng chủ thể 「計画は」 (kế hoạch) và kết thúc bằng kết quả đáng buồn ở Suffix 「失敗に終わった」 (đã kết thúc trong thất bại).
のに1,～のに＜文末＞,N3,①スピードを出すから事故を起こしたんだ。ゆっくり走れと言っておいたのに。,彼女は行ってしまった。私があれほど警告したのに。,彼女は行ってしまった。,私が,あれほど,警告した,のに。,,"Prefix là một câu độc lập thể hiện kết quả thực tế 「彼女は行ってしまった。」 (Cô ấy đã đi mất rồi). là chủ ngữ vế phụ 「私が」 (tôi) đi cùng phó từ mức độ 「あれほど」 (đến mức nhường ấy) để bổ nghĩa cho hành động quá khứ 「警告した」 (đã cảnh báo) . Trợ từ đặt ở cuối câu 「のに」 nhằm bộc lộ tâm trạng tiếc nuối, trách móc hoặc bất lực của người nói khi lời cảnh báo bị ngó lơ."
のに1,せっかく～のに→【せっかく】Nでも～のに,N2,①電気屋でも直せないのに、あなたに直せるはずがないじゃないの。,名医でも治療できないのに、素人の君に治せるわけがない。,,名医でも,治療できない,のに、,素人の君に,治せるわけがない。,Không có Prefix. chứa danh từ đi kèm trợ từ giới hạn cực đoan 「名医でも」 (ngay cả danh y cũng...). Động từ năng lực thể phủ định 「治療できない」 (không thể chữa trị) bổ nghĩa cho trợ từ nghịch lý đối chiếu giả định 「のに、」 (thế mà...) . Đối tượng so sánh cực đoan thứ hai là 「素人の君に」 (đối với một người nghiệp dư như cậu) và câu kết thúc bằng Suffix bác bỏ khả năng xảy ra 「治せるわけがない」 (lẽ nào lại chữa được) để tạo lập một lập luận phản bác sắc bén.
