Grammar,Usage,JLPT Level,Reference Example,Original Example,Prefix,Chunk1,Chunk2,Chunk3,Chunk4,Suffix,Explanation
なんという,なんという＋連体修飾句＋N,N3,①なんという馬鹿なやつだ。,事件現場に残されたのは、なんという悲惨な光景なのだろうかと、記者は言葉を失った。,事件現場に,残されたのは、,なんという,悲惨な,光景なのだろう,かと、記者は言葉を失った。,Cấu trúc cảm thán 「なんという + Danh từ bổ nghĩa + だろう」. Ở đây danh từ 「光景」 (cảnh tượng) được bổ nghĩa bởi tính từ đuôi na 「悲惨な」 (thê thảm). Thứ tự logic là: 「残されたのは」 (chủ ngữ) -> 「なんという」 -> 「悲惨な」 -> 「光景なのだろう」 để hoàn thành vế cảm thán trước khi dẫn tới vế sau.
なんという,なんというNだ,N3,①こんな大きな石を一人で持ち上げられるなんて、何という男だ。,深夜の編集部に一人残り、編集長はなんという原稿だ」とため息をついた。,深夜の編集部に一人残り、編集長は,なんという,原稿,だ」と,ため息を,ついた。,Mẫu câu cảm thán 「なんという + Danh từ + だ」 biểu thị sự ngạc nhiên lớn đối với danh từ 「原稿」 (bản thảo). Thứ tự sắp xếp: mở ngoặc kép -> phó từ cảm thán 「なんという」 đứng trước danh từ -> danh từ 「原稿」 -> đuôi cảm thán 「だ」 kèm trợ từ trích dẫn 「と」 -> bổ ngữ 「ため息を」 cho động từ chính 「ついた」。
なんという,なんということもない,N3,①何ということもなく、毎日が穏やかに過ぎて行く。,世間を騒がせるその大ニュースも、彼にとってはなんということもない日常の一部に過ぎなかった。,世間を騒がせるその大ニュースも、彼にとっては,なんという,こともない,日常の,一部に,過ぎなかった。,"Cụm từ 「なんということもない」 có nghĩa là 「không có gì đặc biệt, bình thường」. Cụm này bổ nghĩa cho danh từ 「日常」 qua trợ từ 「の」. Thứ tự sắp xếp tự nhiên: 「なんという」 -> 「こともない」 tạo thành tính từ -> bổ nghĩa cho 「日常の」 -> danh từ 「一部に」 -> cụm giới hạn 「過ぎなかった」 (chỉ là)."
なんとか,なんとか＜意志的＞,N3,①なんとかして山田さんを助け出そう。,真相を暴くため、記者はなんとかして内部告発者と接触を試みようとした。,真相を暴くため、記者は,なんとかして,内部告発者と,接触を,試みようと,した。,なんとかして」 thể hiện ý chí quyết tâm thực hiện hành động bằng mọi giá. Nó đứng trước để bổ nghĩa cho toàn bộ vế hành động phía sau. Thứ tự sắp xếp: phó từ ý chí 「なんとかして」 -> đối tượng tương tác 「内部告発者と」 -> tân ngữ 「接触を」 -> động từ thể ý định 「試みようと」 đi kèm 「した」.
なんとか,なんとか＜自動的＞,N3,①安月給だがなんとか食べていくことはできる。,激しい市場競争の中で、その小さな出版社はなんとか倒産を免れることができた。,激しい市場競争の中で、その小さな出版社は,なんとか,倒産を,免れることが,できた,。,"なんとか」 mang nghĩa là 「bằng cách nào đó, cuối cùng cũng xoay xở được」 (kết quả khách quan mang lại). Thứ tự sắp xếp: trạng từ khách quan 「なんとか」 -> tân ngữ 「倒産を」 -> động từ thể khả năng 「免れることが」 -> trợ động từ hoàn thành 「できた」。"
なんとか,なんとかなる,N4,①そんなに心配しなくてもなんとかなりますよ。,どんなに苦しい状況でも、諦めなければなんとかなると主人公は強く信じていた。,どんなに苦しい状況でも、諦めなければ,なんとかなると,主人公は,強く,信じて,いた。,Cụm từ 「なんとかなる」 mang nghĩa 「rồi mọi chuyện sẽ ổn thôi」. Đi kèm trợ từ trích dẫn 「と」 để làm tân ngữ cho động từ 「信じていた」. Thứ tự logic: nội dung trích dẫn 「なんとかなると」 -> chủ ngữ của hành động tin tưởng 「主人公は」 -> trạng từ bổ nghĩa 「強く」 -> động từ chính ở dạng tiếp diễn 「信じていた」.
なんとかいう,なんとかいう,N3,①私の言うことは聞こうとしないから、あなたから何とか言ってやって下さい。,発売延期を心配する読者に向けて、著者から何とか言って彼らを安心させてほしい。,発売延期を心配する読者に向けて、,著者から,何とか言って,彼らを,安心させて,ほしい。,何とか言って」 có nghĩa là 「hãy nói điều gì đó để giải quyết vấn đề」. Thứ tự sắp xếp hành động: chủ thể phát ngôn 「著者から」 -> hành động nói 「何とか言って」 -> đối tượng nhận tác động 「彼らを」 -> động từ sai khiến chỉ trạng thái 「安心させて」 -> biểu thị mong muốn 「ほしい」.
なんとかいう,なんとかいうN,N3,①大阪の何とかいう人から電話がありましたよ。,東北地方の何とかいう村に、その事件の目撃者がいるらしい。,東北地方の,何とかいう,村に、,その事件の,目撃者が,いるらしい。,何とかいう」 đóng vai trò bổ nghĩa cho danh từ 「村」 mang nghĩa 「ngôi làng tên là gì đó không rõ」. Thứ tự sắp xếp: vùng địa lý 「東北地方の」 -> cụm từ mơ hồ 「何とかいう」 -> danh từ chỉ nơi chốn 「村に」 -> thuộc tính 「その事件の」 -> chủ ngữ 「目撃者が」 -> động từ phỏng đoán sự tồn tại 「いるらしい」.
なんとかいう,NとかなんとかいうN,N2,①ポエムとか何とかいう喫茶店で会うと言っていました。,最近、若者の間で「悲劇」とかなんとかいう小説が流行しているそうだ。,最近、若者の間で「,悲劇」とか,なんとかいう,小説が,流行して,いるそうだ。,Cấu trúc 「N + とかなんとかいう + N」 dùng khi không nhớ rõ hoặc nói một cách đại khái về tên danh từ. Thứ tự sắp xếp: danh từ cụ thể trong ngoặc kép 「悲劇」とか」 -> cụm từ mơ hồ 「なんとかいう」 -> danh từ chính 「小説が」 -> động từ chỉ xu hướng 「流行しているそうだ」.
なんとかいう,～とかなんとかいう,N2,①あの男は給料が安いとかなんとか言って辞めたそうだ。,その政治家は体調が悪いとかなんとか言って、突然会見を打ち切った。,その政治家は,体調が悪い,とかなんとか,言って、,突然会見を,打ち切った。,"Cấu trúc 「～とかなんとか言って」 dùng để trích dẫn một lý do mơ hồ, có ý mỉa mai hoặc hoài nghi. Thứ tự logic: chủ ngữ 「その政治家は」 -> lý do viện cớ 「体調が悪い」 -> cụm từ trích dẫn đại khái 「とかなんとか」 -> hành động nói 「言って」 -> hành động đột ngột cắt đứt cuộc họp báo 「突然会見を打ち切った」."
なんとしても,,N2,①なんとしても彼には負けたくない。,生き残った若者は、なんとしても故郷の家族に会いたいと強く願った。,生き残った若者は、,なんとしても,故郷の,家族に,会いたいと,強く願った。,Trạng từ 「なんとしても」 nhấn mạnh quyết tâm cao độ 「bằng mọi giá/dù thế nào đi nữa」. Thứ tự logic: chủ ngữ 「生き残った若者は」 -> trạng từ ý chí 「なんとしても」 -> bổ nghĩa 「故郷の」 cho danh từ chỉ đối tượng 「家族に」 -> nguyện vọng kèm trích dẫn 「会いたいと」 -> động từ chính 「強く願った」.
なんとなく,,N3,①なんとなく旅に出てみたくなりました。,夜の通りを歩きながら、彼はなんとなく誰かに見られているような気がした。,夜の通りを歩きながら、彼は,なんとなく,誰かに,見られている,ような気が,した。,"Trạng từ 「なんとなく」 biểu thị cảm giác mơ hồ, không rõ nguyên nhân. Thứ tự sắp xếp: trạng từ chỉ cảm giác 「なんとなく」 -> tác nhân gây ra hành động bị động 「誰かに」 -> động từ thể bị động 「見られている」 -> kết cấu tạo cảm giác 「ような気がした」."
なんとはなしに,,N2,①なんとはなしに昔の友達に会ってみたくなりました。,執筆の手を止め、作家はなんとはなしに窓の外の雨をぼんやりと眺めていた。,執筆の手を止め、作家は,なんとはなしに,窓の,外の雨を,ぼんやりと,眺めていた。,"Trạng từ văn học 「なんとはなしに」 chỉ hành động diễn ra một cách vô thức, không mục đích rõ ràng. Thứ tự logic: chủ ngữ 「作家は」 -> trạng từ chỉ tâm trạng 「なんとはなしに」 -> bổ ngữ sở hữu 「窓の」 -> tân ngữ chính 「外の雨を」 -> trạng từ bổ trợ 「ぼんやりと」 -> động từ chính 「眺めていた」."
なんとも,なんとも,N2,①なんとも申し訳ないことをしてしまいました。,取り壊される旧家を見上げ、老人はなんとも切ない表情を顔に浮かべた。,取り壊される旧家を見上げ、老人は,なんとも,切ない,表情を,顔に,浮かべた。,Trạng từ 「なんとも」 dùng để nhấn mạnh mức độ cảm xúc cực kỳ cao. Thứ tự logic: chủ ngữ 「老人は」 -> trạng từ mức độ 「なんとも」 -> tính từ chỉ cảm xúc buồn bã 「切ない」 bổ nghĩa cho danh từ tân ngữ 「表情を」 -> nơi chốn xuất hiện biểu cảm 「顔に」 -> động từ biểu hiện 「浮かべた」.
なんとも,なんともV－ない,N2,①結果がどうなるかはまだなんとも言えませんね。,容疑者の動機について、警察は現段階ではなんとも判断しがたいと発表した。,容疑者の動機について、警察は,現段階では,なんとも,判断し,がたいと,発表した。,Cấu trúc 「なんとも + V-がたい」 (thể khó khăn) diễn tả việc hoàn toàn không thể đưa ra phán đoán rõ ràng nào. Thứ tự sắp xếp: trạng từ thời gian 「現段階では」 -> trạng từ phủ định nhẹ 「なんとも」 -> động từ căn bản 「判断し」 đi kèm đuôi biểu thị sự khó khăn và trợ từ trích dẫn 「がたいと」 -> động từ tuyên bố 「発表した」.
なんとも,なんともV－ようがない,N1,①こんな事になって、なんともお詫びのしようがありません。,被災地の凄惨な光景は、言葉ではなんとも表現しようがないほど悲惨だった。,被災地の凄惨な光景は、,言葉では,なんとも,表現,しようがないほど,悲惨だった。,"Cấu trúc 「なんとも + V-ようがない」 biểu thị sự bất lực hoàn toàn, không có cách nào thực hiện hành động. Thứ tự logic: phương thức diễn tả 「言葉では」 -> trạng từ 「なんとも」 -> danh động từ 「表現」 đi kèm đuôi cấu trúc mức độ 「しようがないほど」 -> tính từ kết thúc 「悲惨だった」."
なんとも,なんともない　なんともおもわない,N4,①A：気分が悪いんじゃありませんか。B：いいえ、なんともありません。ちょっと疲れただけです。,周囲からの厳しい批判に対しても、彼はなんとも思っていないような態度を崩さなかった。,周囲からの厳しい批判に対しても、彼は,なんとも,思っていない,ような,態度を,崩さなかった。,Cụm từ 「なんとも思っていない」 có nghĩa là 「không bận tâm/chẳng nghĩ ngợi gì」. Thứ tự sắp xếp: trạng từ phủ định 「なんとも」 -> động từ suy nghĩ thể phủ định 「思っていない」 -> bổ nghĩa 「ような」 -> danh từ tân ngữ 「態度を」 -> động từ kết thúc 「崩さなかった」.
なんとも,A－くもなんともない,N3,①そんな話は恐くも何ともないさ。,多くの困難を乗り越えてきた彼にとって、この程度の挫折は痛くも何ともない。,多くの困難を乗り越えてきた彼にとって、,この程度の,挫折は,痛くも,何とも,ない。,Cấu trúc phủ định tuyệt đối của tính từ đuôi i: 「Tính từ -くも何ともない」 (không... một chút nào). Thứ tự logic: cụm bổ nghĩa mức độ 「この程度の」 -> chủ ngữ chính 「挫折は」 -> liên từ trạng thái của tính từ 「痛くも」 -> cụm từ nhấn mạnh và phủ định 「何とも」 + 「ない」.
なんにしても,,N3,①なんにしても健康が一番です。,選挙の結果がどうなるにせよ、なんにしても社会の変革は避けられないだろう。,選挙の結果がどうなるにせよ、,なんにしても,社会の,変革は,避けられない,だろう。,Trạng từ liên kết 「なんにしても」 mang nghĩa 「dù sao đi nữa/trong bất kỳ trường hợp nào」. Thứ tự sắp xếp: liên từ đứng đầu vế kết luận 「なんにしても」 -> bổ ngữ sở hữu 「社会の」 -> danh từ chủ ngữ 「変革は」 -> động từ phủ định khả năng 「避けられない」 -> phỏng đoán 「だろう」.
なんにしろ,Nはなんにしろ,N2,①事情は何にしろ、早く故障した部品を取りかえなければならない。,犯行の動機はなんにしろ、罪のない市民を巻き込むテロ行為は決して許されない。,犯行の,動機は,なんにしろ、,罪のない,市民を巻き込む,テロ行為は決して許されない。,Cấu trúc nhượng bộ 「N + はなんにしろ」 nghĩa là 「bất kể N có là gì đi nữa」. Thứ tự logic: thuộc tính sở hữu 「犯行の」 -> danh từ chủ ngữ 「動機は」 -> cụm từ nhượng bộ 「なんにしろ、」 -> cụm tính từ bổ nghĩa liên hoàn 「罪のない」 -> 「市民を巻き込む」 -> bổ nghĩa cho chủ ngữ chính 「テロ行為は決して許されない」.
