Grammar,Usage,JLPT Level,Reference Example,Original Example,Prefix,Chunk1,Chunk2,Chunk3,Chunk4,Suffix,Explanation
なら3,NがNならNもNだ,N2,①親が親なら子も子だ。,新聞記者が見たところ、社長が社長なら重役も重役で、この会社の不正は正されるはずがない。,新聞記者が見たところ、,社長が社長なら,重役も,重役で、,この会社の不正は,正されるはずがない。,Cấu trúc 「NがNならNもNだ」 thể hiện ý nghĩa 「nếu kẻ đứng đầu đã như thế thì kẻ dưới cũng tệ tương tự」 (thường mang sắc thái tiêu cực). Trong câu: Prefix 「新聞記者が見たところ、」 (Theo quan sátのphóng viên) thiết lập bối cảnh cho câu trần thuật. 「社長が社長なら」 (nếu giám đốc đã tệ) đóng vai trò điều kiện giả định. 「重役も」 và 「重役で、」 (thì ban quản trị cũng tệ tương xứng) tạo thành vế đối ứng ngữ pháp. 「この会社の不正は」 làm chủ ngữのvế sau. Suffix 「正されるはずがない。」 (không đời nào được sửa đổi) bổ nghĩa hoàn chỉnh cho kết cụcのmột tổ chức dột từ nóc.
なら3,～なら（ば）　A／V　なら（ば）,N3,①今年も真夏の日照時間が短い／短かったならば米不足の問題は深刻だ。,今回の外交交渉が失敗に終わるならば、両国の軍事的緊張はさらに高まるだろう。,今回の,外交交渉が,失敗に終わるならば、,両国の軍事的緊張は,さらに,高まるだろう。,"Cấu trúc 「V-るならば」 biểu thị một giả định hoặc điều kiện xảy ra trong tương lai. Trong câu: Prefix 「今回の」 là định ngữ bổ nghĩa cho danh từ phía sau. 「外交交渉が」 là chủ ngữのmệnh đề giả thiết. 「失敗に終わるならば、」 chứa cấu trúc giả định (nếu kết thúc bằng sự thất bại). 「両国の軍事的緊張は」 là chủ ngữのvế sau, diễn tả mối quan hệ giữa hai nước. 「さらに」 là phó từ bổ nghĩa mức độ tăng tiến. Suffix 「高まるだろう。」 (chắc chắn sẽ leo thang) hoàn thành câu bằng một dự đoán mang tính thời sự."
なら3,だったなら　A－かったなら　V－たなら,N3,①私が全能の神様だったなら、あなたを助けてあげられるのに。,あの夜、彼が真実を知っていたなら、このような悲劇的な結末は防げたかもしれない。,あの夜、彼が,真実を,知っていたなら、,このような悲劇的な,結末は,防げたかもしれない。,Cấu trúc giả định quá khứ 「V-たなら」 dùng để giả định một việc trái ngược với thực tế đã xảy ra trong quá khứ. Trong câu: Prefix 「あの夜、彼が」 chỉ mốc thời gian và chủ ngữ thực hiện hành động giả thiết. 「真実を」 là tân ngữのhành động biết. 「知っていたなら、」 chứa cấu trúc giả định (nếu như đã biết). 「このような悲劇的な」 bổ nghĩa cho danh từ kết cục . 「結末は」 là chủ ngữ chịu tác động ở vế kết quả. Suffix 「防げたかもしれない。」 (có lẽ đã có thể ngăn chặn được) thể hiện sự tiếc nuối kịch tính trong tiểu thuyết.
なら3,V－るなら＜観点＞,N2,①事情を知らない人の目から見るなら、少しおおげさな感じがするかもしれない。,今回の法改正を客観的なデータから評価するなら、国民の負担は確実に増加する。,今回の法改正を,客観的な,データから,評価するなら、,国民の負担は,確実に増加する。,Cấu trúc 「V-るなら」 đóng vai trò đưa ra góc nhìn hoặc tiêu chí đánh giá (đứng trên góc độ...). Trong câu: Prefix 「今回の法改正を」 làm tân ngữ cho động từ đánh giá. 「客観的な」 bổ nghĩa cho danh từ nguồn dữ liệu 「データから」 (từ dữ liệu khách quan) chỉ căn cứ đánh giá. 「評価するなら、」 sử dụng cấu trúc ngữ pháp (nếu đánh giá từ...). 「国民の負担は」 làm chủ từ cho mệnh đề kết luận. Suffix 「確実に増加する。」 (chắc chắn sẽ gia tăng) khẳng định một kết luận logic mang tính thời sự.
ならいい,ならいい　A／V（の）ならいい,N4,①お母さんが病気ならいいよ。早く家に帰ってあげなさい。,主人公はため息をつき、「これがすべて悪夢ならいいのにと静かに呟いた。,主人公はため息をつき、「これが,すべて,悪夢,ならいいのに,と静かに,呟いた。,Mẫu ngữ pháp 「Nならいい」 biểu thị ước muốn giá mà/nếu là... thì tốt biết mấy. Trong câu: Prefix 「主人公はため息をつき、「これが」 đóng vai trò dẫn lời thoại nội tâm nhân vật. 「すべて」 là phó từ bổ nghĩa cho danh từ phía sau. 「悪夢」 là danh từ đóng vai trò điều kiện giả định. 「ならいいのに」 sử dụng cấu trúc 「ならいい」 kết hợp vĩ tố chỉ nguyện vọng 「のに」 (ước gì là ác mộng). 「と静かに」 làm trạng từ chỉ cách thức phát ngôn. Suffix 「呟いた。」 (thì thầm) kết thúc câu trần thuật khắc họa tâm lý nhân vật.
ならでは,Nならでは,N2,①親友ならではの細かい心遣いが嬉しかった。,この長編小説は、彼ならではの繊細な心理描写によって読者を強く魅了している。,この長編小説は、,彼ならではの,繊細な,心理描写によって,読者を強く,魅了している。,"Cấu trúc 「Nならではの」 biểu thị nét đặc trưng độc đáo, chỉ có thể tìm thấy ở đối tượng N (chỉ có ở... mới có). Trong câu: Prefix 「この長編小説は、」 là chủ đềのcâu văn nghị luận văn học. 「彼ならではの」 áp dụng ngữ pháp độc đáo chỉ phong cáchのtác giả. 「繊細な」 bổ nghĩa cho danh từ miêu tả tâm lý 「心理描写によって」 (bằng việc miêu tả tâm lý). 「読者を強く」 gồm tân ngữ và phó từ bổ nghĩa cho động từ chính. Suffix 「魅了している。」 (cuốn hút độc giả) hoàn thành nhận định về giá trị tác phẩm."
ならびに,NならびにN,N1,①各国の首相ならびに外相が式典に参列した。,本日の記者会見には、開発責任者ならびに社長が出席し、深く謝罪の意を述べた。,本日の記者会見には、,開発責任者,ならびに,社長が出席し、,深く,謝罪の意を述べた。,"Liên từ trang trọng 「NならびにN」 dùng để liên kết các danh từ có cùng vị thế (và, cũng như). Trong câu: Prefix 「本日の記者会見には、」 thiết lập bối cảnh họp báo chính luận. 「開発責任者」 là danh từ thứ nhất tham dự họp báo. 「ならびに」 đóng vai trò liên kết trang trọng giữa hai danh từ. 「社長が出席し、」 chứa danh từ thứ hai liên kết với và động từ nối câu. 「深く」 là phó từ bổ nghĩa cho hành động xin lỗi. Suffix 「謝罪の意を述べた。」 (bày tỏ lời xin lỗi sâu sắc) hoàn thành bản tin thời sự."
なり1,V－るなり,N2,①家に帰るなり自分の部屋に閉じ込もって出てこない。,彼女は手紙を読むなり、真っ青な顔をしてその場に崩れ落ちた。,彼女は,手紙を,読むなり、,真っ青な顔をして,その場に,崩れ落ちた。,"Cấu trúc 「V-るなり」 diễn tả một hành động xảy ra ngay lập tức sau một hành động khác, thường đi kèm bất ngờ ngoài dự kiến (vừa mới... đã ngay lập tức). Trong câu: Prefix 「彼女は」 giới thiệu chủ ngữ thực hiện chuỗi hành động. 「手紙を」 làm tân ngữ cho động từ đọc. 「読むなり、」 thể hiện cấu trúc ngữ pháp (vừa mới đọc thư xong thì liền...). 「真っ青な顔をして」 mô tả trạng thái biến đổi bất ngờのnhân vật. 「その場に」 chỉ địa điểm xảy ra hành động tiếp theo. Suffix 「崩れ落ちた。」 (ngã quỵ xuống) tạo nên nhịp điệu dồn dập, kịch tínhのtiểu thuyết."
なり1,V－たなり（で）,N2,①座ったなり動こうともしない。,刑事は現場に立ったなりで、じっと床の血痕を見つめ続けていた。,刑事は,現場に,立ったなりで、,じっと床の,血痕を,見つめ続けていた。,"Mẫu ngữ pháp 「V-たなり（で）」 biểu thị trạng thái được giữ nguyên sau khi thực hiện hành động, không hề thay đổi (cứ giữ nguyên trạng thái... mà không dịch chuyển). Trong câu: Prefix 「刑事は」 giới thiệu chủ ngữ trong tiểu thuyết trinh thám. 「現場に」 chỉ địa điểm xảy ra trạng thái đứng. 「立ったなりで、」 sử dụng ngữ pháp (cứ đứng yên tại hiện trường). 「じっと床の」 gồm phó từ và danh từ bổ nghĩa cho vết máu. 「血痕を」 là tân ngữのhành động nhìn chăm chú. Suffix 「見つめ続けていた。」 (liên tục nhìn chăm chú) khép lại phân cảnh điều tra hiện trường."
なり1,V－たなり,N2,①家を出たなり一ケ月も帰ってこなかった。,彼は戦場へ旅立ったなり、一度も手紙をよこさなかった。,彼は,戦場へ,旅立ったなり、,一度も,手紙を,よこさなかった。,Cấu trúc 「V-たなり」 mang ý nghĩa sau khi một hành động xảy ra thì trạng thái đó kéo dài liên tục mà không có sự thay đổi nào tiếp theo (sau khi... thì bặt vô âm tín). Trong câu: Prefix 「彼は」 xác định chủ ngữのcâu chuyện dấn thân. 「戦場へ」 chỉ hướng di chuyển. 「旅立ったなり、」 áp dụng cấu trúc ngữ pháp (sau khi ra chiến trường là cứ thế luôn...). 「一度も」 là phó từ phủ định mạnh mẽ. 「手紙を」 là tân ngữ. Suffix 「よこさなかった。」 (không hề gửi thư về) khắc họa nỗi buồn chia ly trong tiểu thuyết chiến tranh.
なり2,～なり　Nなり　V－るなり,N2,①何かお飲物なりお持ちしましょうか。,疲れが限界に達しているなら、少し横になるなりして体をしっかり休めるべきだ。,疲れが限界に達しているなら、,少し,横になるなりして,体を,しっかり,休めるべきだ。,Mẫu ngữ pháp 「V-るなり」 đóng vai trò đưa ra một gợi ý tiêu biểu cho hành động (như là nằm nghỉ hay làm gì đó tương tự). Trong câu: Prefix 「疲れが限界に達しているなら、」 đưa ra giả định tình huống kiệt sức. 「少し」 là phó từ mức độ. 「横になるなりして」 áp dụng ngữ pháp nhằm đề xuất một giải pháp xoa dịu. 「体を」 là tân ngữのhành động nghỉ ngơi. 「しっかり」 phó từ bổ nghĩa nhấn mạnh mức độ cần thiết. Suffix 「休めるべきだ。」 (nên để cơ thể được nghỉ ngơi đầy đủ) hoàn chỉnh câu khuyên nhủ.
なり2,V－るなりV－ないなり,N2,①行くなり行かないなりはっきり決めてほしい。,政府は要求を受け入れるなり受け入れないなり、早急に方針を示す必要がある。,政府は,要求を,受け入れるなり受け入れないなり、,早急に,方針を,示す必要がある。,Cấu trúc song hành 「V-るなりV-ないなり」 dùng để chỉ ra hai lựa chọn trái ngược nhau và yêu cầu chủ thể phải đưa ra quyết định rõ ràng một trong hai (dù chấp nhận hay từ chối đi chăng nữa). Trong câu: Prefix 「政府は」 là chủ thể hành động trong bài báo chính trị. 「要求を」 là tân ngữ. 「受け入れるなり受け入れないなり、」 thể hiện cấu trúc ngữ pháp song hành. 「早急に」 là phó từ chỉ tính khẩn trương. 「方針を」 là tân ngữ. Suffix 「示す必要がある。」 (cần phải chỉ ra phương hướng rõ ràng) kết thúc câu nghị luận.
なり2,～なり～なり　NなりNなり　V－るなりV－るなり,N2,①彼の父親なり母親なりに相談しなければならないだろう。,事件の真相を知りたいなら、編集長なり担当記者なりに直接事情を尋ねるべきだ。,事件の真相を知りたいなら、,編集長なり,担当記者なりに,直接,事情を,尋ねるべきだ。,Cấu trúc lựa chọn 「NなりNなり」 dùng để đưa ra một số gợi ý tiêu biểu cùng loại (hoặc N1 hoặc N2...). Trong câu: Prefix 「事件の真相を知りたいなら、」 mở đầu bằng mệnh đề giả thiết kịch tính. 「編集長なり」 gợi ý đối tượng thứ nhất (tổng biên tập). 「担当記者なりに」 áp dụng ngữ pháp lựa chọn với trợ từ chỉ đối tượng tiếp nhận 「に」. 「直接」 là phó từ nhấn mạnh tính trực diện. 「事情を」 là tân ngữ. Suffix 「尋ねるべきだ。」 (nên hỏi rõ sự tình) hoàn thành câu khuyên bảo báo chí.
なり2,～なりなんなり　N／V　なりなんなり,N2,①チューリップなりなんなり、少し目立つ花を買ってきて下さい。,黙っていないで、怒鳴るなりなんなりして怒りを正直に表現したらどうだ。,黙っていないで、,怒鳴るなり,なんなりして,怒りを,正直に,表現したらどうだ。,Cấu trúc 「N/Vなりなんなり」 mang nghĩa 「hoặc làm bất cứ cái gì đại loại thế」 nhằm thúc giục thực hiện một hành động cụ thể thay vì đứng yên. Trong câu: Prefix 「黙っていないで、」 tạo thế tương phản (đừng im lặng). 「怒鳴るなり」 là hành động gợi ý thứ nhất. 「なんなりして」 sử dụng cấu trúc ngữ pháp để diễn tả ý 「hoặc làm bất cứ hành động nào tương tự thế」. 「怒りを」 là tân ngữ biểu đạt cảm xúc. 「正直に」 là phó từ trạng thái. Suffix 「表現したらどうだ。」 (sao không biểu lộ ra đi) tạo câu thoại đầy kịch tính.
なり3,～なり　Nなり　A－いなり,N2,①私なりに努力はしてみましたが、力が及びませんでした。,駆け出しの記者なりに必死に真相を追ったが、巨大な権力に阻まれた。,駆け出しの,記者なりに,必死に,真相を追ったが、,巨大な,権力に阻まれた。,"Cấu trúc 「Nなりに」 biểu thị ý nghĩa 「tương xứng với N/ở mức độのN」 (ở góc độ của, theo cách của...). Trong câu: Prefix 「駆け出しの」 là định ngữ bổ nghĩa cho danh từ phía sau. 「記者なりに」 áp dụng cấu trúc ngữ pháp (theo cáchのmột nhà báo mới vào nghề/ở vị thếのhọ). 「必死に」 phó từ chỉ sự nỗ lực tột cùng. 「真相を追ったが、」 mô tả hành động tìm kiếm sự thật nhưng gặp tương phản. 「巨大な」 bổ nghĩa cho danh từ ở Suffix 「権力に阻まれた。」 (đã bị thế lực khổng lồ ngăn chặn) khép lại câu tự sự phóng sự."
なり3,～なり　Nなり　V－るなり,N2,①彼は妻の言うなりになっている。,その若手政治家は、権力者の言うなりになって法案の成立に加担した。,その若手政治家は、,権力者の,言うなりになって,法案の,成立に,加担した。,"Cấu trúc 「V-るなり（になる）」 mang ý nghĩa phục tùng, làm theo hoàn toàn những gì đối phương nói/yêu cầu (tuân theo/nghe theo răm rắp). Trong câu: Prefix 「その若手政治家は、」 giới thiệu chủ thểのcâu chuyện chính trị. 「権力者の」 bổ nghĩa cho danh từ người ra lệnh. 「言うなりになって」 áp dụng cấu trúc ngữ pháp (nghe theo răm rắp lời kẻ có quyền lực). 「法案の」 và 「成立に」 chỉ đích đếnのhành động đồng lõa. Suffix 「加担した。」 (đã tiếp tay đồng lõa) hoàn thiện nhận định phê phán thời sự."
なり3,～なら～なり　NならNなり　NaならNaなり　A－いならA－いなり　V－るならV－るなり,N2,①嫌なら嫌なりの理由があるはずだ。,他者の記事を批判するなら批判するなりの具体的な根拠を示すべきだ。,他者の記事を,批判するなら,批判するなりの,具体的な,根拠を,示すべきだ。,Cấu trúc song hành 「AならAなり」 biểu thị ý nghĩa 「nếu ở trạng thái/mức độ A thì cần có cách ứng xử tương xứng với mức độ A đó」 (đã phê bình thì phải cho ra dáng...). Trong câu: Prefix 「他者の記事を」 làm tân ngữ cho hành động phê bình. 「批判するなら」 đưa ra giả thiết ban đầu. 「批判するなりの」 áp dụng cấu trúc ngữ pháp lặp lại để nhấn mạnh tính tương xứngのhành động. 「具体的な」 là tính từ bổ nghĩa cho tân ngữ 「根拠を」. Suffix 「示すべきだ。」 (thì phải đưa ra được bằng chứng cụ thể) khép lại luận điểm sắc bén.
なり3,には～なり　NにはNなり　V－るにはV－るなり,N2,①若い人には若い人なりの考えがあるだろう。,引退した老記者には老記者なりの矜持があり、決して口を割らなかった。,引退した,老記者には,老記者なりの,矜持があり、,決して,口を割らなかった。,Cấu trúc 「NにはNなりの」 có ý nghĩa 「đối với N thì sẽ có những nét đặc trưng/sự tự tôn riêng biệt phù hợp với N」. Trong câu: Prefix 「引退した」 bổ nghĩa cho nhà báo già đã nghỉ hưu. 「老記者には」 là chủ thể sở hữu phẩm chất được đề cập. 「老記者なりの」 áp dụng cấu trúc ngữ pháp song lặp (lòng kiêu hãnh riêngのnhà báo già). 「矜持があり、」 liên kết mệnh đề tiếp theo bằng dạng lửngのđộng từ. 「決して」 là phó từ phủ định mạnh mẽ đi kèm Suffix 「口を割らなかった。」 (quyết không hé môi nửa lời) mang đậm phong cách văn học kịch tính.
なり3,NはNなり,N2,①彼らは彼らなりにいろいろ努力しているのだから、それは認めてやってほしい。,野党は野党なりに国民の声を代弁しようと議論を重ねている。,野党は,野党なりに,国民の声を,代弁しようと,議論を,重ねている。,Cấu trúc 「N là Nなりに」 diễn tả ý nghĩa 「N ở vị thếのchính N sẽ nỗ lực hoặc có cách thức riêngのmình」. Trong câu: Prefix 「野党は」 giới thiệu chủ thể hành động trong bản tin chính trị. 「野党なりに」 áp dụng cấu trúc ngữ pháp (theo cách riêngのđảng đối lập). 「国民の声を」 là tân ngữのhành động. 「代弁しようと」 biểu thị ý chí quyết tâm đại diện tiếng nói nhân dân. 「議論を」 là tân ngữ. Suffix 「重ねている。」 (liên tục tranh luận) hoàn thành bản tin nghị trường thời sự.
なり3,それなり,N2,①小さな会社だがそれなりの利益は上げている。,突然浮上したこのリーク情報にも、それなりの信憑性があると専門家は分析する。,突然浮上したこのリーク情報にも、,それなりの,信憑性が,あると,専門家は,分析する。,Cấu trúc 「それなり」 mang ý nghĩa 「ở mức độ nhất định/tương xứng với bối cảnh đó」 (có giá trị riêngのnó). Trong câu: Prefix 「突然浮上したこのリーク情報にも、」 thiết lập bối cảnh rò rỉ thông tin. 「それなりの」 sử dụng cấu trúc ngữ pháp để bổ nghĩa cho danh từ 「信憑性が」 (độ tin cậy tương xứng nhất định). 「あると」 làm liên từ trích dẫn nhận định. 「専門家は」 giới thiệu chủ thể phân tích. Suffix 「分析する。」 (chuyên gia phân tích rằng...) khép lại bài báo thời sự.
