Grammar,Usage,JLPT Level,Reference Example,Original Example,Prefix,Chunk1,Chunk2,Chunk3,Chunk4,Suffix,Explanation
ばかり,だとばかりおもっていた　A／V　とばかりおもっていた,N2,①河田さんは独身だとばかり思っていたが、もうお子さんが二人もあるそうだ。,若き刑事は事件が単なる不注意による事故だとばかり思っていたが、新たな証拠によってその見立ては覆された。,若き刑事は事件が,単なる不注意による,事故だとばかり,思っていたが、,新たな証拠によって,その見立ては覆された。,"Trong văn cảnh tiểu thuyết hình sự, cấu trúc ngữ pháp 「～とばかり思っていた」 (cứ ngỡ là...) thể hiện sự phán đoán chủ quan ban đầu của nhân vật (người cảnh sát trẻ). Cụm từ bổ nghĩa ""単なる不注意による"" (do bất cẩn đơn thuần) bổ nghĩa cho danh từ ""事故"" . Cụm ""事故だとばかり"" kết hợp với động từ thể quá khứ ""思っていたが"" (nhưng cứ ngỡ là...) tạo nên vế đối lập ban đầu. Cuối cùng, cụm từ chỉ nguyên nhân ""新たな証拠によって"" (bởi chứng cứ mới) dẫn tới kết quả phủ định ở phần Suffix."
ばかり,～とばかり（に）,N1,①相手チームの調子が崩れた。彼らはこのときとばかりに攻め込んだ。,政治家は、好機が訪れたとばかりに、批判を繰り返すメディアに対して反論の機密文書を公表した。,政治家は、,好機が訪れた,とばかりに、,批判を繰り返すメディアに対して,反論の,機密文書を公表した。,"Cấu trúc ngữ pháp N1 「～とばかりに」 mang ý nghĩa ""như thể muốn nói rằng/như thể là..."". Ở đây, mệnh đề ""好機が訪れた"" (cơ hội đã đến) đi trước trợ từ ""とばかりに"" để thể hiện thái độ quyết liệt của chính trị gia. Cụm từ ""批判を繰り返すメディアに対して"" (đối với truyền thông liên tục chỉ trích) chỉ đối tượng tiếp nhận hành động, kết hợp với cụm bổ nghĩa ""反論の"" (phản bác) để bổ nghĩa trực tiếp cho danh từ tân ngữ ở phần Suffix ""機密文書を公表した""."
ばかりか,書きことば的なかたい表現。～ばかりか　～も／～まで　Nばかりか～も／～まで　Naなばかりか　～も／～まで　A／V　ばかりか～も／～まで,N2,①彼女は、現代語ばかりか古典も読める。,今回の深刻な経済危機の影響は、首都ばかりか地方の過疎地にまで建造物が残されている。,今回の深刻な経済危機の影響は、,首都,ばかりか,地方の過疎地に,まで,建造物が残されている。,"Cấu trúc N2 「～ばかりか～も／まで」 biểu thị ý nghĩa ""không chỉ... mà ngay cả..."". Danh từ ""首都"" (thủ đô) đi kèm với liên từ ""ばかりか"" . Tiếp theo, danh từ chỉ phạm vi xa xôi hơn là ""地方の過疎地に"" (đến vùng thưa thớt dân cư ở địa phương) kết hợp với trợ từ nhấn mạnh mức độ ""まで"" để hoàn thiện mệnh đề bổ nghĩa cho động từ vị ngữ ""及んでいる"" (đang lan rộng/ảnh hưởng đến) ở phần Suffix."
ばかりか,それだかりか,N2,①上田さんは英語が話せる。そればかりか韓国語もインドネシア語も話せる。,新型ウイルスは極めて高い感染力を持っている。そればかりか、若年層においても重症化する事例が相次いで報告されている。,新型ウイルスは極めて高い感染力を持っている。,それ,ばかりか、,若年層においても,重症化する事例が,相次いで報告されている。,"Cấu trúc 「そればかりか」 (không chỉ dừng lại ở đó) dùng làm từ nối liên kết hai câu nhằm bổ sung thông tin nghiêm trọng hơn. Liên từ được chia thành ""それ"" và ""ばかりか、"" . Cụm trạng từ ""若年層においても"" (ngay cả ở nhóm người trẻ) làm sáng tỏ phạm vi ảnh hưởng, bổ nghĩa trực tiếp cho cụm chủ ngữ ""重症化する事例が"" (các trường hợp chuyển nặng) , kết thúc bằng vị ngữ ở Suffix ""相次いで報告されている"" (liên tục được báo cáo)."
ばかりでなく～も,,N3,①山田さんは英語ばかりでなく中国語も話せる。,この再開発計画は、莫大な予算ばかりでなく住民の理解と協力も必要としている。,この再開発計画は、,莫大な予算,ばかりでなく,住民の理解と,協力も,必要としている。,"Cấu trúc N3 「～ばかりでなく～も」 diễn tả ý nghĩa ""không chỉ... mà cả..."". Danh từ chỉ vật chất ""莫大な予算"" (ngân sách khổng lồ) đóng vai trò là yếu tố đầu tiên, đi với cụm từ liên kết ""ばかりでなく"" . Tiếp sau đó, yếu tố tinh thần được đưa vào thông qua cụm danh từ ""住民の理解と"" (sự thấu hiểu của người dân và) để kết nối chặt chẽ với ""協力も"" (cả sự hợp tác) nhằm làm chủ ngữ bổ sung cho vị ngữ ""必要としている"" (đang cần đến) ở phần Suffix."
ばこそ,であればこそ　A－ければこそ　V－ばこそ,N1,①すぐれた教師であればこそ、学生からあれほど慕われるのです。,互いに深い信頼関係があればこそ、この過酷な試練を乗り越えることができたのだ。,互いに,深い信頼関係が,あればこそ、,この過酷な,試練を,乗り越えることができたのだ。,"Ngữ pháp N1 「～ばこそ」 thể hiện ý nghĩa ""chính vì... nên mới..."". Danh từ chỉ trạng thái ""深い信頼関係が"" (mối quan hệ tin cậy sâu sắc) làm chủ ngữ cho động từ ""ある"" chia sang thể điều kiện ""あればこそ"" nhằm nhấn mạnh nguyên nhân cốt lõi. Cụm bổ nghĩa tính từ ""この過酷な"" (khắc nghiệt này) trực tiếp bổ nghĩa cho danh từ tân ngữ ""試練を"" , làm tiền đề dẫn tới hành động vượt qua ở Suffix ""乗り越えることができたのだ""."
はじめ,Nをはじめ（として）～など,N3,①日本の伝統芸能としては、歌舞伎をはじめ、能、茶の湯、生け花などが挙げられる。,この古都には、清水寺をはじめ、金閣寺や伏見稲荷大社など多くの歴史的建造物が残されている。,この古都には、,清水寺,をはじめ、,金閣寺や伏見稲荷大社など,多くの歴史的,建造物が残されている。,"Ngữ pháp N3 「Nをはじめ（として）」 dùng để đưa ra một ví dụ tiêu biểu nhất, nghĩa là ""trước hết là..."". Danh từ tiêu biểu ""清水寺"" đi kèm với ngữ pháp liên kết ""をはじめ、"" . Cụm danh từ liệt kê các đối tượng phụ ""金閣寺や伏見稲荷大社など"" (như chùa Vàng, đền Fushimi Inari) kết hợp với tính từ bổ nghĩa ""多くの歴史的"" (nhiều mang tính lịch sử) để bổ nghĩa cho danh từ chủ ngữ ở Suffix ""建造物が残されている"" (các công trình kiến trúc còn lại)."
はじめ,Nをはじめ（として）～まで,N2,①その会議には、歴史学者をはじめ、町の研究家から一般市民にいたるまで、さまざまな人々が参加した。,その復興計画には、地元代表をはじめ、建設作業員から政府高官にいたるまで多くの人々が携わっている。,その復興計画には、,地元代表,をはじめ、,建設作業員から政府高官,にいたるまで,多くの人々が携わっている。,"Cấu trúc N2 「Nをはじめ（として）～にいたるまで」 diễn tả một phạm vi bao phủ cực kỳ rộng lớn ""từ tiêu biểu là N cho đến tận..."". Danh từ đại diện ""地元代表"" kết hợp với ""をはじめ、"" . Cụm danh từ biểu thị phạm vi ""建設作業員から政府高官"" (từ công nhân xây dựng cho đến quan chức chính phủ) đi liền với cụm từ chức năng ""にいたるまで"" nhằm bổ nghĩa cho chủ ngữ chính ở phần Suffix ""多くの人々が携わっている""."
はじめて,V－て（みて）はじめて,N3,①病気になってはじめて健康のありがたさがわかる。,主人公は、最愛の妻を失ってはじめて、平凡な日常がどれほど大切だったかに気づいた。,主人公は、,最愛の妻を,失ってはじめて、,平凡な日常が,どれほど大切だったか,に気づいた。,"Ngữ pháp N3 「V-てはじめて」 mang ý nghĩa ""chỉ sau khi làm V thì mới nhận ra/bắt đầu..."". Tân ngữ ""最愛の妻u"" đi liền với động từ thể て kết hợp ngữ pháp ""失ってはじめて、"" . Mệnh đề phụ ""平凡な日常が"" (cuộc sống thường nhật bình dị) đóng vai trò chủ ngữ cho trạng từ nghi vấn mức độ ""どれほど大切だったか"" (quan trọng nhường nào) , kết nối với cụm từ nhận thức ở phần Suffix ""に気づいた"" (đã nhận ra)."
はず,Nのはず　Naなはず　A／V　はず　～はずだ＜話し手の判断＞,N3,①A：山田さんも明日の会議には出席するんですか。B：いや、今週は東京に行くと言っていたから、明日の会議には来ないはずだよ。,朝の天気予報によれば、夕方には雨が上がるはずだが、依然として空は重い雲に覆われている。,朝の天気予報によれば、,夕方には,雨が,上がるはずだが、,依然として空は,重い雲に覆われている。,"Ngữ pháp 「～はずだ」 ở trình độ N3 diễn tả sự phán đoán, suy luận chắc chắn của người nói dựa trên một căn cứ đáng tin cậy. Cụm từ chỉ thời gian ""夕方には"" (vào chiều tối) đi với chủ ngữ ""雨が"" , kết hợp với động từ phán đoán nghịch ý ""上がるはずだが、"" . Cụm từ chỉ trạng thái hiện tại ""依然として空は"" (bầu trời vẫn cứ...) liên kết trực tiếp với vị ngữ bị động ở phần Suffix ""重い雲に覆われている""."
はず,～はずだ＜納得＞　Naなはずだ　A／V　はずだ,N3,①この部屋、寒いねえ。（窓が開いているのを見つけて）寒いはずだ。窓が開いているよ。,よく見ると、時計の内部の歯車が錆びていた。これでは機械が動かないはずだ、何年も手入れを怠っていたのだから。,よく見ると、時計の内部の歯車が錆びていた。,これでは,機械が,動かないはずだ、,何年も手入れを,怠っていたのだから。,"Mẫu ngữ pháp 「～はずだ」 ở đây mang nghĩa ""thảo nào/hèn chi"", thể hiện sự vỡ lẽ khi tìm ra nguyên nhân thực sự. Trạng từ điều kiện ""これでは"" (với tình trạng thế này) đi kèm chủ ngữ ""機械が"" , kết hợp với cụm từ biểu thị sự vỡ lẽ ""動かないはずだ、"" (thảo nào không chạy) . Cụm từ bổ nghĩa ""何年も手入れを"" (nhiều năm liền việc bảo dưỡng) làm rõ lý do cho vị ngữ kết câu ở Suffix ""怠っていたのだから"" (vì đã bỏ bê)."
はず,V－たはず,N3,①おかしなことに；閉めたはずの金庫のカギが開いていた。,不思議なことに、外出する前にしっかりと鍵をかけたはずの引き出しが、わずかに開いていた。,不思議なことに、,外出する前に,しっかりと鍵を,かけたはずの,引き出しが、,わずかに開いていた。,"Ngữ pháp N3 「V-たはず của N」 dùng để diễn tả một việc mà người nói tin chắc mình đã thực hiện trong quá khứ nhưng thực tế lại xảy ra trái ngược. Trạng từ chỉ thời gian ""外出する前に"" đi với cụm bổ nghĩa ""しっかりと鍵を"" (khóa một cách chắc chắn) . Động từ quá khứ kết hợp với ngữ pháp phán đoán ""かけたはずの"" đóng vai trò bổ nghĩa cho danh từ chủ ngữ ""引き出しが、"" , dẫn tới trạng thái kỳ lạ ở phần Suffix ""わずかに開いていた""."
はず,～はずがない＜可能性の否定＞,N3,①あの温厚な人がそんなひどいことをするはずがない。,幼い頃から苦楽をともにしてきた親友を、あの誠実な彼が裏切るはずがない。,幼い頃から苦楽をともにしてきた親友を、,あの,誠実な,彼が,裏切る,はずがない。,"Cấu trúc N3 「～はずがない」 biểu thị sự phủ định hoàn toàn một khả năng, dịch là ""chắc chắn không có chuyện/lẽ nào lại..."". Từ chỉ định ""あの"" bổ nghĩa cho tính từ ""誠実な"" để làm nổi bật đặc tính của chủ thể hành động ""彼が"" . Động từ thể từ điển ""裏切る"" (phản bội) kết hợp trực tiếp với cụm phủ định mạnh mẽ ""はずがない"" ở phần Suffix để thể hiện sự tin tưởng tuyệt đối của người nói."
はず,～はずだった,N3,①彼も来るはずだったが、急用ができて来られないそうだ。,新型ロケットは今日の午前中に打ち上げられるはずだったが、直前のシステムトラブルにより急遽延期された。,新型ロケットは,今日の午前中に,打ち上げられる,はずだったが、,直前のシステムトラブルにより,急遽延期された。,"Ngữ pháp N3 「～はずだった」 diễn tả một kế hoạch, dự định chắc chắn sẽ xảy ra trong quá khứ nhưng thực tế lại không thể thực hiện được do yếu tố khách quan. Cụm từ chỉ thời gian ""今日の午前中に"" đi kèm động từ thể bị động ""打ち上げられる"" (được phóng lên) . Sự kết hợp với ngữ pháp ""はずだったが、"" (đáng lẽ ra đã... nhưng) liên kết trực tiếp với nguyên nhân khách quan ""直前のシステムトラブルにより"" , và kết thúc bằng vị ngữ ""急遽延期された"" ở Suffix."
はず,～はずではなかった,N3,①こんなはずではなかった。もっとうまくいくと思っていたのに。,予期せぬ敗北を喫した若き指揮官は、呆然と立ち尽くし、こんなはずではなかったと激しく後悔した。,予期せぬ敗北を喫した若き指揮官は、,呆然と,立ち尽くし、,こんな,はずではなかったと,激しく後悔した。,"Cấu trúc N3 「～はずではなかった」 thể hiện sự hối hận hoặc ngỡ ngàng trước một kết quả thực tế tồi tệ, hoàn toàn đi ngược lại mong đợi ban đầu (""đáng lẽ ra không phải như thế này""). Trạng từ ""呆然と"" (bàng hoàng) bổ nghĩa cho động từ liên kết ""立ち尽くし、"" . Đại từ chỉ định ""こんな"" (như thế này) bổ nghĩa cho cụm từ phủ định quá khứ ""はずではなかったと"" , dẫn tới hành động thể hiện cảm xúc tiếc nuối ""激しく後悔した"" (hối hận mãnh liệt) ở phần Suffix."
はずみ,Nのはずみ　で／に　V一たはずみ　で／に,N2,①ころんだはずみに足首を捻挫してしまった。,二人の間で激しい口論になったはずみに、容疑者は相手を強く突き飛ばしてしまった。,二人の間で,激しい口論に,なったはずみに、,容疑者は,相手を強く,突き飛ばしてしまった。,"Ngữ pháp N2 「V-たはずみに」 diễn tả một hành động vô tình xảy ra ngay vào khoảnh khắc một hành động khác diễn ra do đà hoặc sự xung đột đột ngột. Cụm từ chỉ trạng thái ""激しい口論に"" đi với động từ chia thể quá khứ kèm mẫu ngữ pháp ""なったはずみに、"" . Chủ ngữ của hành động tiếp theo ""容疑者は"" kết hợp với tân ngữ và trạng từ ""相手を強く"" (đối phương một cách thô bạo) để dẫn tới hành động vô tình làm tổn thương ở Suffix ""突き飛ばしてしまった""."
はたして,はたして～か,N2,①説明書の通りに組み立ててみたが、はたしてこれでうまく動くものかどうか自信がない。,宇宙探査機が遥かなる小惑星に向けて旅立ったが、はたして無事に帰還できるだろうかと世界中が注目している。,宇宙探査機が遥かなる小惑星に向けて旅立ったが、,はたして,無事に,帰還できるだろうか,と世界中が,注目している。,"Ngữ pháp N2 「はたして～か」 diễn tả tâm trạng nghi ngờ, lo lắng không biết một sự việc liệu có thực sự xảy ra hay không (""liệu có thực sự... hay không""). Trạng từ ""はたして"" (liệu rằng) đi liền với trạng từ chỉ trạng thái an toàn ""無事に"" (vô sự/bình an) . Cụm từ nghi vấn ""帰還できるだろうか"" kết hợp với trợ từ trích dẫn và chủ ngữ ""と世界中が"" để làm tân ngữ bổ nghĩa cho hành động quan sát ở Suffix ""注目している""."
はたして,はたして～した,N2,①彼もやって来るのではないかと思っていたところ、はたして現れた。,政界再編の噂が以前から囁かれていたが、はたして現職の首相が今日、記者会見で辞任を発表した。,政界再編の噂が以前から囁かれていたが、,はたして,現職の,首相が今日、,記者会見で,辞任を発表した。,"Ngữ pháp N2 「はたして～した」 biểu thị một kết quả xảy ra hoàn toàn đúng như dự đoán hoặc mong đợi trước đó (""quả nhiên là/đúng như dự đoán""). Trạng từ ""はたして"" đặt đầu câu nhằm nhấn mạnh tính chính xác của sự việc. Cụm danh từ định ngữ ""現職の"" bổ nghĩa cho chủ ngữ ""首相が今日、"" . Cụm từ chỉ phương thức ""記者会見で"" chuẩn bị cho vị ngữ chính ở phần Suffix ""辞任を発表した""."
はたして,はたして～としても,N1,①はたして彼の言うことが事実であったとしても、彼に責任がないということにはならない。,はたして容疑者の主張が真実であったとしても、彼に重大な過失があったという事実は覆らない。,,はたして,容疑者の主張が,真実であったとしても、,彼に重大な,過失があったという事実は覆らない。,"Cấu trúc N1 「はたして～としても」 dùng trong câu giả định nhượng bộ, diễn tả ý ""ngay cả khi giả sử điều đó là sự thật đi chăng nữa, thì kết quả vẫn không thay đổi"". Trạng từ giả định ""はたして"" bắt đầu câu hỏi/giả thiết khó xảy ra. Chủ ngữ của vế giả định ""容疑者の主張が"" đi với mệnh đề điều kiện nhượng bộ ""真実であったとしても、"" . Cụm trạng từ chỉ đối tượng ""彼に重大な"" bổ nghĩa trực tiếp cho danh từ chủ ngữ ở phần Suffix ""過失があったという事実は覆らない""."
ぱなし,Rっぱなし　動詞の連用形に付く。「R－はなし」の形で使われることもある。R－っぱなし＜放任＞,N3,①ドアを開けっ放しにしないでください。,逃走した犯人は、盗んだ車のエンジンをかけたっぱなしの状態で路地に放置していた。,逃走した犯人は、,盗んだ車の,エンジンを,かけたっぱなしの,状態で路地に,放置していた。,"Ngữ pháp N3 「R-っぱなし」 dùng để diễn đạt việc giữ nguyên một trạng thái nào đó sau khi thực hiện hành động mà không đưa nó về trạng thái ban đầu (thường mang nghĩa tiêu cực hoặc bất cẩn). Cụm danh từ ""盗んだ車の"" bổ nghĩa cho tân ngữ ""エンジンを"" . Động từ ""かける"" chia thể liên dụng kết hợp với ""っぱなし"" tạo thành ""かけたっぱなしの"" nhằm bổ nghĩa cho danh từ chỉ trạng thái ""状態で路地に"" , kết thúc bằng động từ ""放置していた"" ở phần Suffix."
